ISIN,Description,Ccy,Price,Issuer,Industry Sector,Maturity,Coupon,Rating,PD 1YR,Outstanding Amount,Callable,Next Call Date,Seniority,Coupon Frequency,Coupon Type,First Coupon Date,Penultimate Coupon Date,Issue date,Bid Price,Ask Price,Años a maturity,Bid-Ask Spread,Precio_modelo_limpio,Cupon_corrido,Precio_modelo_sucio,Diferencia,Spread_implicito_bps,YTM,Modified_Duration,Convexity
XS0161488498,DT 7 ½ 01/24/33,EUR,127.8353,DEUTSCHE TELEKOM INT FIN,Communications,2033-01-24,7.5,BBB+,0.021966191,500000000,N,,Sr Unsecured,1,FIXED,24/01/2004,24/01/2032,24/01/2003,127.462,128.208,7.315537303216975,0.7459999999999951,133.74165822053547,5.136986301369863,138.87864452190533,5.906358220535466,74.18031812830894,0.03027607751590865,5.688795454951043,41.381796831815016
FR0000471930,ORAFP 8 ⅛ 01/28/33,EUR,131.3195,ORANGE SA,Communications,2033-01-28,8.125,BBB+,2.14239e-05,1500000000,N,,Sr Unsecured,1,FIXED,28/01/2004,28/01/2032,28/01/2003,130.991,131.648,7.326488706365503,0.6569999999999823,137.95450164181105,5.476027397260274,143.43052903907133,6.635001641811044,81.70655982088705,0.030823987382394284,5.62706450857264,40.73535574048628
XS0162513211,EOANGR 5 ¾ 02/14/33,EUR,115.78,E.ON INTL FINANCE BV,Utilities,2033-02-14,5.75,BBB+,0.00010082,600000000,N,,Sr Unsecured,1,FIXED,14/02/2004,14/02/2032,14/02/2003,115.447,116.114,7.3730321697467485,0.6670000000000016,122.20211341602771,3.607534246575342,125.80964766260306,6.422113416027713,85.3516378028645,0.03198251797443124,5.852819535824713,43.02988482981816
XS0162869076,TELEFO 5 ⅞ 02/14/33,EUR,116.3,TELEFONICA EUROPE BV,Communications,2033-02-14,5.875,BBB-,0.000124958,500000000,N,,Sr Unsecured,1,FIXED,14/02/2004,14/02/2032,14/02/2003,115.984,116.616,7.3730321697467485,0.632000000000005,123.04142966600737,3.685958904109589,126.72738857011696,6.741429666007377,89.31778495855794,0.03235478846303609,5.835627466896061,42.844750019307746
FR0010014845,PEUGOT 6 09/19/33,EUR,112.3887,PSA TRESORERIE GIE,"Consumer, Cyclical",2033-09-19,6.0,BBB,0.024239666,600000000,N,,Sr Unsecured,1,FIXED,19/09/2004,19/09/2032,19/09/2003,111.839,112.938,7.967145790554415,1.0990000000000038,125.34636908443089,0.1972602739726027,125.54362935840349,12.95766908443089,163.20301567764633,0.039404625426587396,5.760046217751495,41.912227654030424
FR0010033381,VIEFP 6 ⅛ 11/25/33,EUR,119.702,VEOLIA ENVIRONNEMENT SA,Utilities,2033-11-25,6.125,BBB,0.000200524,700000000,N,,Sr Unsecured,1,FIXED,25/11/2004,25/11/2032,25/11/2003,119.299,120.105,8.150581793292266,0.8059999999999974,126.6890033338962,5.2020547945205475,131.89105812841674,6.987003333896197,83.21829412867565,0.03284536516349748,6.484653129487037,52.95980935586507
XS0229567440,GE 4 ⅛ 09/19/35,EUR,105.4562,GENERAL ELECTRIC CO,Industrial,2035-09-19,4.125,A-,5.11829e-06,750000000,N,,Sr Unsecured,1,FIXED,19/09/2006,19/09/2034,19/09/2005,105.115,105.798,9.96577686516085,0.6830000000000069,113.84694251276244,0.13561643835616438,113.9825589511186,8.390742512762444,90.66915643213223,0.03410751863320692,7.482836257338152,68.57768143808833
XS0300113254,PG 4 ⅞ 05/11/27,EUR,104.097,PROCTER & GAMBLE CO/THE,"Consumer, Non-cyclical",2027-05-11,4.875,AA-,1.47446e-07,1000000000,N,,Sr Unsecured,1,FIXED,11/05/2008,11/05/2026,11/05/2007,104.013,104.18,1.6071184120465434,0.1670000000000016,104.61409998099705,1.909931506849315,106.52403148784637,0.5170999809970596,31.134806009432243,0.007473798476421087,0.9925816448152562,1.9704366432483187
XS0350890470,GE 6.025 03/01/38,EUR,124.77,GE CAPITAL EURO FUNDING,Industrial,2038-03-01,6.025,A-,5.11829e-06,484697000,N,,Sr Unsecured,1,FIXED,01/03/2009,01/03/2037,06/03/2008,124.175,125.364,12.413415468856947,1.1890000000000072,135.4426807034795,3.532465753424658,138.97514645690416,10.672680703479514,86.28217563867038,0.03466720453499366,8.92958192019147,101.63731536014313
XS0553728709,DT 4 ½ 10/28/30,EUR,108.6433,DEUTSCHE TELEKOM INT FIN,Communications,2030-10-28,4.5,BBB+,0.021966191,300000000,N,,Sr Unsecured,1,FIXED,28/10/2011,28/10/2029,28/10/2010,108.379,108.908,5.073237508555784,0.5289999999999964,110.55903972963051,4.167123287671233,114.72616301730174,1.9157397296305163,37.41382006786243,0.02632457120031984,4.488486361593043,25.50291162297994
FR0011224963,VIEFP 4 ⅝ 03/30/27,EUR,103.19,VEOLIA ENVIRONNEMENT SA,Utilities,2027-03-30,4.625,BBB,0.000200524,750000000,N,,Sr Unsecured,1,FIXED,30/03/2013,30/03/2026,30/03/2012,103.088,103.292,1.4921286789869952,0.20400000000000773,103.93251976888479,2.344178082191781,106.27669785107656,0.7425197688847902,48.354811155177075,0.013906386277739958,0.9862843488649942,1.9455136336320913
XS0826189028,TELIAS 3 09/07/27,EUR,101.318,TELIA COMPANY AB,Communications,2027-09-07,3.0,BBB+,1.15493e-05,370083000,N,,Sr Unsecured,1,FIXED,07/09/2013,07/09/2026,07/09/2012,101.149,101.486,1.9329226557152634,0.3370000000000033,101.98796473292445,0.1972602739726027,102.18522500689706,0.6699647329244556,34.523508052917364,0.016601196233640616,0.9836699029126215,1.9352129557922524
XS0866310088,T 3.55 12/17/32,EUR,101.026,AT&T INC,Communications,2032-12-17,3.55,BBB,0.000147481,1400000000,Y,2032-09-17,Sr Unsecured,1,FIXED,17/12/2013,17/12/2031,17/12/2012,100.784,101.269,6.962354551676934,0.48499999999999943,107.25237179245104,0.13616438356164384,107.38853617601269,6.226371792451047,94.84816651758442,0.03358347387078601,5.332511925450118,35.071172593729656
XS0875797515,DT 3 ¼ 01/17/28,EUR,102.225,DEUTSCHE TELEKOM INT FIN,Communications,2028-01-17,3.25,BBB+,0.021966191,750000000,N,,Sr Unsecured,1,FIXED,17/01/2014,17/01/2027,17/01/2013,102.041,102.409,2.294318959616701,0.3680000000000092,102.82608633851297,2.2883561643835617,105.11444250289652,0.601086338512971,26.019378706842524,0.02102296287836614,1.9283229371880042,5.635986803425035
DE000A1UDWN5,SIEGR 2 ⅞ 03/10/28,EUR,101.861,SIEMENS FINANCIERINGSMAT,Industrial,2028-03-10,2.875,AA-,0.006816219,1000000000,N,,Sr Unsecured,1,FIXED,10/03/2014,10/03/2027,12/03/2013,101.698,102.024,2.439425051334702,0.3260000000000076,102.07700095162902,1.6147260273972603,103.69172697902627,0.21600095162901312,8.839947232053184,0.019176496720809264,1.9351960492479028,5.669690746845912
DE000A1HG1K6,ALVGR 3 03/13/28,EUR,101.741,ALLIANZ FINANCE II B.V.,Financial,2028-03-13,3.0,AA,4.75964e-06,750000000,N,,Sr Unsecured,1,FIXED,13/03/2014,13/03/2027,13/03/2013,101.623,101.859,2.4476386036960984,0.23599999999999,102.37768540019007,1.6602739726027396,104.03795937279281,0.6366854001900748,25.96943879717684,0.021019585248636487,1.9305412237554422,5.644689577311866
XS0908570459,VW 3.3 03/22/33,EUR,97.76498,VOLKSWAGEN INTL FIN NV,"Consumer, Cyclical",2033-03-22,3.3,BBB+,0.042120067,850000000,N,,Sr Unsecured,1,FIXED,22/03/2014,22/03/2032,22/03/2013,97.397,98.133,7.471594798083505,0.73599999999999,105.77362835177297,1.7449315068493154,107.51855985862228,8.008648351772976,116.58628672570076,0.03667817824199273,6.130310991381167,45.7545581075001
BE0002432079,ELIATB 3 ¼ 04/04/28,EUR,101.813,ELIA TRANSMISSION BE,Utilities,2028-04-04,3.25,NR,0.008230541,550000000,N,,Sr Unsecured,1,FIXED,04/04/2014,04/04/2027,04/04/2013,101.694,101.932,2.507871321013005,0.23799999999999955,103.02830985210852,1.6027397260273972,104.63104957813592,1.2153098521085184,48.33011862032433,0.023119435982359982,1.924311071031354,5.612676383682971
XS0922885362,MSFT 2 ⅝ 05/02/33,EUR,98.929,MICROSOFT CORP,Technology,2033-05-02,2.625,AAA,5.81061e-09,550000000,Y,2033-02-02,Sr Unsecured,1,FIXED,02/05/2014,02/05/2032,02/05/2013,98.612,99.245,7.340177960301164,0.6330000000000098,101.23010503826502,1.7332191780821917,102.96332421634722,2.301105038265021,33.939522018522084,0.027955803843616105,6.305570880768542,47.79477440190224
XS0934539726,RBOSGR 2 ⅝ 05/24/28,EUR,100.207,ROBERT BOSCH INVESTMENT,"Consumer, Cyclical",2028-05-24,2.625,A,0.022641193,750000000,N,,Sr Unsecured,1,FIXED,24/05/2014,24/05/2027,24/05/2013,100.065,100.349,2.64476386036961,0.284000000000006,101.57097185387526,0.934931506849315,102.50590336072457,1.3639718538752703,52.10834928910488,0.025175752682173088,1.925960034466493,5.6116769452733335
XS0935427970,JPM 2 ⅞ 05/24/28,EUR,100.9487,JPMORGAN CHASE & CO,Financial,2028-05-24,2.875,A+,0.0001373,1000000000,N,,Sr Unsecured,1,FIXED,24/05/2014,24/05/2027,24/05/2013,100.837,101.061,2.64476386036961,0.22400000000000375,102.20832194575354,1.023972602739726,103.23229454849327,1.259621945753537,47.87967836378381,0.023836233401943602,1.9262682551577972,5.6177300851718135
XS0968972199,TELIAS 3 ½ 09/05/33,EUR,101.148,TELIA COMPANY AB,Communications,2033-09-05,3.5,BBB+,1.15493e-05,506000000,N,,Sr Unsecured,1,FIXED,05/09/2014,05/09/2032,05/09/2013,100.852,101.445,7.928815879534565,0.5929999999999893,107.32283671863497,0.24931506849315072,107.57215178712812,6.174836718634978,83.70989810476168,0.03313555116232649,6.129943485314599,45.84507881830179
BE0002466416,ELIATB 3 04/07/29,EUR,100.778,ELIA TRANSMISSION BE,Utilities,2029-04-07,3.0,NR,0.008230541,350000000,N,,Sr Unsecured,1,FIXED,07/04/2015,07/04/2028,07/04/2014,100.62,100.937,3.515400410677618,0.31699999999999307,102.92417233163238,1.4547945205479453,104.37896685218033,2.1461723316323713,62.05503596573626,0.027263989673330425,2.836499785303229,10.936487272493093
XS1028954870,ITW 3 05/19/34,EUR,97.62833,ILLINOIS TOOL WORKS INC,Industrial,2034-05-19,3.0,A+,1.13905e-06,500000000,Y,2034-02-19,Sr Unsecured,1,FIXED,19/05/2015,19/05/2033,20/05/2014,97.399,97.858,8.386036960985626,0.4590000000000032,103.69966885164929,1.841095890410959,105.54076474206025,6.071338851649287,79.9940593211747,0.033427620514234174,6.98565054395099,58.714708117561784
XS1075995768,MCD 2 ⅝ 06/11/29,EUR,99.646,MCDONALD'S CORP,"Consumer, Cyclical",2029-06-11,2.625,BBB+,4.53177e-07,400000000,N,,Sr Unsecured,1,FIXED,11/06/2015,11/06/2028,11/06/2014,99.486,99.806,3.693360711841205,0.3199999999999932,101.65042774014589,0.8054794520547945,102.45590719220068,2.0044277401458857,55.7325415910944,0.027495475943016323,2.84553186862125,10.98170667778676
XS1076018305,T 3 ⅜ 03/15/34,EUR,98.73593,AT&T INC,Communications,2034-03-15,3.375,BBB,0.000147481,500000000,Y,2033-12-15,Sr Unsecured,1,FIXED,15/03/2015,15/03/2033,11/06/2014,98.473,98.999,8.205338809034908,0.5259999999999962,106.48882375262501,2.681506849315068,109.17033060194008,7.752893752625013,103.32588895504226,0.03559348430280255,6.891383164494101,57.55867469335827
XS1028941117,MRK 1 ⅞ 10/15/26,EUR,99.68211,MERCK & CO INC,"Consumer, Non-cyclical",2026-10-15,1.875,A+,1.37989e-05,1000000000,Y,2026-07-15,Sr Unsecured,1,FIXED,15/10/2015,15/10/2025,15/10/2014,99.605,99.759,0.785763175906913,0.15399999999999636,99.9522966598089,0.40068493150684936,100.35298159131574,0.2701866598088998,34.28703145543574,0.03329239649824183,7.089753117759708,59.91851585783465
XS1028941893,MRK 2 ½ 10/15/34,EUR,94.259,MERCK & CO INC,"Consumer, Non-cyclical",2034-10-15,2.5,A+,1.37989e-05,500000000,Y,2034-07-15,Sr Unsecured,1,FIXED,15/10/2015,15/10/2033,15/10/2014,93.991,94.528,8.785763175906913,0.5370000000000061,99.74489310370971,0.5342465753424658,100.27913967905218,5.485893103709714,70.88262806422934,0.02859151383985614,3.7260391691479766,17.85104997714044
XS1120892507,TELEFO 2.932 10/17/29,EUR,100.2717,TELEFONICA EMISIONES SAU,Communications,2029-10-17,2.932,BBB-,0.021357445,800000000,N,,Sr Unsecured,1,FIXED,17/10/2015,17/10/2028,17/10/2014,100.086,100.458,4.043805612594114,0.3719999999999999,102.80818570942124,2.8034739726027396,105.61165968202398,2.5364857094212425,64.45187777062073,0.022991514077772564,0.9775252152521525,1.911111092907534
XS1134729794,NOVNVX 1 ⅝ 11/09/26,EUR,99.341,NOVARTIS FINANCE SA,"Consumer, Non-cyclical",2026-11-09,1.625,AA-,1.31566e-06,600000000,N,,Sr Unsecured,1,FIXED,09/11/2015,09/11/2025,07/11/2014,99.247,99.434,1.106091718001369,0.1869999999999976,99.67794752348308,1.4513698630136986,101.12931738649678,0.3369475234830901,30.59627103171235,0.022744427112162256,0.9777613776137762,1.9120346231063794
XS1135337498,AAPL 1 ⅝ 11/10/26,EUR,99.365,APPLE INC,Technology,2026-11-10,1.625,AA+,1.07934e-06,1400000000,N,,Sr Unsecured,1,FIXED,10/11/2015,10/11/2025,10/11/2014,99.29,99.441,1.108829568788501,0.15099999999999625,99.67713047813577,1.446917808219178,101.12404828635495,0.3121304781357708,28.269716705870344,0.024362674848111852,0.9762167487684729,1.9059982811521747
XS1136406342,MMM 1 ½ 11/09/26,EUR,99.086,3M COMPANY,Industrial,2026-11-09,1.5,BBB+,1.50941e-05,750000000,N,,Sr Unsecured,1,FIXED,09/11/2015,09/11/2025,12/11/2014,99.035,99.137,1.106091718001369,0.10200000000000387,99.54245638468191,1.3397260273972602,100.88218241207917,0.4564563846819141,41.52924786681733,0.02275697083006645,0.9777493857493857,1.9119877226666022
DE000A13SL34,SAPGR 1 ¾ 02/22/27,EUR,99.486,SAP SE,Technology,2027-02-22,1.75,A+,3.31915e-07,1000000000,Y,2026-11-22,Sr Unsecured,1,FIXED,22/02/2015,22/02/2026,20/11/2014,99.284,99.687,1.1416837782340863,0.4029999999999916,99.80712090608127,1.5006849315068496,101.30780583758812,0.3211209060812621,28.214935999603863,0.02743582894341844,3.7396824235657524,17.95232736337138
XS1143502901,CMCSA 2 ¾ 11/27/29,EUR,100.024,SKY LTD,Communications,2029-11-27,2.75,A-,0.000379551,400000000,N,,Sr Unsecured,1,FIXED,27/11/2015,27/11/2028,27/11/2014,99.804,100.243,4.15605749486653,0.43899999999999295,102.12052740729919,2.3205479452054796,104.44107535250467,2.0965274072991917,52.003274988687636,0.03206109606682676,5.447454235367022,36.13698962018018
XS1146286205,VZ 2 ⅝ 12/01/31,EUR,96.87341,VERIZON COMMUNICATIONS,Communications,2031-12-01,2.625,BBB+,0.000164108,1000000000,N,,Sr Unsecured,1,FIXED,01/12/2015,01/12/2030,01/12/2014,96.63,97.116,6.165639972621492,0.4860000000000042,101.51178480011356,2.186301369863014,103.69808616997658,4.638374800113553,81.00129846953384,0.0301467373473329,2.838558321849957,10.927102915187584
XS1144088165,T 2.6 12/17/29,EUR,98.82738,AT&T INC,Communications,2029-12-17,2.6,BBB,0.000147481,800000000,Y,2029-09-17,Sr Unsecured,1,FIXED,17/12/2015,17/12/2028,02/12/2014,98.659,98.996,3.9616700889801506,0.3369999999999891,101.5381016403052,0.09972602739726029,101.63782766770247,2.710721640305195,70.87035562950729,0.03126899938480432,3.7835835475751938,18.192128768951775
XS1167667283,VW 1 ⅝ 01/16/30,EUR,94.43419,VOLKSWAGEN INTL FIN NV,"Consumer, Cyclical",2030-01-16,1.625,BBB+,0.042120067,1000000000,N,,Sr Unsecured,1,FIXED,16/01/2016,16/01/2029,16/01/2015,94.228,94.64,4.292950034223135,0.41200000000000614,97.56465245891532,1.1486301369863012,98.71328259590162,3.130462458915318,77.96514537310404,0.026253831009356778,0.9744177997527813,1.898980096950103
XS1171485722,WELLTR 1 ⅛ 01/21/27,EUR,98.538,WELLCOME TRUST LTD/THE,"Consumer, Non-cyclical",2027-01-21,1.125,AAA,0.006445107,400000000,N,,Sr Unsecured,1,FIXED,21/01/2016,21/01/2026,21/01/2015,98.42,98.655,1.3059548254620124,0.23499999999999943,98.98088445517351,0.7797945205479453,99.76067897572146,0.4428844551735125,34.34148273129645,0.024080618050710174,0.9764856226880393,1.9070483426328957
XS1180130939,RABOBK 1 ⅜ 02/03/27,EUR,98.99123,COOPERATIEVE RABOBANK UA,Financial,2027-02-03,1.375,AA-,5.75847e-06,1500000000,N,,Sr Preferred,1,FIXED,03/02/2016,03/02/2026,03/02/2015,98.781,99.201,1.3415468856947297,0.4199999999999875,99.28107253697915,0.9041095890410958,100.18518212602025,0.2898425369791511,21.803298934622106,,,
XS1186176571,HTHROW 1 ½ 02/11/30,EUR,93.655,HEATHROW FUNDING LTD,Industrial,2030-02-11,1.5,BBB+,0.024398591,750000000,Y,2026-02-11,1st lien,1,FIXED,11/02/2016,11/02/2029,11/02/2015,93.517,93.794,0.36413415468856947,0.277000000000001,99.82965337932085,0.9534246575342467,100.78307803685509,6.174653379320844,1735.0930149427547,0.035026704685222676,8.10619583864481,76.49576973010801
XS1193213953,TELIAS 1 ⅝ 02/23/35,EUR,85.71703,TELIA COMPANY AB,Communications,2035-02-23,1.625,BBB+,1.15493e-05,500000000,N,,Sr Unsecured,1,FIXED,23/02/2016,23/02/2034,23/02/2015,85.461,85.974,9.396303901437372,0.5130000000000052,92.32588811727767,0.9794520547945205,93.30534017207219,6.608858117277677,84.92338155156344,0.030289496122457227,0.970600985221675,1.8841325450265725
XS1191877452,ANVAU 1 ½ 02/26/27,EUR,98.516,AUSNET SERVICES HOLDINGS,Utilities,2027-02-26,1.5,BBB+,0.017362557,560000000,N,,Sr Unsecured,1,FIXED,26/02/2016,26/02/2026,26/02/2015,98.457,98.575,1.404517453798768,0.11800000000000921,99.41916817933478,0.8917808219178083,100.31094900125258,0.9031681793347701,65.04020701919919,0.02582706047139686,0.9748231827111984,1.900560475102381
XS1196503137,BKNG 1.8 03/03/27,EUR,99.237,BOOKING HOLDINGS INC,Communications,2027-03-03,1.8,A-,6.00979e-06,1000000000,Y,2026-12-03,Sr Unsecured,1,FIXED,03/03/2016,03/03/2026,03/03/2015,99.146,99.328,1.1718001368925393,0.18200000000000216,99.8591703416996,1.4893150684931509,101.34848541019275,0.6221703416996007,53.32131201011213,0.027770277035288587,0.972980073800738,1.8933804480265795
XS1197270819,MDLZ 1 ⅝ 03/08/27,EUR,98.8791,MONDELEZ INTERNATIONAL,"Consumer, Non-cyclical",2027-03-08,1.625,BBB,6.19362e-06,750000000,Y,2026-12-08,Sr Unsecured,1,FIXED,08/03/2016,08/03/2026,06/03/2015,98.766,98.992,1.1854893908281998,0.2259999999999991,99.65436714048677,1.3222602739726028,100.97662741445937,0.7752671404867755,65.86238131463345,0.03691833180246418,7.866258564965824,73.35564523843621
XS1197273755,MDLZ 2 ⅜ 03/06/35,EUR,90.06995,MONDELEZ INTERNATIONAL,"Consumer, Non-cyclical",2035-03-06,2.375,BBB,6.19362e-06,435377000,Y,2034-12-06,Sr Unsecured,1,FIXED,06/03/2016,06/03/2034,06/03/2015,89.787,90.353,9.180013689253936,0.5659999999999883,98.6140013782198,1.9455479452054794,100.55954932342527,8.544051378219791,108.87292136309549,0.02586076523667897,0.9747911547911549,1.9004355909181463
XS1117298163,MCO 1 ¾ 03/09/27,EUR,99.185,MOODY'S CORPORATION,"Consumer, Non-cyclical",2027-03-09,1.75,BBB+,2.0364e-06,500000000,Y,2026-12-09,Sr Unsecured,1,FIXED,09/03/2016,09/03/2026,09/03/2015,99.082,99.287,1.1882272416153319,0.2050000000000125,99.79893261363607,1.419178082191781,101.21811069582785,0.6139326136360665,51.920637897218334,0.03691764869542141,7.8458183711001155,73.09556184531347
XS1196380031,T 2.45 03/15/35,EUR,90.636,AT&T INC,Communications,2035-03-15,2.45,BBB,0.000147481,1250000000,Y,2034-12-15,Sr Unsecured,1,FIXED,15/03/2016,15/03/2034,09/03/2015,90.357,90.915,9.204654346338124,0.5580000000000069,99.223337282873,1.9465753424657535,101.16991262533875,8.587337282873008,108.76864654979718,0.027932940450332865,0.9728261063040791,1.8927812662135108
XS1197833053,KO 1 ⅛ 03/09/27,EUR,98.37704,COCA-COLA CO/THE,"Consumer, Non-cyclical",2027-03-09,1.125,A+,6.77015e-08,1500000000,Y,2026-12-09,Sr Unsecured,1,FIXED,09/03/2016,09/03/2026,09/03/2015,98.27,98.484,1.1882272416153319,0.21399999999999864,99.07206229987166,0.9123287671232877,99.98439106699495,0.6950222998716669,59.225617530023676,0.03439264558411158,8.113036120089573,76.61216354622826
XS1197833137,KO 1 ⅝ 03/09/35,EUR,86.15892,COCA-COLA CO/THE,"Consumer, Non-cyclical",2035-03-09,1.625,A+,6.77015e-08,1500000000,Y,2034-12-09,Sr Unsecured,1,FIXED,09/03/2016,09/03/2034,09/03/2015,85.921,86.397,9.188227241615332,0.4759999999999991,92.48357933241049,1.3178082191780822,93.80138755158856,6.324659332410491,82.67762929811802,0.02871056102262368,0.9720907297830373,1.8899207738602362
XS1202213291,PPG 1.4 03/13/27,EUR,98.57,PPG INDUSTRIES INC,Basic Materials,2027-03-13,1.4,BBB+,0.000106428,600000000,Y,2026-12-13,Sr Unsecured,1,FIXED,13/03/2016,13/03/2026,13/03/2015,98.455,98.685,1.1991786447638604,0.23000000000000398,99.3862814129702,1.1199999999999999,100.50628141297021,0.8162814129702127,68.75482375667956,0.025500359237397373,0.9751337393422655,1.9017716192072587
XS1204154410,ACAFP 2 ⅝ 03/17/27,EUR,100.0731,CREDIT AGRICOLE SA,Financial,2027-03-17,2.625,BBB+,0.000125365,2000000000,N,,Subordinated,1,FIXED,17/03/2016,17/03/2026,17/03/2015,99.977,100.169,1.4565366187542779,0.19199999999999307,100.99706105733034,1.423972602739726,102.42103366007007,0.9239610573303452,63.28078433909014,0.02955885560106828,3.7766799969267297,18.167339170931516
XS1206411230,CCEP 1 ⅞ 03/18/30,EUR,95.978,COCA-COLA EUROPACIFIC,"Consumer, Non-cyclical",2030-03-18,1.875,BBB+,5.8577e-06,500000000,Y,2029-12-18,Sr Unsecured,1,FIXED,18/03/2016,18/03/2029,18/03/2015,95.816,96.139,4.213552361396304,0.3229999999999933,98.63361427101836,1.4743150684931507,100.10792933951151,2.655614271018365,66.68714951435246,0.027707808564231776,0.9730392156862745,1.8936106305267204
XS1205616698,APAAU 2 03/22/27,EUR,99.25,APA INFRASTRUCTURE LTD,Utilities,2027-03-22,2.0,BBB,0.025590344,650000000,N,,Sr Unsecured,1,FIXED,22/03/2016,22/03/2026,20/03/2015,99.204,99.296,1.4702258726899384,0.09200000000001296,100.10975935975256,1.0575342465753426,101.1672936063279,0.8597593597525588,58.79572221843988,0.033883137190928156,3.7734741813296426,18.09688603433523
XS1205548164,WPPLN 1 ⅝ 03/23/30,EUR,93.506,WPP FINANCE DEUTSCHLAND,Communications,2030-03-23,1.625,BBB,0.006265143,600000000,N,,Sr Unsecured,1,FIXED,23/03/2016,23/03/2029,23/03/2015,93.283,93.73,4.473648186173854,0.44700000000000273,97.4046554854649,0.8547945205479451,98.25945000601284,3.8986554854649,93.8520614378497,0.025243079754429347,1.9353529171829515,5.64807985032325
BE6277215545,AGSBB 3 ½ 06/30/47,EUR,101.548,AG INSURANCE SA/NV,Financial,2047-06-30,3.5,A-,4.2946e-07,400000000,Y,2027-06-30,Subordinated,1,VARIABLE,30/06/2016,30/06/2046,31/03/2015,101.331,101.764,1.7440109514031485,0.4329999999999927,102.65629099818432,0.8917808219178084,103.54807182010212,1.1082909981843159,62.86338130895929,0.03213613610514377,3.7940765721525453,18.24969234272119
FR0012663169,VIEFP 1.59 01/10/28,EUR,98.19983,VEOLIA ENVIRONNEMENT SA,Utilities,2028-01-10,1.59,BBB,0.000200524,500000000,Y,2027-10-10,Sr Unsecured,1,FIXED,10/01/2016,10/01/2027,09/04/2015,98.071,98.329,2.023271731690623,0.25799999999999557,99.29750062373027,1.5507945205479452,100.84829514427821,1.0976706237302665,55.3437570454537,0.030128715092915433,0.9707524752475248,1.8847207363983929
XS1218363270,URWFP 1 ⅜ 04/15/30,EUR,93.20046,UNIBAIL-RODAMCO-WESTFLD,Financial,2030-04-15,1.375,NR,0.008889247,655000000,N,,Sr Unsecured,1,FIXED,15/04/2016,15/04/2029,15/04/2015,93.018,93.383,4.5366187542778915,0.3649999999999949,96.27921677144273,0.6366438356164383,96.91586060705917,3.078756771442727,73.36124535397353,0.029161050218800562,0.9716652216748768,1.888266606024975
DE000A1ZZ028,BMW 1 04/20/27,EUR,98.046,BMW US CAPITAL LLC,"Consumer, Cyclical",2027-04-20,1.0,A,0.042905272,500000000,N,,Sr Unsecured,1,FIXED,20/04/2016,20/04/2026,20/04/2015,97.949,98.143,1.5496235455167693,0.19400000000000261,98.60083974977526,0.44931506849315067,99.05015481826841,0.5548397497752546,36.46026264529062,0.035428386123035886,8.06344782253023,75.93235087364187
XS1223837250,GIS 1 ½ 04/27/27,EUR,98.62402,GENERAL MILLS INC,"Consumer, Non-cyclical",2027-04-27,1.5,BBB,7.8248e-05,400000000,Y,2027-01-27,Sr Unsecured,1,FIXED,27/04/2016,27/04/2026,27/04/2015,98.538,98.71,1.322381930184805,0.17199999999999704,99.45276164118236,1.015068493150685,100.46783013433304,0.8287416411823614,63.306366415185344,0.03139836455839561,3.7762633153730136,18.143436523310147
XS1226748512,BMY 1 ¾ 05/15/35,EUR,86.38754,BRISTOL-MYERS SQUIBB CO,"Consumer, Non-cyclical",2035-05-15,1.75,A,0.000339308,575000000,Y,2035-02-15,Sr Unsecured,1,FIXED,15/05/2016,15/05/2034,05/05/2015,86.009,86.766,9.374401095140314,0.757000000000005,93.38188787289637,1.093150684931507,94.47503855782787,6.99434787289637,89.65215189635924,0.029269112097553587,3.764531913591296,18.09218670412893
XS1234373733,MMM 1 ¾ 05/15/30,EUR,94.85107,3M COMPANY,Industrial,2030-05-15,1.75,BBB+,1.50941e-05,500000000,N,,Sr Unsecured,1,FIXED,15/05/2016,15/05/2029,20/05/2015,94.701,95.001,4.618754277891855,0.30000000000001137,97.82193556675355,0.6664383561643836,98.48837392291793,2.9708655667535453,68.85977465131984,0.026350846463655958,0.9743256932515337,1.8986211130601636
XS1234953906,ITW 2 ⅛ 05/22/30,EUR,97.014,ILLINOIS TOOL WORKS INC,Industrial,2030-05-22,2.125,A+,1.13905e-06,500000000,Y,2030-02-22,Sr Unsecured,1,FIXED,22/05/2016,22/05/2029,22/05/2015,96.87,97.158,4.394250513347022,0.2879999999999967,99.5514962879857,1.2866438356164382,100.83814012360214,2.5374962879857037,60.82207251991781,0.027736253080683632,0.9730122850122849,1.8935058135696556
XS1237271421,MCD 1 ⅞ 05/26/27,EUR,99.25943,MCDONALD'S CORP,"Consumer, Cyclical",2027-05-26,1.875,BBB+,4.53177e-07,600000000,N,,Sr Unsecured,1,FIXED,26/05/2016,26/05/2026,26/05/2015,99.155,99.364,1.648186173853525,0.20900000000000318,99.90949907095036,0.6575342465753424,100.5670333175257,0.6500690709503658,39.764264390727035,0.02555971651767743,0.9750773006134968,1.901551484343407
XS1233734562,MLFP 1 ¾ 05/28/27,EUR,99.004,CIE GENERALE DES ESTABLI,"Consumer, Cyclical",2027-05-28,1.75,A,7.14317e-05,300000000,Y,2027-02-28,Sr Unsecured,1,FIXED,28/05/2016,28/05/2026,28/05/2015,98.87,99.137,1.4099931553730323,0.2669999999999959,99.76106946734804,1.0308219178082194,100.79189138515626,0.7570694673480318,54.09791835469289,0.027162367663558378,3.7728075522718747,18.169935440921105
XS1238902057,GE 1 ⅞ 05/28/27,EUR,99.336,GENERAL ELECTRIC CO,Industrial,2027-05-28,1.875,A-,5.11829e-06,466901000,Y,2027-02-28,Sr Unsecured,1,FIXED,28/05/2016,28/05/2026,28/05/2015,99.146,99.525,1.4099931553730323,0.3790000000000049,99.9331354358952,1.1044520547945207,101.03758749068972,0.597135435895197,42.567477044756245,0.02566258054090825,0.9749795098039216,1.9011700890749903
XS1240751229,LLY 2 ⅛ 06/03/30,EUR,97.78732,ELI LILLY & CO,"Consumer, Non-cyclical",2030-06-03,2.125,A+,1.33291e-05,750000000,Y,2030-03-03,Sr Unsecured,1,FIXED,03/06/2016,03/06/2029,02/06/2015,97.579,97.996,4.418891170431212,0.4170000000000016,99.5406194897127,1.2342465753424656,100.77486606505516,1.7532994897127026,41.63499509253674,0.02766109988443304,1.8966851533095566,5.488748898277163
XS1292389415,AAPL 2 09/17/27,EUR,99.44791,APPLE INC,Technology,2027-09-17,2.0,AA+,1.07934e-06,1000000000,N,,Sr Unsecured,1,FIXED,17/09/2016,17/09/2026,17/09/2015,99.33,99.566,1.9603011635865846,0.2360000000000042,100.10782864867222,0.07671232876712329,100.18454097743935,0.6599186486722317,34.03082550888724,0.02580074749829206,0.9748481880509305,1.9006579794923646
XS1311440082,ASSGEN 5 ½ 10/27/47,EUR,105.249,GENERALI,Financial,2047-10-27,5.5,BBB+,6.64834e-07,1250000000,Y,2027-10-27,Subordinated,1,VARIABLE,27/10/2016,29/07/2047,27/10/2015,105.069,105.428,2.0698151950718686,0.35899999999999466,107.1305072746336,5.108219178082192,112.2387264527158,1.8815072746336057,87.84981734888275,0.02242875338321932,0.9780632603406326,1.913215482456296
XS1327028459,MA 2.1 12/01/27,EUR,99.532,MASTERCARD INC,Financial,2027-12-01,2.1,A+,3.29152e-09,800000000,Y,2027-09-01,Sr Unsecured,1,FIXED,01/12/2016,01/12/2026,01/12/2015,99.449,99.615,1.9164955509924708,0.16599999999999682,100.29435672961708,0.17260273972602738,100.46695946934311,0.7623567296170819,40.14841955518509,0.02283109607333257,0.9776785276073618,1.911710606688998
BE6282460615,SYENS 2 ¾ 12/02/27,EUR,100.496,SYENSQO SA,Basic Materials,2027-12-02,2.75,BBB+,0.00023207,500000000,Y,2027-09-02,Sr Unsecured,1,FIXED,02/12/2016,02/12/2026,02/12/2015,100.364,100.629,1.919233401779603,0.26500000000000057,101.50809523083505,0.21849315068493153,101.72658838151999,1.0120952308350581,52.7953306783164,0.02791840949369021,4.590506088967234,26.269714833153806
FR0013073277,LRFP 1 ⅞ 12/16/27,EUR,99.601,LEGRAND SA,Industrial,2027-12-16,1.875,NR,6.83986e-06,355000000,Y,2027-09-16,Sr Unsecured,1,FIXED,16/12/2016,16/12/2026,16/12/2015,99.467,99.736,1.9575633127994525,0.26900000000000546,99.8698564542054,0.07705479452054795,99.94691124872595,0.26885645420540527,13.88125398268131,0.02595051943671423,1.9325109555473008,5.634416046628197
XS1362373224,GS 3 02/12/31,EUR,100.959,GOLDMAN SACHS GROUP INC,Financial,2031-02-12,3.0,A-,0.00026897,1000000000,N,,Sr Unsecured,1,FIXED,12/02/2017,12/02/2030,12/02/2016,100.763,101.156,5.366187542778919,0.3930000000000007,103.48228951338275,1.8986301369863012,105.38091965036905,2.5232895133827498,48.925934132454714,0.025899591861534725,1.9291355873008815,5.621440801885752
XS1375955678,IBM 1 ¾ 03/07/28,EUR,98.37348,IBM CORP,Technology,2028-03-07,1.75,A-,1.97547e-05,500000000,N,,Sr Unsecured,1,FIXED,07/03/2017,07/03/2027,07/03/2016,98.218,98.528,2.431211498973306,0.3100000000000023,99.4300609238096,0.9972602739726029,100.4273211977822,1.056580923809605,44.41933304403258,,,
XS1379122523,AMXLMM 2 ⅛ 03/10/28,EUR,99.105,AMERICA MOVIL SAB DE CV,Communications,2028-03-10,2.125,BBB+,4.0591e-05,596410000,N,,Sr Unsecured,1,FIXED,10/03/2017,10/03/2027,10/03/2016,98.853,99.356,2.439425051334702,0.5030000000000001,100.31004920330706,1.1934931506849316,101.50354235399199,1.2050492033070554,50.20513273537252,0.02209520542617881,0.9783824390243904,1.9144643939826298
XS1378880253,BNP 2 ⅞ 10/01/26,EUR,100.294,BNP PARIBAS,Financial,2026-10-01,2.875,BBB+,0.000632394,750000000,N,,Subordinated,1,FIXED,01/10/2016,01/10/2025,11/03/2016,100.202,100.387,0.999315537303217,0.18500000000000227,100.93609771769488,0.0,100.93609771769488,0.642097717694881,63.8174810017509,0.026004854511840775,1.934750921983415,5.642951051178539
XS1379184473,HSBC 2 ½ 03/15/27,EUR,100.2842,HSBC HOLDINGS PLC,Financial,2027-03-15,2.5,A-,9.28921e-05,759585000,N,,Sr Unsecured,1,FIXED,15/03/2017,15/03/2026,15/03/2016,100.163,100.405,1.4510609171800137,0.24200000000000443,100.81633640957939,1.36986301369863,102.18619942327803,0.5321364095793939,36.56863896988614,0.02251764368412982,0.9779782345828294,1.9128828546354952
XS1382791975,DT 1 ½ 04/03/28,EUR,97.882,DEUTSCHE TELEKOM INT FIN,Communications,2028-04-03,1.5,BBB+,0.021966191,1500000000,N,,Sr Unsecured,1,FIXED,03/04/2017,03/04/2027,23/03/2016,97.683,98.081,2.5051334702258727,0.39799999999999613,98.79431955960435,0.7438356164383562,99.53815517604271,0.9123195596043416,37.397481078166756,0.029702332594483318,1.9242463018411167,5.58867949504494
XS1346228577,AXASA 3 ⅜ 07/06/47,EUR,101.0985,AXA SA,Financial,2047-07-06,3.375,A,6.89119e-06,1500000000,Y,2027-07-06,Subordinated,1,VARIABLE,06/07/2016,08/04/2047,30/03/2016,100.937,101.26,1.7604380561259412,0.3230000000000075,102.46560983447259,0.8044520547945205,103.27006188926711,1.3671098344725863,77.06289805622593,0.02643673329647477,1.9374890879420459,5.65204637556458
FR0013143351,NK 1 ⅞ 03/31/28,EUR,97.9034,IMERYS SA,Industrial,2028-03-31,1.875,BBB-,0.0010981,300000000,Y,2027-12-31,Sr Unsecured,1,FIXED,31/03/2017,31/03/2027,01/04/2016,97.712,98.095,2.2477754962354553,0.38299999999999557,99.78571748606741,1.4075342465753424,101.19325173264275,1.8823174860674072,85.58215620382401,0.026515151515151412,0.9741697416974171,1.8980133712776248
FR0013144003,SANFP 1 ⅛ 04/05/28,EUR,97.07899,SANOFI SA,"Consumer, Non-cyclical",2028-04-05,1.125,AA-,2.18798e-05,700000000,Y,2028-01-05,Sr Unsecured,1,FIXED,05/04/2017,05/04/2027,05/04/2016,96.936,97.222,2.2614647501711156,0.28599999999998715,98.13821969353852,0.8291095890410959,98.96732928257961,1.0592296935385122,48.27149822536749,0.027843785128558795,1.9312637748024002,5.6226774963845605
XS1319820541,FDX 1 ⅝ 01/11/27,EUR,99.0,FEDEX CORP,Industrial,2027-01-11,1.625,BBB,0.000548747,1250000000,Y,2026-10-11,Sr Unsecured,1,FIXED,11/01/2017,11/01/2026,11/04/2016,98.925,99.075,1.0266940451745379,0.15000000000000568,99.70176033254664,1.5804794520547945,101.28223978460143,0.701760332546641,68.75136622790761,0.024573189956314533,1.9422307783048873,5.677379450972632
XS1396285279,EUROGR 1 ½ 04/18/28,EUR,97.53468,EUROGRID GMBH,Utilities,2028-04-18,1.5,NR,0.009725752,750000000,Y,2028-01-18,Sr Unsecured,1,FIXED,18/04/2017,18/04/2027,18/04/2016,97.374,97.696,2.297056810403833,0.32200000000000273,98.93602994007531,1.052054794520548,99.98808473459586,1.4013499400753204,62.620673962464,0.027689010070287796,4.729852396213893,27.35449839427709
XS1397134609,LIN 1 04/20/28,EUR,97.18938,LINDE FINANCE BV,Basic Materials,2028-04-20,1.0,A,0.063121921,750000000,N,,Sr Unsecured,1,FIXED,20/04/2017,20/04/2027,20/04/2016,96.855,97.524,2.5516769336071183,0.6689999999999969,97.532888323577,0.44931506849315067,97.98220339207015,0.343508323576998,13.918598872082827,0.022526240469323996,0.9779700123304563,1.9128506900352658
DE000A180B80,ALVGR 1 ⅜ 04/21/31,EUR,93.574,ALLIANZ FINANCE II B.V.,Financial,2031-04-21,1.375,AA,4.75964e-06,750000000,Y,2031-01-21,Sr Unsecured,1,FIXED,21/04/2017,21/04/2030,21/04/2016,93.303,93.846,5.305954825462012,0.5430000000000064,95.40736350508483,0.953082191780822,96.36044569686565,1.833363505084833,37.65840143007633,0.030186790565495836,0.9706977503090236,1.8845082449099992
XS1400169931,WFC 1 ⅜ 10/26/26,EUR,99.14171,WELLS FARGO & COMPANY,Financial,2026-10-26,1.375,A,0.000286223,2000000000,N,,Sr Unsecured,1,FIXED,26/10/2016,26/10/2025,26/04/2016,99.076,99.207,1.0677618069815196,0.13100000000000023,99.42765589408108,1.2808219178082192,100.70847781188931,0.28594589408108106,26.955570501133575,0.04096356434108722,8.704762761631093,88.9737446167608
XS1401196958,URWFP 1 ⅛ 04/28/27,EUR,98.16181,UNIBAIL-RODAMCO-WESTFLD,Financial,2027-04-28,1.125,NR,0.008889247,500000000,N,,Sr Unsecured,1,FIXED,28/04/2017,28/04/2026,28/04/2016,98.05,98.273,1.571526351813826,0.22299999999999898,98.77087386522014,0.4808219178082192,99.25169578302835,0.6090638652201363,39.423469878300864,0.02212214712114,0.9783566502463056,1.9143634701623442
XS1401197253,URWFP 2 04/28/36,EUR,83.07794,UNIBAIL-RODAMCO-WESTFLD,Financial,2036-04-28,2.0,NR,0.008889247,500000000,N,,Sr Unsecured,1,FIXED,28/04/2017,28/04/2035,28/04/2016,82.75,83.406,10.573579739904176,0.6560000000000059,94.62872477388343,0.8547945205479452,95.48351929443137,11.550784773883436,136.16131686065626,0.027144520403995273,1.9361465047513953,5.644230426262042
XS1402921412,JPM 1 ½ 10/29/26,EUR,99.3032,JPMORGAN CHASE & CO,Financial,2026-10-29,1.5,A+,0.0001373,1500000000,N,,Sr Unsecured,1,FIXED,29/10/2016,29/10/2025,29/04/2016,99.234,99.372,1.0759753593429158,0.13800000000000523,99.55508534058401,1.384931506849315,100.94001684743333,0.25188534058401046,23.52967291298883,0.025695390779182595,1.9329957740039536,5.637235483591083
XS1403015156,UNANA 1 ⅛ 04/29/28,EUR,96.946,UNILEVER FINANCE,"Consumer, Non-cyclical",2028-04-29,1.125,A+,7.01173e-07,700000000,N,,Sr Unsecured,1,FIXED,29/04/2017,29/04/2027,29/04/2016,96.817,97.076,2.5763175906913074,0.25900000000000034,97.81575085502269,0.4777397260273972,98.29349058105008,0.8697508550226871,34.93421341423941,0.029451798097987515,1.9294048658467176,5.60962435070887
XS1403264291,MCD 1 ¾ 05/03/28,EUR,98.422,MCDONALD'S CORP,"Consumer, Cyclical",2028-05-03,1.75,BBB+,4.53177e-07,750000000,N,,Sr Unsecured,1,FIXED,03/05/2017,03/05/2027,03/05/2016,98.303,98.54,2.5872689938398357,0.23700000000000898,99.36423766480718,0.7239726027397262,100.0882102675469,0.9422376648071804,37.279179732524106,0.027736081964390046,1.932647863974009,5.628455265290707
XS1403388694,ENGSM 1 ⅜ 05/05/28,EUR,96.99312,ENAGAS FINANCIACIONES SA,Utilities,2028-05-05,1.375,BBB+,1.61394e-05,750000000,N,,Sr Unsecured,1,FIXED,05/05/2017,05/05/2027,05/05/2016,96.848,97.138,2.5927446954141,0.29000000000000625,98.42429784384464,0.5613013698630137,98.98559921370766,1.4311778438446368,57.03958213741079,0.027406129770405366,1.9344588138381105,5.636705122016834
DE000A169NC2,MBGGR 1 ⅜ 05/11/28,EUR,97.315,MERCEDES-BENZ GROUP AG,"Consumer, Cyclical",2028-05-11,1.375,A,0.001270443,1250000000,N,,Sr Unsecured,1,FIXED,11/05/2017,11/05/2027,11/05/2016,97.124,97.505,2.6091718001368926,0.3810000000000002,98.41162850418354,0.5386986301369863,98.95032713432053,1.096628504183542,43.36721751300152,0.029075842540749058,1.9313005521893165,5.618352523947627
XS1411404426,AZN 1 ¼ 05/12/28,EUR,97.137,ASTRAZENECA PLC,"Consumer, Non-cyclical",2028-05-12,1.25,A+,1.9238e-05,800000000,Y,2028-02-12,Sr Unsecured,1,FIXED,12/05/2017,12/05/2027,12/05/2016,96.984,97.29,2.3655030800821355,0.3060000000000116,98.31825145135933,0.7910958904109588,99.10934734177029,1.18125145135933,51.46849271942121,0.028796318262411382,1.9327815897785043,5.625124096673543
FR0013173432,VIEFP 1 ¼ 05/19/28,EUR,96.82401,VEOLIA ENVIRONNEMENT SA,Utilities,2028-05-19,1.25,NR,0.000200524,800000000,Y,2028-02-19,Sr Unsecured,1,FIXED,19/05/2017,19/05/2027,19/05/2016,96.65,96.998,2.3846680355920604,0.347999999999999,98.30102402018333,0.767123287671233,99.06814730785457,1.4770140201833328,63.9540180625472,0.03334573908685836,8.11664194712122,76.70635092036386
XS1412266816,JNJ 1.15 11/20/28,EUR,96.68462,JOHNSON & JOHNSON,"Consumer, Non-cyclical",2028-11-20,1.15,AAA,8.96047e-08,750000000,Y,2028-08-20,Sr Unsecured,1,FIXED,20/11/2016,20/11/2027,20/05/2016,96.528,96.841,2.8856947296372346,0.3129999999999882,97.57558100620189,0.13232876712328767,97.70790977332517,0.8909610062018913,32.10788337600756,0.027916927631126878,1.9241643555522219,5.594785673602738
XS1412266907,JNJ 1.65 05/20/35,EUR,87.086,JOHNSON & JOHNSON,"Consumer, Non-cyclical",2035-05-20,1.65,AAA,8.96047e-08,1500000000,Y,2035-02-20,Sr Unsecured,1,FIXED,20/05/2017,20/05/2034,20/05/2016,86.827,87.345,9.388090349075975,0.5180000000000007,92.54023265621512,1.008082191780822,93.54831484799594,5.454232656215126,69.56023786595092,0.02722151656987429,1.932442379163065,5.629525577857404
XS1405784015,KHC 2 ¼ 05/25/28,EUR,98.96035,KRAFT HEINZ FOODS CO,"Consumer, Non-cyclical",2028-05-25,2.25,BBB,0.058568923,1250000000,Y,2028-02-25,Sr Unsecured,1,FIXED,25/05/2017,25/05/2027,25/05/2016,98.796,99.125,2.401095140314853,0.3289999999999935,100.60872095140074,1.3438356164383563,101.9525565678391,1.6483709514007359,69.74547028109453,0.027051502285361063,1.9304215316799982,5.622273176939463
XS1419646317,BNP 1 ½ 05/25/28,EUR,97.652,BNP PARIBAS,Financial,2028-05-25,1.5,A+,0.000632394,1000000000,N,,Sr Preferred,1,FIXED,25/05/2017,25/05/2027,25/05/2016,97.508,97.795,2.647501711156742,0.28700000000000614,98.70111306182088,0.5301369863013699,99.23125004812225,1.0491130618208757,40.80771585024262,0.024988356601599593,1.9297221547570047,5.627036546049755
XS1415535696,CCEP 1 ¾ 05/26/28,EUR,98.16451,COCA-COLA EUROPACIFIC,"Consumer, Non-cyclical",2028-05-26,1.75,BBB+,5.8577e-06,500000000,Y,2028-02-26,Sr Unsecured,1,FIXED,26/05/2017,26/05/2027,26/05/2016,98.037,98.292,2.403832991101985,0.25499999999999545,99.44632850191782,1.0404109589041097,100.48673946082192,1.2818185019178117,54.543675490577385,0.029404484038436585,1.9091049088798187,5.530915048167732
XS1420338102,HOLNSW 2 ¼ 05/26/28,EUR,99.52038,HOLCIM FINANCE LUX SA,Industrial,2028-05-26,2.25,BBB+,1.36262e-05,1150000000,Y,2028-02-26,Sr Unsecured,1,FIXED,26/05/2017,26/05/2027,26/05/2016,99.364,99.677,2.403832991101985,0.3130000000000024,100.60884328179668,1.3376712328767124,101.9465145146734,1.0884632817966775,45.87357281635082,0.032181843684741515,4.696059740743385,27.015498244806505
FR0013179314,SCOR 3 ⅝ 05/27/48,EUR,101.311,SCOR SE,Financial,2048-05-27,3.625,BBB+,4.3925e-05,500000000,Y,2028-05-27,Subordinated,1,VARIABLE,27/05/2017,27/05/2047,27/05/2016,101.06,101.563,2.652977412731006,0.5030000000000001,104.13146646819423,1.2613013698630136,105.39276783805725,2.820466468194226,106.27268095584603,0.02293750089241744,1.9257617251983006,5.6190072556986115
XS1421915049,MMM 1 ½ 06/02/31,EUR,92.18,3M COMPANY,Industrial,2031-06-02,1.5,BBB+,1.50941e-05,500000000,Y,2031-03-02,Sr Unsecured,1,FIXED,02/06/2017,02/06/2030,31/05/2016,91.969,92.391,5.415468856947296,0.42200000000001125,95.90868876036998,0.8753424657534248,96.7840312261234,3.7286887603699768,75.67455778965575,0.021633352949519527,1.9122395855400496,5.570793913330788
XS1428953407,HSBC 3 ⅛ 06/07/28,EUR,101.607,HSBC HOLDINGS PLC,Financial,2028-06-07,3.125,BBB+,9.28921e-05,1000000000,N,,Subordinated,1,FIXED,07/06/2017,07/06/2027,07/06/2016,101.404,101.809,2.6830937713894594,0.40500000000000114,102.87942072085858,0.9931506849315069,103.87257140579008,1.2724207208585767,47.48022328039639,0.024942508001651077,1.9391375481530146,5.663948158588031
XS1428773763,ASSGEN 5 06/08/48,EUR,105.4944,GENERALI,Financial,2048-06-08,5.0,BBB+,6.64834e-07,850000000,Y,2028-06-08,Subordinated,1,VARIABLE,08/06/2017,08/03/2048,08/06/2016,105.316,105.672,2.6858316221765914,0.35599999999999454,107.73450801748712,1.5753424657534245,109.30985048324054,2.240108017487117,81.13663851121439,0.031041597694883516,1.9311887314407539,5.6108007607238015
FR0013182847,AIFP 1 ¼ 06/13/28,EUR,97.6016,AIR LIQUIDE FINANCE,Basic Materials,2028-06-13,1.25,A,0.010105715,1000000000,Y,2028-03-13,Sr Unsecured,1,FIXED,13/06/2017,13/06/2027,13/06/2016,97.408,97.795,2.4476386036960984,0.38700000000000045,98.24125032277581,0.6917808219178081,98.93303114469362,0.6396503227758075,26.89453109491649,0.032816684853773904,4.683807508961559,26.910128558958732
XS1446746189,PEP 0 ⅞ 07/18/28,EUR,95.741,PEPSICO INC,"Consumer, Non-cyclical",2028-07-18,0.875,A+,2.5576e-06,750000000,Y,2028-04-18,Sr Unsecured,1,FIXED,18/07/2017,18/07/2027,18/07/2016,95.596,95.886,2.546201232032854,0.28999999999999204,97.23199022002544,0.3979452054794521,97.6299354255049,1.490990220025438,61.03805375335869,0.028572208365917454,0.9722214851485149,1.890429232368768
XS1463101680,VOD 1.6 07/29/31,EUR,92.36,VODAFONE GROUP PLC,Communications,2031-07-29,1.6,BBB,0.000445526,860001000,N,,Sr Unsecured,1,FIXED,29/07/2017,29/07/2030,29/07/2016,92.149,92.572,5.823408624229979,0.4230000000000018,96.01467022126603,0.2805479452054795,96.29521816647151,3.6546702212660307,69.26741536048107,0.025309347612458195,0.9753154034229828,1.9024802723082717
XS1463043973,WFC 1 02/02/27,EUR,98.19437,WELLS FARGO & COMPANY,Financial,2027-02-02,1.0,A,0.000286223,2000000000,N,,Sr Unsecured,1,FIXED,02/02/2017,02/02/2026,02/08/2016,98.132,98.257,1.3388090349075976,0.125,98.79203393641498,0.6602739726027397,99.45230790901772,0.5976639364149747,45.33064751223209,0.036413190865445186,9.11686196151995,94.96827659495652
XS1470601656,BNP 2 ¼ 01/11/27,EUR,99.726,BNP PARIBAS,Financial,2027-01-11,2.25,BBB+,0.000632394,1020000000,N,,Subordinated,1,FIXED,11/01/2017,11/01/2026,11/08/2016,99.655,99.797,1.2785763175906912,0.1419999999999959,100.40826689800267,1.621232876712329,102.02949977471499,0.6822668980026663,53.356798021600454,0.032911635840429755,1.9288866874328232,5.595127884839728
XS1485643610,KO 1.1 09/02/36,EUR,79.0146,COCA-COLA CO/THE,"Consumer, Non-cyclical",2036-09-02,1.1,A+,6.77015e-08,500000000,N,,Sr Unsecured,1,FIXED,02/09/2017,02/09/2035,02/09/2016,78.724,79.306,10.921286789869953,0.5819999999999936,85.76672713182134,0.08739726027397261,85.85412439209531,6.752127131821339,79.79714546751985,0.03419591609115635,1.9264822628891694,5.581205072379225
DE000A185QB3,EVKGR 0 ¾ 09/07/28,EUR,95.158,EVONIK INDUSTRIES AG,Basic Materials,2028-09-07,0.75,BBB,0.000434528,500000000,Y,2028-06-07,Sr Unsecured,1,FIXED,07/09/2017,07/09/2027,07/09/2016,94.946,95.369,2.6830937713894594,0.4230000000000018,96.73882775926619,0.23835616438356166,96.97718392364975,1.5808277592661852,61.74018616474345,0.03231909873608517,1.9263869143743089,5.587576763964027
FR0013201134,DGFP 0 ¾ 09/09/28,EUR,94.92271,COFIROUTE SA,"Consumer, Non-cyclical",2028-09-09,0.75,NR,0.006323982,650000000,N,,Sr Unsecured,1,FIXED,09/09/2017,09/09/2027,09/09/2016,94.808,95.037,2.940451745379877,0.2289999999999992,96.39132248074662,0.045205479452054796,96.43652796019867,1.4686124807466285,52.56263562759937,0.030351342723718713,1.9277088881546105,5.599788987630724
XS1485533431,KPN 1 ⅛ 09/11/28,EUR,95.982,KONINKLIJKE KPN NV,Communications,2028-09-11,1.125,BBB,1.5647e-06,625000000,Y,2028-06-11,Sr Unsecured,1,FIXED,11/09/2017,11/09/2027,09/09/2016,95.821,96.142,2.6940451745379876,0.32099999999999795,97.69741503702012,0.3452054794520548,98.04262051647217,1.7154150370201222,66.31191535035862,0.026484316749568564,0.9741990049751243,1.8981274025890444
XS1405775534,TMO 1 ⅜ 09/12/28,EUR,96.825,THERMO FISHER SCIENTIFIC,"Consumer, Non-cyclical",2028-09-12,1.375,A-,3.83619e-05,600000000,Y,2028-06-12,Sr Unsecured,1,FIXED,12/09/2017,12/09/2027,12/09/2016,96.684,96.965,2.6967830253251197,0.2810000000000059,98.34427372863902,0.41815068493150687,98.76242441357053,1.5192737286390212,58.33756124837032,0.02891958834040391,1.9282895670721878,5.607213468298601
FR0013201639,SANFP 0 ½ 01/13/27,EUR,97.907,SANOFI SA,"Consumer, Non-cyclical",2027-01-13,0.5,AA-,2.18798e-05,1150000000,Y,2026-10-13,Sr Unsecured,1,FIXED,13/01/2017,13/01/2026,13/09/2016,97.83,97.984,1.0321697467488022,0.15399999999999636,98.56073608538783,0.48356164383561645,99.04429772922344,0.653736085387834,64.4310250973675,0.0318642497780651,1.9320678283196449,5.611234094613732
XS1485603747,APTV 1.6 09/15/28,EUR,97.524,APTIV SWISS HOLDINGS LTD,"Consumer, Cyclical",2028-09-15,1.6,BBB,0.000258509,500000000,Y,2028-06-15,Sr Unsecured,1,FIXED,15/09/2017,15/09/2027,15/09/2016,97.378,97.67,2.704996577686516,0.2920000000000016,98.92436205622325,0.4734246575342466,99.3977867137575,1.4003620562232442,53.35653541978325,0.023734910136930257,1.9102963712079597,5.555690910605285
XS1492825481,NOVNVX 0 ⅝ 09/20/28,EUR,95.112,NOVARTIS FINANCE SA,"Consumer, Non-cyclical",2028-09-20,0.625,AA-,1.31566e-06,500000000,N,,Sr Unsecured,1,FIXED,20/09/2017,20/09/2027,20/09/2016,94.92,95.304,2.97056810403833,0.38400000000000034,95.99379814667067,0.018835616438356163,96.01263376310902,0.8817981466706755,31.23993872511303,0.03433450122351267,4.708614695535632,27.075433963561093
FR0013203734,ACAFP 4 ¾ 09/27/48,EUR,104.589,CREDIT AGRICOLE ASSRNCES,Financial,2048-09-27,4.75,NR,0.001735407,1000000000,Y,2028-09-27,Subordinated,1,VARIABLE,27/09/2017,27/09/2047,27/09/2016,104.338,104.84,2.9897330595482545,0.5020000000000095,107.82315646235587,0.052054794520547946,107.87521125687641,3.2341564623558696,106.3680658527043,0.02800732701894119,2.8886215018748205,11.201417848063755
FR0013203825,LIFP 1 ¼ 09/29/31,EUR,90.123,KLEPIERRE SA,Financial,2031-09-29,1.25,A-,2.73016e-05,600000000,Y,2031-06-29,Sr Unsecured,1,FIXED,29/09/2017,29/09/2030,29/09/2016,89.897,90.349,5.7412731006160165,0.4519999999999982,94.22528667431395,0.3219178082191781,94.54720448253313,4.102286674313945,79.89189066700204,0.02579800937739159,2.8949476609285036,11.2502504811381
FR0013205069,GFCFP 1 01/30/29,EUR,94.88685,GECINA,Financial,2029-01-30,1.0,A-,0.000165878,500000000,Y,2028-10-30,Sr Unsecured,1,FIXED,30/01/2017,30/01/2028,30/09/2016,94.719,95.055,3.080082135523614,0.33600000000001273,96.90522030282587,0.9205479452054794,97.82576824803135,2.018370302825872,69.00694795836318,0.02629510312944814,0.9743786138613862,1.898827366300873
FR0013210416,VIEFP 0.927 01/04/29,EUR,94.49424,VEOLIA ENVIRONNEMENT SA,Utilities,2029-01-04,0.927,BBB,0.000200524,500000000,Y,2028-10-04,Sr Unsecured,1,FIXED,04/01/2017,04/01/2028,04/10/2016,94.361,94.627,3.0088980150581794,0.26599999999999113,96.80890145838134,0.9193808219178083,97.72828228029915,2.3146614583813374,81.13841817003694,0.032609471033625395,4.752918836969075,27.446950757223558
FR0013204468,BPCEGP 1 10/05/28,EUR,95.49501,BPCE SA,Financial,2028-10-05,1.0,A+,1.82924e-05,1000000000,N,,Sr Preferred,1,FIXED,05/10/2017,05/10/2027,05/10/2016,95.335,95.655,3.0116358658453115,0.3200000000000074,97.01562346835871,0.989041095890411,98.00466456424913,1.520613468358718,52.957535858797094,,,
XS1499602289,BX 1 10/05/26,EUR,98.41224,BLACKSTONE HOLDINGS FINA,Financial,2026-10-05,1.0,NR,1.41591e-05,600000000,N,,Sr Unsecured,1,FIXED,05/10/2017,05/10/2025,05/10/2016,98.333,98.491,1.0102669404517455,0.15800000000000125,99.08690626859125,0.989041095890411,100.07594736448166,0.6746662685912526,67.58049778428752,0.025698951951007278,2.895231936321172,11.252447352993244
DE000A2BPA51,BASGR 0 ⅞ 10/06/31,EUR,89.154,BASF SE,Basic Materials,2031-10-06,0.875,A-,0.000440507,500000000,Y,2031-07-06,Sr Unsecured,1,FIXED,06/10/2017,06/10/2030,06/10/2016,88.85,89.457,5.760438056125941,0.6069999999999993,92.19215259726354,0.20856164383561646,92.40071424109917,3.0381525972635472,59.417972629006144,0.026218220338983106,0.9744516129032257,1.8991118917793957
XS1501367921,LXSGR 1 10/07/26,EUR,98.574,LANXESS AG,Basic Materials,2026-10-07,1.0,NR,0.003328192,500000000,Y,2026-07-07,Sr Unsecured,1,FIXED,07/10/2017,07/10/2025,07/10/2016,98.476,98.673,0.7638603696098563,0.19700000000000273,99.2961413866799,0.2356164383561644,99.53175782503607,0.7221413866799082,95.26414926125217,0.03166418860427026,5.53608706689543,36.943462478078125
XS1503131713,TRNIM 1 10/11/28,EUR,95.5224,TERNA RETE ELETTRICA,Utilities,2028-10-11,1.0,BBB+,2.09814e-05,750000000,N,,Sr Unsecured,1,FIXED,11/10/2017,11/10/2027,11/10/2016,95.375,95.669,3.028062970568104,0.29399999999999693,96.98909649614319,0.9726027397260274,97.96169923586922,1.4666964961431859,50.80516519154794,0.03108326348713125,0.9698537794299876,1.8812327069492625
XS1505132602,SWFP 0 ¾ 04/14/27,EUR,98.176,SODEXO SA,"Consumer, Cyclical",2027-04-14,0.75,BBB+,0.000685589,800000000,Y,2027-01-14,Sr Unsecured,1,FIXED,14/04/2017,14/04/2026,14/10/2016,98.069,98.283,1.2867898699520877,0.21399999999999864,98.52398484725242,0.5342465753424657,99.05823142259489,0.3479848472524196,27.49026706307629,0.03420347939509819,1.920479543269161,5.557961147372158
XS1505554771,TELEFO 1.93 10/17/31,EUR,93.33887,TELEFONICA EMISIONES SAU,Communications,2031-10-17,1.93,BBB-,0.021357445,750000000,N,,Sr Unsecured,1,FIXED,17/10/2017,17/10/2030,17/10/2016,93.082,93.596,6.0424366872005475,0.51400000000001,97.64695305813503,1.8453972602739723,99.492350318409,4.308083058135026,78.39316584961276,0.03941508140852916,1.9148396709405218,5.517718257494446
XS1506398244,WSTP 0 ⅞ 04/17/27,EUR,97.834,WESTPAC BANKING CORP,Financial,2027-04-17,0.875,AA-,3.51898e-05,500000000,N,,Sr Unsecured,1,FIXED,17/04/2017,17/04/2026,17/10/2016,97.762,97.907,1.541409993155373,0.14499999999999602,98.42101167050404,0.4003424657534247,98.82135413625747,0.5870116705040402,38.8465383450646,0.03331117112898097,1.9257246619025612,5.581448672966718
XS1505896735,CRHID 1 ⅜ 10/18/28,EUR,96.11,CRH FINANCE DAC,Industrial,2028-10-18,1.375,BBB+,5.66045e-05,600000000,Y,2028-07-18,Sr Unsecured,1,FIXED,18/10/2017,18/10/2027,18/10/2016,95.995,96.225,2.7953456536618755,0.22999999999998977,98.26893473899047,0.28253424657534243,98.5514689855658,2.1589347389904674,80.37217794678169,0.022343907981540276,0.9781444308445533,1.9135330551844298
FR0013213683,SANEFP 0.95 10/19/28,EUR,94.353,SANEF SA,"Consumer, Non-cyclical",2028-10-19,0.95,BBB-,0.016819763,300000000,Y,2028-07-19,Sr Unsecured,1,FIXED,19/10/2017,19/10/2027,19/10/2016,94.071,94.634,2.7980835044490076,0.5630000000000024,97.12195468279133,0.1926027397260274,97.31455742251735,2.768954682791332,104.1713668461703,0.023895357742186624,0.9766623048327139,1.9077385153622979
XS1405767515,UPS 1 11/15/28,EUR,95.56079,UNITED PARCEL SERVICE,Industrial,2028-11-15,1.0,A,8.19937e-05,500000000,Y,2028-08-15,Sr Unsecured,1,FIXED,15/11/2017,15/11/2027,24/10/2016,95.431,95.69,2.8720054757015743,0.25900000000000034,97.17433015411886,0.12876712328767123,97.30309727740654,1.6135401541188656,58.8036412132783,0.0317248071521036,1.923945034823888,5.58024647947247
XS1508450688,UCGIM 2 ⅛ 10/24/26,EUR,99.893,UNICREDIT SPA,Financial,2026-10-24,2.125,BBB+,0.000322889,1000000000,N,,Sr Preferred,1,FIXED,24/10/2017,24/10/2025,24/10/2016,99.832,99.954,1.0622861054072552,0.12199999999999989,100.2119396251702,1.991095890410959,102.20303551558116,0.31893962517020213,29.989217106561817,,,
XS1505573482,SRGIM 0 ⅞ 10/25/26,EUR,98.52081,SNAM SPA,Utilities,2026-10-25,0.875,BBB+,2.41679e-05,1250000000,N,,Sr Unsecured,1,FIXED,25/10/2017,25/10/2025,25/10/2016,98.464,98.578,1.0650239561943875,0.11400000000000432,98.9069358303387,0.8174657534246577,99.72440158376335,0.38612583033869896,36.70329238843363,0.030113350573865962,0.9707669543773119,1.8847769594220034
XS1457608286,C 1 ½ 10/26/28,EUR,96.80774,CITIGROUP INC,Financial,2028-10-26,1.5,A-,0.000312288,1000000000,Y,2028-07-26,Sr Unsecured,1,FIXED,26/10/2017,26/10/2027,26/10/2016,96.699,96.916,2.817248459958932,0.21699999999999875,98.59124525609037,0.27534246575342464,98.8665877218438,1.783505256090379,65.6165617425355,0.02708069691142952,2.880612541297364,11.166573128722982
XS1508831051,ENGSM 0 ¾ 10/27/26,EUR,98.35403,ENAGAS FINANCIACIONES SA,Utilities,2026-10-27,0.75,BBB+,1.61394e-05,500000000,Y,2026-07-27,Sr Unsecured,1,FIXED,27/10/2017,27/10/2025,27/10/2016,98.285,98.423,0.8186173853524983,0.13800000000000523,99.04829945286303,0.13561643835616438,99.1839158912192,0.6942694528630398,85.7497624991962,,,
XS1511787589,MS 1 ⅜ 10/27/26,EUR,98.4115,MORGAN STANLEY,Financial,2026-10-27,1.375,A,2.70627e-05,1500000000,N,,Sr Unsecured,1,FIXED,27/10/2017,27/10/2025,27/10/2016,98.229,98.594,1.0704996577686516,0.3649999999999949,99.42617622723576,1.277054794520548,100.70323102175631,1.0146762272357535,95.76068134206967,0.03730920646181252,8.991443335096731,93.1641861386472
XS1405766624,VZ 1 ⅜ 11/02/28,EUR,96.208,VERIZON COMMUNICATIONS,Communications,2028-11-02,1.375,BBB+,0.000164108,1059958000,N,,Sr Unsecured,1,FIXED,02/11/2017,02/11/2027,02/11/2016,96.05,96.366,3.0882956878850103,0.3160000000000025,98.00392152474241,1.2544520547945206,99.25837357953694,1.7959215247424112,60.70571836938296,0.03324557495376342,1.923857852043503,5.574457115643438
XS1512827095,MRLSM 1 ⅞ 11/02/26,EUR,99.425,MERLIN PROPERTIES SOCIMI,Financial,2026-11-02,1.875,BBB+,3.63482e-05,800000000,Y,2026-08-02,Sr Unsecured,1,FIXED,02/11/2017,02/11/2025,02/11/2016,99.366,99.483,0.8350444900752909,0.11700000000000443,99.9524470851461,0.3082191780821918,100.2606662632283,0.5274470851461075,63.122792931750446,0.028738386856624106,0.9720644361833954,1.8898185361850857
XS1513062411,MRK 1 ⅜ 11/02/36,EUR,80.63282,MERCK & CO INC,"Consumer, Non-cyclical",2036-11-02,1.375,A+,1.37989e-05,500000000,Y,2036-08-02,Sr Unsecured,1,FIXED,02/11/2017,02/11/2035,02/11/2016,80.371,80.894,10.836413415468858,0.5230000000000103,88.49397750205324,0.22602739726027396,88.72000489931351,7.861157502053246,92.44335319532544,0.02533263552003852,0.9752932515337425,1.9023938529745201
FR0013216926,BNFP 1.208 11/03/28,EUR,95.969,DANONE SA,"Consumer, Non-cyclical",2028-11-03,1.208,BBB+,1.13671e-06,1600000000,Y,2028-08-03,Sr Unsecured,1,FIXED,03/11/2017,03/11/2027,03/11/2016,95.866,96.073,2.839151266255989,0.20699999999999363,97.77925682051635,0.19526575342465752,97.97452257394102,1.8102568205163578,66.49513584498372,,,
FR0013217114,ORAFP 0 ⅞ 02/03/27,EUR,98.057,ORANGE SA,Communications,2027-02-03,0.875,BBB+,2.14239e-05,750000000,Y,2026-11-03,Sr Unsecured,1,FIXED,03/02/2017,03/02/2026,03/11/2016,97.995,98.12,1.0896646132785763,0.125,98.88176751196674,0.7958904109589042,99.67765792292565,0.8247675119667406,76.81819736891534,,,
XS1512677003,BFCM 1 ⅞ 11/04/26,EUR,99.358,BANQUE FED CRED MUTUEL,Financial,2026-11-04,1.875,BBB+,1.08678e-05,700000000,N,,Subordinated,1,FIXED,04/11/2017,04/11/2025,04/11/2016,99.282,99.434,1.0924024640657084,0.15200000000000102,99.94972503650897,1.7003424657534247,101.65006750226239,0.5917250365089615,54.32458706251847,0.02670448192085233,0.9739900990099009,1.8973134259386326
XS1405765733,DOV 1 ¼ 11/09/26,EUR,98.7721,DOVER CORP,Industrial,2026-11-09,1.25,BBB+,8.65558e-06,600000000,Y,2026-08-09,Sr Unsecured,1,FIXED,09/11/2017,09/11/2025,09/11/2016,98.709,98.835,0.8542094455852156,0.12599999999999056,99.42866057697614,0.18150684931506847,99.61016742629121,0.6565605769761476,77.36501813564888,0.027125711470323968,1.926808892620101,5.6079350218357
DE000A188WW1,BASGR 0 ¾ 11/10/26,EUR,98.642,BASF FINANCE EUROPE NV,Basic Materials,2026-11-10,0.75,A-,0.018848259,500000000,Y,2026-08-10,Sr Unsecured,1,FIXED,10/11/2017,10/11/2025,10/11/2016,98.546,98.738,0.8569472963723477,0.19199999999999307,99.0063891231754,0.10684931506849316,99.11323843824388,0.36438912317539973,42.951845753612965,0.03123377009272322,1.9100396915629383,5.528071780954967
ES0211845310,ABESM 1 02/27/27,EUR,98.373,ABERTIS INFRAESTRUCTURAS,"Consumer, Non-cyclical",2027-02-27,1.0,BBB-,0.016819763,500000000,N,,Sr Unsecured,1,FIXED,27/02/2017,27/02/2026,17/11/2016,98.073,98.673,1.4072553045859,0.6000000000000085,98.7311072099578,0.5917808219178082,99.3228880318756,0.35810720995779377,25.832890941307117,0.026767967678865683,0.9739298765432097,1.897078808846943
XS1520907814,ABBV 2 ⅛ 11/17/28,EUR,98.871,ABBVIE INC,"Consumer, Non-cyclical",2028-11-17,2.125,A-,2.03341e-05,750000000,Y,2028-08-17,Sr Unsecured,1,FIXED,17/11/2017,17/11/2027,17/11/2016,98.775,98.966,2.8774811772758384,0.1909999999999883,100.28302997835142,0.261986301369863,100.54501627972128,1.412029978351427,50.20460802087508,0.030324444999141203,4.67174680689412,26.85916538140909
XS1492458044,VTRS 3 ⅛ 11/22/28,EUR,100.0031,UTAH ACQUISITION SUB,"Consumer, Non-cyclical",2028-11-22,3.125,BBB-,0.000970976,750000000,Y,2028-08-22,Sr Unsecured,1,FIXED,22/11/2017,22/11/2027,22/11/2016,99.856,100.15,2.891170431211499,0.29400000000001114,103.06393820621629,0.3424657534246575,103.40640395964095,3.060838206216289,107.17041719913259,0.028041637583078084,0.9727232472324722,1.89238103141297
FR0013220258,ARRFP 1 ¼ 01/06/27,EUR,98.6104,APRR SA,"Consumer, Non-cyclical",2027-01-06,1.25,A-,0.011186382,500000000,Y,2026-10-06,Sr Unsecured,1,FIXED,06/01/2017,06/01/2026,28/11/2016,98.551,98.67,1.0130047912388775,0.11899999999999977,99.33301550877155,1.2328767123287672,100.56589222110031,0.722615508771554,72.02588145253154,0.026340279362259002,0.9743357248157248,1.8986602093043674
FR0013220266,ARRFP 1 ⅞ 01/06/31,EUR,94.70415,APRR SA,"Consumer, Non-cyclical",2031-01-06,1.875,A-,0.011186382,500000000,Y,2030-10-06,Sr Unsecured,1,FIXED,06/01/2017,06/01/2030,28/11/2016,94.543,94.865,5.0130047912388775,0.3219999999999885,98.11419718835725,1.8493150684931505,99.96351225685041,3.410047188357254,73.24222000992275,0.023864004535882027,0.9766922126081583,1.9078553563388394
XS1527556192,ASML 1 ⅝ 05/28/27,EUR,98.853,ASML HOLDING NV,Technology,2027-05-28,1.625,A,9.22768e-08,750000000,Y,2027-02-28,Sr Unsecured,1,FIXED,28/05/2017,28/05/2026,30/11/2016,98.742,98.965,1.4099931553730323,0.22299999999999898,99.58900349880089,0.9571917808219178,100.54619527962281,0.7360034988008977,52.670872921348874,0.030149987805869367,0.9707324290998768,1.8846428978122949
XS1528093799,ATOSTR 1 ¾ 02/01/27,EUR,99.13866,AUTOSTRADE PER L'ITALIA,"Consumer, Non-cyclical",2027-02-01,1.75,BBB-,0.009300628,600000000,N,,Sr Unsecured,1,FIXED,01/02/2018,01/02/2026,01/12/2016,99.027,99.251,1.3360711841204653,0.22400000000000375,99.77347864167864,1.16027397260274,100.93375261428137,0.6348186416786348,47.80798501887506,,,
BE6334365713,ECLEAR 1 ⅛ 12/07/26,EUR,98.768,EUROCLEAR HOLDING SA,Financial,2026-12-07,1.125,AA-,0.001962336,600000000,N,,Sr Preferred,1,FIXED,07/12/2017,07/12/2025,07/12/2016,98.696,98.84,1.1827515400410678,0.14400000000000546,99.07631552239782,0.9184931506849314,99.99480867308276,0.30831552239781956,26.34122473760949,0.025684966028910784,0.974958230958231,1.9010871042264066
FR0013222494,ENFP 1 ⅜ 06/07/27,EUR,98.408,BOUYGUES SA,Industrial,2027-06-07,1.375,A-,3.58094e-05,1000000000,Y,2027-03-07,Sr Unsecured,1,FIXED,07/06/2017,07/06/2026,07/12/2016,98.322,98.493,1.429158110882957,0.17099999999999227,99.23476844578686,0.7835616438356164,100.01833008962247,0.826768445786854,58.60029879423063,,,
XS1405762805,TKAAV 1 ½ 12/07/26,EUR,99.149,TELEKOM FINANZMANAGEMENT,Communications,2026-12-07,1.5,A-,2.47339e-05,750000000,Y,2026-09-07,Sr Unsecured,1,FIXED,07/12/2017,07/12/2025,07/12/2016,99.06,99.239,0.9336071184120466,0.17900000000000205,99.61056905399016,0.09863013698630135,99.70919919097646,0.4615690539901607,49.66461724807213,,,
XS1528141788,GWOCN 1 ¾ 12/07/26,EUR,99.202,GREAT-WEST LIFECO INC,Financial,2026-12-07,1.75,A,6.60381e-08,500000000,N,,Sr Unsecured,1,FIXED,07/12/2017,07/12/2025,07/12/2016,99.125,99.278,1.1827515400410678,0.1530000000000058,99.79989112461794,1.4287671232876713,101.22865824790561,0.597891124617945,50.792164470357896,0.023931091322089836,0.9766282208588957,1.9076053635560237
XS1531347661,BDX 1.9 12/15/26,EUR,99.50743,BECTON DICKINSON & CO,"Consumer, Non-cyclical",2026-12-15,1.9,BBB,1.17832e-05,500000000,Y,2026-09-15,Sr Unsecured,1,FIXED,15/12/2017,15/12/2025,09/12/2016,99.408,99.607,0.9555099247091033,0.19899999999999807,99.97794808205806,0.08328767123287671,100.06123575329094,0.47051808205806367,49.29478667157462,0.024776778392605645,0.9758222679172446,1.9044581971263095
XS1532779748,ZBH 2.425 12/13/26,EUR,99.97238,ZIMMER BIOMET HOLDINGS,"Consumer, Non-cyclical",2026-12-13,2.425,BBB,1.83175e-05,500000000,Y,2026-09-13,Sr Unsecured,1,FIXED,13/12/2017,13/12/2025,13/12/2016,99.885,100.06,0.9500342231348392,0.17499999999999716,100.46745083304876,0.1195890410958904,100.58703987414465,0.4950708330487572,51.8990800345908,0.03425827283962436,5.58373094188455,37.31157616442204
XS1538284230,ACAFP 1 ⅞ 12/20/26,EUR,99.494,CREDIT AGRICOLE LONDON,Financial,2026-12-20,1.875,A-,0.000125365,1500000000,N,,Sr Non Preferred,1,FIXED,20/12/2017,20/12/2025,20/12/2016,99.429,99.559,1.218343600273785,0.12999999999999545,99.94267873942731,1.464041095890411,101.40671983531772,0.44867873942730796,36.93045083480654,0.026868444772659386,1.9053831609264873,5.525404460344456
DE000A2DAHN6,ALVGR 3.099 07/06/47,EUR,100.6063,ALLIANZ SE,Financial,2047-07-06,3.099,A+,4.75964e-06,1000000000,Y,2027-07-06,Subordinated,1,VARIABLE,06/07/2017,08/04/2047,13/01/2017,100.471,100.742,1.7604380561259412,0.2710000000000008,101.99255497346715,0.7386657534246576,102.7312207268918,1.386254973467146,78.44935842368497,0.018559326183830292,0.9817788461538461,1.927779405510355
XS1548387593,BASGR 1.45 12/13/32,EUR,89.446,BASF SE,Basic Materials,2032-12-13,1.45,A-,0.000440507,300000000,Y,2032-09-13,Sr Unsecured,1,FIXED,13/12/2017,13/12/2031,13/01/2017,88.318,90.573,6.951403148528406,2.2549999999999955,93.87383779359946,0.07150684931506848,93.94534464291453,4.4278377935994655,72.66287157715801,0.03287913787664464,0.9681674876847292,1.8746965684195203
XS1550988643,NNGRNV 4 ⅝ 01/13/48,EUR,103.7255,NN GROUP NV,Financial,2048-01-13,4.625,BBB,1.1594e-06,850000000,Y,2028-01-13,Subordinated,1,VARIABLE,13/01/2018,13/10/2047,13/01/2017,103.416,104.036,2.2833675564681726,0.6200000000000045,105.8561939859027,3.307191780821918,109.16338576672463,2.1306939859027096,91.32282404124187,0.026896190058060657,2.8553569341295297,11.03687527653064
DE000CZ40LW5,CMZB 4 03/30/27,EUR,102.105,COMMERZBANK AG,Financial,2027-03-30,4.0,BBB-,0.000516517,648900000,N,,Subordinated,1,FIXED,30/03/2018,30/03/2026,16/01/2017,101.951,102.259,1.4921286789869952,0.30800000000000693,103.02274143379262,2.0273972602739727,105.05013869406659,0.9177414337926137,60.29307112770979,0.02650148018978873,0.9741827160493828,1.8980639284987044
FR0013231768,NK 1 ½ 01/15/27,EUR,98.269,IMERYS SA,Industrial,2027-01-15,1.5,BBB-,0.0010981,600000000,Y,2026-10-15,Sr Unsecured,1,FIXED,15/01/2018,15/01/2026,17/01/2017,98.188,98.349,1.0376454483230664,0.16100000000000136,99.5712062069314,1.4424657534246577,101.01367196035605,1.3022062069313876,126.78216370098745,0.027763624782994004,0.9729863714637146,1.8934049581082513
XS1550951138,TELEFO 2.318 10/17/28,EUR,98.94253,TELEFONICA EMISIONES SAU,Communications,2028-10-17,2.318,BBB-,0.021357445,700000000,N,,Sr Unsecured,1,FIXED,17/10/2017,17/10/2027,17/01/2017,98.78,99.106,3.0444900752908968,0.3259999999999934,100.81773836118792,2.21638904109589,103.03412740228381,1.8752083611879158,63.06908645783464,0.017411168487128603,0.9828867924528304,1.932132893556427
FR0013231099,DGFP 1 ¼ 01/18/27,EUR,98.636,AUTOROUTES DU SUD DE LA,"Consumer, Non-cyclical",2027-01-18,1.25,A-,4.03887e-05,1000000000,Y,2026-10-18,Sr Unsecured,1,FIXED,18/01/2018,18/01/2026,18/01/2017,98.574,98.699,1.0458590006844628,0.125,99.31125888925945,1.191780821917808,100.50303971117725,0.6752588892594531,65.19102408591972,0.024363233665559324,0.9762162162162162,1.9059962016070124
XS1551917591,IGIM 1 ⅝ 01/19/27,EUR,98.87974,ITALGAS SPA,Utilities,2027-01-19,1.625,BBB,3.11332e-05,750000000,N,,Sr Unsecured,1,FIXED,19/01/2018,19/01/2026,19/01/2017,98.815,98.944,1.3004791238877482,0.1290000000000049,99.62064738873059,1.1352739726027397,100.75592136133334,0.7409073887305908,57.424027086894164,0.02569124308254735,0.9749522643818851,1.9010638356467304
FR0013232444,CCAMA 6 01/23/27,EUR,104.186,CAISSE NAT REASSURANCE,Financial,2027-01-23,6.0,NR,0.001619129,650000000,N,,Subordinated,1,FIXED,23/01/2018,23/01/2026,23/01/2017,104.034,104.339,1.3114305270362765,0.3049999999999926,105.22451470243554,4.126027397260273,109.35054209969582,1.0385147024355348,75.8788977315328,0.03191716894256267,5.404626006950965,35.75479734376525
DE000A19B8E2,ANNGR 1 ¾ 01/25/27,EUR,99.33,VONOVIA SE,Financial,2027-01-25,1.75,BBB+,0.001036135,500000000,N,,Sr Unsecured,1,FIXED,25/01/2018,25/01/2026,25/01/2017,99.256,99.404,1.3169062286105406,0.14799999999999613,99.77673172624881,1.1938356164383563,100.97056734268718,0.44673172624881374,34.09462854127744,0.025637134387551778,0.9750036991368679,1.901264426661152
XS1554373677,FREGR 2 ⅛ 02/01/27,EUR,99.567,FRESENIUS FIN IRELAND PL,"Consumer, Non-cyclical",2027-02-01,2.125,BBB-,2.02554e-05,700000000,Y,2026-11-01,Sr Unsecured,1,FIXED,01/02/2018,01/02/2026,30/01/2017,99.495,99.64,1.0841889117043122,0.14499999999999602,100.21591711543624,1.9445205479452055,102.16043766338144,0.6489171154362481,59.88323077873731,0.029497319384212344,2.8174257683496418,10.822272478392472
XS1554373834,FREGR 3 01/30/32,EUR,98.968,FRESENIUS FIN IRELAND PL,"Consumer, Non-cyclical",2032-01-30,3.0,BBB-,2.02554e-05,500000000,Y,2031-10-30,Sr Unsecured,1,FIXED,30/01/2018,30/01/2031,30/01/2017,98.711,99.225,6.078028747433265,0.5139999999999958,103.64313446189819,2.7616438356164386,106.40477829751462,4.675134461898182,81.67230555073785,0.02121361618154902,0.9792270531400966,1.9177712432028757
XS1557095616,DT 1 ⅜ 01/30/27,EUR,98.841,DEUTSCHE TELEKOM INT FIN,Communications,2027-01-30,1.375,BBB+,0.021966191,938531000,N,,Sr Unsecured,1,FIXED,30/01/2018,30/01/2026,30/01/2017,98.75,98.932,1.3305954825462012,0.18200000000000216,99.28688201822025,0.9191780821917809,100.20606010041203,0.4458820182202601,33.83980162626288,0.025932735380458496,0.9747227722772277,1.9001689655916079
FR0013236544,CMARK 3 ½ 02/09/29,EUR,101.558,CREDIT MUTUEL ARKEA,Financial,2029-02-09,3.5,BBB+,1.22381e-05,500000000,N,,Subordinated,1,FIXED,09/02/2018,09/02/2028,09/02/2017,101.396,101.72,3.359342915811088,0.32399999999999807,104.49223507534626,2.2438356164383566,106.73607069178462,2.934235075346251,88.02882587040631,0.02621855544870181,0.9744512946979038,1.8991106514768419
XS1562614831,BBVASM 3 ½ 02/10/27,EUR,101.35,BANCO BILBAO VIZCAYA ARG,Financial,2027-02-10,3.5,BBB+,9.10572e-05,1000000000,N,,Subordinated,1,FIXED,10/02/2018,10/02/2026,10/02/2017,100.95,101.75,1.3607118412046544,0.7999999999999972,102.09518741282992,2.2342465753424663,104.32943398817238,0.745187412829921,53.96799718061407,0.02585703338593412,1.935031776754874,5.644585470313751
XS1566101603,UNANA 1 02/14/27,EUR,98.447,UNILEVER FINANCE,"Consumer, Non-cyclical",2027-02-14,1.0,A+,7.01173e-07,600000000,N,,Sr Unsecured,1,FIXED,14/02/2018,14/02/2026,14/02/2017,98.374,98.52,1.3716632443531827,0.1460000000000008,98.76276793718472,0.6273972602739726,99.39016519745869,0.31576793718471663,23.35319192835159,0.029273756546483804,0.9715588235294118,1.8878530951557098
FR0013238045,LIFP 1 ⅜ 02/16/27,EUR,98.785,KLEPIERRE SA,Financial,2027-02-16,1.375,A-,2.73016e-05,600000000,Y,2026-11-16,Sr Unsecured,1,FIXED,16/02/2018,16/02/2026,16/02/2017,98.699,98.872,1.1252566735112937,0.17300000000000182,99.3966398814885,1.2017123287671232,100.59835221025563,0.6116398814885002,54.825776821035234,0.02763420292214386,0.9731089108910892,1.8938819049112836
XS1569845404,URWFP 1 ½ 02/22/28,EUR,97.91,UNIBAIL-RODAMCO-WESTFLD,Financial,2028-02-22,1.5,NR,0.008889247,600000000,N,,Sr Unsecured,1,FIXED,22/02/2018,22/02/2027,22/02/2017,97.777,98.042,2.3928815879534566,0.26500000000000057,98.87232358800392,0.9082191780821918,99.78054276608611,0.962323588003926,41.24102898997916,0.026239104973185136,0.9744317821782178,1.8990345962380353
XS1570260460,SMINLN 2 02/23/27,EUR,99.099,SMITHS GROUP PLC,Industrial,2027-02-23,2.0,BBB,3.77874e-07,650000000,Y,2026-11-23,Sr Unsecured,1,FIXED,23/02/2018,23/02/2026,23/02/2017,99.022,99.176,1.1444216290212184,0.15399999999999636,100.08684281925669,1.7095890410958905,101.79643186035258,0.9878428192566844,86.63906389257322,0.0334317723762161,0.9676497536945812,1.8726920916503673
XS1574158082,PFE 1 03/06/27,EUR,98.284,PFIZER INC,"Consumer, Non-cyclical",2027-03-06,1.0,A,8.61109e-05,750000000,Y,2026-12-06,Sr Unsecured,1,FIXED,06/03/2018,06/03/2026,06/03/2017,98.228,98.339,1.1800136892539357,0.1110000000000042,98.93405689037779,0.8191780821917808,99.75323497256957,0.6500568903777832,55.84172010660526,0.028091263696947196,0.972676293740759,1.8921983448105189
FR0013241346,AIFP 1 03/08/27,EUR,98.41761,AIR LIQUIDE FINANCE,Basic Materials,2027-03-08,1.0,A,0.010105715,600000000,Y,2026-12-08,Sr Unsecured,1,FIXED,08/03/2018,08/03/2026,08/03/2017,98.334,98.501,1.1854893908281998,0.1670000000000016,98.9291441842055,0.8136986301369863,99.74284281434248,0.5115341842055017,43.711369597220234,0.028363480593970567,0.9724188177339902,1.8911967141663428
FR0013241676,ORAFP 1 ½ 09/09/27,EUR,98.21645,ORANGE SA,Communications,2027-09-09,1.5,BBB+,2.14239e-05,500000000,Y,2027-06-09,Sr Unsecured,1,FIXED,09/09/2017,09/09/2026,09/03/2017,98.105,98.328,1.6865160848733745,0.22299999999999898,99.28832719934498,0.46849315068493147,99.75682035002991,1.071877199344982,64.58120205734893,0.028260077707625217,0.9725166051660515,1.8915770946474035
XS1578127778,TMO 1.45 03/16/27,EUR,98.67801,THERMO FISHER SCIENTIFIC,"Consumer, Non-cyclical",2027-03-16,1.45,A-,3.83619e-05,500000000,Y,2026-12-16,Sr Unsecured,1,FIXED,16/03/2018,16/03/2026,16/03/2017,98.603,98.753,1.2073921971252566,0.15000000000000568,99.44115356145355,1.148082191780822,100.58923575323436,0.7631435614535462,63.79248395818734,,,
XS1575992596,WKLNA 1 ½ 03/22/27,EUR,98.70051,WOLTERS KLUWER NV,"Consumer, Non-cyclical",2027-03-22,1.5,NR,8.87712e-06,500000000,Y,2026-12-22,Sr Unsecured,1,FIXED,22/03/2018,22/03/2026,22/03/2017,98.624,98.777,1.2238193018480492,0.1530000000000058,99.49341456667251,1.1630136986301371,100.65642826530265,0.7929045666725187,65.37200670111856,0.025795987478794392,0.9748527116564417,1.9006756188478349
XS1584122763,ESSITY 1 ⅝ 03/30/27,EUR,98.832,ESSITY AB,"Consumer, Non-cyclical",2027-03-30,1.625,BBB+,4.90885e-07,500000000,Y,2026-12-30,Sr Unsecured,1,FIXED,30/03/2018,30/03/2026,27/03/2017,98.664,98.999,1.2457221081451062,0.33499999999999375,99.6366414572303,1.2243150684931507,100.86095652572345,0.8046414572303036,65.09376529858395,0.0299918460032019,0.9708814723926381,1.8852216668705943
FR0013246733,VIEFP 1.496 11/30/26,EUR,99.098,VEOLIA ENVIRONNEMENT SA,Utilities,2026-11-30,1.496,BBB,0.000200524,650000000,Y,2026-08-30,Sr Unsecured,1,FIXED,30/11/2017,30/11/2025,30/03/2017,99.032,99.163,0.9117043121149897,0.13100000000000023,99.6147338780058,0.13115616438356165,99.74589004238935,0.5167338780057946,56.93088359632143,0.020661613637897112,0.9797566467065868,1.9198461735314707
FR0013247202,EDENFP 1 ⅞ 03/30/27,EUR,99.31312,EDENRED SE,"Consumer, Non-cyclical",2027-03-30,1.875,NR,0.000992738,500000000,Y,2026-12-30,Sr Unsecured,1,FIXED,30/03/2018,30/03/2026,30/03/2017,99.235,99.391,1.2457221081451062,0.1560000000000059,99.94122770165826,1.4126712328767124,101.35389893453498,0.6281077016582657,50.617708103080744,0.03412008268870204,0.9670056860321384,1.8701999936369733
XS1586555945,VW 1 ⅞ 03/30/27,EUR,98.90855,VOLKSWAGEN INTL FIN NV,"Consumer, Cyclical",2027-03-30,1.875,BBB+,0.042120067,2500000000,N,,Sr Unsecured,1,FIXED,30/03/2018,30/03/2026,30/03/2017,98.813,99.004,1.4921286789869952,0.1910000000000025,99.92949509447926,0.9503424657534247,100.87983756023269,1.0209450944792593,68.97752699453729,0.02477432497204025,0.9758246041412911,1.9044673160950147
ES0224244089,MAPSM 4 ⅜ 03/31/47,EUR,102.2621,MAPFRE SA,Financial,2047-03-31,4.375,BBB-,1.19515e-05,600000000,Y,2027-03-31,Subordinated,1,VARIABLE,31/03/2018,31/12/2046,31/03/2017,102.018,102.506,1.4948665297741273,0.48799999999999955,103.57508487834076,2.205479452054795,105.78056433039555,1.3129848783407567,85.85638614272878,0.029663394068699667,2.8697163147228815,11.091656307114315
XS1585010074,NOVNVX 1 ⅛ 09/30/27,EUR,97.78845,NOVARTIS FINANCE SA,"Consumer, Non-cyclical",2027-09-30,1.125,AA-,1.31566e-06,600000000,Y,2027-06-30,Sr Unsecured,1,FIXED,30/09/2017,30/09/2026,31/03/2017,97.669,97.908,1.7440109514031485,0.23900000000000432,98.6231871689979,0.28664383561643836,98.90983100461435,0.8347371689979042,48.87748598094221,0.029420534617130654,0.9714202955665026,1.8873147812770221
XS1587911451,BFCM 2 ⅝ 03/31/27,EUR,100.144,BANQUE FED CRED MUTUEL,Financial,2027-03-31,2.625,BBB+,1.08678e-05,500000000,N,,Subordinated,1,FIXED,31/03/2018,31/03/2026,31/03/2017,100.076,100.213,1.4948665297741273,0.13700000000000045,101.02309012052224,1.3232876712328767,102.34637779175512,0.8790901205222355,58.666877881943996,0.029552514398796075,0.9712957678355503,1.886830937230502
FR0013248523,VIEFP 1 ½ 04/03/29,EUR,95.84961,VEOLIA ENVIRONNEMENT SA,Utilities,2029-04-03,1.5,NR,0.000200524,700000000,Y,2029-01-03,Sr Unsecured,1,FIXED,03/04/2018,03/04/2028,03/04/2017,95.698,96.001,3.2580424366872007,0.3030000000000115,98.18007435653186,1.1136986301369862,99.29377298666884,2.330464356531863,74.91360632493304,0.03260479723607509,2.8408021988841,10.921606649686419
FR0013248721,KERFP 1 ½ 04/05/27,EUR,98.59916,KERING,"Consumer, Cyclical",2027-04-05,1.5,NR,0.001163335,300000000,Y,2027-01-05,Sr Unsecured,1,FIXED,05/04/2018,05/04/2026,05/04/2017,98.515,98.683,1.2621492128678986,0.16800000000000637,99.477560153732,1.1054794520547944,100.5830396057868,0.8784001537320023,70.27691727799385,0.030998414801846175,0.9699335960591134,1.8815423615283269
XS1587893451,HELNSW 3 ⅜ 09/29/47,EUR,100.4077,ELM BV(HELVETIA SCHWEIZ),Financial,2047-09-29,3.375,NR,5.80647e-07,500000000,Y,2027-09-29,Subordinated,1,VARIABLE,29/09/2017,29/06/2047,11/04/2017,100.147,100.668,1.9931553730321698,0.5210000000000008,102.77267506684498,0.018493150684931507,102.79116821752991,2.364975066844977,118.62889523859958,0.026664453606406253,0.9740280736196321,1.8974613763983432
XS1596740453,MRDGF 2 ¼ 04/11/29,EUR,97.156,MADRILENA RED DE GAS FIN,Utilities,2029-04-11,2.25,BBB-,,300000000,Y,2029-01-11,Sr Unsecured,1,FIXED,11/04/2018,11/04/2028,11/04/2017,96.862,97.451,3.2799452429842573,0.5889999999999986,100.5107378175702,1.621232876712329,102.13197069428253,3.3547378175701965,106.00487375724896,0.01677868812245494,0.9834981905910736,1.9345373817918312
FR0013252277,AKEFP 1 ½ 04/20/27,EUR,98.44826,ARKEMA,Basic Materials,2027-04-20,1.5,BBB+,0.001210346,900000000,Y,2027-01-20,Sr Unsecured,1,FIXED,20/04/2018,20/04/2026,20/04/2017,98.38,98.517,1.3032169746748803,0.13700000000000045,99.46063775556941,1.0438356164383562,100.50447337200777,1.0123777555694033,78.52866846994907,0.029020666693734997,0.9717977805178792,1.8887818524389524
XS1603892149,MS 1 ⅞ 04/27/27,EUR,99.22911,MORGAN STANLEY,Financial,2027-04-27,1.875,A,2.70627e-05,2000000000,N,,Sr Unsecured,1,FIXED,27/04/2018,27/04/2026,27/04/2017,99.164,99.294,1.568788501026694,0.12999999999999545,99.92031358948316,0.8065068493150686,100.72682043879823,0.6912035894831519,44.384173961152776,0.022860111702818514,0.9776507936507938,1.911602148652054
XS1821883102,NFLX 3 ⅝ 05/15/27,EUR,101.915,NETFLIX INC,Communications,2027-05-15,3.625,A-,6.46298e-07,1300000000,N,,Sr Unsecured,2,FIXED,15/11/2017,15/11/2026,02/05/2017,101.818,102.012,1.6180698151950719,0.19400000000000261,102.71835058875374,1.3692255434782608,104.087576132232,0.8033505887537302,49.43224654224234,0.02761962227452054,2.8755656222133625,11.136536175857195
XS1605365193,ACAFP 1 ⅜ 05/03/27,EUR,98.516,CREDIT AGRICOLE LONDON,Financial,2027-05-03,1.375,A+,0.000125365,1500000000,N,,Sr Preferred,1,FIXED,03/05/2018,03/05/2026,03/05/2017,98.441,98.591,1.5852156057494866,0.14999999999999147,99.14542325242992,0.5688356164383562,99.71425886886827,0.6294232524299161,40.265261395069075,0.03657880915073372,9.47616405538495,105.54890338618975
PTBSSLOM0002,BRCORO 2 ⅜ 05/10/27,EUR,100.087,BCR-BRISA CONCESSAO RODO,"Consumer, Non-cyclical",2027-05-10,2.375,A,0.005608295,300000000,N,,1st lien,1,FIXED,10/05/2018,10/05/2026,10/05/2017,99.993,100.181,1.6043805612594113,0.1880000000000024,100.69728843169194,0.9369863013698629,101.6342747330618,0.6102884316919415,38.062951708304034,0.027641181117486032,1.9269840536626521,5.606754297634421
XS1612543121,GE 1 ½ 05/17/29,EUR,96.414,GENERAL ELECTRIC CO,Industrial,2029-05-17,1.5,A-,5.11829e-06,969116000,Y,2029-02-17,Sr Unsecured,1,FIXED,17/05/2018,17/05/2028,17/05/2017,96.199,96.628,3.381245722108145,0.42900000000000205,98.04021523887566,0.9287671232876713,98.96898236216333,1.626215238875659,50.30062395709573,0.030181443821014526,0.9707027883272004,1.884527806532403
XS1612543394,GE 2 ⅛ 05/17/37,EUR,86.32,GENERAL ELECTRIC CO,Industrial,2037-05-17,2.125,A-,5.11829e-06,560230000,Y,2037-02-17,Sr Unsecured,1,FIXED,17/05/2018,17/05/2036,17/05/2017,85.881,86.758,11.381245722108146,0.8769999999999953,95.09800104234421,1.3157534246575342,96.41375446700174,8.778001042344215,95.40466246278682,0.02836982320808829,2.8699383574282167,11.10201702889974
DE000A19HCX8,JABHOL 2 05/18/28,EUR,98.53287,JAB HOLDINGS BV,Financial,2028-05-18,2.0,BBB,0.004836786,750000000,N,,Sr Unsecured,1,FIXED,18/05/2018,18/05/2027,18/05/2017,98.435,98.631,2.628336755646817,0.19599999999999795,99.98056632959418,0.7452054794520548,100.72577180904624,1.44769632959418,56.302455622249994,0.02922607948559779,2.870965979483857,11.101236927817315
XS1615079974,JPM 1.638 05/18/28,EUR,98.66029,JPMORGAN CHASE & CO,Financial,2028-05-18,1.638,A+,0.0001373,2000000000,Y,2027-05-18,Sr Unsecured,1,VARIABLE,18/05/2018,18/02/2028,18/05/2017,98.574,98.747,1.626283367556468,0.17300000000000182,99.53685939549726,0.6103232876712329,100.1471826831685,0.8765693954972562,54.564133780129104,0.030287718249704634,0.9706026600985223,1.8841390475806548
XS1616411119,EOANGR 1 ⅝ 05/22/29,EUR,96.561,E.ON SE,Utilities,2029-05-22,1.625,BBB+,0.00010082,750000000,Y,2029-02-22,Sr Unsecured,1,FIXED,22/05/2018,22/05/2028,22/05/2017,96.418,96.703,3.3949349760438055,0.2849999999999966,98.43052567922528,0.9839041095890411,99.41442978881433,1.8695256792252763,57.521444805960925,0.027207018719994966,2.8802502131368986,11.16378600330725
XS1617845679,IBM 1 ½ 05/23/29,EUR,95.97,IBM CORP,Technology,2029-05-23,1.5,A-,1.97547e-05,1000000000,N,,Sr Unsecured,1,FIXED,23/05/2018,23/05/2028,23/05/2017,95.849,96.091,3.6413415468856947,0.24199999999999022,97.7483129850627,0.5383561643835617,98.28666914944625,1.7783129850626977,51.37611535214273,0.031363640993775956,0.9695901234567904,1.8802100150099084
XS1617830721,WFC 1 ½ 05/24/27,EUR,98.51617,WELLS FARGO & COMPANY,Financial,2027-05-24,1.5,A,0.000286223,1500000000,N,,Sr Unsecured,1,FIXED,24/05/2018,24/05/2026,24/05/2017,98.45,98.582,1.6427104722792607,0.1319999999999908,99.3100069334699,0.5342465753424657,99.84425350881236,0.7938369334698905,49.00379101423693,0.03171596320043033,2.863864950397795,11.046851871625854
XS1619312686,AAPL 1 ⅜ 05/24/29,EUR,96.173,APPLE INC,Technology,2029-05-24,1.375,AA+,1.07934e-06,1250000000,Y,2029-02-24,Sr Unsecured,1,FIXED,24/05/2018,24/05/2028,24/05/2017,96.007,96.339,3.40041067761807,0.33199999999999363,97.61214666639124,0.825,98.43714666639124,1.4391466663912382,44.35966214030932,0.04093440354805517,9.461234395614182,105.06770413702895
XS1617831026,BFCM 1 ¼ 05/26/27,EUR,98.171,BANQUE FED CRED MUTUEL,Financial,2027-05-26,1.25,A+,1.08678e-05,1300000000,N,,Sr Preferred,1,FIXED,26/05/2018,26/05/2026,26/05/2017,98.111,98.231,1.648186173853525,0.11999999999999034,98.90582148558317,0.4383561643835616,99.34417764996674,0.7348214855831685,45.356423693592,0.028747117103866026,0.9720561869618697,1.8897864612216986
XS1619568303,URWFP 1 ½ 05/29/29,EUR,95.28726,UNIBAIL-RODAMCO-WESTFLD,Financial,2029-05-29,1.5,NR,0.008889247,500000000,N,,Sr Unsecured,1,FIXED,29/05/2018,29/05/2028,29/05/2017,95.15,95.425,3.6577686516084875,0.2749999999999915,97.73003439328836,0.5136986301369862,98.24373302342535,2.44277439328836,70.52518358934626,0.02678660869913669,0.9739121951219512,1.8970099276145147
XS1619568998,URWFP 2 05/29/37,EUR,81.75254,UNIBAIL-RODAMCO-WESTFLD,Financial,2037-05-29,2.0,NR,0.008889247,500000000,N,,Sr Unsecured,1,FIXED,29/05/2018,29/05/2036,29/05/2017,81.332,82.173,11.657768651608487,0.8410000000000082,93.60878849121193,0.684931506849315,94.29371999806123,11.856248491211929,130.1095199848736,0.024413274880419073,0.9761685293630455,1.905809995437622
XS1623355457,NNGRNV 1 ⅝ 06/01/27,EUR,98.78521,NN GROUP NV,Financial,2027-06-01,1.625,A-,1.1594e-06,600000000,Y,2027-03-01,Sr Unsecured,1,FIXED,01/06/2018,01/06/2026,01/06/2017,98.617,98.954,1.4127310061601643,0.3369999999999891,99.58821817452814,0.9527397260273973,100.54095790055554,0.8030081745281308,57.37569209570776,0.029937874350112987,0.9709323493234931,1.8854192539256753
XS1624344542,STERV 2 ½ 06/07/27,EUR,99.826,STORA ENSO OYJ,Industrial,2027-06-07,2.5,BBB-,0.001439436,300000000,Y,2027-03-07,Sr Unsecured,1,FIXED,07/06/2018,07/06/2026,07/06/2017,99.731,99.921,1.429158110882957,0.19000000000001194,100.80412883193914,1.4246575342465753,102.22878636618572,0.978128831939145,68.38864265887686,0.031587348534584093,5.576553954734608,37.309474123151766
XS1627343186,AQUASM 2.629 06/08/27,EUR,100.1832,FCC AQUALIA SA,Utilities,2027-06-08,2.629,NR,0.007559526,650000000,Y,2027-03-08,1st lien,1,FIXED,08/06/2018,08/06/2026,08/06/2017,100.044,100.323,1.431895961670089,0.27899999999999636,100.98594733946638,1.4909671232876713,102.47691446275405,0.8027473394663787,55.87942415080603,0.031039040260268526,0.9698953783045565,1.8813940897130774
XS1627947440,ADRIT 1 ⅝ 06/08/27,EUR,98.671,AEROPORTI DI ROMA SPA,Industrial,2027-06-08,1.625,BBB-,0.010770069,432821000,Y,2027-03-08,Sr Unsecured,1,FIXED,08/06/2018,08/06/2026,08/06/2017,98.576,98.767,1.431895961670089,0.1910000000000025,99.58273257270056,0.9215753424657535,100.50430791516632,0.9117325727005579,64.32115488264387,0.028977216439762123,0.9718388162762023,1.8889413696422601
FR0013260551,ARRFP 1 ⅝ 01/13/32,EUR,91.735,APRR SA,"Consumer, Non-cyclical",2032-01-13,1.625,A-,0.011186382,500000000,Y,2031-10-13,Sr Unsecured,1,FIXED,13/01/2018,13/01/2031,13/06/2017,91.549,91.922,6.031485284052019,0.37299999999999045,95.95042254199988,1.5715753424657535,97.52199788446563,4.215422541999885,77.6305879662374,0.03002894635040957,0.9708465024630543,1.8850858626894902
XS1621087516,SUMIBK 1.413 06/14/27,EUR,98.36,SUMITOMO MITSUI FINL GRP,Financial,2027-06-14,1.413,A,0.000331437,500000000,N,,Sr Unsecured,1,FIXED,14/06/2018,14/06/2026,14/06/2017,98.294,98.427,1.700205338809035,0.13300000000000978,99.13749969795208,0.42196438356164384,99.55946408151372,0.7774996979520807,46.464116112568234,0.030145717410223868,0.9707364532019706,1.884658523150283
XS1627193359,SGOFP 1 ⅜ 06/14/27,EUR,98.52016,CIE DE SAINT-GOBAIN SA,Industrial,2027-06-14,1.375,BBB+,0.000335785,750000000,N,,Sr Unsecured,1,FIXED,14/06/2018,14/06/2026,14/06/2017,98.437,98.603,1.700205338809035,0.16599999999999682,99.07457287081823,0.41061643835616435,99.48518930917439,0.5544128708182257,33.112323477228806,0.03014338584747306,0.9707386503067484,1.884667054398735
XS1629387462,HEIGR 1 ½ 06/14/27,EUR,98.54092,HEIDELBERG MATERIALS FIN,Industrial,2027-06-14,1.5,BBB,0.01639308,500000000,Y,2027-03-14,Sr Unsecured,1,FIXED,14/06/2018,14/06/2026,14/06/2017,98.455,98.627,1.4483230663928817,0.17199999999999704,99.40136155147198,0.8260273972602739,100.22738894873225,0.860441551471979,60.106990024042595,0.03816647317874773,8.369244135319688,84.43337170853049
FR0013262698,COVFP 1 ½ 06/21/27,EUR,98.52975,COVIVIO,Financial,2027-06-21,1.5,NR,0.00050927,595000000,Y,2027-03-21,Sr Unsecured,1,FIXED,21/06/2018,21/06/2026,21/06/2017,98.423,98.636,1.4674880219028064,0.21299999999999386,99.39359460287785,0.7972602739726028,100.19085487685045,0.8638446028778475,59.57137254789803,0.031995683687596706,0.9689963008631319,1.8779076621728668
XS1627602201,AIG 1 ⅞ 06/21/27,EUR,98.894,AMERICAN INTL GROUP,Financial,2027-06-21,1.875,BBB+,3.18714e-06,820946000,Y,2027-03-21,Sr Unsecured,1,FIXED,21/06/2018,21/06/2026,21/06/2017,98.77,99.018,1.4674880219028064,0.24800000000000466,99.93056052772019,0.9965753424657535,100.92713587018595,1.0365605277201837,71.19554984645268,0.03281145190795898,5.519869951618371,36.77139500813768
XS1629866432,T 3.15 09/04/36,EUR,94.5432,AT&T INC,Communications,2036-09-04,3.15,BBB,0.000147481,1750000000,Y,2036-06-04,Sr Unsecured,1,FIXED,04/09/2017,04/09/2035,21/06/2017,94.264,94.822,10.674880219028063,0.5580000000000069,105.23792827261067,1.026986301369863,106.26491457398053,10.694728272610675,116.22181166128642,0.031857583261067524,0.9691259881422927,1.8784103617855505
XS1637333748,BRITEL 1 ½ 06/23/27,EUR,98.52407,BRITISH TELECOMMUNICATIO,Communications,2027-06-23,1.5,BBB,0.008914572,1150000000,Y,2027-03-23,Sr Unsecured,1,FIXED,23/06/2018,23/06/2026,23/06/2017,98.422,98.626,1.4729637234770705,0.20400000000000773,99.39137792091908,0.7890410958904108,100.1804190168095,0.8673079209190888,59.59286741538192,0.029526696976018965,2.87010682558265,11.094649732193346
FR0013266350,GFCFP 1 ⅜ 06/30/27,EUR,98.232,GECINA,Financial,2027-06-30,1.375,A-,0.000165878,452600000,Y,2027-03-31,Sr Unsecured,1,FIXED,30/06/2018,30/06/2026,30/06/2017,98.124,98.339,1.4948665297741273,0.2150000000000034,99.20023672208043,0.6931506849315069,99.89338740701194,0.9682367220804338,65.71242218177292,0.03641025970486481,9.47881891165359,105.59919283186711
FR0013266368,GFCFP 2 06/30/32,EUR,93.124,GECINA,Financial,2032-06-30,2.0,A-,0.000165878,700000000,Y,2032-03-30,Sr Unsecured,1,FIXED,30/06/2018,30/06/2031,30/06/2017,92.866,93.383,6.494182067077344,0.5169999999999959,97.69935323631898,1.0136986301369864,98.71305186645597,4.575353236318989,77.9953596117514,0.03263008348269492,5.5371322992630105,36.930721071114775
XS1637162592,DHR 1.2 06/30/27,EUR,98.07555,DH EUROPE FINANCE SA,"Consumer, Non-cyclical",2027-06-30,1.2,A-,1.40565e-05,600000000,Y,2027-03-30,Sr Unsecured,1,FIXED,30/06/2018,30/06/2026,30/06/2017,98.003,98.148,1.4921286789869952,0.14499999999999602,98.94693449257971,0.6082191780821918,99.55515367066191,0.8713844925797076,59.35357098643413,0.03636838826893783,5.513758456684815,36.63576723431636
DE000A2GSCW3,MBGGR 1 ½ 07/03/29,EUR,95.88722,MERCEDES-BENZ GROUP AG,"Consumer, Cyclical",2029-07-03,1.5,A,0.001270443,1500000000,N,,Sr Unsecured,1,FIXED,03/07/2018,03/07/2028,03/07/2017,95.723,96.051,3.753593429158111,0.32800000000000296,97.62379394424391,0.3698630136986301,97.99365695794255,1.736573944243915,48.76991906865844,0.028729295484195283,2.859983818310768,11.04790856912699
DE000A2GSCX1,MBGGR 2 ⅛ 07/03/37,EUR,86.458,MERCEDES-BENZ GROUP AG,"Consumer, Cyclical",2037-07-03,2.125,A,0.001270443,1400000000,N,,Sr Unsecured,1,FIXED,03/07/2018,03/07/2036,03/07/2017,86.098,86.818,11.75359342915811,0.7199999999999989,94.78273800879863,0.523972602739726,95.30671061153836,8.324738008798633,88.06839351215085,0.03595922379126109,9.196282738568492,101.31820892365414
FR0013266848,LRFP 1 ⅞ 07/06/32,EUR,92.546,LEGRAND SA,Industrial,2032-07-06,1.875,NR,6.83986e-06,500000000,Y,2032-04-06,Sr Unsecured,1,FIXED,06/07/2018,06/07/2031,06/07/2017,92.264,92.828,6.513347022587269,0.5640000000000072,96.93592038318191,0.9143835616438356,97.85030394482574,4.389920383181902,74.91879615093306,0.03055635117664665,0.9703496551724137,1.8831569065864444
XS1641623381,HTHROW 1 ⅞ 07/12/32,EUR,90.654,HEATHROW FUNDING LTD,Industrial,2032-07-12,1.875,BBB+,0.024398591,500000000,N,,1st lien,1,FIXED,12/07/2018,12/07/2031,12/07/2017,90.461,90.847,6.778918548939083,0.3859999999999957,96.71841275443975,0.4160958904109589,97.13450864485071,6.064412754439758,100.88964789679196,0.03188013395356415,0.9691048088779285,1.8783282611806524
XS1651071950,TMO 1.95 07/24/29,EUR,97.383,THERMO FISHER SCIENTIFIC,"Consumer, Non-cyclical",2029-07-24,1.95,A-,3.83619e-05,700000000,Y,2029-04-24,Sr Unsecured,1,FIXED,24/07/2018,24/07/2028,24/07/2017,97.26,97.506,3.561943874058864,0.2459999999999951,99.36665979570367,0.8547945205479451,100.22145431625161,1.983659795703673,57.95359710775566,0.028792078753097767,2.8757112957886344,11.128901075360424
XS1651072099,TMO 2 ⅞ 07/24/37,EUR,93.54447,THERMO FISHER SCIENTIFIC,"Consumer, Non-cyclical",2037-07-24,2.875,A-,3.83619e-05,700000000,Y,2037-04-24,Sr Unsecured,1,FIXED,24/07/2018,24/07/2036,24/07/2017,93.283,93.806,11.561943874058864,0.5229999999999961,102.41353645732295,1.2602739726027397,103.6738104299257,8.869066457322944,90.86154075725848,0.028957290116845506,2.8648027655195087,11.071244805112013
XS1652855815,VOD 1 ½ 07/24/27,EUR,98.49049,VODAFONE GROUP PLC,Communications,2027-07-24,1.5,BBB,0.000445526,357309000,N,,Sr Unsecured,1,FIXED,24/07/2018,24/07/2026,24/07/2017,98.33,98.651,1.809719370294319,0.32099999999999795,99.22777346812822,0.28356164383561644,99.51133511196383,0.7372834681282256,41.40458375022606,0.0351556185646337,0.9660383251231528,1.866460091213492
XS1652866002,TRNIM 1 ⅜ 07/26/27,EUR,98.243,TERNA RETE ELETTRICA,Utilities,2027-07-26,1.375,BBB+,2.09814e-05,1000000000,N,,Sr Unsecured,1,FIXED,26/07/2018,26/07/2026,26/07/2017,98.136,98.35,1.8151950718685832,0.21399999999999864,99.00425940389962,0.2523972602739726,99.25665666417359,0.7612594038996292,42.70740510232071,0.03611680327868864,0.9651421508034609,1.8629987425150605
XS1654192274,UNANA 1 ⅜ 07/31/29,EUR,95.73528,UNILEVER FINANCE,"Consumer, Non-cyclical",2029-07-31,1.375,A+,7.01173e-07,750000000,N,,Sr Unsecured,1,FIXED,31/07/2018,31/07/2028,31/07/2017,95.593,95.877,3.8302532511978096,0.2839999999999918,97.08357155349226,0.23356164383561642,97.31713319732788,1.3482915534922597,37.20298346803794,0.03243787572092625,0.9685812807881775,1.876299394986533
XS1672151492,HOLNSW 1 ¾ 08/29/29,EUR,96.75267,HOLCIM FINANCE LUX SA,Industrial,2029-08-29,1.75,BBB+,1.36262e-05,750000000,Y,2029-05-29,Sr Unsecured,1,FIXED,29/08/2018,29/08/2028,29/08/2017,96.57,96.936,3.6577686516084875,0.36600000000001387,98.60185643446756,0.5993150684931507,99.20117150296072,1.849186434467569,52.9095270679772,0.03036704053406346,2.871215015120131,11.09439797183652
XS1673102734,ISSDC 1 ½ 08/31/27,EUR,98.05289,ISS GLOBAL A/S,"Consumer, Non-cyclical",2027-08-31,1.5,BBB,0.008372387,600000000,Y,2027-05-31,Sr Unsecured,1,FIXED,31/08/2018,31/08/2026,31/08/2017,97.982,98.124,1.6618754277891854,0.1419999999999959,99.30051172357557,0.5054794520547945,99.80599117563037,1.2476217235755627,76.32493293536781,0.026456727273395087,1.9318763877861316,5.630101121551433
XS1676933853,WSTP 1 ⅛ 09/05/27,EUR,97.6,WESTPAC BANKING CORP,Financial,2027-09-05,1.125,AA-,3.51898e-05,750000000,N,,Sr Unsecured,1,FIXED,05/09/2018,05/09/2026,05/09/2017,97.506,97.693,1.9274469541409993,0.1869999999999976,98.46744288669852,0.08013698630136987,98.54757987299989,0.8674428866985266,46.10755648386463,0.03261643640507058,0.9684137931034483,1.8756505493460167
XS1681050610,LLOYDS 1 ½ 09/12/27,EUR,98.311,LLOYDS BANKING GROUP PLC,Financial,2027-09-12,1.5,A-,0.000125759,1000000000,N,,Sr Unsecured,1,FIXED,12/09/2018,12/09/2026,12/09/2017,98.235,98.386,1.946611909650924,0.15099999999999625,99.16122062401314,0.07808219178082192,99.23930281579396,0.8502206240131329,44.51104945515213,0.02778320899238362,1.929035389381307,5.614224716112434
XS1681520356,GSK 1 ⅜ 09/12/29,EUR,95.303,GLAXOSMITHKLINE CAPITAL,"Consumer, Non-cyclical",2029-09-12,1.375,A,0.028372812,500000000,Y,2029-06-12,Sr Unsecured,1,FIXED,12/09/2018,12/09/2028,12/09/2017,95.148,95.458,3.696098562628337,0.3100000000000023,97.24715438494889,0.41815068493150687,97.66530506988039,1.944154384948888,55.60963619712121,0.029925288309340745,2.845130744775796,10.962635178298695
XS1681521081,TELEFO 1.715 01/12/28,EUR,98.21,TELEFONICA EMISIONES SAU,Communications,2028-01-12,1.715,BBB-,0.021357445,1250000000,N,,Sr Unsecured,1,FIXED,12/01/2018,12/01/2027,12/09/2017,98.1,98.32,2.2806297056810405,0.21999999999999886,99.42191990100537,1.2310410958904112,100.65296099689577,1.2119199010053734,54.2860159135595,0.028824893381476552,2.868634938545267,11.09202640340298
FR0013281755,ICADFP 1 ½ 09/13/27,EUR,98.294,ICADE,Financial,2027-09-13,1.5,NR,0.002670412,440000000,Y,2027-06-13,Sr Unsecured,1,FIXED,13/09/2018,13/09/2026,13/09/2017,98.2,98.387,1.6974674880219027,0.1869999999999976,99.28292005197555,0.4520547945205479,99.7349748464961,0.9889200519755548,59.183254052739905,0.032124998489318934,2.8557575455682116,11.002119767767967
XS1681520786,TCLAU 1 ¾ 03/29/28,EUR,98.026,TRANSURBAN FINANCE CO,"Consumer, Non-cyclical",2028-03-29,1.75,BBB+,1.1415e-06,500000000,Y,2027-12-29,Secured,1,FIXED,29/03/2019,29/03/2027,13/09/2017,97.96,98.093,2.242299794661191,0.13300000000000978,99.51584524207703,1.323287671232877,100.83913291330991,1.4898452420770383,67.9028534851898,0.03617845497304554,5.548140732278026,36.94796176635538
XS1684831982,MRLSM 2 ⅜ 09/18/29,EUR,98.253,MERLIN PROPERTIES SOCIMI,Financial,2029-09-18,2.375,BBB+,3.63482e-05,400000000,Y,2029-06-18,Sr Unsecured,1,FIXED,18/09/2018,18/09/2028,18/09/2017,98.06,98.446,3.7125256673511293,0.3859999999999957,100.76457617948913,0.6832191780821918,101.44779535757132,2.5115761794891256,70.08163327554837,0.036403599863664496,0.9648750738916255,1.8619678164347397
XS1685542497,IGIM 1 ⅝ 01/18/29,EUR,96.435,ITALGAS SPA,Utilities,2029-01-18,1.625,BBB,3.11332e-05,750000000,N,,Sr Unsecured,1,FIXED,18/01/2018,18/01/2028,18/09/2017,96.291,96.58,3.299110198494182,0.2890000000000015,98.52813135365709,1.1397260273972603,99.66785738105435,2.0931313536570855,66.23432077342088,0.026531237807297988,1.934931706211155,5.641735642979136
XS1685653211,LSELN 1 ¾ 09/19/29,EUR,95.88,LONDON STOCK EXCHANGE PL,Financial,2029-09-19,1.75,A-,3.28737e-06,500000000,Y,2029-06-19,Sr Unsecured,1,FIXED,19/09/2018,19/09/2028,19/09/2017,95.703,96.057,3.7152635181382614,0.3539999999999992,98.55122059847687,0.49863013698630143,99.04985073546318,2.6712205984768786,75.65482726704755,0.03168737226960065,2.8535707756660256,10.99390696405566
FR0013283140,VIEFP 1 ⅝ 09/21/32,EUR,89.422,VEOLIA ENVIRONNEMENT SA,Utilities,2032-09-21,1.625,NR,0.000200524,540000000,Y,2032-06-21,Sr Unsecured,1,FIXED,21/09/2018,21/09/2031,21/09/2017,89.203,89.64,6.721423682409308,0.4369999999999976,95.2218809439619,0.45410958904109594,95.675990533003,5.7998809439619095,98.02807164161003,0.035543858930509625,0.9656761433868974,1.8650608278131837
XS1689185426,MGCN 1 ½ 09/25/27,EUR,97.93482,MAGNA INTERNATIONAL INC,"Consumer, Cyclical",2027-09-25,1.5,A-,0.000477458,600000000,Y,2027-06-25,Sr Unsecured,1,FIXED,25/09/2018,25/09/2026,25/09/2017,97.825,98.044,1.730321697467488,0.2189999999999941,99.2667273108976,0.40273972602739727,99.66946703692498,1.3319073108975914,78.37155686473496,0.03867094082328362,0.9627688237887623,1.8538476161191944
FR0013284205,GFCFP 1 ⅜ 01/26/28,EUR,97.542,GECINA,Financial,2028-01-26,1.375,A-,0.000165878,519800000,Y,2027-10-26,Sr Unsecured,1,FIXED,26/01/2018,26/01/2027,26/09/2017,97.44,97.644,2.0670773442847366,0.20400000000000773,98.83977242498257,1.2808219178082192,100.1205943427908,1.2977724249825684,64.3528351546057,0.02424990387420948,0.9763242312423125,1.9064180090217848
XS1688199949,ATOSTR 1 ⅞ 09/26/29,EUR,96.35236,AUTOSTRADE PER L'ITALIA,"Consumer, Non-cyclical",2029-09-26,1.875,BBB-,0.009300628,700000000,Y,2029-06-26,Sr Unsecured,1,FIXED,26/09/2018,26/09/2028,26/09/2017,96.206,96.499,3.7344284736481863,0.29299999999999216,98.97909584542059,0.49828767123287676,99.47738351665346,2.6267358454205834,73.80298692288058,0.03383218367459824,0.967274975369458,1.8712417559519707
XS1689535000,NDAFH 1 ⅛ 09/27/27,EUR,97.654,NORDEA BANK ABP,Financial,2027-09-27,1.125,AA-,4.21953e-05,1000000000,N,,Sr Preferred,1,FIXED,27/09/2018,27/09/2026,27/09/2017,97.588,97.72,1.9876796714579055,0.132000000000005,98.41658888466327,0.012328767123287671,98.42891765178656,0.7625888846632733,39.32535021467218,0.03413002335369833,0.966996390605686,1.870164038888849
XS1691349952,NORTEG 2.065 09/28/27,EUR,98.265,NORTEGAS ENERGIA GRUPO S,Utilities,2027-09-28,2.065,NR,0.007585032,575000000,Y,2027-06-28,Sr Unsecured,1,FIXED,28/09/2018,28/09/2026,28/09/2017,98.134,98.395,1.7385352498288844,0.2609999999999957,100.2191610292005,0.5374657534246575,100.75662678262516,1.954161029200506,113.90797338049495,0.03575264692343107,0.9654814814814815,1.8643089821673524
XS1693281617,STANLN 1 ⅝ 10/03/27,EUR,99.21895,STANDARD CHARTERED PLC,Financial,2027-10-03,1.625,A-,0.000289262,500000000,Y,2026-10-03,Sr Unsecured,1,VARIABLE,03/10/2018,03/10/2026,03/10/2017,99.17,99.267,1.0047912388774811,0.0969999999999942,99.70819858996461,1.616095890410959,101.32429448037557,0.4892485899646033,48.92068814111119,0.03557310962505524,0.9656488669950738,1.864955468657739
XS1577950667,BXBAU 1 ½ 10/04/27,EUR,98.17841,BRAMBLES FINANCE PLC,Industrial,2027-10-04,1.5,BBB+,1.20267e-06,500000000,Y,2027-07-04,Sr Unsecured,1,FIXED,04/10/2018,04/10/2026,04/10/2017,98.081,98.276,1.754962354551677,0.19499999999999318,99.25461105224072,0.36575342465753424,99.62036447689826,1.0762010522407195,62.378311218588244,0.035142989623655314,0.966050110974106,1.866505633826165
FR0013286788,DGFP 1 ⅛ 10/13/27,EUR,97.78751,COFIROUTE SA,"Consumer, Non-cyclical",2027-10-13,1.125,NR,0.006323982,750000000,Y,2027-07-13,Sr Unsecured,1,FIXED,13/10/2018,13/10/2026,13/10/2017,97.709,97.866,1.7796030116358659,0.15699999999999648,98.59286131296531,0.2465753424657534,98.83943665543106,0.805351312965314,46.23379336027062,0.025797803428836537,3.825632960494442,18.528262317956283
XS1702729275,EOANGR 1 ¼ 10/19/27,EUR,97.755,E.ON INTL FINANCE BV,Utilities,2027-10-19,1.25,BBB+,0.00010082,850000000,Y,2027-07-19,Sr Unsecured,1,FIXED,19/10/2018,19/10/2026,19/10/2017,97.641,97.869,1.7960301163586585,0.22799999999999443,98.79741169822351,0.2534246575342466,99.05083635575777,1.0424116982235176,59.27725746797261,0.023410999838475298,0.9771245376078914,1.9095447239908714
XS1704789590,IREIM 1 ½ 10/24/27,EUR,98.01336,IREN SPA,Utilities,2027-10-24,1.5,BBB,6.77917e-05,500000000,Y,2027-07-24,Sr Unsecured,1,FIXED,24/10/2018,24/10/2026,24/10/2017,97.932,98.095,1.809719370294319,0.1629999999999967,99.22777346812822,0.28356164383561644,99.51133511196383,1.214413468128214,68.36519123666346,0.02866692546120749,3.7801650108876528,18.200167634927297
XS1700721464,SRGIM 1 ⅜ 10/25/27,EUR,97.93333,SNAM SPA,Utilities,2027-10-25,1.375,BBB+,2.41679e-05,552469000,Y,2027-07-25,Sr Unsecured,1,FIXED,25/10/2018,25/10/2026,25/10/2017,97.831,98.036,1.8124572210814511,0.2049999999999983,99.00592740818209,0.25616438356164384,99.26209179174373,1.0725974081820908,60.35776284370638,0.03929707253044414,9.821820054707485,116.11351979216931
XS1708193815,PG 1 ¼ 10/25/29,EUR,95.007,PROCTER & GAMBLE CO/THE,"Consumer, Non-cyclical",2029-10-25,1.25,AA-,1.47446e-07,500000000,N,,Sr Unsecured,1,FIXED,25/10/2018,25/10/2028,25/10/2017,94.891,95.122,4.0657084188911705,0.23099999999999454,96.32131052173287,1.1678082191780823,97.48911874091095,1.314310521732864,34.431206217008985,0.03529729186125803,0.9659061294386267,1.8659493017742184
XS1708161291,VZ 1 ⅜ 10/27/26,EUR,99.056,VERIZON COMMUNICATIONS,Communications,2026-10-27,1.375,BBB+,0.000164108,745579000,N,,Sr Unsecured,1,FIXED,27/10/2018,27/10/2025,27/10/2017,98.981,99.131,1.0704996577686516,0.15000000000000568,99.42617622723576,1.277054794520548,100.70323102175631,0.3701762272357598,34.82199188983877,0.03565236767249176,9.652861161156538,108.29783007807019
XS1708167652,VZ 1 ⅞ 10/26/29,EUR,96.302,VERIZON COMMUNICATIONS,Communications,2029-10-26,1.875,BBB+,0.000164108,750000000,N,,Sr Unsecured,1,FIXED,26/10/2018,26/10/2028,27/10/2017,96.137,96.467,4.068446269678303,0.3299999999999983,98.7319616558506,1.7465753424657533,100.47853699831634,2.4299616558505903,62.987824557920824,0.0292723466493789,2.877869854043493,11.136637945946932
XS1708335978,VZ 2 ⅞ 01/15/38,EUR,90.061,VERIZON COMMUNICATIONS,Communications,2038-01-15,2.875,BBB+,0.000164108,1500000000,N,,Sr Unsecured,1,FIXED,15/01/2018,15/01/2037,27/10/2017,89.761,90.36,12.290212183436003,0.5990000000000038,102.18812161072559,2.040068493150685,104.22819010387627,12.127121610725581,120.70278160835639,0.03395832221920004,5.578744575845429,37.273829781731386
XS1709374497,IGIM 1.608 10/31/27,EUR,98.14379,ITALGAS RETI SPA,Utilities,2027-10-31,1.608,BBB,3.11332e-05,730000000,Y,2027-07-31,Sr Unsecured,1,FIXED,31/10/2018,31/10/2026,31/10/2017,98.028,98.259,1.8288843258042438,0.23099999999999454,99.41063526534703,0.2731397260273973,99.68377499137442,1.2668452653470297,70.49968311347507,0.027226028074250598,1.9336140425785466,5.634071614455639
XS1707075245,NESNVX 1 ¾ 11/02/37,EUR,83.71816,NESTLE FINANCE INTL LTD,"Consumer, Non-cyclical",2037-11-02,1.75,AA-,0.016977096,750000000,Y,2037-08-02,Sr Unsecured,1,FIXED,02/11/2018,02/11/2036,02/11/2017,83.413,84.024,11.835728952772074,0.6110000000000042,90.90498288369689,0.28767123287671237,91.1926541165736,7.186822883696891,77.0137266407249,0.02551932625551125,1.9404299390707378,5.666873552824771
XS1707075328,NESNVX 1 ¼ 11/02/29,EUR,95.24911,NESTLE FINANCE INTL LTD,"Consumer, Non-cyclical",2029-11-02,1.25,AA-,0.016977096,750000000,Y,2029-08-02,Sr Unsecured,1,FIXED,02/11/2018,02/11/2028,02/11/2017,95.114,95.384,3.8357289527720737,0.269999999999996,96.62060074369633,0.2054794520547945,96.82608019575112,1.3714907436963273,37.91336674317951,0.028138607471847606,1.9295314758622435,5.61486831999242
XS1717441726,UPS 1 ½ 11/15/32,EUR,89.8633,UNITED PARCEL SERVICE,Industrial,2032-11-15,1.5,A,8.19937e-05,500000000,Y,2032-08-15,Sr Unsecured,1,FIXED,15/11/2018,15/11/2031,13/11/2017,89.684,90.043,6.872005475701574,0.35900000000000887,94.28087091010099,0.19315068493150683,94.4740215950325,4.4175709101009915,73.05295325102648,0.037845717130316044,9.677182141485988,108.53186165220237
XS1718316281,SOCGEN 1 ⅜ 01/13/28,EUR,97.411,SOCIETE GENERALE,Financial,2028-01-13,1.375,BBB,0.00033915,750000000,N,,Sr Non Preferred,1,FIXED,13/01/2019,13/01/2027,13/11/2017,97.339,97.482,2.2833675564681726,0.14300000000000068,98.66872620209755,0.9832191780821917,99.65194538017974,1.257726202097544,56.60630018226155,0.03893094392090197,0.9625278810408924,1.8529198435621408
DE000A2GSLY0,MBGGR 1 11/15/27,EUR,97.01103,MERCEDES-BENZ GROUP AG,"Consumer, Cyclical",2027-11-15,1.0,A,0.001270443,1000000000,N,,Sr Unsecured,1,FIXED,15/11/2018,15/11/2026,15/11/2017,96.914,97.108,2.1218343600273784,0.19400000000000261,98.02398656723722,0.8767123287671232,98.90069889600434,1.012956567237211,49.185392593139,0.033630237106130556,6.4567672860075875,49.18171516420483
XS1717355561,BFCM 1 ⅝ 11/15/27,EUR,97.719,BANQUE FED CRED MUTUEL,Financial,2027-11-15,1.625,BBB+,1.08678e-05,500000000,N,,Subordinated,1,FIXED,15/11/2018,15/11/2026,15/11/2017,97.624,97.813,2.1218343600273784,0.18900000000000716,99.3111034518335,1.4246575342465753,100.73576098608008,1.592103451833509,76.77533736784535,0.02397363133102885,1.9386172713947634,5.665471856436669
XS1718417717,BASGR 1 ⅝ 11/15/37,EUR,80.85939,BASF SE,Basic Materials,2037-11-15,1.625,A-,0.000440507,750000000,Y,2037-08-15,Sr Unsecured,1,FIXED,15/11/2018,15/11/2036,15/11/2017,80.524,81.195,11.871321013004792,0.6709999999999923,89.59282619325646,0.20924657534246574,89.80207276859892,8.733436193256452,95.1221855333771,0.025883763945847068,3.7910769269832953,18.303153701084533
XS1718418103,BASGR 0 ⅞ 11/15/27,EUR,97.095,BASF SE,Basic Materials,2027-11-15,0.875,A-,0.000440507,1000000000,Y,2027-08-15,Sr Unsecured,1,FIXED,15/11/2018,15/11/2026,15/11/2017,96.978,97.212,1.8699520876112252,0.23400000000000887,98.06125350015303,0.11267123287671234,98.17392473302974,0.9662535001530301,53.10772940737907,0.038309982276704596,9.841208933595114,116.48893452631808
FR0013295722,ARRFP 1 ½ 01/17/33,EUR,88.55,APRR SA,"Consumer, Non-cyclical",2033-01-17,1.5,A-,0.011186382,700000000,Y,2032-10-17,Sr Unsecured,1,FIXED,17/01/2018,17/01/2032,17/11/2017,88.339,88.762,7.044490075290897,0.4230000000000018,94.08172371336993,1.4342465753424656,95.5159702887124,5.531723713369928,90.14110221066113,0.028560960631021017,1.9299071815869122,5.614800399607034
XS1721051495,EDPPL 1 ½ 11/22/27,EUR,98.26781,EDP FINANCE BV,Utilities,2027-11-22,1.5,BBB,0.019507714,500000000,N,,Sr Unsecured,1,FIXED,22/11/2018,22/11/2026,20/11/2017,98.178,98.358,2.1409993155373033,0.18000000000000682,99.0407387609592,1.2863013698630137,100.32704013082221,0.7729287609592035,36.86535580013245,0.03591698760130954,0.965328314883149,1.8637175110302802
XS1721422068,VOD 1 ⅞ 11/20/29,EUR,97.322,VODAFONE GROUP PLC,Communications,2029-11-20,1.875,BBB,0.000445526,592397000,N,,Sr Unsecured,1,FIXED,20/11/2018,20/11/2028,20/11/2017,97.156,97.489,4.136892539356605,0.3329999999999984,98.68539634389882,1.6181506849315068,100.30354702883032,1.3633963438988133,34.59695825834964,0.027457865280259876,3.805266131338264,18.376664168994292
XS1721422902,VOD 2 ⅞ 11/20/37,EUR,90.93926,VODAFONE GROUP PLC,Communications,2037-11-20,2.875,BBB,0.000445526,750000000,N,,Sr Unsecured,1,FIXED,20/11/2018,20/11/2036,20/11/2017,90.605,91.273,12.136892539356605,0.6679999999999922,102.2417464241552,2.481164383561644,104.72291080771684,11.302486424155191,113.05659564263885,0.031434278175589456,2.8374991640254024,10.912687799843585
XS1722801708,BNP 1 ½ 05/23/28,EUR,97.39973,BNP PARIBAS,Financial,2028-05-23,1.5,A-,0.000632394,1000000000,N,,Sr Non Preferred,1,FIXED,23/05/2018,23/05/2027,23/11/2017,97.276,97.523,2.642026009582478,0.2469999999999999,98.70468016911491,0.5383561643835617,99.24303633349847,1.3049501691149032,50.92700402749757,0.015247347604997262,0.9849816425120772,1.940377672171579
FR0013298676,HITTFP 1 ⅝ 11/27/27,EUR,98.10149,ABERTIS FRANCE SAS,"Consumer, Non-cyclical",2027-11-27,1.625,BBB-,0.016819763,500000000,Y,2027-08-27,Sr Unsecured,1,FIXED,27/11/2018,27/11/2026,27/11/2017,98.003,98.2,1.9028062970568105,0.19700000000000273,99.41382235488933,0.15582191780821916,99.56964427269756,1.3123323548893353,70.27321341761211,0.03179024997112595,1.9168620911164096,5.552552857073389
XS1725633413,MCD 1 ½ 11/28/29,EUR,95.341,MCDONALD'S CORP,"Consumer, Cyclical",2029-11-28,1.5,BBB+,4.53177e-07,500000000,N,,Sr Unsecured,1,FIXED,28/11/2018,28/11/2028,28/11/2017,95.218,95.464,4.158795345653662,0.2459999999999951,97.19187965502987,1.2616438356164383,98.4535234906463,1.8508796550298712,47.309753093746814,0.026186169353328927,1.9355867887004898,5.645547788211969
XS1725678194,COLSM 2 ½ 11/28/29,EUR,98.185,INMOBILIARIA COLONIAL SO,Financial,2029-11-28,2.5,NR,0.000362068,500000000,Y,2029-08-28,Sr Unsecured,1,FIXED,28/11/2018,28/11/2028,28/11/2017,98.013,98.357,3.9069130732375084,0.3439999999999941,101.1710582334978,0.23287671232876714,101.40393494582656,2.9860582334978005,79.39374293178187,0.03559255913272018,0.96563073110285,1.8648854177004488
XS1725580622,UNIIM 3 ½ 11/29/27,EUR,101.9456,UNIPOL ASSICURAZIONI SPA,Financial,2027-11-29,3.5,BBB,2.62952e-06,500000000,Y,2027-08-29,Sr Unsecured,1,FIXED,29/11/2018,29/11/2026,29/11/2017,101.722,102.169,1.9082819986310746,0.44700000000000273,102.89247904318651,0.3164383561643836,103.2089173993509,0.9468790431865131,49.12498042161246,0.03436531838557991,5.559336882197753,37.090182318876
XS1729882024,TALANX 2 ¼ 12/05/47,EUR,98.22694,TALANX AG,Financial,2047-12-05,2.25,NR,5.19267e-06,750000000,Y,2027-12-05,Subordinated,1,VARIABLE,05/12/2018,05/09/2047,05/12/2017,98.112,98.342,2.1765913757700206,0.23000000000000398,100.59996633667109,1.8493150684931505,102.44928140516424,2.3730263366710886,110.94998369636417,,,
XS1730885073,INTNED 1 ⅜ 01/11/28,EUR,97.60716,ING GROEP NV,Financial,2028-01-11,1.375,A-,8.33832e-05,1000000000,N,,Sr Unsecured,1,FIXED,11/01/2019,11/01/2027,05/12/2017,97.518,97.696,2.2778918548939084,0.17799999999999727,98.67302840616532,0.9907534246575342,99.66378183082286,1.0658684061653219,48.03572822930756,0.03939513377838652,0.9620980198019803,1.8512651994137836
DE000A19S4V6,ALVGR 0 ⅞ 12/06/27,EUR,97.408,ALLIANZ FINANCE II B.V.,Financial,2027-12-06,0.875,AA,4.75964e-06,750000000,Y,2027-09-06,Sr Unsecured,1,FIXED,06/12/2018,06/12/2026,06/12/2017,97.32,97.497,1.9301848049281314,0.1770000000000067,97.99576730812392,0.05993150684931507,98.05569881497323,0.5877673081239152,31.26942617880377,0.02925515054716624,1.9040271018103678,5.511709736053744
FR0013300605,LIFP 1 ⅝ 12/13/32,EUR,90.327,KLEPIERRE SA,Financial,2032-12-13,1.625,A-,2.73016e-05,800000000,Y,2032-09-13,Sr Unsecured,1,FIXED,13/12/2018,13/12/2031,11/12/2017,90.043,90.611,6.951403148528406,0.5679999999999978,94.98814624469006,0.08013698630136987,95.06828323099143,4.661146244690059,76.04868343781249,0.023666677254895803,0.9768804848484847,1.9085909633556208
FR0013302809,SUFP 0 ⅞ 12/13/26,EUR,98.458,SCHNEIDER ELECTRIC SE,Industrial,2026-12-13,0.875,NR,4.03484e-05,750000000,Y,2026-09-13,Sr Unsecured,1,FIXED,13/12/2018,13/12/2025,13/12/2017,98.384,98.531,0.9500342231348392,0.14700000000000557,99.02170308421023,0.04315068493150685,99.06485376914173,0.563703084210232,60.025081448842734,0.026500485478189225,1.9373680821883015,5.6513417097157985
XS1734533372,DHLGR 1 12/13/27,EUR,97.1719,DEUTSCHE POST AG,Industrial,2027-12-13,1.0,A-,0.000114015,500000000,Y,2027-09-13,Sr Unsecured,1,FIXED,13/12/2018,13/12/2026,13/12/2017,97.072,97.272,1.949349760438056,0.20000000000000284,98.21194636158292,0.049315068493150684,98.26126143007606,1.0400463615829239,54.83132479766427,0.02569872430916898,1.9353326480332762,5.646336636964855
XS1733289406,ASSGEN 4 ¼ 12/14/47,EUR,102.5371,GENERALI,Financial,2047-12-14,4.25,BBB+,6.64834e-07,500000000,Y,2027-12-14,Subordinated,1,VARIABLE,14/12/2018,14/09/2047,14/12/2017,102.307,102.767,2.2012320328542097,0.45999999999999375,104.86912639548636,3.3883561643835614,108.25748255986993,2.3320263954863663,104.43488459748673,0.027691891674482064,1.9292082727354432,5.615228226923321
XS1734066811,PVH 3 ⅛ 12/15/27,EUR,100.7408,PVH CORP,"Consumer, Cyclical",2027-12-15,3.125,BBB-,0.004101437,600000000,Y,2027-09-15,Sr Unsecured,2,FIXED,15/06/2018,15/06/2027,21/12/2017,100.56,100.922,1.9548254620123204,0.36199999999999477,102.27524271122725,0.13812154696132595,102.41336425818858,1.534442711227257,79.00666201951074,0.02871563056259014,3.8073039038522243,18.37506756097836
XS1747444831,BMW 1 ⅛ 01/10/28,EUR,97.067,BMW FINANCE NV,"Consumer, Cyclical",2028-01-10,1.125,A,0.04472225,750000000,N,,Sr Unsecured,1,FIXED,10/01/2019,10/01/2027,10/01/2018,96.948,97.187,2.2751540041067764,0.23900000000000432,98.12423230487458,0.8136986301369863,98.93793093501156,1.0572323048745886,47.90002315394373,0.026610630814992625,1.9371590546486268,5.650124560592456
DE000A19UR79,ANNGR 1 ½ 01/14/28,EUR,97.94,VONOVIA SE,Financial,2028-01-14,1.5,BBB+,0.001036135,491500000,N,,Sr Unsecured,1,FIXED,14/01/2019,14/01/2027,15/01/2018,97.806,98.074,2.2861054072553046,0.2680000000000007,98.94333909932186,1.0684931506849313,100.01183225000679,1.0033390993218632,44.951703208322954,0.027968350400016675,1.9286849710937302,5.612190969208798
DE000DL19T26,DB 1 ¾ 01/17/28,EUR,98.04327,DEUTSCHE BANK AG,Financial,2028-01-17,1.75,BBB+,0.000192593,801900000,N,,Sr Non Preferred,1,FIXED,17/01/2019,17/01/2027,16/01/2018,97.952,98.134,2.294318959616701,0.18200000000000216,99.49331807777529,1.232191780821918,100.7255098585972,1.4500480777752784,64.61623528125472,0.02741850788470615,1.9297260308909394,5.618234118613658
FR0013310224,ORAFP 1 ⅜ 01/16/30,EUR,94.42,ORANGE SA,Communications,2030-01-16,1.375,BBB+,2.14239e-05,1000000000,Y,2029-10-16,Sr Unsecured,1,FIXED,16/01/2019,16/01/2029,16/01/2018,94.244,94.597,4.041067761806982,0.35299999999999443,96.83165591187347,1.3184931506849313,98.1501490625584,2.411655911873467,63.70566699872152,0.02978938163261421,3.803142482839283,18.33557621766254
XS1750349190,CBAAU 1 ⅛ 01/18/28,EUR,97.04629,COMMONWEALTH BANK AUST,Financial,2028-01-18,1.125,AA-,2.74771e-05,602136000,N,,Sr Unsecured,1,FIXED,18/01/2019,18/01/2027,18/01/2018,96.874,97.219,2.297056810403833,0.34499999999999886,98.10187065176945,0.7890410958904109,98.89091174765986,1.0555806517694464,47.384604545093495,0.02529713777490283,0.9753270180488336,1.90252558427206
XS1753808929,EXOIM 1 ¾ 01/18/28,EUR,97.991,EXOR NV,Financial,2028-01-18,1.75,NR,2.32729e-06,500000000,Y,2027-10-18,Sr Preferred,1,FIXED,18/01/2019,18/01/2027,18/01/2018,97.898,98.085,2.0451745379876796,0.1869999999999976,99.60241873573814,1.6684931506849316,101.27091188642308,1.611418735738141,80.40986017138326,0.032846326544961515,1.911476285858471,5.527936255453088
XS1753814737,RENEPL 1 ¾ 01/18/28,EUR,98.095,REN FINANCE BV,Utilities,2028-01-18,1.75,BBB,2.07679e-05,300000000,Y,2027-10-18,Sr Unsecured,1,FIXED,18/01/2019,18/01/2027,18/01/2018,97.882,98.308,2.0451745379876796,0.42600000000000193,99.60241873573814,1.6684931506849316,101.27091188642308,1.507418735738142,75.18031119768268,0.026617361101377857,1.9324135991269185,5.631610284437005
FR0013310455,DGFP 1 ⅜ 01/22/30,EUR,94.035,AUTOROUTES DU SUD DE LA,"Consumer, Non-cyclical",2030-01-22,1.375,A-,4.03887e-05,1000000000,Y,2029-10-22,Sr Unsecured,1,FIXED,22/01/2019,22/01/2029,22/01/2018,93.89,94.18,4.057494866529774,0.29000000000000625,96.81309067792395,1.2958904109589042,98.10898108888286,2.778090677923956,73.2522909950609,0.030886199806148797,1.9243475003849875,5.584817849199484
XS1756296965,TELEFO 1.447 01/22/27,EUR,98.944,TELEFONICA EMISIONES SAU,Communications,2027-01-22,1.447,BBB-,0.021357445,1000000000,Y,2026-10-22,Sr Unsecured,1,FIXED,22/01/2019,22/01/2026,22/01/2018,98.838,99.05,1.056810403832991,0.2120000000000033,99.50820488559854,1.3637479452054795,100.87195283080402,0.5642048855985422,53.76873347069452,0.02962198841410411,2.869834589910929,11.092562891792298
FR0013312154,ACAFP 2 ⅝ 01/29/48,EUR,98.743,CREDIT AGRICOLE ASSRNCES,Financial,2048-01-29,2.625,NR,0.001735407,1000000000,Y,2028-01-29,Subordinated,1,VARIABLE,29/01/2019,29/01/2047,29/01/2018,98.565,98.921,2.327173169062286,0.35600000000000875,101.4503557184132,1.7619863013698631,103.21234201978307,2.7073557184132113,117.99590587001757,0.028834079557342615,1.9282166875298243,5.607239123779746
FR0013312501,BPCEGP 1 ⅝ 01/31/28,EUR,98.00647,BPCE SA,Financial,2028-01-31,1.625,BBB+,1.82924e-05,750000000,N,,Sr Non Preferred,1,FIXED,31/01/2019,31/01/2027,31/01/2018,97.92,98.093,2.3326488706365502,0.17300000000000182,99.19455862085776,1.0818493150684931,100.27640793592626,1.1880886208577692,52.13761305866561,0.024889922397176363,1.9310557249426452,5.632598869420776
XS1761721262,ARNDTN 1 ⅝ 01/31/28,EUR,97.203,AROUNDTOWN SA,Financial,2028-01-31,1.625,NR,0.002953027,795000000,Y,2027-10-31,Sr Unsecured,1,FIXED,31/01/2019,31/01/2027,31/01/2018,97.077,97.329,2.080766598220397,0.25199999999999534,99.3340592217142,1.4914383561643836,100.82549757787858,2.131059221714196,105.03775182274113,0.02535893900064894,0.9752682323856612,1.9022962502013043
XS1761785077,EOANGR 1 ½ 07/31/29,EUR,95.861,E.ON INTL FINANCE BV,Utilities,2029-07-31,1.5,BBB+,0.00010082,1000000000,Y,2029-04-30,Sr Unsecured,1,FIXED,31/07/2018,31/07/2028,31/01/2018,95.686,96.036,3.578370978781656,0.3499999999999943,97.81855642633572,0.6328767123287671,98.45143313866448,1.9575564263357137,57.531707216874864,0.031262722994712666,6.4513293416229915,49.198033247047256
XS1765875718,ATIM 1 ⅝ 02/08/28,EUR,97.588,ASTM SPA,"Consumer, Non-cyclical",2028-02-08,1.625,BBB-,0.012254229,550000000,Y,2027-11-08,1st lien,1,FIXED,08/02/2019,08/02/2027,08/02/2018,97.486,97.69,2.102669404517454,0.20399999999999352,99.32180624679167,1.4558219178082192,100.77762816459989,1.7338062467916728,84.41452362615553,,,
XS1767931121,SANTAN 2 ⅛ 02/08/28,EUR,99.29832,BANCO SANTANDER SA,Financial,2028-02-08,2.125,BBB,0.000140759,1250000000,N,,Subordinated,1,FIXED,08/02/2019,08/02/2027,08/02/2018,99.123,99.474,2.3545516769336072,0.3509999999999991,100.32187207617373,1.3681506849315068,101.69002276110524,1.0235520761737291,44.098007214157406,0.028822700050198817,3.80688856910051,18.371124136445523
XS1769090991,UNANA 1 ⅛ 02/12/27,EUR,98.624,UNILEVER FINANCE,"Consumer, Non-cyclical",2027-02-12,1.125,A+,7.01173e-07,700000000,N,,Sr Unsecured,1,FIXED,12/02/2019,12/02/2026,12/02/2018,98.561,98.687,1.3661875427789185,0.12599999999999056,98.93443545005326,0.711986301369863,99.64642175142312,0.31043545005326223,23.012246274550662,0.03522020790682275,10.455021337130935,126.79998351711382
XS1769091296,UNANA 1 ⅝ 02/12/33,EUR,90.691,UNILEVER FINANCE,"Consumer, Non-cyclical",2033-02-12,1.625,A+,7.01173e-07,800000000,N,,Sr Unsecured,1,FIXED,12/02/2019,12/02/2032,12/02/2018,90.482,90.9,7.367556468172484,0.41800000000000637,94.51098154887023,1.0284246575342464,95.53940620640448,3.8199815488702313,59.02914681051457,0.022344249855541894,1.9336266570863077,5.651930278533452
XS1771723167,MCK 1 ⅝ 10/30/26,EUR,99.29718,MCKESSON CORP,"Consumer, Non-cyclical",2026-10-30,1.625,BBB+,4.2919e-07,500000000,Y,2026-07-30,Sr Unsecured,1,FIXED,30/10/2018,30/10/2025,12/02/2018,99.244,99.35,0.8268309377138946,0.10599999999999454,99.74949061263403,0.2804794520547945,100.02997006468883,0.4523106126340366,54.77423253108476,0.022192107108350078,1.9408463770989197,5.680738568807209
XS1769041192,NOVNVX 1 ⅜ 08/14/30,EUR,94.38152,NOVARTIS FINANCE SA,"Consumer, Non-cyclical",2030-08-14,1.375,AA-,1.31566e-06,750000000,Y,2030-05-14,Sr Unsecured,1,FIXED,14/08/2018,14/08/2029,14/02/2018,94.179,94.584,4.616016427104722,0.40500000000000114,96.1921238997938,0.5273972602739726,96.71952116006777,1.8106038997938043,42.17689450189275,0.03243892589733172,0.9685802955665026,1.8762955779193875
XS1769041606,NOVNVX 1.7 08/14/38,EUR,82.416,NOVARTIS FINANCE SA,"Consumer, Non-cyclical",2038-08-14,1.7,AA-,1.31566e-06,750000000,Y,2038-05-14,Sr Unsecured,1,FIXED,14/08/2018,14/08/2037,14/02/2018,82.106,82.726,12.616016427104723,0.6200000000000045,89.4936736767064,0.6520547945205479,90.14572847122695,7.077673676706397,72.66564366100019,0.02506964490417803,1.9330228382306742,5.63962111111508
XS1772457633,COVFP 2 ⅜ 02/20/28,EUR,100.272,COVIVIO,Financial,2028-02-20,2.375,NR,0.00050927,300000000,Y,2027-11-20,Sr Unsecured,1,FIXED,20/02/2019,20/02/2027,20/02/2018,100.063,100.482,2.135523613963039,0.41899999999999693,100.85767770603842,2.0496575342465753,102.907335240285,0.5856777060384104,27.59659988730157,0.028961646907751513,1.9279757146826706,5.605841416086596
XS1775786574,SAMPFH 1 ⅝ 02/21/28,EUR,98.85,SAMPO OYJ,Financial,2028-02-21,1.625,A,1.08227e-09,313018000,Y,2027-11-21,Sr Unsecured,1,FIXED,21/02/2019,21/02/2027,21/02/2018,98.68,99.02,2.138261464750171,0.3399999999999892,99.30194347714968,1.3979452054794521,100.69988868262912,0.4519434771496833,21.504996155454307,0.03060812792316786,0.9703009057527541,1.8829676954092303
XS1781401085,GYCGR 1 ½ 02/22/27,EUR,98.3109,GRAND CITY PROPERTIES SA,Financial,2027-02-22,1.5,NR,0.00073146,583300000,Y,2026-11-22,Sr Unsecured,1,FIXED,22/02/2019,22/02/2026,22/02/2018,98.218,98.404,1.1416837782340863,0.18599999999999284,99.5275737814776,1.2863013698630137,100.81387515134061,1.2166737814775956,107.68426404034064,0.031234014229454855,1.919053279362792,5.563033254529727
DE000CZ40MM4,CMZB 1 ⅞ 02/28/28,EUR,98.78206,COMMERZBANK AG,Financial,2028-02-28,1.875,BBB,0.000516517,500000000,N,,Sr Non Preferred,1,FIXED,28/02/2019,28/02/2027,28/02/2018,98.665,98.899,2.409308692676249,0.23399999999999466,99.73526800085645,1.1044520547945207,100.83972005565097,0.9532080008564492,40.31633054617389,0.027831336138861316,1.9308168865287485,5.6209835180371215
FR0013320058,ICADFP 1 ⅝ 02/28/28,EUR,97.564,ICADE,Financial,2028-02-28,1.625,NR,0.002670412,571500000,Y,2027-11-28,Sr Unsecured,1,FIXED,28/02/2019,28/02/2027,28/02/2018,97.463,97.665,2.1574264202600957,0.2020000000000124,99.2912729914476,1.3667808219178081,100.65805381336541,1.727272991447606,82.0084862903386,0.03820734399950046,9.299091944480967,102.7621548573668
XS1785458172,WPC 2 ⅛ 04/15/27,EUR,99.09198,WPC EUROBOND BV,Financial,2027-04-15,2.125,BBB+,7.04222e-05,500000000,Y,2027-01-15,Sr Unsecured,1,FIXED,15/04/2018,15/04/2026,06/03/2018,99.024,99.16,1.2895277207392197,0.13599999999999568,100.25409811049272,1.507876712328767,101.76197482282149,1.1621181104927132,90.47010356838771,0.027149101490711872,3.813390225655819,18.432904206186244
FR0013321536,CARDFP 2 ⅛ 03/07/28,EUR,98.093,CARMILA SA,Financial,2028-03-07,2.125,BBB,0.000144503,274300000,Y,2027-12-07,Sr Unsecured,1,FIXED,07/03/2019,07/03/2027,07/03/2018,97.862,98.323,2.1820670773442847,0.4609999999999985,100.33563635984966,1.734931506849315,102.07056786669898,2.242636359849655,104.735378366383,0.026543109741260344,0.9741432098765433,1.8979099866971505
XS1785795763,CB 1.55 03/15/28,EUR,97.633,CHUBB INA HOLDINGS LLC,Financial,2028-03-15,1.55,A,2.80507e-07,900000000,Y,2027-12-15,Sr Unsecured,1,FIXED,15/03/2019,15/03/2027,07/03/2018,97.54,97.727,2.2039698836413417,0.1869999999999976,99.10518187754404,1.2315068493150685,100.33668872685911,1.4721818775440454,68.45162049953788,0.028798047385318604,3.7931846456383935,18.28282034390037
XS1785813251,CB 2 ½ 03/15/38,EUR,88.31706,CHUBB INA HOLDINGS LLC,Financial,2038-03-15,2.5,A,2.80507e-07,900000000,Y,2037-09-15,Sr Unsecured,1,FIXED,15/03/2019,15/03/2037,07/03/2018,88.006,88.628,11.956194387405887,0.6219999999999999,98.4598379130807,0.1095890410958904,98.56942695417659,10.142777913080707,104.49857226821888,0.02651893093442061,1.931431675509549,5.628142080873469
DE000A2G8VU3,SAPGR 1 ⅜ 03/13/30,EUR,94.98528,SAP SE,Technology,2030-03-13,1.375,A+,3.31915e-07,500000000,Y,2029-12-13,Sr Unsecured,1,FIXED,13/03/2019,13/03/2029,13/03/2018,94.829,95.141,4.199863107460644,0.3120000000000118,96.65291884571829,1.1,97.75291884571828,1.6676388457182867,42.3360453133107,0.02728974337904146,1.933493296291136,5.633369569044073
XS1788586375,REESM 1 ¼ 03/13/27,EUR,98.632,RED ELECTRICA FINANCI SA,Utilities,2027-03-13,1.25,A-,2.7585e-05,600000000,Y,2026-12-13,Sr Unsecured,1,FIXED,13/03/2019,13/03/2026,13/03/2018,98.519,98.744,1.1991786447638604,0.22499999999999432,99.21025106627103,1.0,100.21025106627103,0.5782510662710223,48.731558227630984,0.027200664845478267,1.9301387984386607,5.620631053995186
FR0013322989,GFCFP 1 ⅝ 03/14/30,EUR,95.32233,GECINA,Financial,2030-03-14,1.625,A-,0.000165878,500000000,Y,2029-12-14,Sr Unsecured,1,FIXED,14/03/2019,14/03/2029,14/03/2018,95.121,95.524,4.202600958247776,0.4030000000000058,97.64541943061225,1.2955479452054794,98.94096737581773,2.3230894306122565,58.75924155497835,0.028646098422849417,3.807573671741007,18.3776291227149
XS1789176846,PRIFII 1 ¾ 03/15/28,EUR,98.26551,PROLOGIS INTL FUND II,Financial,2028-03-15,1.75,A-,0.002987741,300000000,Y,2027-12-15,Sr Unsecured,1,FIXED,15/03/2019,15/03/2027,15/03/2018,98.17,98.361,2.2039698836413417,0.1910000000000025,99.53252979829226,1.3904109589041096,100.92294075719637,1.267019798292253,58.659654780668724,0.035476335354314055,10.358600543438596,125.19055747241505
FR0013323870,ORAFP 1 ⅜ 03/20/28,EUR,97.399,ORANGE SA,Communications,2028-03-20,1.375,BBB+,2.14239e-05,1000000000,Y,2027-12-20,Sr Unsecured,1,FIXED,20/03/2019,20/03/2027,20/03/2018,97.292,97.506,2.217659137577002,0.21399999999999864,98.72045050641631,1.0736301369863015,99.79408064340261,1.321450506416312,61.20196305197037,0.026265154207742274,1.9250194536426009,5.604071904590612
XS1785340172,ISPIM 1 ¾ 03/20/28,EUR,98.13625,INTESA SANPAOLO SPA,Financial,2028-03-20,1.75,BBB+,0.000100348,1250000000,N,,Sr Preferred,1,FIXED,20/03/2019,20/03/2027,20/03/2018,98.019,98.253,2.4668035592060233,0.23399999999999466,99.41497099037431,0.9349315068493153,100.34990249722362,1.2787209903743104,53.06723343519529,0.026677929614714213,1.9322986839392267,5.630942276665875
FR0013324357,SANFP 1 ⅜ 03/21/30,EUR,94.445,SANOFI SA,"Consumer, Non-cyclical",2030-03-21,1.375,AA-,2.18798e-05,2000000000,Y,2029-12-21,Sr Unsecured,1,FIXED,21/03/2019,21/03/2029,21/03/2018,94.288,94.601,4.2217659137577,0.3130000000000024,96.62839475028024,1.0698630136986302,97.69825776397887,2.183394750280243,55.315217905432625,0.031284185728589625,3.756646585042594,18.018264579115375
FR0013324373,SANFP 1 ⅞ 03/21/38,EUR,83.882,SANOFI SA,"Consumer, Non-cyclical",2038-03-21,1.875,AA-,2.18798e-05,1250000000,Y,2037-12-21,Sr Unsecured,1,FIXED,21/03/2019,21/03/2037,21/03/2018,83.534,84.23,12.2217659137577,0.695999999999998,91.77605471185223,1.4589041095890412,93.23495882144127,7.89405471185222,82.31045275225225,0.040202309907441676,9.857307517739319,116.643371977646
XS1794354628,STERV 2 ½ 03/21/28,EUR,99.7566,STORA ENSO OYJ,Industrial,2028-03-21,2.5,BBB-,0.001439436,300000000,Y,2027-12-21,Sr Unsecured,1,FIXED,21/03/2019,21/03/2027,21/03/2018,99.634,99.879,2.220396988364134,0.24500000000000455,101.13952988490044,1.9452054794520548,103.0847353643525,1.3829298849004346,62.8325313217049,0.02866770202324246,0.9721312315270936,1.8900782626207673
XS1795252672,C 1 ⅝ 03/21/28,EUR,97.995,CITIGROUP INC,Financial,2028-03-21,1.625,A-,0.000312288,750000000,Y,2028-02-21,Sr Unsecured,1,FIXED,21/03/2019,21/03/2027,21/03/2018,97.897,98.093,2.3901437371663246,0.19599999999999795,99.16315385754763,0.9883561643835618,100.15151002193119,1.1681538575476225,50.061990009106516,0.02436969567058322,1.933198354962052,5.642858558121542
DE000A19X8B2,ANNGR 2 ⅛ 03/22/30,EUR,96.28162,VONOVIA SE,Financial,2030-03-22,2.125,BBB+,0.001036135,495600000,N,,Sr Unsecured,1,FIXED,22/03/2019,22/03/2029,22/03/2018,96.102,96.461,4.470910335386721,0.35899999999999466,99.51806196767063,1.1236301369863015,100.64169210465694,3.236441967670629,76.6120450558591,0.025548786570270494,1.9391760322268985,5.6618747149222175
DE000A19X8C0,ANNGR 2 ¾ 03/22/38,EUR,88.09277,VONOVIA SE,Financial,2038-03-22,2.75,BBB+,0.001036135,500000000,N,,Sr Unsecured,1,FIXED,22/03/2019,22/03/2037,22/03/2018,87.715,88.47,12.470910335386721,0.7549999999999955,100.80118479400501,1.454109589041096,102.2552943830461,12.708414794005009,126.57862038409783,0.030396658955897833,2.8211081636318296,10.835155954311077
XS1793224632,RELLN 1 ½ 05/13/27,EUR,98.67132,RELX FINANCE BV,"Consumer, Non-cyclical",2027-05-13,1.5,A-,5.964e-07,500000000,Y,2027-02-13,Sr Unsecured,1,FIXED,13/05/2019,13/05/2026,22/03/2018,98.602,98.741,1.3689253935660506,0.1389999999999958,99.43369394097151,0.9452054794520548,100.37889942042356,0.7623739409715142,56.26591901747434,0.028480345226046002,1.918569632609883,5.5709979393013604
XS1796209010,GS 2 03/22/28,EUR,99.157,GOLDMAN SACHS GROUP INC,Financial,2028-03-22,2.0,A-,0.00026897,750000000,N,,Sr Unsecured,1,FIXED,22/03/2019,22/03/2027,22/03/2018,99.062,99.251,2.4722792607802875,0.18900000000000716,100.00938031976315,1.0575342465753426,101.0669145663385,0.8523803197631565,35.067280184855626,0.026541051510507816,1.9328115913926731,5.633438653976597
DE000A2LQJ75,DBOERS 1 ⅛ 03/26/28,EUR,97.24622,DEUTSCHE BOERSE AG,Financial,2028-03-26,1.125,NR,4.58215e-08,600000000,Y,2027-12-26,Sr Unsecured,1,FIXED,26/03/2019,26/03/2027,26/03/2018,97.042,97.45,2.2340862422997945,0.40800000000000125,98.16622323446076,0.8599315068493151,99.02615474131008,0.9200032344607649,42.39256754322999,0.02831421359651168,3.801931954361189,18.345039885912474
XS1799611642,AXASA 3 ¼ 05/28/49,EUR,100.5945,AXA SA,Financial,2049-05-28,3.25,A,6.89119e-06,2000000000,Y,2029-05-28,Subordinated,1,VARIABLE,28/05/2018,26/02/2049,26/03/2018,100.446,100.743,3.6550308008213555,0.29699999999999704,103.83143911456628,1.121917808219178,104.95335692278546,3.236939114566283,90.16420460908567,0.030189161245627295,1.9164691800533087,5.556732590963723
XS1794675931,FFHCN 2 ¾ 03/29/28,EUR,99.812,FAIRFAX FINL HLDGS LTD,Financial,2028-03-29,2.75,BBB+,3.07653e-06,750000000,Y,2027-12-29,Sr Unsecured,1,FIXED,29/03/2019,29/03/2027,29/03/2018,99.676,99.948,2.242299794661191,0.27199999999999136,101.68868803642349,2.0794520547945208,103.768140091218,1.876688036423488,84.31270003621026,0.026895916573836106,1.9307165273475346,5.6239867760563165
XS1801905628,MIZUHO 1.598 04/10/28,EUR,97.969,MIZUHO FINANCIAL GROUP,Financial,2028-04-10,1.598,A,0.000341565,500000000,N,,Sr Unsecured,1,FIXED,10/04/2019,10/04/2027,10/04/2018,97.892,98.047,2.524298425735797,0.15500000000000114,99.02043931542981,0.761786301369863,99.78222561679968,1.0514393154298176,42.740369109076205,0.026769347468151617,1.930956572524069,5.6253813661441745
BE6334363692,ECLEAR 1 ½ 04/11/30,EUR,95.03096,EUROCLEAR HOLDING SA,Financial,2030-04-11,1.5,AA-,0.001962336,300000000,N,,Sr Preferred,1,FIXED,11/04/2019,11/04/2029,11/04/2018,94.738,95.324,4.525667351129363,0.5859999999999985,96.82513066294162,0.7109589041095891,97.5360895670512,1.7941706629416245,42.40290428723952,0.02794384537396232,1.9346325088730467,5.635423072349623
BE6334364708,ECLEAR 2 ⅝ 04/11/48,EUR,99.24646,EUROCLEAR HOLDING SA,Financial,2048-04-11,2.625,A,0.001962336,400000000,Y,2028-04-11,Subordinated,1,VARIABLE,11/04/2019,11/04/2047,11/04/2018,98.958,99.535,2.5270362765229293,0.5769999999999982,101.52323415889519,1.2441780821917807,102.76741224108697,2.2767741588951935,91.34332430025275,0.029836597550230874,1.9263245549311945,5.596268929246099
XS1806368897,SCGAU 1 ¾ 04/11/28,EUR,98.194,SCENTRE GROUP TRUST 1/2,Financial,2028-04-11,1.75,A,0.001333381,500000000,Y,2028-01-11,Sr Unsecured,1,FIXED,11/04/2019,11/04/2027,11/04/2018,98.117,98.271,2.2778918548939084,0.15399999999999636,99.50041720218621,1.2609589041095892,100.7613761062958,1.3064172021862106,58.5814205337121,0.027278597170964532,1.9299911126701834,5.6197733860780135
FR0013327988,CAPFP 1 ¾ 04/18/28,EUR,98.218,CAPGEMINI SE,Technology,2028-04-18,1.75,NR,0.000167553,500000000,Y,2028-01-18,Sr Unsecured,1,FIXED,18/04/2019,18/04/2027,18/04/2018,98.097,98.339,2.297056810403833,0.24200000000000443,99.49213613227921,1.2273972602739727,100.71953339255319,1.2741361322792102,56.660601273320616,0.02917594654788428,0.971651157758061,1.8882119447451606
XS1808482746,HANRUE 1 ⅛ 04/18/28,EUR,96.79614,HANNOVER RE,Financial,2028-04-18,1.125,NR,1.34716e-07,750000000,Y,2028-01-18,Sr Unsecured,1,FIXED,18/04/2019,18/04/2027,18/04/2018,96.553,97.04,2.297056810403833,0.487000000000009,98.10187065176945,0.7890410958904109,98.89091174765986,1.3057306517694514,58.68948104076495,0.030762831662961107,1.9234111306628636,5.581627308279776
FR0013330099,VPARKI 1 ⅝ 04/19/28,EUR,97.39963,INDIGO GROUP SAS,Financial,2028-04-19,1.625,NR,0.024154377,800000000,Y,2028-01-19,Sr Unsecured,1,FIXED,19/04/2019,19/04/2027,19/04/2018,97.314,97.485,2.299794661190965,0.17100000000000648,99.21257903664402,1.1352739726027397,100.34785300924676,1.8129490366440137,80.92042635239038,0.02849725724772523,1.9312077765541789,5.620089305125932
XS1810653540,HEIGR 1 ¾ 04/24/28,EUR,98.12149,HEIDELBERG MATERIALS FIN,Industrial,2028-04-24,1.75,BBB,0.01639308,750000000,Y,2028-01-24,Sr Unsecured,1,FIXED,24/04/2019,24/04/2027,24/04/2018,97.995,98.248,2.3134839151266258,0.2530000000000001,99.48505190881995,1.1986301369863015,100.68368204580625,1.3635619088199604,60.246017650785106,0.03350400843314188,4.655785397706518,26.68243519502847
XS1811435251,BAC 1.662 04/25/28,EUR,98.78,BANK OF AMERICA CORP,Financial,2028-04-25,1.662,A+,0.000123703,1250000000,Y,2027-04-25,Sr Unsecured,1,VARIABLE,25/04/2019,25/01/2028,25/04/2018,98.706,98.854,1.5633127994524298,0.14799999999999613,99.59641972084452,0.7239945205479451,100.32041424139247,0.8164197208445216,52.78851230622403,0.039886299060574455,10.0912697161038,120.50002874656919
XS1811198701,SYDAU 1 ¾ 04/26/28,EUR,97.465,SYDNEY AIRPORT FINANCE,Industrial,2028-04-26,1.75,BBB+,0.033100929,500000000,Y,2028-01-26,1st lien,1,FIXED,26/04/2019,26/04/2027,26/04/2018,97.408,97.523,2.31895961670089,0.11499999999999488,99.4826933384059,1.1890410958904112,100.67173443429631,2.0176933384058913,89.24108938705422,0.029552967260394594,3.783441831761557,18.211086507264223
XS1815116998,PHIANA 1 ⅜ 05/02/28,EUR,97.172,KONINKLIJKE PHILIPS NV,"Consumer, Non-cyclical",2028-05-02,1.375,BBB+,4.31505e-05,500000000,Y,2028-02-02,Sr Unsecured,1,FIXED,02/05/2019,02/05/2027,02/05/2018,97.075,97.269,2.3381245722108144,0.19400000000000261,98.62578147844295,0.9078767123287671,99.53365819077172,1.4537814784429486,64.01138264940398,0.02649812540912369,3.8090092413619128,18.412200365180265
FR0013332996,URWFP 1 ⅞ 01/15/31,EUR,93.31017,UNIBAIL-RODAMCO-WESTFLD,Financial,2031-01-15,1.875,BBB,0.008889247,900000000,Y,2030-10-15,Sr Unsecured,1,FIXED,15/01/2019,15/01/2030,15/05/2018,93.088,93.532,5.037645448323066,0.4440000000000026,98.09492577296629,1.803082191780822,99.89800796474711,4.784755772966292,103.06823404789125,0.02926518445451787,1.9193408849231801,5.571187869030807
FR0013333002,URWFP 2 ¼ 05/14/38,EUR,83.67206,UNIBAIL-RODAMCO-WESTFLD,Financial,2038-05-14,2.25,BBB,0.008889247,500000000,Y,2038-02-14,Sr Unsecured,1,FIXED,14/05/2019,14/05/2037,15/05/2018,83.269,84.075,12.372347707049967,0.8059999999999974,95.57191894339498,1.4116438356164382,96.98356277901142,11.899858943394975,122.86095668408989,0.02564573152365323,3.785367305649385,18.26889545642635
XS1822829799,GSK 1 ¾ 05/21/30,EUR,95.515,GLAXOSMITHKLINE CAPITAL,"Consumer, Non-cyclical",2030-05-21,1.75,A,0.028372812,750000000,Y,2030-02-21,Sr Unsecured,1,FIXED,21/05/2019,21/05/2029,21/05/2018,95.335,95.695,4.39151266255989,0.35999999999999943,97.99604300755627,1.0643835616438357,99.0604265692001,2.4810430075562664,60.09193359097454,0.02867001066233612,1.9267805649973673,5.6022476602807565
XS1823502577,BASGR 1 ½ 05/22/30,EUR,95.69,BASF SE,Basic Materials,2030-05-22,1.5,A-,0.000440507,500000000,Y,2030-02-22,Sr Unsecured,1,FIXED,22/05/2019,22/05/2029,22/05/2018,95.396,95.983,4.394250513347022,0.5870000000000033,96.95554863359047,0.9082191780821918,97.86376781167266,1.2655486335904698,30.645288981090708,0.03061079256638589,0.9702983970406907,1.882957958599468
XS1824240136,BFCM 2 ½ 05/25/28,EUR,99.183,BANQUE FED CRED MUTUEL,Financial,2028-05-25,2.5,BBB+,1.08678e-05,500000000,N,,Subordinated,1,FIXED,25/05/2019,25/05/2027,25/05/2018,99.058,99.309,2.647501711156742,0.25099999999999056,101.25309276671086,0.8835616438356164,102.13665441054648,2.0700927667108573,79.46771150778972,0.030288207840977667,2.8407820004170508,10.937616327895103
XS1828033834,DT 2 12/01/29,EUR,97.87939,DEUTSCHE TELEKOM INT FIN,Communications,2029-12-01,2.0,BBB+,0.021966191,1000000000,N,,Sr Unsecured,1,FIXED,01/12/2018,01/12/2028,01/06/2018,97.657,98.102,4.167008898015058,0.4450000000000074,99.15881455845425,1.6657534246575343,100.82456798311179,1.2794245584542523,32.12862423782006,0.028396024859531674,1.931399177839684,5.621200862129682
XS1835955474,JPM 1.812 06/12/29,EUR,97.97739,JPMORGAN CHASE & CO,Financial,2029-06-12,1.812,A+,0.0001373,1000000000,Y,2028-06-12,Sr Unsecured,1,VARIABLE,12/06/2019,12/03/2029,12/06/2018,97.847,98.108,2.6967830253251197,0.2610000000000099,99.47977948187415,0.5510465753424658,100.03082605721661,1.5023894818741468,57.214334923870936,0.029886616106046496,1.9285847014930886,5.604866952306035
FR0013344215,SUFP 1 ⅜ 06/21/27,EUR,98.364,SCHNEIDER ELECTRIC SE,Industrial,2027-06-21,1.375,NR,4.03484e-05,750000000,Y,2027-03-21,Sr Unsecured,1,FIXED,21/06/2019,21/06/2026,21/06/2018,98.289,98.439,1.4674880219028064,0.14999999999999147,99.21460596126374,0.7308219178082193,99.94542787907196,0.8506059612637387,58.75039024423098,0.028773217681485722,1.9299774109028758,5.614304973812825
DE000A1919H2,JABHOL 2 ½ 06/25/29,EUR,98.505,JAB HOLDINGS BV,Financial,2029-06-25,2.5,BBB,0.004836786,750000000,N,,Sr Unsecured,1,FIXED,25/06/2019,25/06/2028,25/06/2018,98.381,98.63,3.7316906228610542,0.24899999999999523,101.20312292947501,0.6712328767123288,101.87435580618734,2.6981229294750193,74.77643344753915,0.02545053705311477,2.8680626882733375,11.113095294601534
FR0013346137,DGFP 1 ⅜ 06/27/28,EUR,97.191,AUTOROUTES DU SUD DE LA,"Consumer, Non-cyclical",2028-06-27,1.375,A-,4.03887e-05,700000000,Y,2028-03-27,Sr Unsecured,1,FIXED,27/06/2019,27/06/2027,27/06/2018,97.104,97.278,2.485968514715948,0.1740000000000066,98.50694337842927,0.7082191780821918,99.21516255651146,1.3159433784292673,54.5774525307391,0.028392715578411335,2.862993755823954,11.065880435741942
XS1856834608,BFCM 1 ⅜ 07/16/28,EUR,96.9118,BANQUE FED CRED MUTUEL,Financial,2028-07-16,1.375,A+,1.08678e-05,1054000000,N,,Sr Preferred,1,FIXED,16/07/2019,16/07/2027,16/07/2018,96.806,97.018,2.7898699520876113,0.2120000000000033,98.27310835285202,0.29006849315068495,98.5631768460027,1.3613083528520207,50.56325993123527,0.030131750797771462,1.9281226276747692,5.602187562099501
XS1856797219,WSTP 1.45 07/17/28,EUR,97.264,WESTPAC BANKING CORP,Financial,2028-07-17,1.45,AA-,3.51898e-05,850000000,N,,Sr Unsecured,1,FIXED,17/07/2019,17/07/2027,17/07/2018,97.161,97.366,2.7926078028747434,0.2049999999999983,98.47267443806412,0.3019178082191781,98.77459224628329,1.2086744380641221,44.752325071004044,0.030613237718823363,3.7793144071492324,18.17217406933465
XS1861206636,GS 2 11/01/28,EUR,98.44467,GOLDMAN SACHS GROUP INC,Financial,2028-11-01,2.0,A-,0.00026897,1500000000,N,,Sr Unsecured,1,FIXED,01/11/2018,01/11/2027,01/08/2018,98.329,98.56,3.0855578370978782,0.23100000000000875,99.85903349938192,1.83013698630137,101.68917048568329,1.4143634993819205,47.15028281919491,0.03661160316017982,10.03674991958159,119.8089025767163
XS1861322383,PLD 1 ⅞ 01/05/29,EUR,97.264,PROLOGIS EURO FINANCE,Financial,2029-01-05,1.875,A,0.010005575,700000000,Y,2028-10-05,Sr Unsecured,1,FIXED,05/01/2019,05/01/2028,01/08/2018,97.162,97.367,3.0116358658453115,0.2049999999999983,99.54865816795044,1.8544520547945207,101.40311022274496,2.2846581679504396,78.49706963127214,0.02902526765510613,1.93021007149123,5.6142969436188634
DE000A194DE7,MBGGR 1 ½ 02/09/27,EUR,99.06331,MERCEDES-BENZ INT FINCE,"Consumer, Cyclical",2027-02-09,1.5,A,0.042824479,500000000,N,,Sr Unsecured,1,FIXED,09/02/2019,09/02/2026,09/08/2018,98.948,99.179,1.3579739904175223,0.23100000000000875,99.43817266502913,0.9616438356164384,100.39981650064557,0.37486266502912713,27.83150522237258,0.03013586807368683,3.8018014334023595,18.322859090231397
XS1872032799,NAB 1 ⅜ 08/30/28,EUR,96.866,NATIONAL AUSTRALIA BANK,Financial,2028-08-30,1.375,AA-,2.72424e-05,1250000000,N,,Sr Unsecured,1,FIXED,30/08/2019,30/08/2027,30/08/2018,96.771,96.961,2.9130732375085557,0.18999999999999773,98.17955340494152,0.12054794520547946,98.30010135014699,1.3135534049415156,46.81079539936948,0.03508306190588036,0.966106041923551,1.8667217684823796
FR0013357852,MLFP 1 ¾ 09/03/30,EUR,95.13282,CIE GENERALE DES ESTABLI,"Consumer, Cyclical",2030-09-03,1.75,A,7.14317e-05,1000000000,Y,2030-06-03,Sr Unsecured,1,FIXED,03/09/2019,03/09/2029,03/09/2018,94.94,95.326,4.670773442847365,0.3859999999999957,97.78254256486146,0.5753424657534247,98.35788503061488,2.649722564861463,60.683846086234816,0.030512142388645067,1.9262259274701172,5.593452912179098
FR0013357860,MLFP 2 ½ 09/03/38,EUR,88.885,CIE GENERALE DES ESTABLI,"Consumer, Cyclical",2038-09-03,2.5,A,7.14317e-05,750000000,Y,2038-06-03,Sr Unsecured,1,FIXED,03/09/2019,03/09/2037,03/09/2018,88.467,89.304,12.670773442847365,0.8370000000000033,98.03281353316059,0.821917808219178,98.85473134137978,9.147813533160587,89.62585952196078,0.02917185852172151,1.9287531120699843,5.6081036086272915
FR0013358124,HSBC 1 ⅜ 09/04/28,EUR,97.07299,HSBC CONTINENTAL EUROPE,Financial,2028-09-04,1.375,A+,1.16458e-05,750000000,N,,Sr Preferred,1,FIXED,04/09/2019,04/09/2027,04/09/2018,96.943,97.203,2.926762491444216,0.2600000000000051,98.169202284382,0.10171232876712329,98.27091461314912,1.0962122843819913,38.84799090057627,0.027279672556758516,3.8128822414328347,18.4280734167068
XS1873209172,UNANA 1 ⅜ 09/04/30,EUR,93.91119,UNILEVER FINANCE,"Consumer, Non-cyclical",2030-09-04,1.375,A+,7.01173e-07,650000000,N,,Sr Unsecured,1,FIXED,04/09/2019,04/09/2029,04/09/2018,93.768,94.055,4.9253935660506505,0.28700000000000614,95.85662450040239,0.10171232876712329,95.95833682916951,1.945434500402385,42.76083808938901,0.03159373264930832,0.9693738613861387,1.8793713662773457
XS1875284702,SSELN 1 ⅜ 09/04/27,EUR,97.939,SSE PLC,Utilities,2027-09-04,1.375,BBB+,3.05599e-05,650000000,Y,2027-06-04,Sr Unsecured,1,FIXED,04/09/2019,04/09/2026,04/09/2018,97.855,98.023,1.672826830937714,0.16799999999999216,99.09139193228448,0.4482876712328767,99.53967960351736,1.1523919322844876,70.13685819637551,0.02839755029166128,1.9067081606247418,5.52515847182372
BE0002596741,ELIASO 1 ½ 09/05/28,EUR,97.034,ELIA GROUP SA/NV,Utilities,2028-09-05,1.5,NR,0.000444498,300000000,Y,2028-06-05,Sr Unsecured,1,FIXED,05/09/2019,05/09/2027,05/09/2018,96.883,97.185,2.6776180698151952,0.3020000000000067,98.6815197202212,0.4849315068493151,99.16645122707052,1.6475197202211973,63.58859119334456,0.030940066420121554,3.771294637346138,18.11666954451933
XS1876069185,CPGLN 1 ½ 09/05/28,EUR,97.285,COMPASS GROUP FINANCE NV,"Consumer, Cyclical",2028-09-05,1.5,A,2.91485e-06,500000000,Y,2028-06-05,Sr Unsecured,1,FIXED,05/09/2019,05/09/2027,05/09/2018,97.173,97.396,2.6776180698151952,0.22299999999999898,98.6815197202212,0.4849315068493151,99.16645122707052,1.3965197202212067,53.83107153572296,0.03179051875539322,3.788451868343586,18.21746714849926
XS1874127902,SIEGR 1 ⅜ 09/06/30,EUR,94.938,SIEMENS FINANCIERINGSMAT,Industrial,2030-09-06,1.375,AA-,0.006816219,1000000000,N,,Sr Unsecured,1,FIXED,06/09/2019,06/09/2029,06/09/2018,94.74,95.136,4.930869267624915,0.3960000000000008,95.85074060484686,0.09417808219178081,95.94491868703864,0.91274060484686,19.93122744764807,0.03332013376489389,3.7756472627404216,18.117337518357157
XS1874128033,SIEGR 1 09/06/27,EUR,97.90676,SIEMENS FINANCIERINGSMAT,Industrial,2027-09-06,1.0,AA-,0.006816219,750000000,N,,Sr Unsecured,1,FIXED,06/09/2019,06/09/2026,06/09/2018,97.762,98.051,1.9301848049281314,0.2890000000000015,98.23044777347991,0.0684931506849315,98.29894092416484,0.32368777347990374,17.16532876871382,0.027813709696611653,1.9266574279303104,5.604859850426551
ES0224244097,MAPSM 4 ⅛ 09/07/48,EUR,102.465,MAPFRE SA,Financial,2048-09-07,4.125,NR,1.19515e-05,500000000,Y,2028-09-07,Subordinated,1,VARIABLE,07/09/2019,07/06/2048,07/09/2018,102.24,102.691,2.9349760438056127,0.4510000000000076,105.92595748807953,0.27123287671232876,106.19719036479187,3.4609574880795293,117.40931214853883,0.028390542696782622,1.9267234357111007,5.6030341067503215
FR0013359239,ORAFP 1 ⅞ 09/12/30,EUR,95.479,ORANGE SA,Communications,2030-09-12,1.875,BBB+,2.14239e-05,1200000000,Y,2030-06-12,Sr Unsecured,1,FIXED,12/09/2019,12/09/2029,12/09/2018,95.289,95.669,4.695414099931554,0.37999999999999545,98.31678314723523,0.5702054794520548,98.88698862668728,2.8377831472352284,64.51142193894287,0.027908759664148713,1.914109929639425,5.555689337446308
XS1877654126,INVSA 1 ½ 09/12/30,EUR,93.78543,INVESTOR AB,Financial,2030-09-12,1.5,AA-,4.82318e-08,500000000,Y,2030-06-12,Sr Unsecured,1,FIXED,12/09/2019,12/09/2029,12/09/2018,93.622,93.948,4.695414099931554,0.3259999999999934,96.65827380977666,0.4561643835616439,97.1144381933383,2.872843809776654,66.0291718635941,0.02921534197948828,2.7969635022227677,10.718294847014281
FR0013359254,VIEFP 1 ⅝ 09/17/30,EUR,93.70492,VEOLIA ENVIRONNEMENT SA,Utilities,2030-09-17,1.625,NR,0.000200524,500000000,Y,2030-06-17,Sr Unsecured,1,FIXED,17/09/2019,17/09/2029,17/09/2018,93.54,93.87,4.7091033538672145,0.3299999999999983,97.1992658650847,0.47191780821917806,97.67118367330387,3.4943458650846964,80.07924616691459,0.03264273884538133,1.9222220661964828,5.570280790373455
XS1882544973,INTNED 2 09/20/28,EUR,98.50012,ING GROEP NV,Financial,2028-09-20,2.0,A-,8.33832e-05,1500000000,N,,Sr Unsecured,1,FIXED,20/09/2019,20/09/2027,20/09/2018,98.395,98.605,2.97056810403833,0.21000000000000796,99.92140813523099,0.06027397260273973,99.98168210783373,1.421288135230995,49.1380542282554,0.032268648603179274,3.772886502328623,18.11165830173838
XS1881593971,SGOFP 1 ⅞ 09/21/28,EUR,98.151,CIE DE SAINT-GOBAIN SA,Industrial,2028-09-21,1.875,BBB+,0.000335785,700000000,N,,Sr Unsecured,1,FIXED,21/09/2019,21/09/2027,21/09/2018,98.034,98.268,2.973305954825462,0.23399999999999466,99.56357900433288,0.05136986301369863,99.61494886734658,1.4125790043328834,48.91147139933046,0.027404031314022987,1.9262815241195608,5.604876060129765
FR0013365640,CCAMA 3 ⅜ 09/24/28,EUR,101.1211,CAISSE NAT REASSURANCE,Financial,2028-09-24,3.375,NR,0.001619129,500000000,N,,Subordinated,1,FIXED,24/09/2019,24/09/2027,24/09/2018,100.93,101.312,2.9815195071868583,0.3819999999999908,103.86140968095059,0.06472602739726027,103.92613570834784,2.7403096809505882,92.53694752596518,0.029749795468354722,1.921848031312036,5.579192906443665
XS1881005117,PHNXLN 4 ⅜ 01/24/29,EUR,104.1175,PHOENIX GRP HLD PLC,Financial,2029-01-24,4.375,NR,0.000128482,500000000,N,,Subordinated,1,FIXED,24/01/2019,24/01/2028,24/09/2018,103.837,104.398,3.3155373032169746,0.5609999999999928,107.23832668310476,2.996575342465753,110.2349020255705,3.1208266831047524,93.1988874602966,0.02370514458128944,3.7799525419834774,18.25627353036882
XS1882681452,VGASDE 1 ½ 09/25/28,EUR,96.637,VIER GAS TRANSPORT GMBH,Utilities,2028-09-25,1.5,NR,0.006561922,500000000,Y,2028-06-25,Sr Unsecured,1,FIXED,25/09/2019,25/09/2027,25/09/2018,96.53,96.743,2.732375085557837,0.21299999999999386,98.64600924282344,0.40273972602739727,99.04874896885083,2.0090092428234385,76.19461515524364,0.025184476873094837,1.931646939946677,5.6338341929473135
FR0013367638,DGFP 1 ¾ 09/26/30,EUR,94.54,VINCI SA,Industrial,2030-09-26,1.75,A-,4.03887e-05,1185000000,Y,2030-06-26,Sr Unsecured,1,FIXED,26/09/2019,26/09/2029,26/09/2018,94.378,94.703,4.733744010951403,0.32500000000000284,97.73509703805105,0.46506849315068505,98.20016553120173,3.1950970380510455,72.49270009070406,0.02447087707331366,0.9761136430317847,1.9055956882255647
XS1886403200,BRITEL 2 ⅛ 09/26/28,EUR,98.818,BRITISH TELECOMMUNICATIO,Communications,2028-09-26,2.125,BBB,0.008914572,500000000,Y,2028-06-26,Sr Unsecured,1,FIXED,26/09/2019,26/09/2027,26/09/2018,98.691,98.944,2.735112936344969,0.2530000000000001,100.29081759921752,0.5647260273972603,100.85554362661478,1.472817599217521,55.00094712871663,0.02369186632912161,2.8071598005536247,10.808655554371644
FR0013368602,SOCGEN 2 ⅛ 09/27/28,EUR,98.373,SOCIETE GENERALE,Financial,2028-09-27,2.125,BBB,0.00033915,1250000000,N,,Sr Non Preferred,1,FIXED,27/09/2019,27/09/2027,27/09/2018,98.277,98.468,2.9897330595482545,0.1910000000000025,100.27757145116298,0.023287671232876714,100.30085912239586,1.9045714511629797,65.44480312487966,0.024286843723994745,2.8935854158118386,11.254158853002691
XS1888184121,SAMPFH 2 ¼ 09/27/30,EUR,99.54521,SAMPO OYJ,Financial,2030-09-27,2.25,A,1.08227e-09,404858000,Y,2030-06-27,Sr Unsecured,1,FIXED,27/09/2019,27/09/2029,28/09/2018,99.229,99.862,4.736481861738535,0.6329999999999956,99.96274820353464,0.5917808219178081,100.55452902545245,0.4175382035346473,9.199404769142967,0.03363251667341741,11.136047370506226,144.70946438988125
XS1843459436,APH 2 10/08/28,EUR,99.001,AMPHENOL TECH HLDS GMBH,Industrial,2028-10-08,2.0,A-,4.78776e-06,500000000,Y,2028-07-08,Sr Unsecured,1,FIXED,08/10/2019,08/10/2027,08/10/2018,98.843,99.159,2.7679671457905544,0.3160000000000025,99.95574629508836,0.4657534246575342,100.4214997197459,0.9547462950883556,35.23634085986358,0.03424734305423948,0.9668866995073891,1.8697397793685848
XS1893631769,VW 2 ¼ 10/16/26,EUR,99.80762,VOLKSWAGEN FINANCIAL SER,"Consumer, Non-cyclical",2026-10-16,2.25,BBB+,0.003521565,750000000,N,,Sr Unsecured,1,FIXED,16/10/2019,16/10/2025,16/10/2018,99.728,99.887,1.0403832991101984,0.15900000000000603,100.33556524113865,2.1575342465753424,102.49309948771399,0.5279452411386529,50.675223656200274,0.022378256095819993,1.9381581544431676,5.669535170145686
XS2076099865,NFLX 4 ⅝ 05/15/29,EUR,106.459,NETFLIX INC,Communications,2029-05-15,4.625,A-,6.46298e-07,1100000000,N,,Sr Unsecured,2,FIXED,15/05/2019,15/11/2028,26/10/2018,106.334,106.583,3.619438740588638,0.24899999999999523,108.67098845478053,1.7469429347826086,110.41793138956314,2.211988454780524,60.71310862406226,0.03239192754427516,3.739254293869647,17.893633898088343
XS1900752814,PG 1.2 10/30/28,EUR,96.486,PROCTER & GAMBLE CO/THE,"Consumer, Non-cyclical",2028-10-30,1.2,AA-,1.47446e-07,800000000,N,,Sr Unsecured,1,FIXED,30/10/2019,30/10/2027,30/10/2018,96.382,96.589,3.080082135523614,0.20699999999999363,97.49674301075285,1.1046575342465752,98.60140054499942,1.0107430107528472,34.23357738334138,0.028103450531350174,1.9249575049576937,5.597199862533022
XS1900752905,PG 1 ⅞ 10/30/38,EUR,84.534,PROCTER & GAMBLE CO/THE,"Consumer, Non-cyclical",2038-10-30,1.875,AA-,1.47446e-07,500000000,N,,Sr Unsecured,1,FIXED,30/10/2019,30/10/2037,30/10/2018,84.207,84.86,13.078713210130047,0.6530000000000058,90.90395748383983,1.726027397260274,92.6299848811001,6.369957483839826,62.684618215798935,0.02689649305672175,0.9738079804161567,1.8966039654443874
XS1907122656,CCEP 1 ½ 11/08/27,EUR,98.139,COCA-COLA EUROPACIFIC,"Consumer, Non-cyclical",2027-11-08,1.5,BBB+,5.8577e-06,650000000,Y,2027-08-08,Sr Unsecured,1,FIXED,08/11/2019,08/11/2026,08/11/2018,98.05,98.229,1.8507871321013005,0.17900000000000205,99.20772676572429,0.2219178082191781,99.42964457394346,1.0687267657242927,58.82286556984034,0.03001583122291119,4.620039142701572,26.464243873538592
XS1908273219,AVLN 1 ⅞ 11/13/27,EUR,99.298,AVIVA PLC,Financial,2027-11-13,1.875,A,7.58893e-07,464002000,N,,Sr Unsecured,1,FIXED,13/11/2019,13/11/2026,13/11/2018,99.114,99.482,2.116358658453114,0.367999999999995,99.82771729449829,1.654109589041096,101.48182688353938,0.5297172944982833,25.37156374257659,0.026713117395603975,1.923039801793093,5.5947423831380245
XS1904690341,PRIFII 2 ⅜ 11/14/30,EUR,96.806,PROLOGIS INTL FUND II,Financial,2030-11-14,2.375,A-,0.002987741,300000000,Y,2030-08-14,Sr Unsecured,1,FIXED,14/11/2019,14/11/2029,14/11/2018,96.625,96.986,4.867898699520876,0.3610000000000042,100.49547896279954,0.31232876712328766,100.80780772992283,3.689478962799541,80.33109545149819,0.03351674389457511,4.541932588323521,25.804532597241746
XS1907150780,TELBSS 2 ⅛ 05/15/28,EUR,98.685,TELE2 AB,Communications,2028-05-15,2.125,NR,2.20048e-06,500000000,Y,2028-02-15,Sr Unsecured,1,FIXED,15/05/2019,15/05/2027,15/11/2018,98.568,98.802,2.3737166324435317,0.23400000000000887,100.32043595937924,1.3273972602739725,101.64783321965321,1.6354359593792367,70.12207492073513,0.04222571946676,9.884905047454698,122.0393687177332
XS1908370171,IHGLN 2 ⅛ 05/15/27,EUR,99.45014,INTERCONTINENTAL HOTELS,"Consumer, Cyclical",2027-05-15,2.125,NR,8.0374e-06,500000000,Y,2027-02-14,Sr Unsecured,1,FIXED,15/05/2019,15/05/2026,15/11/2018,99.354,99.546,1.3716632443531827,0.19200000000000728,100.26983369555145,1.3332191780821918,101.60305287363364,0.8196936955514502,59.92350999594275,,,
XS1909186451,INTNED 2 ½ 11/15/30,EUR,97.703,ING GROEP NV,Financial,2030-11-15,2.5,A-,8.33832e-05,1500000000,N,,Sr Unsecured,1,FIXED,15/11/2019,15/11/2029,15/11/2018,97.528,97.877,5.122518822724161,0.34899999999998954,101.02989216937911,2.191780821917808,103.22167299129691,3.326892169379107,68.69957748851144,0.03095944928194376,3.7133016216378674,17.742382734308343
XS1910948162,VW 2 ⅝ 11/16/27,EUR,99.91096,VOLKSWAGEN INTL FIN NV,"Consumer, Cyclical",2027-11-16,2.625,BBB+,0.042120067,750000000,N,,Sr Unsecured,1,FIXED,16/11/2019,16/11/2026,16/11/2018,99.832,99.989,2.1245722108145104,0.1570000000000107,101.37154108391718,2.2941780821917805,103.66571916610896,1.4605810839171767,69.2069044190665,0.03199003192711958,2.8165317886697925,10.800614183083697
XS1910948329,VW 3 ¼ 11/18/30,EUR,99.539,VOLKSWAGEN INTL FIN NV,"Consumer, Cyclical",2030-11-18,3.25,BBB+,0.042120067,1000000000,N,,Sr Unsecured,1,FIXED,18/11/2019,18/11/2029,16/11/2018,99.296,99.783,5.130732375085558,0.48699999999999477,104.63455799267166,2.8226027397260274,107.45716073239768,5.095557992671658,103.67627067541392,0.02947705494847877,3.797413021653658,18.30222284752056
XS1910948675,VW 4 ⅛ 11/16/38,EUR,99.039,VOLKSWAGEN INTL FIN NV,"Consumer, Cyclical",2038-11-16,4.125,BBB+,0.042120067,1250000000,N,,Sr Unsecured,1,FIXED,16/11/2019,16/11/2037,16/11/2018,98.579,99.5,13.125256673511293,0.9210000000000065,115.76232547180555,3.60513698630137,119.36746245810693,16.723325471805552,149.040971813808,0.02801433431982444,0.9727490820073439,1.8924815530922605
XS1843449122,TACHEM 2 ¼ 11/21/26,EUR,99.92841,TAKEDA PHARMACEUTICAL,"Consumer, Non-cyclical",2026-11-21,2.25,BBB+,3.17812e-05,1500000000,Y,2026-08-21,Sr Unsecured,1,FIXED,21/11/2019,21/11/2025,21/11/2018,99.885,99.971,0.8870636550308009,0.08599999999999852,100.28002766601996,0.25273972602739725,100.53276739204736,0.3516176660199619,39.47039697386165,0.030139545468777135,3.7352897845882875,17.893435915211057
XS1843449395,TACHEM 3 11/21/30,EUR,99.64418,TAKEDA PHARMACEUTICAL,"Consumer, Non-cyclical",2030-11-21,3.0,BBB+,3.17812e-05,1500000000,Y,2030-08-21,Sr Unsecured,1,FIXED,21/11/2019,21/11/2029,21/11/2018,99.494,99.795,4.887063655030801,0.30100000000000193,103.36330117256001,0.336986301369863,103.70028747392988,3.7191211725600084,79.25099709928023,0.029922691953162904,2.8458025858695755,10.966128115224638
XS1843448314,MUNRE 3 ¼ 05/26/49,EUR,100.1437,MUNICH RE,Financial,2049-05-26,3.25,NR,1.20016e-07,1250000000,Y,2029-05-26,Subordinated,1,VARIABLE,26/05/2019,26/02/2049,22/11/2018,99.954,100.334,3.649555099247091,0.38000000000000966,103.82874162118138,1.1397260273972603,104.96846764857864,3.6850416211813837,103.0263773943539,0.029398574757104497,3.7738279640525394,18.15076261437394
FR0013382348,ARRFP 1 ½ 01/25/30,EUR,94.612,APRR SA,"Consumer, Non-cyclical",2030-01-25,1.5,A-,0.011186382,500000000,Y,2029-10-25,Sr Unsecured,1,FIXED,25/01/2019,25/01/2029,26/11/2018,94.484,94.74,4.0657084188911705,0.2560000000000002,97.28631855463273,1.4013698630136986,98.68768841764643,2.674318554632734,70.11999754096207,0.02958517479695485,1.9267987390342747,5.599017142314298
XS1914502304,SYK 2 ⅛ 11/30/27,EUR,99.342,STRYKER CORP,"Consumer, Non-cyclical",2027-11-30,2.125,BBB+,6.05078e-07,750000000,Y,2027-08-31,Sr Unsecured,1,FIXED,30/11/2019,30/11/2026,30/11/2018,99.234,99.451,1.9137577002053388,0.21699999999999875,100.34064186828972,0.18047945205479451,100.52112132034452,0.9986418682897238,52.70885552748097,0.03450929843392061,0.9666418673218674,1.8687929993190133
XS1914502643,SYK 2 ⅝ 11/30/30,EUR,98.5547,STRYKER CORP,"Consumer, Non-cyclical",2030-11-30,2.625,BBB+,6.05078e-07,650000000,Y,2030-08-30,Sr Unsecured,1,FIXED,30/11/2019,30/11/2029,30/11/2018,98.378,98.732,4.91170431211499,0.3539999999999992,101.64155157667722,0.23013698630136986,101.87168856297859,3.086851576677219,65.96545347689613,0.025420589672496125,1.9382278514331017,5.658646091361567
XS1907120791,T 2.35 09/05/29,EUR,98.183,AT&T INC,Communications,2029-09-05,2.35,BBB,0.000147481,1245556000,Y,2029-06-04,Sr Unsecured,1,FIXED,04/09/2019,04/09/2028,03/12/2018,98.027,98.338,3.67419575633128,0.31099999999999284,100.68877779867276,0.7661643835616438,101.4549421822344,2.505777798672753,70.6436395223394,0.028756492038556083,4.701820819497964,27.11870693404579
FR0013385473,VIEFP 1.94 01/07/30,EUR,96.27808,VEOLIA ENVIRONNEMENT SA,Utilities,2030-01-07,1.94,BBB,0.000200524,750000000,Y,2029-10-07,Sr Unsecured,1,FIXED,07/01/2020,07/01/2029,05/12/2018,96.129,96.427,4.016427104722792,0.2980000000000018,99.01559822404845,1.9081095890410957,100.92370781308954,2.7375182240484435,71.82611462851412,0.02644051774803913,3.809234133629505,18.414336558268104
XS1917358621,DHLGR 1 ⅝ 12/05/28,EUR,97.44682,DEUTSCHE POST AG,Industrial,2028-12-05,1.625,A-,0.000114015,750000000,Y,2028-09-05,Sr Unsecured,1,FIXED,05/12/2019,05/12/2027,05/12/2018,97.316,97.578,2.9295003422313486,0.26200000000000045,98.87156634012618,0.11575342465753424,98.98731976478372,1.4247463401261768,50.284663611114766,0.026741792524102904,2.864339069253166,11.084570784343263
XS1918000107,LSELN 1 ¾ 12/06/27,EUR,98.35581,LONDON STOCK EXCHANGE PL,Financial,2027-12-06,1.75,A-,3.28737e-06,500000000,Y,2027-09-06,Sr Unsecured,1,FIXED,06/12/2019,06/12/2026,06/12/2018,98.268,98.444,1.9301848049281314,0.17600000000000193,99.63853056561578,0.11986301369863014,99.75839357931441,1.2827205656157759,67.6081337088387,0.024760925145926163,1.9371168708561042,5.656726962390568
DE000A2TSTF5,SAPGR 1 ¼ 03/10/28,EUR,97.51118,SAP SE,Technology,2028-03-10,1.25,A+,3.31915e-07,1000000000,Y,2027-12-10,Sr Unsecured,1,FIXED,10/03/2019,10/03/2027,10/12/2018,97.407,97.615,2.190280629705681,0.2079999999999984,98.47658243895096,1.0102739726027397,99.4868564115537,0.9654024389509601,45.263409196498614,0.029580326303366166,2.8561860109216064,11.022243819519467
DE000A2TSTG3,SAPGR 1 ⅝ 03/10/31,EUR,94.252,SAP SE,Technology,2031-03-10,1.625,A+,3.31915e-07,1250000000,Y,2030-12-10,Sr Unsecured,1,FIXED,10/03/2019,10/03/2030,10/12/2018,94.048,94.455,5.190965092402464,0.4069999999999965,96.7607113311543,1.3133561643835616,98.07406749553786,2.508711331154302,52.337272920726484,0.02580302754462378,1.9375007568169085,5.654410085558144
DE000A2RWAY2,ALVGR 1 ½ 01/15/30,EUR,95.711,ALLIANZ FINANCE II B.V.,Financial,2030-01-15,1.5,AA,4.75964e-06,750000000,Y,2029-10-15,Sr Unsecured,1,FIXED,15/01/2020,15/01/2029,15/01/2019,95.52,95.903,4.03832991101985,0.3830000000000098,97.31420057673611,1.4424657534246577,98.75666633016077,1.6032005767361142,42.06180200337316,0.027250012204869743,2.873150608707388,11.12665806033843
FR0013396520,ORAFP 2 01/15/29,EUR,98.081,ORANGE SA,Communications,2029-01-15,2.0,BBB+,2.14239e-05,1250000000,Y,2028-10-15,Sr Unsecured,1,FIXED,15/01/2020,15/01/2028,15/01/2019,97.959,98.202,3.0390143737166326,0.242999999999995,99.89140490201046,1.9232876712328768,101.81469257324333,1.8104049020104611,61.362184377170756,0.024715143673666624,2.847092369328148,11.009307407493168
FR0013396876,SUFP 1 ½ 01/15/28,EUR,98.118,SCHNEIDER ELECTRIC SE,Industrial,2028-01-15,1.5,NR,4.03484e-05,750000000,Y,2027-10-15,Sr Unsecured,1,FIXED,15/01/2020,15/01/2027,15/01/2019,98.023,98.214,2.0369609856262834,0.1910000000000025,99.11119953024011,1.4424657534246577,100.55366528366477,0.9931995302401191,49.787956652969584,0.028184608907936934,2.811977227152394,10.803031069233926
XS1916073254,EMR 2 10/15/29,EUR,97.28791,EMERSON ELECTRIC CO,Industrial,2029-10-15,2.0,A,7.40674e-05,500000000,Y,2029-07-15,Sr Unsecured,1,FIXED,15/10/2019,15/10/2028,15/01/2019,97.146,97.429,3.786447638603696,0.28300000000000125,99.39018804411252,0.4273972602739726,99.8175853043865,2.1022780441125235,57.98007684729709,0.026345399438424344,0.9743308641975308,1.8986412658558143
FR0013397288,ARRFP 1 ¼ 01/18/28,EUR,97.43894,APRR SA,"Consumer, Non-cyclical",2028-01-18,1.25,A-,0.011186382,500000000,Y,2027-10-18,Sr Unsecured,1,FIXED,18/01/2020,18/01/2027,18/01/2019,97.357,97.521,2.0451745379876796,0.16400000000000148,98.60881792801146,1.191780821917808,99.80059874992926,1.1698779280114593,58.690230928431916,0.030840672851033465,4.680204503045721,26.915835574270766
FR0013397452,DGFP 1 ⅝ 01/18/29,EUR,96.872,VINCI SA,Industrial,2029-01-18,1.625,A-,4.03887e-05,1500000000,Y,2028-10-18,Sr Unsecured,1,FIXED,18/01/2020,18/01/2028,18/01/2019,96.766,96.977,3.047227926078029,0.21099999999999852,98.78786546613202,1.5493150684931507,100.33718053462518,1.9158654661320185,65.29443002044164,0.029022912155067037,2.8715469061506442,11.105692049507205
XS1936208419,FREGR 2 ⅞ 02/15/29,EUR,101.153,FRESENIUS SE & CO KGAA,"Consumer, Non-cyclical",2029-02-15,2.875,BBB-,2.02554e-05,500000000,Y,2028-11-15,Sr Unsecured,1,FIXED,15/02/2020,15/02/2028,21/01/2019,100.944,101.362,3.1238877481177276,0.41799999999999216,102.4555279333386,2.5205479452054793,104.97607587854408,1.3025279333385953,42.13515715510077,0.03414141287251165,7.163916283745026,60.74213368680529
XS1941841311,ASSGEN 3 ⅞ 01/29/29,EUR,102.999,GENERALI,Financial,2029-01-29,3.875,BBB+,6.64834e-07,500000000,N,,Subordinated,1,FIXED,29/01/2020,29/01/2028,29/01/2019,102.758,103.24,3.3292265571526354,0.4819999999999993,105.66587949979188,2.601027397260274,108.26690689705215,2.6668794997918894,79.97135326132319,0.031774417704938676,4.70956899936217,27.126800289604457
XS1945110606,IBM 1 ¼ 01/29/27,EUR,98.651,IBM CORP,Technology,2027-01-29,1.25,A-,1.97547e-05,1000000000,N,,Sr Unsecured,1,FIXED,29/01/2020,29/01/2026,31/01/2019,98.562,98.741,1.3278576317590691,0.17900000000000205,99.12615637687084,0.839041095890411,99.96519747276125,0.4751563768708422,36.19598025904186,0.030786934879211057,4.658498197343545,26.748915760759413
XS1945110861,IBM 1 ¾ 01/31/31,EUR,93.905,IBM CORP,Technology,2031-01-31,1.75,A-,1.97547e-05,1250000000,N,,Sr Unsecured,1,FIXED,31/01/2020,31/01/2030,31/01/2019,93.724,94.086,5.333333333333333,0.36199999999999477,97.24395750998755,1.1650684931506852,98.40902600313824,3.3389575099875515,68.00567788747537,0.028620080700846734,0.9721762376237624,1.8902532740005877
XS1948611840,BMW 1 ½ 02/06/29,EUR,96.026,BMW FINANCE NV,"Consumer, Cyclical",2029-02-06,1.5,A,0.04472225,1500000000,N,,Sr Unsecured,1,FIXED,06/02/2020,06/02/2028,06/02/2019,95.876,96.175,3.351129363449692,0.2989999999999924,98.07430104025097,0.973972602739726,99.0482736429907,2.0483010402509763,64.0304104074661,0.03891572979100788,7.207432469065521,61.06706317877131
XS1953240261,TELIAS 2 ⅛ 02/20/34,EUR,91.10666,TELIA COMPANY AB,Communications,2034-02-20,2.125,BBB+,1.15493e-05,500000000,Y,2033-11-20,Sr Unsecured,1,FIXED,20/02/2020,20/02/2033,20/02/2019,90.84,91.374,8.136892539356605,0.5339999999999918,97.30247625822335,1.8339041095890412,99.1363803678124,6.195816258223346,87.2925451540588,0.024979396715935052,1.942419821528851,5.676621960177466
FR0013404571,DGFP 1 ⅜ 02/21/31,EUR,91.787,AUTOROUTES DU SUD DE LA,"Consumer, Non-cyclical",2031-02-21,1.375,A-,4.03887e-05,1000000000,Y,2030-11-21,Sr Unsecured,1,FIXED,21/02/2020,21/02/2030,21/02/2019,91.632,91.942,5.138945927446954,0.30999999999998806,95.60820388684601,1.1828767123287671,96.79108059917478,3.821203886846007,81.66235146488197,0.026317276348951753,4.748218165640351,27.521074634445718
DE000A2TR083,MBGGR 2 02/27/31,EUR,95.07098,MERCEDES-BENZ GROUP AG,"Consumer, Cyclical",2031-02-27,2.0,A,0.001270443,750000000,N,,Sr Unsecured,1,FIXED,27/02/2020,27/02/2030,27/02/2019,94.855,95.287,5.4072553045859,0.43200000000000216,98.44224484565302,1.1835616438356165,99.62580648948864,3.371264845653016,67.28064725889156,0.035558596572120425,11.171886893543606,145.1960251252255
FR0013405032,URWFP 1 02/27/27,EUR,98.1898,UNIBAIL-RODAMCO-WESTFLD,Financial,2027-02-27,1.0,BBB,0.008889247,750000000,Y,2026-11-27,Sr Unsecured,1,FIXED,27/02/2020,27/02/2026,27/02/2019,98.113,98.266,1.1553730321697468,0.1530000000000058,98.95617930336918,0.8438356164383561,99.80001491980754,0.7663793033691775,67.25859221554356,0.03077357028228576,2.859609743106536,11.03153224092407
FR0013405040,URWFP 1 ¾ 02/27/34,EUR,85.51656,UNIBAIL-RODAMCO-WESTFLD,Financial,2034-02-27,1.75,BBB,0.008889247,750000000,Y,2033-11-27,Sr Unsecured,1,FIXED,27/02/2020,27/02/2033,27/02/2019,85.268,85.766,8.15605749486653,0.49800000000000466,94.52944537791784,1.4767123287671233,96.00615770668496,9.01288537791784,131.1434827612674,0.032567736273457486,7.357494436517008,63.03102914551679
XS1955187775,SIEGR 0.9 02/28/28,EUR,96.92,SIEMENS FINANCIERINGSMAT,Industrial,2028-02-28,0.9,AA-,0.006816219,650000000,N,,Sr Unsecured,1,FIXED,28/02/2020,28/02/2027,28/02/2019,96.745,97.095,2.409308692676249,0.3499999999999943,97.46333335773879,0.53013698630137,97.99347034404016,0.5433333577387884,23.32472606253269,0.02833705415932198,0.972443807169345,1.8912939162040208
XS1955187858,SIEGR 1 ¼ 02/28/31,EUR,93.605,SIEMENS FINANCIERINGSMAT,Industrial,2031-02-28,1.25,AA-,0.006816219,800000000,N,,Sr Unsecured,1,FIXED,28/02/2020,28/02/2030,28/02/2019,93.394,93.816,5.409993155373032,0.42199999999999704,94.65179679739707,0.7363013698630138,95.38809816726008,1.0467967973970644,21.126894683165872,0.030832721096196846,4.691434684643039,27.002796927134494
XS1955187932,SIEGR 1 ¾ 02/28/39,EUR,81.46,SIEMENS FINANCIERINGSMAT,Industrial,2039-02-28,1.75,AA-,0.006816219,800000000,N,,Sr Unsecured,1,FIXED,28/02/2020,28/02/2038,28/02/2019,81.117,81.804,13.409993155373032,0.6869999999999976,89.15959461234597,1.0308219178082194,90.1904165301542,7.699594612345976,75.79527480026269,0.0383507056679372,10.821960789678036,138.79016899084135
XS1958307461,ACAFP 1 ¾ 03/05/29,EUR,96.251,CREDIT AGRICOLE LONDON,Financial,2029-03-05,1.75,A-,0.000125365,1500000000,N,,Sr Non Preferred,1,FIXED,05/03/2020,05/03/2028,05/03/2019,96.152,96.35,3.4250513347022586,0.1979999999999933,98.80912397852761,1.0068493150684932,99.8159732935961,2.558123978527604,78.12067849085074,0.030265696188149865,4.728642512361419,27.300320617089177
XS1958648294,CL 1 ⅜ 03/06/34,EUR,86.93245,COLGATE-PALMOLIVE CO,"Consumer, Non-cyclical",2034-03-06,1.375,A+,1.17308e-06,500000000,Y,2033-12-06,Sr Unsecured,1,FIXED,06/03/2020,06/03/2033,06/03/2019,86.744,87.121,8.180698151950718,0.37699999999999534,91.73738121066984,1.1263698630136987,92.86375107368353,4.804931210669835,69.25760026034737,0.03402829900033866,4.529637832664799,25.701730462637006
XS1960678255,MDT 1 ⅛ 03/07/27,EUR,98.33838,MEDTRONIC GLOBAL HLDINGS,"Consumer, Non-cyclical",2027-03-07,1.125,A-,1.28812e-06,1500000000,Y,2026-12-07,Sr Unsecured,1,FIXED,07/03/2020,07/03/2026,07/03/2019,98.272,98.405,1.1827515400410678,0.13299999999999557,99.07631552239782,0.9184931506849314,99.99480867308276,0.7379355223978195,63.18349143186029,0.028710001261138953,2.8644665908100255,11.071258590282122
XS1960678412,MDT 1 ⅝ 03/07/31,EUR,93.33739,MEDTRONIC GLOBAL HLDINGS,"Consumer, Non-cyclical",2031-03-07,1.625,A-,1.28812e-06,1000000000,Y,2030-12-07,Sr Unsecured,1,FIXED,07/03/2020,07/03/2030,07/03/2019,93.163,93.512,5.1827515400410675,0.34900000000000375,96.7688241512941,1.3267123287671232,98.09553648006123,3.4314341512940985,72.04922607744828,0.03836355884194117,7.182480683320121,60.80171832486774
XS1960678685,MDT 2 ¼ 03/07/39,EUR,84.00882,MEDTRONIC GLOBAL HLDINGS,"Consumer, Non-cyclical",2039-03-07,2.25,A-,1.28812e-06,1000000000,Y,2038-12-07,Sr Unsecured,1,FIXED,07/03/2020,07/03/2038,07/03/2019,83.692,84.325,13.182751540041068,0.6330000000000098,94.96285300775997,1.8369863013698629,96.79983930912984,10.954033007759975,107.33592062813962,0.03020128502347647,2.861244037711614,11.044022424065034
XS1955024986,KO 1 ¼ 03/08/31,EUR,91.87,COCA-COLA CO/THE,"Consumer, Non-cyclical",2031-03-08,1.25,A+,6.77015e-08,750000000,N,,Sr Unsecured,1,FIXED,08/03/2020,08/03/2030,08/03/2019,91.731,92.008,5.431895961670089,0.277000000000001,94.6233120987042,0.7089041095890412,95.33221620829325,2.7533120987041997,55.88751272911717,0.03158147822680404,4.665425912498737,26.789104093573798
FR0013407418,CMARK 3 ⅜ 03/11/31,EUR,99.874,CREDIT MUTUEL ARKEA,Financial,2031-03-11,3.375,BBB+,1.22381e-05,750000000,N,,Subordinated,1,FIXED,11/03/2020,11/03/2030,11/03/2019,99.619,100.13,5.4401095140314855,0.5109999999999957,105.4028317304597,1.8863013698630138,107.28913310032272,5.5288317304597,106.23156613789055,0.03216102764599062,4.687069370678611,26.94644505772831
XS1961772560,TELEFO 1.788 03/12/29,EUR,96.929,TELEFONICA EMISIONES SAU,Communications,2029-03-12,1.788,BBB-,0.021357445,1000000000,Y,2028-12-12,Sr Unsecured,1,FIXED,12/03/2020,12/03/2028,12/03/2019,96.782,97.076,3.1978097193702943,0.29399999999999693,99.13171565635122,1.4352986301369863,100.5670142864882,2.2027156563512165,71.57655398261197,0.03084176236186472,0.9700809925558312,1.8821142642362139
XS1960589155,HTHROW 1 ⅞ 03/14/34,EUR,86.705,HEATHROW FUNDING LTD,Industrial,2034-03-14,1.875,BBB+,0.024398591,650000000,N,,1st lien,1,FIXED,14/03/2020,14/03/2033,14/03/2019,86.486,86.925,8.449007529089664,0.43899999999999295,95.15914789428685,1.0325342465753424,96.19168214086218,8.454147894286848,118.3552910973942,0.029969731821336575,4.741844563770862,27.407631118661634
FR0013408960,BFCM 1 ¾ 03/15/29,EUR,96.40869,BANQUE FED CRED MUTUEL,Financial,2029-03-15,1.75,A-,1.08678e-05,1000000000,N,,Sr Non Preferred,1,FIXED,15/03/2020,15/03/2028,15/03/2019,96.263,96.555,3.4524298425735798,0.2920000000000016,98.78456350376295,0.9589041095890412,99.743467613352,2.3758735037629464,71.94655444485079,0.028658878918868657,2.890370721612645,11.205770204849156
XS1962571011,SGOFP 1 ⅞ 03/15/31,EUR,94.15,CIE DE SAINT-GOBAIN SA,Industrial,2031-03-15,1.875,BBB+,0.000335785,1044000000,N,,Sr Unsecured,1,FIXED,15/03/2020,15/03/2030,15/03/2019,93.959,94.341,5.451060917180014,0.3819999999999908,97.77801383141883,1.0273972602739725,98.8054110916928,3.6280138314188264,72.26681136703746,0.03325915538516488,7.383308949056094,63.30154425077533
XS1963745234,MCD 1.6 03/15/31,EUR,92.64417,MCDONALD'S CORP,"Consumer, Cyclical",2031-03-15,1.6,BBB+,4.53177e-07,500000000,Y,2030-12-15,Sr Unsecured,1,FIXED,15/03/2020,15/03/2030,15/03/2019,92.495,92.793,5.204654346338125,0.2980000000000018,96.62537538179669,1.2712328767123289,97.89660825850902,3.981205381796684,83.58919805021759,0.03533130233012106,3.7195793598546505,17.734213566329398
XS1963553919,PEP 0 ¾ 03/18/27,EUR,97.73566,PEPSICO INC,"Consumer, Non-cyclical",2027-03-18,0.75,A+,2.5576e-06,500000000,Y,2026-12-18,Sr Unsecured,1,FIXED,18/03/2020,18/03/2026,18/03/2019,97.677,97.795,1.212867898699521,0.117999999999995,98.60791821675453,0.5897260273972602,99.19764424415179,0.8722582167545312,73.22539148501785,0.02941068883083191,3.771702241379466,18.136889469722735
XS1963555617,PEP 1 ⅛ 03/18/31,EUR,91.42617,PEPSICO INC,"Consumer, Non-cyclical",2031-03-18,1.125,A+,2.5576e-06,500000000,Y,2030-12-18,Sr Unsecured,1,FIXED,18/03/2020,18/03/2030,18/03/2019,91.235,91.617,5.212867898699521,0.382000000000005,94.29902926355025,0.8845890410958904,95.18361830464615,2.8728592635502537,60.7767873152319,0.03118808501856468,2.8584271208080034,11.022498424500654
FR0013409844,SANFP 0 ⅞ 03/21/29,EUR,94.354,SANOFI SA,"Consumer, Non-cyclical",2029-03-21,0.875,AA-,2.18798e-05,650000000,Y,2028-12-21,Sr Unsecured,1,FIXED,21/03/2020,21/03/2028,21/03/2019,94.218,94.489,3.2224503764544834,0.2710000000000008,96.29062202610008,0.6808219178082193,96.9714439439083,1.936622026100082,63.61832141012803,0.02706624207443975,4.699183051944899,27.12723982643967
FR0013409851,SANFP 1 ¼ 03/21/34,EUR,85.626,SANOFI SA,"Consumer, Non-cyclical",2034-03-21,1.25,AA-,2.18798e-05,500000000,Y,2033-12-21,Sr Unsecured,1,FIXED,21/03/2020,21/03/2033,21/03/2019,85.291,85.96,8.2217659137577,0.6689999999999969,90.75439357727451,0.9726027397260274,91.72699631700054,5.128393577274508,74.20747221741175,0.0312878330321118,2.8513029612789977,10.9849995646674
XS1963116964,SRENVX 2.534 04/30/50,EUR,96.333,SWISS RE FINANCE LUX,Financial,2050-04-30,2.534,A,0.001784866,538500000,Y,2030-04-30,Subordinated,1,VARIABLE,30/04/2019,30/04/2049,21/03/2019,96.109,96.557,4.577686516084873,0.4480000000000075,101.23803574898812,1.0691397260273972,102.30717547501553,4.905035748988126,113.29124837504891,0.02850500353785488,0.9722850122850124,1.8906762902281335
XS1963837197,MMC 1.979 03/21/30,EUR,96.41885,MARSH & MCLENNAN COS INC,Financial,2030-03-21,1.979,A-,2.45897e-07,550000000,Y,2029-12-21,Sr Unsecured,1,FIXED,21/03/2020,21/03/2029,21/03/2019,96.171,96.667,4.2217659137577,0.4959999999999951,99.0440262438518,1.5398246575342467,100.58385090138604,2.625176243851797,65.61345870677461,0.028265422681001424,2.877217868246361,11.140474108827503
FR0013410818,SOCGEN 1 ¾ 03/22/29,EUR,96.137,SOCIETE GENERALE,Financial,2029-03-22,1.75,BBB,0.00033915,1250000000,N,,Sr Non Preferred,1,FIXED,22/03/2020,22/03/2028,22/03/2019,96.024,96.251,3.4715947980835042,0.22700000000000387,98.76740261932791,0.9253424657534248,99.69274508508134,2.63040261932791,79.34749458953146,0.028429353558692017,0.9723565323565325,1.8909544520328412
DE000A2TSDE2,DT 1 ¾ 03/25/31,EUR,95.582,DEUTSCHE TELEKOM AG,Communications,2031-03-25,1.75,BBB+,0.000125821,1000000000,N,,Sr Unsecured,1,FIXED,25/03/2020,25/03/2030,25/03/2019,95.306,95.858,5.478439425051334,0.5520000000000067,97.11858884374648,0.9109589041095891,98.02954774785607,1.536588843746486,30.251330851860676,0.032360959725804044,4.56750490282558,26.020164784850536
XS1968706108,ACAFP 2 03/25/29,EUR,96.815,CREDIT AGRICOLE SA,Financial,2029-03-25,2.0,BBB+,0.000125365,1250000000,N,,Subordinated,1,FIXED,25/03/2020,25/03/2028,25/03/2019,96.609,97.02,3.479808350444901,0.41100000000000136,99.59107421329318,1.0410958904109588,100.63217010370414,2.7760742132931853,83.14820652768087,0.031032009803171022,2.867212469867242,11.068986083000832
XS1969600748,CNHI 1 ¾ 03/25/27,EUR,98.93,CNH INDUSTRIAL FIN EUR S,Industrial,2027-03-25,1.75,BBB,0.05446984,600000000,Y,2026-12-25,Sr Unsecured,1,FIXED,25/03/2020,25/03/2026,25/03/2019,98.857,99.003,1.2320328542094456,0.1460000000000008,99.7913040806891,1.3424657534246576,101.13376983411376,0.861304080689095,70.36043639250545,0.03656932536483961,10.860548258167132,139.59929011907846
XS1966038249,TLSAU 1 ⅜ 03/26/29,EUR,95.88042,TELSTRA GROUP LTD,Communications,2029-03-26,1.375,A-,1.00035e-08,600000000,Y,2028-12-26,Sr Unsecured,1,FIXED,26/03/2020,26/03/2028,26/03/2019,95.766,95.995,3.2361396303901437,0.2289999999999992,97.81747283960276,1.051027397260274,98.86850023686303,1.9370528396027566,62.70249589898407,0.030258170256088582,2.8610815081392116,11.042779964584652
XS1967635977,ABESM 2 ⅜ 09/27/27,EUR,99.545,ABERTIS INFRAESTRUCTURAS,"Consumer, Non-cyclical",2027-09-27,2.375,BBB-,0.016819763,1000000000,Y,2027-06-27,Sr Unsecured,1,FIXED,27/09/2020,27/09/2026,27/03/2019,99.439,99.651,1.7357973990417521,0.2120000000000033,100.74299283848325,0.6246575342465753,101.36765037272983,1.1979928384832448,69.37004063423261,0.02864098669054249,0.9721564792176041,1.8901764401695358
XS1967636199,ABESM 3 03/27/31,EUR,98.926,ABERTIS INFRAESTRUCTURAS,"Consumer, Non-cyclical",2031-03-27,3.0,BBB-,0.016819763,1000000000,Y,2030-12-27,Sr Unsecured,1,FIXED,27/03/2020,27/03/2030,27/03/2019,98.743,99.109,5.23750855578371,0.36599999999999966,103.45447512280782,2.284931506849315,105.73940662965714,4.528475122807819,90.76952395236354,0.031062185698515907,0.9698736059479555,1.88130962302898
XS1968706520,SCGAU 1.45 03/28/29,EUR,95.333,SCENTRE GROUP TRUST 1/2,Financial,2029-03-28,1.45,A,0.001333381,500000000,Y,2028-12-28,Sr Unsecured,1,FIXED,28/03/2020,28/03/2028,28/03/2019,95.233,95.434,3.241615331964408,0.2009999999999934,98.04352236441602,1.1004109589041096,99.14393332332013,2.710522364416022,87.81529496732095,0.03167760690810644,3.802870603076026,18.311710491537163
DE000A2LQRS3,DT 2 ¼ 03/29/39,EUR,85.647,DEUTSCHE TELEKOM AG,Communications,2039-03-29,2.25,BBB+,0.000125821,500000000,N,,Sr Unsecured,1,FIXED,29/03/2020,29/03/2038,29/03/2019,85.25,86.044,13.489390828199863,0.7939999999999969,94.73188882377997,1.1465753424657534,95.87846416624572,9.084888823779963,86.51293085327995,0.03507949094040607,2.8076979976371774,10.73409556972537
XS1843442622,NDAQ 1 ¾ 03/28/29,EUR,96.393,NASDAQ INC,Financial,2029-03-28,1.75,BBB+,1.5499e-06,600000000,Y,2028-12-28,Sr Unsecured,1,FIXED,28/03/2020,28/03/2028,01/04/2019,96.24,96.547,3.241615331964408,0.30700000000000216,98.97522246131531,1.328082191780822,100.30330465309613,2.582222461315311,83.06540802349687,0.030196952432306412,2.868193049295054,11.079983739935797
XS1972547696,VW 2 ¼ 10/01/27,EUR,99.403,VOLKSWAGEN FINANCIAL SER,"Consumer, Non-cyclical",2027-10-01,2.25,BBB+,0.003521565,650000000,N,,Sr Unsecured,1,FIXED,01/10/2019,01/10/2026,01/04/2019,99.301,99.504,1.998631074606434,0.20300000000000296,100.59364207962636,0.0,100.59364207962636,1.1906420796263575,60.19627854819322,0.02990003590742968,2.8760791969620527,11.122882284648538
XS1979280853,VZ 0 ⅞ 04/08/27,EUR,97.836,VERIZON COMMUNICATIONS,Communications,2027-04-08,0.875,BBB+,0.000164108,622793000,Y,2027-01-08,Sr Unsecured,1,FIXED,08/04/2020,08/04/2026,08/04/2019,97.704,97.967,1.270362765229295,0.26300000000000523,98.69787769737255,0.6376712328767125,99.33554893024926,0.8618776973725488,69.02729354821476,0.029374953676147775,2.856774405666805,11.026735941934158
XS1979280937,VZ 1 ¼ 04/08/30,EUR,92.9,VERIZON COMMUNICATIONS,Communications,2030-04-08,1.25,BBB+,0.000164108,1250000000,Y,2030-01-08,Sr Unsecured,1,FIXED,08/04/2020,08/04/2029,08/04/2019,92.736,93.064,4.271047227926078,0.32799999999998875,96.06790164256289,0.910958904109589,96.97886054667248,3.1679016425628816,80.09176657683128,0.029935070084032175,2.8795381406719915,11.140521456841427
BE0002644251,AGSBB 3 ¼ 07/02/49,EUR,99.27743,AGEAS,Financial,2049-07-02,3.25,A-,4.2946e-07,500000000,Y,2029-07-02,Subordinated,1,VARIABLE,02/07/2019,02/04/2049,10/04/2019,99.059,99.496,3.7508555783709787,0.4369999999999976,103.8790200970609,0.8102739726027397,104.68929406966365,4.601590097060907,125.92689877876533,0.03301553491515706,0.9680396530359355,1.874201539699869
XS1979490239,BX 1 ½ 04/10/29,EUR,95.703,BLACKSTONE HOLDINGS FINA,Financial,2029-04-10,1.5,A+,1.41591e-05,600000000,Y,2029-01-10,Sr Unsecured,1,FIXED,10/04/2020,10/04/2028,10/04/2019,95.517,95.889,3.277207392197125,0.3719999999999999,98.15824685754313,1.084931506849315,99.24317836439245,2.4552468575431305,78.54227561783225,0.03174470034794014,4.698229913933404,27.039730060540972
XS1980064833,C 1 ¼ 04/10/29,EUR,95.07726,CITIGROUP INC,Financial,2029-04-10,1.25,A-,0.000312288,1350000000,Y,2029-03-10,Sr Unsecured,1,FIXED,10/04/2020,10/04/2028,10/04/2019,94.966,95.189,3.4387405886379194,0.22299999999999898,97.15364104614571,0.702054794520548,97.85569584066626,2.0763810461457126,63.7274452039954,0.027341889445071682,3.6859940043229167,17.605770271006765
XS1974922525,NHYNO 2 04/11/29,EUR,97.345,NORSK HYDRO ASA,Basic Materials,2029-04-11,2.0,NR,6.09411e-05,300000000,Y,2029-01-11,Sr Unsecured,1,FIXED,11/04/2020,11/04/2028,11/04/2019,97.178,97.513,3.2799452429842573,0.33500000000000796,99.72553549461223,1.441095890410959,101.1666313850232,2.380535494612232,75.24600746428683,0.03265627167177009,2.811470964389892,10.7699643754925
XS1981054221,CCEP 1 ⅛ 04/12/29,EUR,94.71406,COCA-COLA EUROPACIFIC,"Consumer, Non-cyclical",2029-04-12,1.125,BBB+,5.8577e-06,500000000,Y,2029-01-12,Sr Unsecured,1,FIXED,12/04/2020,12/04/2028,12/04/2019,94.614,94.814,3.2826830937713893,0.19999999999998863,96.97327048381554,0.8075342465753426,97.78080473039088,2.2592104838155365,72.67537487780453,0.033155506940607864,4.726207466191195,27.231365036531205
XS1986416268,SIKASW 0 ⅞ 04/29/27,EUR,97.651,SIKA CAPITAL BV,Industrial,2027-04-29,0.875,NR,2.77717e-05,500000000,Y,2027-01-29,Sr Unsecured,1,FIXED,29/04/2020,29/04/2026,29/04/2019,97.579,97.723,1.3278576317590691,0.14400000000000546,98.63962027688059,0.5873287671232877,99.22694904400387,0.9886202768805958,75.85908720415853,0.03216360160555559,2.865933604416713,11.05436051084977
XS1986416698,SIKASW 1 ½ 04/29/31,EUR,92.36947,SIKA CAPITAL BV,Industrial,2031-04-29,1.5,NR,2.77717e-05,500000000,Y,2031-01-29,Sr Unsecured,1,FIXED,29/04/2020,29/04/2030,29/04/2019,92.192,92.547,5.327857631759069,0.355000000000004,96.00368436932193,1.0068493150684932,97.01053368439042,3.634214369321924,74.80633469846615,0.03317409494972235,0.9678910891089109,1.8736263207528665
XS1989380172,NFLX 3 ⅞ 11/15/29,EUR,104.2676,NETFLIX INC,Communications,2029-11-15,3.875,A-,6.46298e-07,1200000000,N,,Sr Unsecured,2,FIXED,15/12/2019,15/06/2029,29/04/2019,104.069,104.466,4.123203285420945,0.39699999999999136,106.60046860191332,1.463654891304348,108.06412349321766,2.3328686019133187,57.30449195140189,0.03203777149162377,4.685423971381032,26.93583700841084
XS1989708836,ASRNED 3 ⅜ 05/02/49,EUR,100.3078,ASR NEDERLAND NV,Financial,2049-05-02,3.375,NR,6.9113e-05,500000000,Y,2029-02-02,Subordinated,1,VARIABLE,02/05/2020,02/05/2048,02/05/2019,100.047,100.568,3.3401779603011637,0.5210000000000008,104.07928942322698,2.2284246575342466,106.30771408076123,3.7714894232269813,114.56142958384378,0.032076107949029556,0.9689207920792081,1.8776150026468006
XS1991126431,RABOBK 1 ⅛ 05/07/31,EUR,90.05767,COOPERATIEVE RABOBANK UA,Financial,2031-05-07,1.125,A-,5.75847e-06,1000000000,N,,Sr Non Preferred,1,FIXED,07/05/2020,07/05/2030,07/05/2019,89.872,90.243,5.596167008898015,0.3709999999999951,93.75949275818061,0.45308219178082193,94.21257494996144,3.7018227581806116,73.88414666016564,0.03256131434979318,2.867092887132534,11.057523861729287
XS1991265395,BAC 1.381 05/09/30,EUR,94.83,BANK OF AMERICA CORP,Financial,2030-05-09,1.381,A+,0.000123703,1250000000,Y,2029-05-09,Sr Unsecured,1,VARIABLE,09/05/2020,09/02/2030,09/05/2019,94.718,94.942,3.6030116358658453,0.22399999999998954,97.38202540155261,0.5486164383561644,97.93064183990877,2.552025401552612,74.96896342365656,0.031055278576287343,2.8671462000522205,11.068478611599245
XS1995781546,CCHLN 1 05/14/27,EUR,97.757,COCA-COLA HBC FINANCE BV,"Consumer, Non-cyclical",2027-05-14,1.0,BBB+,0.014100174,700000000,Y,2027-02-14,Sr Unsecured,1,FIXED,14/05/2020,14/05/2026,14/05/2019,97.691,97.822,1.3716632443531827,0.13100000000000023,98.76276793718472,0.6273972602739726,99.39016519745869,1.0057679371847144,74.64488108045883,0.035449126280672094,2.860342607874496,11.00236281945254
XS1995795504,CCHLN 1 ⅝ 05/14/31,EUR,92.81154,COCA-COLA HBC FINANCE BV,"Consumer, Non-cyclical",2031-05-14,1.625,BBB+,0.014100174,576600000,Y,2031-02-14,Sr Unsecured,1,FIXED,14/05/2020,14/05/2030,14/05/2019,92.656,92.967,5.371663244353183,0.31099999999999284,96.58344010786733,1.0195205479452054,97.60296065581254,3.7719001078673386,76.81699553794361,0.029245048638265672,4.745414184860631,27.447952473997987
FR0013419736,CAFP 1 05/17/27,EUR,97.861,CARREFOUR SA,"Consumer, Non-cyclical",2027-05-17,1.0,NR,0.000487552,500000000,Y,2027-02-17,Sr Unsecured,1,FIXED,17/05/2020,17/05/2026,15/05/2019,97.733,97.99,1.379876796714579,0.2569999999999908,98.75545757189491,0.6191780821917808,99.37463565408669,0.8944575718949039,65.95865802053298,0.032397571886630935,3.7589322941597425,18.02030512808422
XS1998215559,BAX 1.3 05/15/29,EUR,94.494,BAXTER INTERNATIONAL INC,"Consumer, Non-cyclical",2029-05-15,1.3,BBB,0.001046548,750000000,Y,2029-02-15,Sr Unsecured,1,FIXED,15/05/2020,15/05/2028,15/05/2019,94.372,94.616,3.375770020533881,0.24399999999999977,97.40067092176895,0.812054794520548,98.2127257162895,2.9066709217689493,91.05645684183155,0.04060872562353403,10.414475152468949,131.44972001538795
XS1997077364,TCLAU 1.45 05/16/29,EUR,95.32664,TRANSURBAN FINANCE CO,"Consumer, Non-cyclical",2029-05-16,1.45,BBB+,1.1415e-06,600000000,Y,2029-02-16,Secured,1,FIXED,16/05/2020,16/05/2028,16/05/2019,95.207,95.446,3.378507871321013,0.23900000000000432,97.88175150823702,0.9017808219178082,98.78353233015483,2.555111508237019,79.56685822559294,0.03217539863325742,0.9688275862068966,1.877253783590963
XS1995662027,ADENVX 1 ¼ 11/20/29,EUR,93.576,ADECCO INT FINANCIAL SVS,"Consumer, Non-cyclical",2029-11-20,1.25,BBB+,0.001753951,300000000,Y,2029-08-20,Sr Unsecured,1,FIXED,20/11/2019,20/11/2028,20/05/2019,93.352,93.801,3.885010266940452,0.44899999999999807,96.55519634699517,0.14383561643835616,96.69903196343353,2.979196346995181,82.1001314653681,0.03188052104174629,2.8599124637466913,11.025285665879167
XS1998798042,NAB 1 ⅛ 05/20/31,EUR,91.741,NATIONAL AUSTRALIA BANK,Financial,2031-05-20,1.125,AA-,2.72424e-05,500000000,N,,Sr Unsecured,1,FIXED,20/05/2020,20/05/2030,20/05/2019,91.483,92.0,5.631759069130732,0.5169999999999959,93.70989012059253,0.413013698630137,94.12290381922267,1.9688901205925333,38.703704890088346,0.031669377541443076,2.8746057261614957,11.102635377271653
XS1843435923,FIS 2 05/21/30,EUR,95.418,FIDELITY NATL INFO SERV,Technology,2030-05-21,2.0,BBB,5.41796e-05,1000000000,Y,2030-02-21,Sr Unsecured,1,FIXED,21/05/2020,21/05/2029,21/05/2019,95.273,95.563,4.39151266255989,0.29000000000000625,99.03381025011679,1.2164383561643837,100.25024860628118,3.6158102501167804,87.50859603945865,0.03323063645818052,2.8098259680969266,10.757581576429361
XS1843436145,FIS 2.95 05/21/39,EUR,88.949,FIDELITY NATL INFO SERV,Technology,2039-05-21,2.95,BBB,5.41796e-05,500000000,Y,2039-02-21,Sr Unsecured,1,FIXED,21/05/2020,21/05/2038,21/05/2019,88.622,89.276,13.390828199863108,0.6539999999999964,102.68040286668716,1.7942465753424661,104.47464944202963,13.731402866687162,128.49453548802614,0.02438794596917048,0.9761926660059465,1.905904242327595
XS1843436228,FIS 1 ½ 05/21/27,EUR,98.336,FIDELITY NATL INFO SERV,Technology,2027-05-21,1.5,BBB,5.41796e-05,1250000000,Y,2027-02-21,Sr Unsecured,1,FIXED,21/05/2020,21/05/2026,21/05/2019,98.263,98.409,1.3908281998631074,0.1460000000000008,99.42474956543377,0.9123287671232878,100.33707833255706,1.0887495654337727,79.23833644938126,0.030484555072444915,4.6931736945058145,27.02218608149061
XS1998904921,KKR 1 ⅝ 05/22/29,EUR,95.59467,KKR GRP FIN CO V LLC,Financial,2029-05-22,1.625,A,0.0030325,650000000,Y,2029-02-22,Sr Unsecured,1,FIXED,22/05/2020,22/05/2028,22/05/2019,95.378,95.812,3.3949349760438055,0.4339999999999975,98.43052567922528,0.9839041095890411,99.41442978881433,2.83585567922529,87.69588824622842,0.03970630838445571,10.658202656270813,135.8050552237781
FR0013421369,CMARK 1 ⅛ 05/23/29,EUR,94.24264,CREDIT MUTUEL ARKEA,Financial,2029-05-23,1.125,A+,1.22381e-05,500000000,N,,Sr Preferred,1,FIXED,23/05/2020,23/05/2028,23/05/2019,94.114,94.371,3.6413415468856947,0.2569999999999908,96.44623016405029,0.4037671232876713,96.84999728733796,2.203590164050297,64.3731970237751,0.031929265426664986,2.8774577378442117,11.115503209793435
XS1995716211,SAMPFH 3 ⅜ 05/23/49,EUR,100.146,SAMPO OYJ,Financial,2049-05-23,3.375,NR,1.08227e-09,500000000,Y,2029-05-23,Subordinated,1,VARIABLE,23/05/2020,23/02/2049,23/05/2019,99.944,100.349,3.6413415468856947,0.40500000000000114,104.25872709012472,1.2113013698630137,105.47002845998773,4.1127270901247215,115.15255952355494,0.03232593261939091,2.8656416590902376,11.051704494879257
XS2002017361,VOD 0.9 11/24/26,EUR,98.49784,VODAFONE GROUP PLC,Communications,2026-11-24,0.9,BBB,0.000445526,437559000,N,,Sr Unsecured,1,FIXED,24/11/2019,24/11/2025,24/05/2019,98.398,98.598,1.1471594798083504,0.20000000000000284,98.85121270242826,0.7668493150684933,99.61806201749675,0.3533727024282598,31.201252545947373,0.03556691444552245,7.2683588867535045,61.89039184024449
XS2002018500,VOD 1 ⅝ 11/24/30,EUR,93.49,VODAFONE GROUP PLC,Communications,2030-11-24,1.625,BBB,0.000445526,1000000000,N,,Sr Unsecured,1,FIXED,24/11/2019,24/11/2029,24/05/2019,93.319,93.661,5.147159479808351,0.34199999999999875,96.80403868566223,1.3845890410958905,98.18862772675813,3.31403868566224,69.97675173555018,0.0325985699315315,4.740877110085971,27.354220010775236
XS2002019060,VOD 2 ½ 05/24/39,EUR,85.288,VODAFONE GROUP PLC,Communications,2039-05-24,2.5,BBB,0.000445526,750000000,N,,Sr Unsecured,1,FIXED,24/05/2020,24/05/2038,24/05/2019,84.915,85.661,13.64271047227926,0.7459999999999951,97.47521026296548,0.8904109589041096,98.36562122186959,12.187210262965479,115.19866240881419,0.0446593019526851,0.9572498881987577,1.832654696913068
FR0013421815,ACAFP 1 07/03/29,EUR,93.82,CREDIT AGRICOLE LONDON,Financial,2029-07-03,1.0,A+,0.000125365,1000000000,N,,Sr Preferred,1,FIXED,03/07/2020,03/07/2028,28/05/2019,93.718,93.921,3.753593429158111,0.20300000000000296,95.83619520864859,0.2465753424657534,96.08277055111434,2.016195208648597,57.39513099876494,0.03628057165248367,11.316570498056208,147.70416245600282
FR0013422011,BNP 1 ⅜ 05/28/29,EUR,94.769,BNP PARIBAS,Financial,2029-05-28,1.375,A-,0.000632394,1450000000,N,,Sr Non Preferred,1,FIXED,28/05/2020,28/05/2028,28/05/2019,94.644,94.894,3.6550308008213555,0.25,97.29748240485395,0.47465753424657536,97.77213993910053,2.5284824048539463,73.30006681318889,0.02898109910229898,2.882258297853438,11.161442838503175
FR0013422227,GFCFP 1 ⅝ 05/29/34,EUR,86.753,GECINA,Financial,2034-05-29,1.625,A-,0.000165878,700000000,Y,2034-02-28,Sr Unsecured,1,FIXED,29/05/2020,29/05/2033,29/05/2019,86.473,87.034,8.410677618069816,0.561000000000007,93.30772461038829,0.9571917808219178,94.2649163912102,6.554724610388291,92.20536203175271,0.033101292187993715,2.855747722234169,10.995208129501188
XS1843434793,ITW 1 06/05/31,EUR,89.72686,ILLINOIS TOOL WORKS INC,Industrial,2031-06-05,1.0,A+,1.13905e-06,500000000,Y,2031-03-05,Sr Unsecured,1,FIXED,05/06/2020,05/06/2030,05/06/2019,89.55,89.903,5.423682409308693,0.35300000000000864,93.36810560692375,0.5753424657534246,93.94344807267717,3.6412456069237464,74.99552579733852,0.030979588364385763,1.9277120991288077,5.597536407259013
XS1843435170,ITW 0 ⅝ 12/05/27,EUR,96.32327,ILLINOIS TOOL WORKS INC,Industrial,2027-12-05,0.625,A+,1.13905e-06,500000000,Y,2027-09-05,Sr Unsecured,1,FIXED,05/12/2019,05/12/2026,05/06/2019,96.247,96.399,1.9274469541409993,0.15200000000000102,97.53003938682397,0.04452054794520548,97.57455993476918,1.2067693868239786,64.73383063635762,0.03320942399835893,4.668358080934682,26.784321644286248
XS2008925344,UNANA 1 ½ 06/11/39,EUR,78.251,UNILEVER PLC,"Consumer, Non-cyclical",2039-06-11,1.5,A+,7.01173e-07,650000000,N,,Sr Unsecured,1,FIXED,11/06/2020,11/06/2038,11/06/2019,77.979,78.523,13.69199178644764,0.5439999999999969,85.99280895550503,0.4602739726027397,86.45308292810776,7.741808955505022,76.65660523512864,0.037426854907560175,11.19664637276081,145.48709877887075
XS2009943379,ENXFP 1 ⅛ 06/12/29,EUR,94.97472,EURONEXT NV,Financial,2029-06-12,1.125,NR,4.25259e-07,750000000,Y,2029-03-12,Sr Unsecured,1,FIXED,12/06/2020,12/06/2028,12/06/2019,94.838,95.112,3.4442162902121836,0.2740000000000009,96.73479100198804,0.6256849315068493,97.3604759334949,1.7600710019880381,54.0024746996079,0.035772508070439975,11.245762350233647,146.48978619552932
XS2010331440,COF 1.65 06/12/29,EUR,95.332,CAPITAL ONE FINANCIAL CO,Financial,2029-06-12,1.65,BBB+,0.000282375,500000000,N,,Sr Unsecured,1,FIXED,12/06/2020,12/06/2028,12/06/2019,95.181,95.483,3.696098562628337,0.3020000000000067,98.21582791548701,0.5017808219178083,98.71760873740482,2.883827915487018,82.35697346905084,0.033557567415618855,2.84824832070409,10.953358149155207
FR0013425147,PUBFP 1 ¼ 06/13/28,EUR,96.469,MMS USA HOLDINGS INC,Communications,2028-06-13,1.25,BBB+,2.97601e-05,750000000,Y,2028-03-13,Sr Unsecured,1,FIXED,13/06/2020,13/06/2027,13/06/2019,96.352,96.586,2.4476386036960984,0.23399999999999466,98.24125032277581,0.6917808219178081,98.93303114469362,1.7722503227758182,74.95222718847315,0.035146228835300164,0.9660470879801735,1.8664939523899462
FR0013425154,PUBFP 1 ¾ 06/13/31,EUR,92.871,MMS USA INVESTMENTS INC,Communications,2031-06-13,1.75,BBB+,2.97601e-05,750000000,Y,2031-03-13,Sr Unsecured,1,FIXED,13/06/2020,13/06/2030,13/06/2019,92.656,93.087,5.44558521560575,0.4309999999999974,97.1468166282866,0.9684931506849316,98.11530977897154,4.275816628286606,85.89902167821228,0.03300507980949733,4.701174338643462,27.04088501678085
XS2010331101,DE 1.65 06/13/39,EUR,78.76553,JOHN DEERE CASH MANAGEME,Industrial,2039-06-13,1.65,A,0.000246194,650000000,N,,Sr Unsecured,1,FIXED,13/06/2020,13/06/2038,13/06/2019,78.459,79.072,13.697467488021903,0.6129999999999995,87.70491713274217,0.49726027397260275,88.20217740671477,8.93938713274217,88.14651801796099,0.031178172147708943,3.840978371849673,18.563300732784953
XS2013626010,ZURNVX 1 ⅝ 06/17/39,EUR,79.984,ZURICH FINANCE IRELAND,Financial,2039-06-17,1.625,AA-,0.001491281,500000000,Y,2039-03-17,Sr Unsecured,1,FIXED,17/06/2020,17/06/2038,17/06/2019,79.496,80.473,13.456536618754278,0.9770000000000039,87.69703115667821,0.8815068493150685,88.57853800599328,7.713031156678213,76.4883101712147,0.03921095723857074,11.2589587325694,146.44518180724464
FR0013425162,BFCM 1 ⅞ 06/18/29,EUR,95.84,BANQUE FED CRED MUTUEL,Financial,2029-06-18,1.875,BBB+,1.08678e-05,1000000000,N,,Subordinated,1,FIXED,18/06/2020,18/06/2028,18/06/2019,95.636,96.045,3.7125256673511293,0.409000000000006,98.99581642414662,0.5393835616438356,99.53519998579046,3.1558164241466216,89.40279308575164,0.032321664352514955,1.9312090252739578,5.606252069971812
XS2012102674,CB 0 ⅞ 06/15/27,EUR,97.45,CHUBB INA HOLDINGS LLC,Financial,2027-06-15,0.875,A,2.80507e-07,575000000,Y,2027-03-15,Sr Unsecured,1,FIXED,15/06/2020,15/06/2026,18/06/2019,97.348,97.552,1.4510609171800137,0.20400000000000773,98.51519789830193,0.4794520547945206,98.99464995309646,1.065197898301932,74.95850927695228,0.03580674147121297,2.8152293835933726,10.767899085564029
XS2012102914,CB 1.4 06/15/31,EUR,91.37041,CHUBB INA HOLDINGS LLC,Financial,2031-06-15,1.4,A,2.80507e-07,575000000,Y,2031-03-15,Sr Unsecured,1,FIXED,15/06/2020,15/06/2030,18/06/2019,91.099,91.642,5.451060917180014,0.5429999999999922,95.36156699832364,0.7671232876712328,96.12869028599488,3.991156998323632,80.91182042441832,0.03769698218148104,0.9636724565756825,1.8573292071252216
FR0013428067,AIFP 0 ⅝ 06/20/30,EUR,90.76,AIR LIQUIDE FINANCE,Basic Materials,2030-06-20,0.625,A,0.010105715,600000000,Y,2030-03-20,Sr Unsecured,1,FIXED,20/06/2020,20/06/2029,20/06/2019,90.597,90.923,4.465434633812457,0.3260000000000076,93.1947729669838,0.3339041095890411,93.52867707657285,2.4347729669838003,59.90804230721748,0.033651235259481806,3.8315777052087743,18.473271180049604
XS2015329498,INVSA 1 ½ 06/20/39,EUR,75.70499,INVESTOR AB,Financial,2039-06-20,1.5,AA-,4.82318e-08,500000000,Y,2039-03-20,Sr Unsecured,1,FIXED,20/06/2020,20/06/2038,20/06/2019,75.365,76.045,13.464750171115675,0.6800000000000068,86.27493292196543,0.8013698630136987,87.07630278497913,10.569942921965435,107.88587176614378,0.04602217718326692,16.93499591054347,355.56020783497854
FR0013428943,LRFP 0 ⅝ 06/24/28,EUR,95.028,LEGRAND SA,Industrial,2028-06-24,0.625,NR,6.83986e-06,475000000,Y,2028-03-24,Sr Unsecured,1,FIXED,24/06/2020,24/06/2027,24/06/2019,94.938,95.117,2.4777549623545516,0.17900000000000205,96.71926857712161,0.3270547945205479,97.04632337164216,1.6912685771216047,71.45966393288714,0.033622560508879754,3.7744796723673786,18.10634752251723
XS2011260705,MRKGR 2 ⅞ 06/25/2079,EUR,98.026,MERCK KGAA,"Consumer, Non-cyclical",2079-06-25,2.875,BBB,1.5421e-05,633900000,Y,2029-03-25,Jr Subordinated,1,VARIABLE,25/06/2020,25/06/2078,25/06/2019,97.7,98.353,3.479808350444901,0.6529999999999916,102.49963838419748,1.4965753424657533,103.99621372666323,4.473638384197486,132.54271395294947,0.033839390686500166,0.9672682323856612,1.8712156667649624
XS2006277508,AMXLMM 0 ¾ 06/26/27,EUR,97.09,AMERICA MOVIL SAB DE CV,Communications,2027-06-26,0.75,BBB+,4.0591e-05,765835000,Y,2027-03-26,Sr Unsecured,1,FIXED,26/06/2020,26/06/2026,26/06/2019,96.978,97.202,1.4811772758384667,0.22400000000000375,98.30423304173972,0.38835616438356163,98.69258920612329,1.2142330417397176,83.94973948725628,0.039986490716892864,0.9615509517923364,1.8491604657854959
FR0013430741,LIFP 0 ⅝ 07/01/30,EUR,89.903,KLEPIERRE SA,Financial,2030-07-01,0.625,A-,2.73016e-05,700000000,Y,2030-04-01,Sr Unsecured,1,FIXED,01/07/2020,01/07/2029,01/07/2019,89.668,90.137,4.498288843258043,0.4689999999999941,93.13653486992499,0.3133561643835617,93.44989103430855,3.2335348699249806,79.39045284978242,0.04201836705985483,10.912138598524445,140.11645773823804
FR0013431715,URWFP 1 ¾ 07/01/49,EUR,60.043,UNIBAIL-RODAMCO-WESTFLD,Financial,2049-07-01,1.75,BBB,0.008889247,500000000,Y,2049-01-01,Sr Unsecured,1,FIXED,01/07/2020,01/07/2048,01/07/2019,59.662,60.423,23.252566735112936,0.7610000000000028,81.11463004813693,1.3089041095890412,82.42353415772597,21.07163004813693,164.9740475011017,0.03770433763860663,4.657329670603847,26.624031134132817
XS1843434108,FI 1 ⅝ 07/01/30,EUR,93.598,FISERV INC,Technology,2030-07-01,1.625,BBB,0.000255013,500000000,Y,2030-04-01,Sr Unsecured,1,FIXED,01/07/2020,01/07/2029,01/07/2019,93.413,93.783,4.498288843258043,0.37000000000000455,97.38301863673797,0.8147260273972603,98.19774466413523,3.7850186367379735,90.60135831662417,0.03320581396885581,4.737916419406209,27.32078775473125
XS1843434280,FI 1 ⅛ 07/01/27,EUR,97.815,FISERV INC,Technology,2027-07-01,1.125,BBB,0.000255013,500000000,Y,2027-04-01,Sr Unsecured,1,FIXED,01/07/2020,01/07/2026,01/07/2019,97.74,97.889,1.4976043805612593,0.1490000000000009,98.83357126205016,0.564041095890411,99.39761235794057,1.018571262050159,69.25125232010458,0.03939065709339733,11.255421822157938,146.36813498115364
XS2018637327,HEIGR 1 ⅛ 12/01/27,EUR,97.23684,HEIDELBERG MATERIALS FIN,Industrial,2027-12-01,1.125,BBB,0.01639308,750000000,Y,2027-09-01,Sr Unsecured,1,FIXED,01/12/2019,01/12/2026,01/07/2019,97.121,97.353,1.9164955509924708,0.23199999999999932,98.47670370427109,0.09246575342465753,98.56916945769575,1.2398637042710874,66.39404507865693,0.04338063821553642,17.11590220970465,361.1548063327378
XS2020583618,TELEFO 1.957 07/01/39,EUR,77.862,TELEFONICA EMISIONES SAU,Communications,2039-07-01,1.957,BBB-,0.021357445,500000000,Y,2039-01-01,Sr Unsecured,1,FIXED,01/07/2020,01/07/2038,01/07/2019,77.463,78.261,13.25119780971937,0.7980000000000018,91.64218699584696,1.4637287671232877,93.10591576297024,13.780186995846961,140.17088915049013,0.03213914284508756,2.8591765606167376,11.019664114329284
FR0013431277,BNP 1 ⅝ 07/02/31,EUR,90.387,BNP PARIBAS,Financial,2031-07-02,1.625,BBB+,0.000632394,1108000000,N,,Subordinated,1,FIXED,02/07/2020,02/07/2030,02/07/2019,90.17,90.603,5.749486652977413,0.4329999999999927,96.21992114560817,0.40513698630136985,96.62505813190954,5.832921145608168,113.0724261695261,0.030261107308883085,2.8610731170248904,11.042715820509807
XS2020670852,MDT 1 07/02/31,EUR,89.469,MEDTRONIC GLOBAL HLDINGS,"Consumer, Non-cyclical",2031-07-02,1.0,A-,1.28812e-06,1000000000,Y,2031-04-02,Sr Unsecured,1,FIXED,02/07/2020,02/07/2030,02/07/2019,89.277,89.661,5.500342231348392,0.38400000000000034,93.25219760053524,0.4986301369863014,93.75082773752155,3.783197600535246,77.02452928536013,0.03860560407267898,0.962829389788294,1.8540808676801972
XS2020670936,MDT 1 ½ 07/02/39,EUR,75.552,MEDTRONIC GLOBAL HLDINGS,"Consumer, Non-cyclical",2039-07-02,1.5,A-,1.28812e-06,1000000000,Y,2039-04-02,Sr Unsecured,1,FIXED,02/07/2020,02/07/2038,02/07/2019,75.282,75.822,13.500342231348391,0.5400000000000063,86.23047612733674,0.7479452054794521,86.9784213328162,10.678476127336737,108.88594224434279,0.033854334846224375,4.746879755042755,27.37855867805889
XS2020671157,MDT 1 ¾ 07/02/49,EUR,62.805,MEDTRONIC GLOBAL HLDINGS,"Consumer, Non-cyclical",2049-07-02,1.75,A-,1.28812e-06,1000000000,Y,2049-01-02,Sr Unsecured,1,FIXED,02/07/2020,02/07/2048,02/07/2019,62.535,63.074,23.255304585900067,0.5390000000000015,81.11296406189024,1.304109589041096,82.41707365093133,18.30796406189024,139.7349501244738,0.0346425078498995,0.9665174129353235,1.8683118190143813
XS2022084367,CNHI 1 ⅝ 07/03/29,EUR,95.524,CNH INDUSTRIAL FIN EUR S,Industrial,2029-07-03,1.625,BBB,0.05446984,500000000,Y,2029-04-03,Sr Unsecured,1,FIXED,03/07/2020,03/07/2028,03/07/2019,95.403,95.645,3.5044490075290895,0.24199999999999022,98.31970873040493,0.8058219178082192,99.12553064821314,2.7957087304049253,83.90546593283588,0.033935064209161606,7.345337356500471,62.83793538544354
XS2022424993,ISPIM 1 ¾ 07/04/29,EUR,96.39219,INTESA SANPAOLO SPA,Financial,2029-07-04,1.75,BBB+,0.000100348,1000000000,N,,Sr Preferred,1,FIXED,04/07/2020,04/07/2028,04/07/2019,96.266,96.518,3.756331279945243,0.25199999999999534,98.51519535418245,0.42671232876712334,98.94190768294958,2.123005354182453,59.34713163090451,0.03856764212689971,0.9628645833333336,1.854216411675349
XS2023644201,MRKGR 0 ⅜ 07/05/27,EUR,96.644,MERCK FIN SERVICES GMBH,"Consumer, Non-cyclical",2027-07-05,0.375,A-,0.014005227,600000000,Y,2027-04-05,Sr Unsecured,1,FIXED,05/07/2020,05/07/2026,05/07/2019,96.561,96.726,1.5085557837097878,0.16499999999999204,97.72149226408145,0.18390410958904108,97.90539637367048,1.0774922640814424,73.49302426255404,0.033780666349697334,4.6973456999937095,26.998100149258782
XS2023644540,MRKGR 0 ⅞ 07/05/31,EUR,88.62839,MERCK FIN SERVICES GMBH,"Consumer, Non-cyclical",2031-07-05,0.875,A-,0.014005227,800000000,Y,2031-04-05,Sr Unsecured,1,FIXED,05/07/2020,05/07/2030,05/07/2019,88.459,88.798,5.508555783709788,0.33899999999999864,92.59763865282352,0.4291095890410959,93.02674824186461,3.9692486528235236,81.13534176445829,0.033264853640600396,2.877294884382217,11.10512692343291
XS2024715794,DT 0 ½ 07/05/27,EUR,97.135,DEUTSCHE TELEKOM AG,Communications,2027-07-05,0.5,BBB+,0.000125821,1006905000,N,,Sr Unsecured,1,FIXED,05/07/2020,05/07/2026,05/07/2019,97.009,97.261,1.757700205338809,0.25199999999999534,97.54193579575912,0.12054794520547946,97.66248374096459,0.4069357957591109,23.807372695296564,0.03636823541329574,1.915731864474766,5.531925105861737
XS2024716099,DT 1 ⅜ 07/05/34,EUR,86.063,DEUTSCHE TELEKOM AG,Communications,2034-07-05,1.375,BBB+,0.000125821,850000000,N,,Sr Unsecured,1,FIXED,05/07/2020,05/07/2033,05/07/2019,85.749,86.377,8.758384668035593,0.6280000000000001,90.94479088608661,0.3315068493150685,91.27629773540167,4.8817908860866055,66.64674460803315,0.037264930171417764,7.361327873423623,62.89231802976807
XS2019814503,OMC 0.8 07/08/27,EUR,97.05675,OMNICOM FINANCE HOLD,Communications,2027-07-08,0.8,BBB+,0.000385162,500000000,Y,2027-04-08,Sr Unsecured,1,FIXED,08/07/2020,08/07/2026,08/07/2019,96.946,97.167,1.516769336071184,0.22100000000000364,98.33721507140424,0.38575342465753426,98.72296849606178,1.280465071404251,86.47209821692817,0.032142255049080505,2.85916770712771,11.019596491460032
XS2019815062,OMC 1.4 07/08/31,EUR,91.038,OMNICOM FINANCE HOLD,Communications,2031-07-08,1.4,BBB+,0.000385162,500000000,Y,2031-04-08,Sr Unsecured,1,FIXED,08/07/2020,08/07/2030,08/07/2019,90.828,91.249,5.516769336071184,0.42099999999999227,95.28518140517912,0.675068493150685,95.9602498983298,4.24718140517912,85.309649145528,0.03359462907350738,2.8550418081799407,10.98810563777263
XS2021462440,PRIFII 0 ⅞ 07/09/29,EUR,93.109,PROLOGIS INTL FUND II,Financial,2029-07-09,0.875,A-,0.002987741,450000000,Y,2029-04-09,Sr Unsecured,1,FIXED,09/07/2020,09/07/2028,09/07/2019,92.958,93.261,3.5208761122518824,0.30299999999999727,95.78184658313006,0.4195205479452055,96.20136713107527,2.6728465831300667,81.21619238073006,0.035663062429151064,2.863309972027318,11.016116521081814
XS2023873149,ARNDTN 1.45 07/09/28,EUR,95.85388,AROUNDTOWN SA,Financial,2028-07-09,1.45,NR,0.002953027,600000000,Y,2028-04-09,Sr Unsecured,1,FIXED,09/07/2020,09/07/2027,09/07/2019,95.726,95.982,2.521560574948665,0.2560000000000002,98.66185110301292,0.6952054794520547,99.35705658246498,2.8079711030129175,115.61133828542613,0.03205038587178452,2.8815162174149265,11.135583535106676
FR0013433679,ORAFP 1.2 07/11/34,EUR,82.796,ORANGE SA,Communications,2034-07-11,1.2,BBB+,2.14239e-05,300000000,N,,Sr Unsecured,1,FIXED,11/07/2020,11/07/2033,11/07/2019,82.447,83.146,8.774811772758385,0.6989999999999981,89.54954223765088,0.2695890410958904,89.81913127874677,6.753542237650876,93.96100127607153,0.031993561741075774,3.8231663329327428,18.438781996952866
XS2025480596,ABESM 1 ⅝ 07/15/29,EUR,95.52315,ABERTIS INFRAESTRUCTURAS,"Consumer, Non-cyclical",2029-07-15,1.625,BBB-,0.016819763,600000000,Y,2029-04-15,Sr Unsecured,1,FIXED,15/07/2020,15/07/2028,15/07/2019,95.41,95.637,3.5373032169746748,0.22700000000000387,98.28662139357613,0.7523972602739726,99.03901865385009,2.7634713935761255,82.20505745806487,0.033319412759458204,3.8107930394956804,18.34348127470319
XS2028104037,WLK 1 ⅝ 07/17/29,EUR,95.12759,WESTLAKE CORP,Basic Materials,2029-07-17,1.625,BBB,0.001380385,700000000,Y,2029-04-17,Sr Unsecured,1,FIXED,17/07/2020,17/07/2028,17/07/2019,94.945,95.31,3.542778918548939,0.3650000000000091,98.28111370058845,0.7434931506849315,99.02460685127338,3.153523700588451,93.8656889023679,0.0245406970020535,0.9760471232876714,1.9053359737562778
XS2029713349,GOOEUR 1 ⅛ 07/18/29,EUR,93.169,GELF BOND ISSUER I SA,Financial,2029-07-18,1.125,BBB+,0.000798823,400000000,Y,2029-04-18,Sr Unsecured,1,FIXED,18/07/2020,18/07/2028,18/07/2019,93.008,93.33,3.5455167693360714,0.32200000000000273,96.58619001530023,0.5116438356164383,97.09783385091667,3.4171900153002355,102.97715760201716,0.02945313813729576,3.840193661881255,18.578881089988368
XS2028900087,MUFG 0.848 07/19/29,EUR,93.35905,MITSUBISHI UFJ FIN GRP,Financial,2029-07-19,0.848,A-,0.000331534,500000000,N,,Sr Unsecured,1,FIXED,19/07/2020,19/07/2028,19/07/2019,93.201,93.518,3.7973990417522243,0.3170000000000073,95.21820601031234,0.17192328767123288,95.39012929798358,1.859156010312347,52.51752390998094,0.03611530775368481,7.391175389610278,63.27977498473021
XS2032727310,IGIM 0 ⅞ 04/24/30,EUR,91.40117,ITALGAS SPA,Utilities,2030-04-24,0.875,BBB,3.11332e-05,600000000,N,,Sr Unsecured,1,FIXED,24/04/2020,24/04/2029,24/07/2019,91.225,91.578,4.561259411362081,0.35300000000000864,94.10076294541793,0.3835616438356165,94.48432458925355,2.6995929454179333,64.79687318919167,0.03612225684160384,1.9245418373792842,5.566807555528992
XS2033262622,JPM 1.001 07/25/31,EUR,91.404,JPMORGAN CHASE & CO,Financial,2031-07-25,1.001,A+,0.0001373,1500000000,Y,2030-07-25,Sr Unsecured,1,VARIABLE,25/07/2020,25/04/2031,25/07/2019,91.261,91.548,4.813141683778234,0.28700000000000614,94.28417886566551,0.1864876712328767,94.47066653689839,2.8801788656655134,65.69240912097912,0.02828452569450016,3.868487382023345,18.77588961607341
DE000A2YNZW8,MBGGR 0 ⅜ 11/08/26,EUR,97.97073,MERCEDES-BENZ INT FINCE,"Consumer, Cyclical",2026-11-08,0.375,A,0.042824479,1000000000,N,,Sr Unsecured,1,FIXED,08/11/2019,08/11/2025,08/08/2019,97.891,98.051,1.103353867214237,0.1599999999999966,98.32714757903466,0.33595890410958906,98.66310648314425,0.3564175790346553,32.89082608303003,0.044508101121687356,0.9573884577114428,1.8331853179181896
DE000A2YNZX6,MBGGR 0 ¾ 02/08/30,EUR,91.82912,MERCEDES-BENZ GROUP AG,"Consumer, Cyclical",2030-02-08,0.75,A,0.001270443,750000000,N,,Sr Unsecured,1,FIXED,08/02/2020,08/02/2029,08/08/2019,91.636,92.022,4.355920602327173,0.3860000000000099,93.90433001748815,0.48287671232876717,94.38720672981691,2.0752100174881463,51.932093310477995,0.045831556760496314,0.9561769230769233,1.828548616449705
DE000A2YNZY4,MBGGR 1 ⅛ 08/08/34,EUR,82.98698,MERCEDES-BENZ GROUP AG,"Consumer, Cyclical",2034-08-08,1.125,A,0.001270443,500000000,N,,Sr Unsecured,1,FIXED,08/08/2020,08/08/2033,08/08/2019,82.724,83.25,8.851471594798083,0.5259999999999962,88.84276417342687,0.16643835616438357,89.00920252959125,5.855784173426869,80.79340209517827,0.034700576453538946,2.895567596383334,11.188940613453674
XS2038039074,BAC 0.58 08/08/29,EUR,94.249,BANK OF AMERICA CORP,Financial,2029-08-08,0.58,A+,0.000123703,1000000000,Y,2028-08-08,Sr Unsecured,1,VARIABLE,08/08/2020,08/05/2029,08/08/2019,94.141,94.357,2.8528405201916494,0.21599999999999397,96.04254743249709,0.08580821917808219,96.12835565167516,1.7935474324970926,66.38807326030982,0.04712178430595256,0.9549987546699875,1.8240452428424534
XS2047500926,EOANGR 0.35 02/28/30,EUR,90.74943,E.ON SE,Utilities,2030-02-28,0.35,BBB+,0.00010082,750000000,Y,2029-11-28,Sr Unsecured,1,FIXED,28/02/2020,28/02/2029,28/08/2019,90.547,90.951,4.158795345653662,0.40399999999999636,92.65726022331313,0.2943835616438356,92.95164378495697,1.9078302233131268,50.2811071663231,0.035938640156959925,5.711986606487115,38.421087936632645
DE000A2YN2U2,HOTGR 0 ½ 09/03/27,EUR,96.21754,HOCHTIEF AKTIENGESELLSCH,Industrial,2027-09-03,0.5,NR,0.001012461,500000000,Y,2027-06-03,Sr Unsecured,1,FIXED,03/09/2020,03/09/2026,03/09/2019,96.08,96.355,1.6700889801505818,0.2750000000000057,97.66947558661091,0.1643835616438356,97.83385914825475,1.4519355866109152,89.73934214618588,0.038398672177255976,18.126653650895165,391.8029373150428
FR0013444304,HSBC 0.1 09/03/27,EUR,95.71331,HSBC CONTINENTAL EUROPE,Financial,2027-09-03,0.1,A+,1.16458e-05,1250000000,N,,Sr Preferred,1,FIXED,03/09/2020,03/09/2026,03/09/2019,95.634,95.793,1.9219712525667352,0.15900000000000603,96.55580116001127,0.0076712328767123295,96.56347239288799,0.8424911600112637,45.58689975108654,0.03195598941967886,7.600077522040965,65.85383175824228
XS2046736752,ATCOA 0 ⅛ 09/03/29,EUR,90.623,ATLAS COPCO FINANCE,Industrial,2029-09-03,0.125,A+,0.012572324,300000000,Y,2029-06-03,Sr Unsecured,1,FIXED,03/09/2020,03/09/2028,03/09/2019,90.509,90.738,3.671457905544148,0.2289999999999992,92.90253022996828,0.0410958904109589,92.94362612037924,2.279530229968273,67.73445149719451,0.03692622911241525,2.866983071438806,11.026079497263671
XS2049584084,BAWAG 0 ⅜ 09/03/27,EUR,95.858,BAWAG P.S.K.,Financial,2027-09-03,0.375,NR,4.92021e-06,500000000,N,,Sr Non Preferred,1,FIXED,03/09/2020,03/09/2026,03/09/2019,95.754,95.961,1.9219712525667352,0.20699999999999363,97.06992289174167,0.028767123287671233,97.09869001502933,1.211922891741665,65.4338366830264,0.035079753942147206,2.886137573663784,11.137682887379217
FR0013444684,ORAFP 0 ½ 09/04/32,EUR,83.56489,ORANGE SA,Communications,2032-09-04,0.5,BBB+,2.14239e-05,1000000000,Y,2032-06-04,Sr Unsecured,1,FIXED,04/09/2020,04/09/2031,04/09/2019,83.356,83.774,6.674880219028063,0.41800000000000637,88.36974265660655,0.16301369863013698,88.53275635523669,4.804852656606542,85.00649189688315,0.03326896157107955,0.9678022249690978,1.8732822933102726
FR0013444692,ORAFP 1 ⅜ 09/04/49,EUR,62.79229,ORANGE SA,Communications,2049-09-04,1.375,BBB+,2.14239e-05,750000000,Y,2049-03-04,Sr Unsecured,1,FIXED,04/09/2020,04/09/2048,04/09/2019,62.305,63.28,23.422313483915126,0.9750000000000014,74.5871195026531,0.7948630136986301,75.38198251635173,11.794829502653094,89.42840547504954,0.035089194640859474,2.8787397781758033,11.09955224000291
XS2049616894,SIEGR 0 ½ 09/05/34,EUR,81.23289,SIEMENS FINANCIERINGSMAT,Industrial,2034-09-05,0.5,AA-,0.006816219,1000000000,N,,Sr Unsecured,1,FIXED,05/09/2020,05/09/2033,05/09/2019,80.959,81.507,8.928131416837783,0.5480000000000018,83.74447243005817,0.03561643835616438,83.78008886841432,2.5115824300581693,34.85717073778182,0.037998821520019516,2.88634661016428,11.117846156303493
XS2049769297,MOLNLY 0 ⅞ 09/05/29,EUR,92.135,MOLNLYCKE HOLDING AB,"Consumer, Non-cyclical",2029-09-05,0.875,NR,0.00462818,500000000,Y,2029-06-05,Sr Unsecured,1,FIXED,05/09/2020,05/09/2028,05/09/2019,91.994,92.276,3.676933607118412,0.2819999999999965,95.51819148597733,0.28287671232876715,95.8010681983061,3.3831914859773207,99.17103833722862,0.03887942537962664,7.544348045002813,64.92369684087612
XS2049630028,MIZUHO 0.402 09/06/29,EUR,91.29951,MIZUHO FINANCIAL GROUP,Financial,2029-09-06,0.402,A,0.000341565,500000000,N,,Sr Unsecured,1,FIXED,06/09/2020,06/09/2028,06/09/2019,91.182,91.417,3.9315537303216974,0.23499999999999943,93.32331349368351,0.027534246575342466,93.35084774025886,2.0238034936835163,56.07046290557394,0.04873889801341133,0.9535261845386533,1.818424369201684
XS2050448336,BALDER 1 ⅛ 01/29/27,EUR,97.869,FASTIGHETS AB BALDER,Financial,2027-01-29,1.125,NR,0.001221059,500000000,Y,2026-10-29,Sr Unsecured,1,FIXED,29/01/2020,29/01/2026,06/09/2019,97.784,97.954,1.0759753593429158,0.1699999999999875,99.15948245961276,1.0386986301369863,100.19818108974975,1.290482459612761,121.6683644935481,0.036472750008862735,4.759053410934095,27.426310430471343
CH0494734418,UBS 0.65 09/10/29,EUR,91.99171,UBS GROUP AG,Financial,2029-09-10,0.65,A-,0.000727758,1000000000,N,,Sr Unsecured,1,FIXED,10/09/2020,10/09/2028,10/09/2019,91.855,92.129,3.9425051334702257,0.2740000000000009,94.22995686682948,0.0373972602739726,94.26735412710346,2.238246866829485,61.54002905226369,0.043637174176276126,17.546656386458466,373.87755350288177
XS2049090595,VGASDE 0 ⅛ 09/10/29,EUR,89.76301,VIER GAS TRANSPORT GMBH,Utilities,2029-09-10,0.125,NR,0.006561922,500000000,Y,2029-06-10,Sr Unsecured,1,FIXED,10/09/2020,10/09/2028,10/09/2019,89.63,89.896,3.6906228610540723,0.26600000000000534,92.85707543886834,0.0386986301369863,92.89577406900533,3.0940654388683413,91.91960322119203,0.031859800215642976,3.8280579028553223,18.47188706750798
XS2049146215,VGASDE 0 ½ 09/10/34,EUR,77.08393,VIER GAS TRANSPORT GMBH,Utilities,2034-09-10,0.5,NR,0.006561922,500000000,Y,2034-06-10,Sr Unsecured,1,FIXED,10/09/2020,10/09/2033,10/09/2019,76.842,77.326,8.68993839835729,0.48399999999999466,84.23093123941592,0.1547945205479452,84.38572575996388,7.147001239415928,104.2383628672424,0.04031462498832641,11.043519318554313,142.55729614889574
XS2049582625,PLD 0 ¼ 09/10/27,EUR,95.591,PROLOGIS EURO FINANCE,Financial,2027-09-10,0.25,A,0.010005575,600000000,Y,2027-06-10,Sr Unsecured,1,FIXED,10/09/2020,10/09/2026,10/09/2019,95.518,95.663,1.6892539356605065,0.14499999999999602,97.23019447235208,0.0773972602739726,97.30759173262605,1.639194472352088,100.65387250712573,0.03298918411628916,2.8708631841148673,11.07393202550773
XS2049583607,PLD 0 ⅝ 09/10/31,EUR,86.411,PROLOGIS EURO FINANCE,Financial,2031-09-10,0.625,A,0.010005575,700000000,Y,2031-06-10,Sr Unsecured,1,FIXED,10/09/2020,10/09/2030,10/09/2019,86.203,86.618,5.689253935660506,0.41499999999999204,90.98267964643242,0.1934931506849315,91.17617279711735,4.571679646432415,91.97955778359416,0.03441607756178657,4.761409497224363,27.480629751480294
XS2049583789,PLD 1 ½ 09/10/49,EUR,58.946,PROLOGIS EURO FINANCE,Financial,2049-09-10,1.5,A,0.010005575,500000000,Y,2049-03-10,Sr Unsecured,1,FIXED,10/09/2020,10/09/2048,10/09/2019,58.641,59.252,23.43874058863792,0.6110000000000042,76.71681083093428,0.8424657534246576,77.55927658435894,17.77081083093428,139.602535015197,0.03820624591460926,7.406955982910458,63.37818303053384
XS2051362072,T 0.8 03/04/30,EUR,91.17038,AT&T INC,Communications,2030-03-04,0.8,BBB,0.000147481,1250000000,Y,2029-12-04,Sr Unsecured,1,FIXED,04/03/2020,04/03/2029,11/09/2019,90.993,91.348,4.175222450376454,0.355000000000004,94.40480017739084,0.6597260273972604,95.0645262047881,3.234420177390845,84.53718261595276,0.033957531887852097,2.8505499016415876,10.962420970361133
XS2051362312,T 1.8 09/14/39,EUR,77.76084,AT&T INC,Communications,2039-09-14,1.8,BBB,0.000147481,750000000,Y,2039-03-14,Sr Unsecured,1,FIXED,14/09/2020,14/09/2038,11/09/2019,77.408,78.114,13.44832306639288,0.7060000000000031,89.68218439159128,0.9912328767123288,90.67341726830361,11.921344391591276,119.99854906588834,0.03646599353336841,2.879321626067152,11.092726446937071
XS2051494495,BRITEL 1 ⅛ 09/12/29,EUR,93.886,BRITISH TELECOMMUNICATIO,Communications,2029-09-12,1.125,BBB,0.008914572,750000000,Y,2029-06-12,Sr Unsecured,1,FIXED,12/09/2020,12/09/2028,12/09/2019,93.724,94.049,3.696098562628337,0.32500000000000284,96.36654208445971,0.3421232876712329,96.70866537213094,2.4805420844597137,71.581636607409,0.04105021312269622,7.348617566228556,62.599742498837294
XS2051655095,CCEP 0.7 09/12/31,EUR,87.601,COCA-COLA EUROPACIFIC,"Consumer, Non-cyclical",2031-09-12,0.7,BBB+,5.8577e-06,500000000,Y,2031-06-12,Sr Unsecured,1,FIXED,12/09/2020,12/09/2030,12/09/2019,87.398,87.804,5.69472963723477,0.4060000000000059,91.37014179728916,0.21287671232876712,91.58301850961793,3.7691417972891657,75.22106440385167,0.033782262670510196,2.8905939821130286,11.169951739589921
XS2051660509,SRGIM 1 09/12/34,EUR,80.868,SNAM SPA,Utilities,2034-09-12,1.0,BBB+,2.41679e-05,600000000,Y,2034-06-12,Sr Unsecured,1,FIXED,12/09/2020,12/09/2033,12/09/2019,80.645,81.091,8.695414099931554,0.44599999999999795,88.11121418099856,0.3041095890410959,88.41532377003965,7.243214180998564,102.87188970572693,0.034636437752124494,2.838384396400776,10.895052290114092
XS2051670300,BPPEHX 1 ¾ 03/12/29,EUR,95.38,BLACKSTONE PP EUR HOLD,Financial,2029-03-12,1.75,NR,0.021241973,600000000,Y,2028-12-12,Sr Unsecured,1,FIXED,12/03/2020,12/03/2028,12/09/2019,95.237,95.523,3.1978097193702943,0.28600000000000136,99.01522630361369,1.4047945205479455,100.42002082416164,3.635226303613692,119.10901606549402,0.033753634815274394,0.9673484729064038,1.8715261360687026
DE000A2R7JD3,ANNGR 0 ½ 09/14/29,EUR,91.209,VONOVIA SE,Financial,2029-09-14,0.5,BBB+,0.001036135,500000000,Y,2029-06-14,Sr Unsecured,1,FIXED,14/09/2020,14/09/2028,16/09/2019,91.09,91.328,3.701574264202601,0.23799999999999955,94.15391455603825,0.14931506849315068,94.3032296245314,2.944914556038242,86.3816425761358,0.03749243087370325,4.705063671432864,26.993973109816757
DE000A2R7JE1,ANNGR 1 ⅛ 09/14/34,EUR,80.023,VONOVIA SE,Financial,2034-09-14,1.125,BBB+,0.001036135,500000000,Y,2034-06-14,Sr Unsecured,1,FIXED,14/09/2020,14/09/2033,16/09/2019,79.763,80.283,8.700889801505818,0.519999999999996,89.07559200293554,0.33595890410958906,89.41155090704513,9.05259200293554,129.12168692011224,0.03886505238889107,4.651609311019055,26.560779119979447
FR0013444551,DSYFP 0 ⅜ 09/16/29,EUR,91.56644,DASSAULT SYSTEMES,Technology,2029-09-16,0.375,NR,1.54845e-06,1150000000,Y,2029-06-16,Sr Unsecured,1,FIXED,16/09/2020,16/09/2028,16/09/2019,91.389,91.744,3.707049965776865,0.355000000000004,93.70125780833652,0.10993150684931507,93.81118931518584,2.1348178083365212,62.45036980182631,0.03393460380750793,2.890165293461165,11.166646403798739
FR0013447125,CCAMA 2 ⅛ 09/16/29,EUR,96.247,CAISSE NAT REASSURANCE,Financial,2029-09-16,2.125,NR,0.001619129,500000000,N,,Subordinated,1,FIXED,16/09/2020,16/09/2028,16/09/2019,96.009,96.484,3.9589322381930185,0.4749999999999943,99.75059073956393,0.08732876712328766,99.83791950668721,3.5035907395639327,93.11461934562246,0.0372852618451871,2.8587464059788283,10.981258734278365
XS2050968333,SW 1 ½ 09/15/27,EUR,98.18587,SMURFIT KAPPA TREASURY,Industrial,2027-09-15,1.5,BBB,0.001115092,750000000,Y,2027-06-15,Sr Unsecured,2,FIXED,15/03/2020,15/03/2027,16/09/2019,98.006,98.366,1.702943189596167,0.35999999999999943,99.2955549766926,0.4426229508196721,99.73817792751227,1.1096849766926056,66.5292509383412,0.0294558802776865,1.938314609598184,5.644228824832822
FR0013447232,COVFP 1 ⅛ 09/17/31,EUR,88.23458,COVIVIO,Financial,2031-09-17,1.125,NR,0.00050927,599000000,Y,2031-06-17,Sr Unsecured,1,FIXED,17/09/2020,17/09/2030,17/09/2019,87.976,88.493,5.708418891170431,0.5169999999999959,93.60334764851082,0.32671232876712325,93.93005997727795,5.3687676485108256,106.3028121257328,0.03469907992439719,4.755085766212857,27.426957502457757
XS2052313827,LYB 1 ⅝ 09/17/31,EUR,89.9,LYB INTERNATIONAL FINANC,Basic Materials,2031-09-17,1.625,BBB,0.003239253,500000000,Y,2031-06-17,Sr Unsecured,1,FIXED,17/09/2020,17/09/2030,17/09/2019,89.622,90.177,5.708418891170431,0.5550000000000068,96.25895518161643,0.47191780821917806,96.7308729898356,6.358955181616423,124.42287580717927,0.039202953448932466,11.361334083926664,148.25341421717403
XS2052998403,ANZNZ 0 ⅜ 09/17/29,EUR,91.52613,ANZ NEW ZEALAND INTL/LDN,Financial,2029-09-17,0.375,A+,,500000000,N,,Sr Unsecured,1,FIXED,17/09/2020,17/09/2028,17/09/2019,91.394,91.659,3.9616700889801506,0.26500000000000057,93.1583902274576,0.014383561643835616,93.17277378910144,1.632260227457607,44.84806225041385,0.042747662213920394,17.075810688174517,360.0278559618317
FR0013447166,STLA 1 ⅛ 09/18/29,EUR,92.73759,STELLANTIS NV,"Consumer, Cyclical",2029-09-18,1.125,BBB,0.024239666,600000000,Y,2029-06-18,Sr Unsecured,1,FIXED,18/09/2020,18/09/2028,18/09/2019,92.521,92.954,3.7125256673511293,0.4329999999999927,96.34267679113286,0.32363013698630133,96.66630692811916,3.6050867911328623,104.23826223996556,0.03458069408114028,5.663407100682609,38.018800735403815
XS2050404800,DHR 0.45 03/18/28,EUR,95.221,DH EUROPE FINANCE II,"Consumer, Non-cyclical",2028-03-18,0.45,A-,1.40565e-05,1250000000,Y,2027-12-18,Sr Unsecured,1,FIXED,18/03/2020,18/03/2027,18/09/2019,95.127,95.314,2.212183436002738,0.1869999999999976,96.74113005994134,0.3538356164383562,97.0949656763797,1.5201300599413372,71.7317894855358,0.04102005115606418,11.223330273667402,145.67035191502904
XS2050406094,DHR 0 ¾ 09/18/31,EUR,87.709,DH EUROPE FINANCE II,"Consumer, Non-cyclical",2031-09-18,0.75,A-,1.40565e-05,1750000000,Y,2031-06-18,Sr Unsecured,1,FIXED,18/09/2020,18/09/2030,18/09/2019,87.533,87.886,5.711156741957564,0.35299999999999443,91.60695054941131,0.21575342465753422,91.82270397406884,3.8979505494113056,77.5189850143859,0.0316880318062704,1.9254309062668016,5.586139347901149
XS2050406177,DHR 1.35 09/18/39,EUR,74.20653,DH EUROPE FINANCE II,"Consumer, Non-cyclical",2039-09-18,1.35,A-,1.40565e-05,1250000000,Y,2039-03-18,Sr Unsecured,1,FIXED,18/09/2020,18/09/2038,18/09/2019,73.935,74.478,13.45927446954141,0.5429999999999922,84.58731443354583,0.7286301369863014,85.31594457053212,10.380784433545827,107.13787236213395,0.03548877095946187,2.878354642224598,11.09472170427905
XS2051149552,DHR 1.8 09/18/49,EUR,64.21303,DH EUROPE FINANCE II,"Consumer, Non-cyclical",2049-09-18,1.8,A-,1.40565e-05,750000000,Y,2049-03-18,Sr Unsecured,1,FIXED,18/09/2020,18/09/2048,18/09/2019,63.893,64.533,23.460643394934976,0.6400000000000006,81.84651004057292,0.9715068493150686,82.81801688988799,17.63348004057292,132.17142875854807,0.03697166190353777,2.8668555704306984,11.0251038849572
XS2052320954,VZ 0 ⅞ 03/19/32,EUR,86.217,VERIZON COMMUNICATIONS,Communications,2032-03-19,0.875,BBB+,0.000164108,800000000,Y,2031-12-19,Sr Unsecured,1,FIXED,19/03/2020,19/03/2031,19/09/2019,86.013,86.421,6.2149212867898695,0.40800000000000125,91.4442897961807,0.6856164383561645,92.12990623453686,5.227289796180699,96.9775192387001,0.04161737468629553,0.9600454296388542,1.8433744539409043
XS2052321093,VZ 1 ½ 09/19/39,EUR,74.18098,VERIZON COMMUNICATIONS,Communications,2039-09-19,1.5,BBB+,0.000164108,500000000,Y,2039-03-19,Sr Unsecured,1,FIXED,19/09/2020,19/09/2038,19/09/2019,73.81,74.552,13.462012320328542,0.7420000000000044,86.27835728221231,0.8054794520547945,87.08383673426711,12.097377282212307,124.81874176850481,0.03798733323009664,2.851749071869351,10.940435484650232
XS2052968596,WPC 1.35 04/15/28,EUR,96.52827,WPC EUROBOND BV,Financial,2028-04-15,1.35,BBB+,7.04222e-05,500000000,Y,2028-01-15,Sr Unsecured,1,FIXED,15/04/2020,15/04/2027,19/09/2019,96.436,96.62,2.2888432580424367,0.1839999999999975,98.60900822903653,0.957945205479452,99.56695343451598,2.080738229036527,93.86756164506818,0.03180926957697662,3.8385752192362967,18.540264821995137
XS2042667944,KYGID 0 ⅝ 09/20/29,EUR,91.816,KERRY GROUP FIN SERVICES,"Consumer, Non-cyclical",2029-09-20,0.625,BBB+,8.22651e-06,750000000,Y,2029-06-20,Sr Unsecured,1,FIXED,20/09/2020,20/09/2028,20/09/2019,91.705,91.928,3.7180013689253935,0.22299999999999898,94.56345429670009,0.17636986301369864,94.73982415971379,2.7474542967000843,79.93443845848913,0.040526304918100615,0.9610521091811414,1.847242313123041
FR0013448859,SOCGEN 0 ⅞ 09/24/29,EUR,92.123,SOCIETE GENERALE,Financial,2029-09-24,0.875,BBB,0.00033915,750000000,N,,Sr Non Preferred,1,FIXED,24/09/2020,24/09/2028,24/09/2019,92.009,92.238,3.980835044490075,0.2289999999999992,95.00958247913994,0.016780821917808223,95.02636330105774,2.886582479139932,78.50226255614459,0.03259936599830195,4.717137677326179,27.171016624691113
XS2055104785,ASBBNK 0 ½ 09/24/29,EUR,91.614,ASB BANK LIMITED,Financial,2029-09-24,0.5,A+,,500000000,N,,Sr Unsecured,1,FIXED,24/09/2020,24/09/2028,24/09/2019,91.487,91.742,3.980835044490075,0.25500000000000966,93.59067458795643,0.009589041095890411,93.60026362905232,1.976674587956424,54.00519691996446,0.03078114939166477,1.9292773522814315,5.604325748660895
XS2055728054,BMW 0 ⅜ 09/24/27,EUR,96.36456,BMW FINANCE NV,"Consumer, Cyclical",2027-09-24,0.375,A,0.04472225,750000000,N,,Sr Unsecured,1,FIXED,24/09/2020,24/09/2026,24/09/2019,96.25,96.479,1.9794661190965093,0.2289999999999992,96.97983584967518,0.007191780821917808,96.9870276304971,0.6152758496751858,32.19038611218999,0.03299349320778069,5.534854048985413,36.90191409375376
DE000A2YPFA1,ALVGR 1.301 09/25/49,EUR,93.042,ALLIANZ SE,Financial,2049-09-25,1.301,A+,4.75964e-06,1000000000,Y,2029-09-25,Subordinated,1,VARIABLE,25/09/2020,25/06/2049,25/09/2019,92.902,93.183,3.9835728952772076,0.2810000000000059,96.6179789336768,0.02138630136986301,96.63936523504665,3.5759789336767938,96.50384432424283,0.02885950194458466,1.9389502258933116,5.648877109863952
XS2056400299,WFC 0 ⅝ 03/25/30,EUR,90.54033,WELLS FARGO & COMPANY,Financial,2030-03-25,0.625,A,0.000286223,1000000000,N,,Sr Unsecured,1,FIXED,25/03/2020,25/03/2029,25/09/2019,90.387,90.693,4.479123887748118,0.3059999999999974,93.17049901570711,0.3253424657534246,93.49584148146053,2.6301690157071107,64.60781106063864,0.03473458420770903,4.742617759270459,27.330345359484852
XS2055646918,ABBV 0 ¾ 11/18/27,EUR,96.826,ABBVIE INC,"Consumer, Non-cyclical",2027-11-18,0.75,A-,2.03341e-05,750000000,Y,2027-08-18,Sr Unsecured,1,FIXED,18/11/2019,18/11/2026,26/09/2019,96.74,96.912,1.8781656399726214,0.17200000000001125,97.82389767466023,0.09041095890410959,97.91430863356435,0.997897674660237,54.72425873888582,0.0401448750850431,11.240571984583221,146.04495912664382
XS2055647213,ABBV 1 ¼ 11/18/31,EUR,90.863,ABBVIE INC,"Consumer, Non-cyclical",2031-11-18,1.25,A-,2.03341e-05,650000000,Y,2031-08-18,Sr Unsecured,1,FIXED,18/11/2019,18/11/2030,26/09/2019,90.718,91.008,5.878165639972622,0.28999999999999204,94.05123695666094,0.1506849315068493,94.20192188816779,3.188236956660944,60.513280733396066,0.0437590194554666,16.884574630783337,354.27334703368376
XS2055651918,ABESM 1 ⅛ 03/26/28,EUR,96.267,ABERTIS INFRAESTRUCTURAS,"Consumer, Non-cyclical",2028-03-26,1.125,BBB-,0.016819763,850000000,Y,2027-12-26,Sr Unsecured,1,FIXED,26/03/2021,26/03/2027,26/09/2019,96.149,96.385,2.2340862422997945,0.2360000000000042,98.16622323446076,0.8599315068493151,99.02615474131008,1.899223234460763,87.95781843958734,0.03230666971401663,3.7527094521003552,17.981259905331683
XS2055652056,ABESM 1 ⅞ 03/26/32,EUR,92.36,ABERTIS INFRAESTRUCTURAS,"Consumer, Non-cyclical",2032-03-26,1.875,BBB-,0.016819763,650000000,Y,2031-12-26,Sr Unsecured,1,FIXED,26/03/2021,26/03/2031,26/09/2019,92.089,92.632,6.234086242299795,0.5430000000000064,97.17467698647944,1.4332191780821917,98.60789616456164,4.814676986479441,85.60836934834424,0.036263181984349586,4.7352328046842755,27.246908590764992
XS2058556536,TMO 0 ½ 03/01/28,EUR,95.427,THERMO FISHER SCIENTIFIC,"Consumer, Non-cyclical",2028-03-01,0.5,A-,3.83619e-05,800000000,Y,2027-12-01,Sr Unsecured,1,FIXED,01/03/2020,01/03/2027,30/09/2019,95.344,95.51,2.1656399726214923,0.16600000000001103,96.92348664997334,0.41643835616438357,97.33992500613772,1.4964866499733347,72.00228934403872,0.030880853750662417,1.9243575601340794,5.584876085483754
XS2058556619,TMO 0 ⅞ 10/01/31,EUR,88.259,THERMO FISHER SCIENTIFIC,"Consumer, Non-cyclical",2031-10-01,0.875,A-,3.83619e-05,900000000,Y,2031-07-01,Sr Unsecured,1,FIXED,01/10/2020,01/10/2030,30/09/2019,88.062,88.457,5.746748802190281,0.394999999999996,92.21408014374695,0.2205479452054795,92.43462808895244,3.9550801437469545,77.91462593133446,0.026196065759367212,2.9121021473617166,11.336416092250825
XS2058557260,TMO 1 ½ 10/01/39,EUR,74.91377,THERMO FISHER SCIENTIFIC,"Consumer, Non-cyclical",2039-10-01,1.5,A-,3.83619e-05,900000000,Y,2039-04-01,Sr Unsecured,1,FIXED,01/10/2020,01/10/2038,30/09/2019,74.657,75.171,13.49760438056126,0.51400000000001,86.2338919335775,0.752054794520548,86.98594672809804,11.320121933577497,115.96157007549625,0.022259366464185186,0.9782253240279163,1.9138495691390436
XS2058557344,TMO 1 ⅞ 10/01/49,EUR,64.18974,THERMO FISHER SCIENTIFIC,"Consumer, Non-cyclical",2049-10-01,1.875,A-,3.83619e-05,1000000000,Y,2049-04-01,Sr Unsecured,1,FIXED,01/10/2020,01/10/2048,30/09/2019,63.924,64.456,23.498973305954827,0.5320000000000036,83.1125755319908,0.9400684931506851,84.05264402514149,18.9228355319908,141.76448562420975,0.046034673567532866,0.9559912546583852,1.8278385579666272
XS2056491587,ASSGEN 2.124 10/01/30,EUR,95.909,GENERALI,Financial,2030-10-01,2.124,BBB+,6.64834e-07,750000000,N,,Subordinated,1,FIXED,01/10/2020,01/10/2029,01/10/2019,95.67,96.148,4.999315537303217,0.47799999999999443,99.29358351497334,0.0,99.29358351497334,3.384583514973329,72.32873072724688,0.044323585354532485,11.074001716880968,142.78487189678512
XS2056374353,MDLZ 0 ⅞ 10/01/31,EUR,87.62197,MONDELEZ INTL HLDINGS NE,"Consumer, Non-cyclical",2031-10-01,0.875,BBB+,6.19362e-06,500000000,Y,2031-07-01,Sr Unsecured,1,FIXED,01/10/2020,01/10/2030,02/10/2019,87.426,87.818,5.746748802190281,0.3919999999999959,92.21408014374695,0.2205479452054795,92.43462808895244,4.59211014374695,90.79405553880808,,,
FR0013449998,ELISGP 1 ⅝ 04/03/28,EUR,97.204,ELIS SA,"Consumer, Non-cyclical",2028-04-03,1.625,BBB-,7.64836e-05,550000000,Y,2028-01-03,Sr Unsecured,1,FIXED,03/04/2020,03/04/2027,03/10/2019,97.028,97.379,2.2559890485968515,0.3509999999999991,99.23668619728704,1.2065068493150684,100.4431930466021,2.032686197287049,92.54444912955272,0.035236360317029196,1.9122930921878174,5.522648379795062
FR0013450822,CMARK 0 ⅜ 10/03/28,EUR,93.60416,CREDIT MUTUEL ARKEA,Financial,2028-10-03,0.375,A+,1.22381e-05,500000000,N,,Sr Preferred,1,FIXED,03/10/2020,03/10/2027,03/10/2019,93.518,93.69,3.0061601642710474,0.17199999999999704,95.21829353661657,0.3729452054794521,95.59123874209602,1.6141335366165777,57.055807246908756,0.039294360666282974,2.853114026779009,10.938313588697
XS2063247915,SANTAN 0.3 10/04/26,EUR,98.116,BANCO SANTANDER SA,Financial,2026-10-04,0.3,A+,0.000140759,1000000000,N,,Sr Preferred,1,FIXED,04/10/2020,04/10/2025,04/10/2019,98.046,98.187,1.0075290896646132,0.14099999999999113,98.39696433601982,0.29753424657534244,98.69449858259516,0.28096433601982085,28.36189135763048,0.031185207639141958,1.928517125951728,5.599918098011643
DE000A2R8ND3,ANNGR 0 ⅝ 10/07/27,EUR,96.19662,VONOVIA SE,Financial,2027-10-07,0.625,BBB+,0.001036135,500000000,Y,2027-07-07,Sr Unsecured,1,FIXED,07/10/2020,07/10/2026,07/10/2019,96.124,96.269,1.7631759069130732,0.14500000000001023,97.7485499670357,0.14726027397260275,97.8958102410083,1.5519299670357043,90.89475286983058,,,
DE000A2R8NE1,ANNGR 1 ⅝ 10/07/39,EUR,72.70403,VONOVIA SE,Financial,2039-10-07,1.625,BBB+,0.001036135,500000000,Y,2039-07-07,Sr Unsecured,1,FIXED,07/10/2020,07/10/2038,07/10/2019,72.409,72.999,13.763175906913073,0.5899999999999892,87.3433504465603,0.38287671232876713,87.72622715888906,14.63932044656029,150.0360734114679,0.037680334619810775,4.765978163768245,27.458229426863525
XS2063232727,C 0 ½ 10/08/27,EUR,98.129,CITIGROUP INC,Financial,2027-10-08,0.5,A-,0.000312288,1500000000,Y,2026-10-08,Sr Unsecured,1,VARIABLE,08/10/2020,08/07/2027,08/10/2019,98.063,98.195,1.0184804928131417,0.1319999999999908,98.57968518681602,0.4904109589041096,99.07009614572013,0.4506851868160169,44.96041580835207,,,
XS2063268754,IDSLN 1 ¼ 10/08/26,EUR,98.708,INT DISTRIBUTION SERV,Industrial,2026-10-08,1.25,NR,0.003828601,550000000,Y,2026-07-08,Sr Unsecured,1,FIXED,08/10/2020,08/10/2025,08/10/2019,98.638,98.778,0.7665982203969883,0.14000000000000057,99.48192620467711,0.2910958904109589,99.77302209508807,0.7739262046771103,101.51053342169966,,,
XS2062490649,ENAPHO 2.045 10/09/28,EUR,97.192,EP INFRASTRUCTURE AS,Utilities,2028-10-09,2.045,BBB-,0.003085091,500000000,Y,2028-07-09,Sr Unsecured,1,FIXED,09/10/2020,09/10/2027,09/10/2019,96.846,97.537,2.7707049965776864,0.6910000000000025,100.07533205372191,0.47063013698630135,100.54596219070821,2.883332053721915,107.27693352723502,0.03990723478388383,7.19839475015636,60.92721805722643
XS2063350925,HANRUE 1 ⅛ 10/09/39,EUR,92.207,HANNOVER RE,Financial,2039-10-09,1.125,NR,1.34716e-07,750000000,Y,2029-07-09,Subordinated,1,VARIABLE,09/10/2020,11/07/2039,09/10/2019,92.032,92.382,3.7700205338809036,0.3500000000000085,96.25929485766036,0.2589041095890411,96.5181989672494,4.052294857660371,115.81011826274502,0.03330965000334163,2.877168281832482,11.104154705492354
XS2063495811,DLR 1 ⅛ 04/09/28,EUR,96.192,DIGITAL EURO FINCO,Financial,2028-04-09,1.125,BBB,0.000167809,500000000,Y,2028-01-09,Sr Unsecured,1,FIXED,09/04/2020,09/04/2027,09/10/2019,96.056,96.329,2.272416153319644,0.27299999999999613,98.12702908368438,0.8167808219178082,98.94380990560218,1.935029083684384,88.17194748958644,0.03776023808173523,11.73915568337839,155.05846684558898
XS2063535970,NEPSJ 1 ⅞ 10/09/26,EUR,99.436,NE PROPERTY BV,Financial,2026-10-09,1.875,BBB,0.003935961,249997000,Y,2026-07-09,Sr Unsecured,1,FIXED,09/10/2020,09/10/2025,09/10/2019,99.294,99.578,0.7693360711841205,0.284000000000006,99.95226540297367,0.4315068493150685,100.38377225228874,0.5162654029736586,66.97538608104219,0.029900913914269023,1.923871858500958,5.58651125482695
FR0013452620,VIEFP 0 ½ 10/14/31,EUR,85.356,VEOLIA ENVIRONNEMENT SA,Utilities,2031-10-14,0.5,NR,0.000200524,700000000,Y,2031-07-14,Sr Unsecured,1,FIXED,14/10/2020,14/10/2030,14/10/2019,85.135,85.577,5.782340862422998,0.44199999999999307,90.14125273816025,0.10821917808219178,90.24947191624244,4.785252738160253,95.49074474345441,0.03054542433870532,1.9285293066165896,5.602273517111359
FR0013452893,TKOFP 2 ¼ 10/14/26,EUR,99.588,TIKEHAU CAPITAL SCA,Financial,2026-10-14,2.25,BBB-,1.06585e-05,300000000,Y,2026-07-14,Sr Unsecured,1,FIXED,14/10/2020,14/10/2025,14/10/2019,99.41,99.767,0.783025325119781,0.3569999999999993,100.24054277664693,0.486986301369863,100.7275290780168,0.6525427766469392,82.94652450287957,0.02862408863045403,3.8503194801867098,18.65428263297657
FR0013453040,ALOFP 0 ¼ 10/14/26,EUR,97.961,ALSTOM SA,Industrial,2026-10-14,0.25,NR,0.00084863,700000000,Y,2026-07-14,Sr Unsecured,1,FIXED,14/10/2020,14/10/2025,14/10/2019,97.902,98.02,0.783025325119781,0.117999999999995,98.7031988713128,0.05410958904109589,98.75730846035388,0.7421988713127945,96.27531619175507,0.0317109977312623,0.9692636815920398,1.8789441689067101
XS2058888616,EXOIM 1 ¾ 10/14/34,EUR,84.908,EXOR NV,Financial,2034-10-14,1.75,NR,2.32729e-06,500000000,Y,2034-07-14,Sr Unsecured,1,FIXED,14/10/2020,14/10/2033,14/10/2019,84.645,85.171,8.78302532511978,0.5260000000000105,93.8564371751455,0.37876712328767126,94.23520429843317,8.9484371751455,122.52498534734109,,,
XS2065601937,IREIM 0 ⅞ 10/14/29,EUR,93.097,IREN SPA,Utilities,2029-10-14,0.875,BBB,6.77917e-05,500000000,Y,2029-07-14,Sr Unsecured,1,FIXED,14/10/2020,14/10/2028,14/10/2019,92.967,93.227,3.783709787816564,0.2600000000000051,95.3387681004022,0.18938356164383563,95.52815166204604,2.2417681004022114,63.623099343861774,0.026880167364795756,3.6994786955888785,17.698172590447673
XS2064302735,PEP 0 ⅞ 10/16/39,EUR,70.6246,PEPSICO INC,"Consumer, Non-cyclical",2039-10-16,0.875,A+,2.5576e-06,500000000,Y,2039-04-16,Sr Unsecured,1,FIXED,16/10/2020,16/10/2038,16/10/2019,70.347,70.903,13.538672142368242,0.5560000000000116,79.08856203755781,0.4027397260273973,79.4913017635852,8.463962037557806,89.2846489112444,0.03606948033093816,9.64155538352181,113.3257365514133
FR0013453974,ALTAFP 1 ⅞ 01/17/28,EUR,97.866,ALTAREA,Financial,2028-01-17,1.875,NR,0.000407773,450000000,Y,2027-10-17,Sr Unsecured,1,FIXED,17/01/2020,17/01/2027,17/10/2019,97.671,98.06,2.0424366872005475,0.3889999999999958,99.85171227616001,1.792808219178082,101.6445204953381,1.9857122761600152,99.21913223742386,0.03754265071726791,5.645843956433792,37.79012978667219
XS2068065163,INFLN 1 ¼ 04/22/28,EUR,96.54979,INFORMA PLC,Communications,2028-04-22,1.25,BBB,1.36352e-05,500000000,Y,2028-01-22,Sr Unsecured,1,FIXED,22/04/2020,22/04/2027,22/10/2019,96.464,96.636,2.308008213552361,0.17199999999999704,98.37004094594286,0.8630136986301371,99.233054644573,1.8202509459428597,81.48514414025337,0.02417146826856288,0.9763990024937654,1.90671002414164
XS2066392452,SUMIBK 0.632 10/23/29,EUR,91.682,SUMITOMO MITSUI FINL GRP,Financial,2029-10-23,0.632,A,0.000331437,1250000000,N,,Sr Unsecured,1,FIXED,23/10/2020,23/10/2028,23/10/2019,91.579,91.785,4.060232717316906,0.20600000000000307,93.94562642768156,0.5939068493150685,94.53953327699662,2.263626427681558,60.63492646805256,0.045725013866884705,0.9562743424317616,1.8289212359865958
FR0013455540,BPCEGP 0 ½ 02/24/27,EUR,97.411,BPCE SA,Financial,2027-02-24,0.5,BBB+,1.82924e-05,1000000000,N,,Sr Non Preferred,1,FIXED,24/02/2020,24/02/2026,24/10/2019,97.335,97.487,1.3990417522245038,0.15200000000000102,98.05541905985439,0.3,98.35541905985438,0.6444190598543855,47.123763979948514,0.04937879895930764,0.9529447335811646,1.8162073305201532
XS2069380991,EOANGR 0 ¼ 10/24/26,EUR,97.91845,E.ON SE,Utilities,2026-10-24,0.25,BBB+,0.00010082,750000000,Y,2026-07-24,Sr Unsecured,1,FIXED,24/10/2020,24/10/2025,24/10/2019,97.855,97.982,0.810403832991102,0.12699999999999534,98.65956705410066,0.04726027397260274,98.70682732807326,0.7411170541006555,92.93435528041904,0.0318874288310044,5.654583659025902,38.00459531024558
XS2072829794,NFLX 3 ⅝ 06/15/30,EUR,103.509,NETFLIX INC,Communications,2030-06-15,3.625,A-,6.46298e-07,1100000000,Y,2030-03-15,Sr Unsecured,2,FIXED,15/06/2020,15/12/2029,25/10/2019,103.306,103.712,4.4517453798767965,0.4060000000000059,105.94177384149363,0.1602209944751381,106.10199483596877,2.4327738414936277,55.827141607140646,0.03343460050987239,0.967647105590062,1.8726818419136486
XS2229743724,EOANGR 3 ½ 10/26/37,EUR,98.973,E.ON SE,Utilities,2037-10-26,3.5,BBB+,0.00010082,462100000,N,,Sr Unsecured,1,FIXED,26/10/2020,26/10/2036,26/10/2019,98.39,99.555,12.068446269678303,1.1650000000000063,108.72155220029317,3.26027397260274,111.98182617289592,9.748552200293176,93.27326456980315,0.03124033560887569,5.647396553292107,37.955488964584795
FR0013456621,URWFP 0 ⅞ 03/29/32,EUR,84.785,UNIBAIL-RODAMCO-WESTFLD,Financial,2032-03-29,0.875,BBB,0.008889247,750000000,Y,2031-12-29,Sr Unsecured,1,FIXED,29/03/2020,29/03/2031,28/10/2019,84.565,85.006,6.242299794661191,0.4410000000000025,91.39788736243699,0.6616438356164385,92.05953119805343,6.612887362436993,123.22292086181639,0.03680888294977038,2.8600850827474167,10.99147816640825
XS2068969067,RABOBK 0 ¼ 10/30/26,EUR,97.884,COOPERATIEVE RABOBANK UA,Financial,2026-10-30,0.25,A-,5.75847e-06,750000000,N,,Sr Non Preferred,1,FIXED,30/10/2020,30/10/2025,30/10/2019,97.835,97.934,1.0787132101300478,0.09900000000000375,98.23196554983313,0.23013698630136986,98.46210253613451,0.347965549833134,32.87419617343343,0.0341239492722718,4.770299707804601,27.554265760591502
XS2010038730,DOV 0 ¾ 11/04/27,EUR,96.34464,DOVER CORP,Industrial,2027-11-04,0.75,BBB+,8.65558e-06,500000000,Y,2027-08-04,Sr Unsecured,1,FIXED,04/11/2020,04/11/2026,04/11/2019,96.261,96.428,1.839835728952772,0.1670000000000016,97.8702465467415,0.11917808219178083,97.98942462893328,1.5256065467414999,85.58108175479556,0.03983632003668209,17.44016814214027,371.1492134279022
XS2075811781,SESGFP 0 ⅞ 11/04/27,EUR,96.1283,SES SA,Communications,2027-11-04,0.875,BBB-,0.006157273,500000000,Y,2027-08-04,Sr Unsecured,1,FIXED,04/11/2020,04/11/2026,04/11/2019,95.897,96.359,1.839835728952772,0.4619999999999891,98.09404952339645,0.139041095890411,98.23309061928686,1.965749523396454,110.32145269647899,0.03484432123654848,4.766845300756945,27.514930387704158
XS2075811948,JPM 1.047 11/04/32,EUR,88.47,JPMORGAN CHASE & CO,Financial,2032-11-04,1.047,A+,0.0001373,1750000000,Y,2031-11-04,Sr Unsecured,1,VARIABLE,04/11/2020,04/08/2032,04/11/2019,88.315,88.625,6.091718001368926,0.3100000000000023,92.6243077128305,0.9494712328767123,93.57377894570722,4.1543077128305015,77.42349810244484,0.02430995188655361,0.976266996291718,1.9061944960969062
DE000A2R9ZU9,MBGGR 0 ⅝ 05/06/27,EUR,97.36949,MERCEDES-BENZ INT FINCE,"Consumer, Cyclical",2027-05-06,0.625,A,0.042824479,1250000000,N,,Sr Unsecured,1,FIXED,06/05/2020,06/05/2026,06/11/2019,97.292,97.447,1.593429158110883,0.15500000000000114,97.97546869098292,0.2534246575342466,98.22889334851718,0.6059786909829228,38.962873681335054,0.046999209222957465,0.9551105590062112,1.8244723598503148
DE000A2YPFU9,MBGGR 1 ⅛ 11/06/31,EUR,89.21523,MERCEDES-BENZ GROUP AG,"Consumer, Cyclical",2031-11-06,1.125,A,0.001270443,1000000000,N,,Sr Unsecured,1,FIXED,06/11/2020,06/11/2030,06/11/2019,88.985,89.446,6.09719370294319,0.4609999999999985,93.0562542057304,1.014041095890411,94.0702953016208,3.841024205730392,71.19720619217088,0.0389703999232967,11.718274399338148,154.5772100365939
XS2071382662,VCXAU 1 ⅛ 11/07/29,EUR,92.864,VICINITY CENTRES TRUST,Financial,2029-11-07,1.125,A,0.000540009,500000000,Y,2029-08-07,Sr Unsecured,1,FIXED,07/11/2020,07/11/2028,07/11/2019,92.722,93.007,3.8494182067077345,0.2850000000000108,96.14452483611305,0.16952054794520546,96.31404538405826,3.2805248361130452,91.60001107941346,0.030136643647967722,3.8449507335608324,18.60141036508836
XS2075937370,LLY 0 ⅝ 11/01/31,EUR,87.38348,ELI LILLY & CO,"Consumer, Non-cyclical",2031-11-01,0.625,A+,1.33291e-05,600000000,Y,2031-08-01,Sr Unsecured,1,FIXED,01/11/2020,01/11/2030,07/11/2019,87.208,87.559,5.831622176591376,0.3509999999999991,90.72370633667951,0.10445205479452055,90.82815839147403,3.340226336679507,65.32593403933086,0.029731751539953555,3.8464971137274064,18.616256564659203
XS2075938006,LLY 1.7 11/01/49,EUR,66.01739,ELI LILLY & CO,"Consumer, Non-cyclical",2049-11-01,1.7,A+,1.33291e-05,1000000000,Y,2049-05-01,Sr Unsecured,1,FIXED,01/11/2020,01/11/2048,07/11/2019,65.665,66.37,23.581108829568787,0.7049999999999983,80.05718671156698,0.7126027397260275,80.76978945129301,14.039796711566979,103.20279948704314,0.024705078662683434,0.9758905472636815,1.904724720477216
XS2077546682,EOANGR 0 ⅝ 11/07/31,EUR,87.08382,E.ON SE,Utilities,2031-11-07,0.625,BBB+,0.00010082,500000000,Y,2031-08-07,Sr Unsecured,1,FIXED,07/11/2020,07/11/2030,07/11/2019,86.888,87.28,5.848049281314168,0.3919999999999959,90.69391160801388,0.09417808219178081,90.78808969020565,3.6100916080138745,70.54316743387469,0.040962562123693654,0.9606493416630422,1.8456943152752723
ES0213307061,CABKSM 1 ⅛ 11/12/26,EUR,98.725,CAIXABANK SA,Financial,2026-11-12,1.125,A-,0.000118254,750000000,N,,Sr Non Preferred,1,FIXED,12/11/2020,12/11/2025,12/11/2019,98.641,98.808,1.1143052703627652,0.1670000000000016,99.1295796908874,0.9955479452054795,100.12512763609287,0.4045796908874024,36.68046171365495,0.02812042318772586,2.891906942545387,11.217624249543592
XS2070192591,BSX 0 ⅝ 12/01/27,EUR,96.108,BOSTON SCIENTIFIC CORP,"Consumer, Non-cyclical",2027-12-01,0.625,A-,3.19353e-07,900000000,Y,2027-09-01,Sr Unsecured,1,FIXED,01/12/2020,01/12/2026,12/11/2019,96.043,96.173,1.9164955509924708,0.12999999999999545,97.54457394768339,0.05136986301369863,97.5959438106971,1.4365739476833852,77.57826433792545,0.025469442798471534,0.9751631382316314,1.9018862923315276
XS2078409716,CL 0 ⅞ 11/12/39,EUR,69.62926,COLGATE-PALMOLIVE CO,"Consumer, Non-cyclical",2039-11-12,0.875,A+,1.17308e-06,500000000,Y,2039-05-12,Sr Unsecured,1,FIXED,12/11/2020,12/11/2038,12/11/2019,69.338,69.92,13.609856262833675,0.5820000000000078,78.96979150294057,0.34041095890410966,79.31020246184468,9.340531502940564,98.84947508313597,0.03157696160465063,4.795095797851465,27.79091431940811
XS2078667925,OPBANK 0 ⅝ 11/12/29,EUR,91.124,OP CORPORATE BANK PLC,Financial,2029-11-12,0.625,A-,1.29446e-05,500000000,N,,Sr Non Preferred,1,FIXED,12/11/2020,12/11/2028,12/11/2019,90.989,91.259,4.114989733059549,0.269999999999996,93.82022442886262,0.553082191780822,94.37330662064343,2.696224428862621,71.53018394839404,0.028361942726976758,0.9724202719406676,1.8912023705623242
XS2078737215,SEB 0 ⅝ 11/12/29,EUR,91.266,SKANDINAVISKA ENSKILDA,Financial,2029-11-12,0.625,A,5.4877e-05,1000000000,N,,Sr Non Preferred,1,FIXED,12/11/2020,12/11/2028,12/11/2019,91.165,91.368,4.114989733059549,0.20299999999998875,93.82022442886262,0.553082191780822,94.37330662064343,2.554224428862611,67.71016444088026,0.04646677370253753,0.9555965130759653,1.8263293916058865
XS2078692105,SANSCF 0 ½ 11/14/26,EUR,98.077,SANTAN CONSUMER FINANCE,Financial,2026-11-14,0.5,A,0.008725382,500000000,N,,Sr Preferred,1,FIXED,14/11/2020,14/11/2025,14/11/2019,98.008,98.146,1.1197809719370295,0.13800000000000523,98.4396211431903,0.4397260273972603,98.87934717058755,0.3626211431902959,32.93650467783226,0.02449662727595494,0.9760891089108908,1.9054998970689137
XS2079105891,ZBH 1.164 11/15/27,EUR,97.18313,ZIMMER BIOMET HOLDINGS,"Consumer, Non-cyclical",2027-11-15,1.164,BBB,1.83175e-05,500000000,Y,2027-09-15,Sr Unsecured,1,FIXED,15/11/2020,15/11/2026,15/11/2019,97.09,97.276,1.9548254620123204,0.18599999999999284,98.51845551120023,0.05102465753424657,98.56948016873447,1.3353255112002245,70.1437317291364,0.03577639166673833,2.877546710128261,11.088517477471195
XS2079107830,SKFBSS 0 ⅞ 11/15/29,EUR,94.501,SKF AB,Industrial,2029-11-15,0.875,BBB+,3.44864e-05,300000000,Y,2029-08-15,Sr Unsecured,1,FIXED,15/11/2020,15/11/2028,15/11/2019,94.113,94.889,3.871321013004791,0.7759999999999962,95.19213565474239,0.11267123287671234,95.3048068876191,0.6911356547423821,19.05138011727281,0.03019896598784553,3.825692209552541,18.47634282807516
XS2079713322,BBVASM 0 ⅜ 11/15/26,EUR,97.882,BANCO BILBAO VIZCAYA ARG,Financial,2026-11-15,0.375,A,9.10572e-05,1000000000,N,,Sr Preferred,1,FIXED,15/11/2020,15/11/2025,15/11/2019,97.82,97.945,1.1225188227241616,0.125,98.29837309437711,0.3287671232876712,98.62714021766479,0.4163730943771071,37.79073372657838,0.03650645494051441,1.9138291926242554,5.524093062093799
XS2079716937,AAPL 0 ½ 11/15/31,EUR,87.88314,APPLE INC,Technology,2031-11-15,0.5,AA+,1.07934e-06,1000000000,Y,2031-08-15,Sr Unsecured,1,FIXED,15/11/2020,15/11/2030,15/11/2019,87.686,88.08,5.8699520876112254,0.39399999999999125,89.97272749165488,0.06438356164383562,90.03711105329872,2.089587491654882,40.52958725740219,0.04639040917383368,0.9556662515566626,1.8265959687287248
FR0013460607,BVIFP 1 ⅛ 01/18/27,EUR,98.336,BUREAU VERITAS SA,"Consumer, Non-cyclical",2027-01-18,1.125,NR,8.85117e-07,500000000,Y,2026-10-18,Sr Unsecured,1,FIXED,18/01/2021,18/01/2026,18/11/2019,98.262,98.409,1.0458590006844628,0.14700000000000557,99.18301470721364,1.0726027397260274,100.25561744693967,0.8470147072136456,81.95005512596482,0.03484552222726994,4.754380577735814,27.418957378237426
XS2076155105,ABT 0 ⅜ 11/19/27,EUR,95.918,ABBOTT IRELAND FINANCING,"Consumer, Non-cyclical",2027-11-19,0.375,AA-,2.10045e-08,590000000,Y,2027-08-19,Sr Unsecured,1,FIXED,19/11/2020,19/11/2026,19/11/2019,95.827,96.01,1.8809034907597535,0.18300000000000693,97.13434744867001,0.04417808219178082,97.17852553086179,1.2163474486700068,67.05559986403196,0.048400507181608425,0.9538339529120198,1.819598419455538
XS2081018629,ISPIM 1 11/19/26,EUR,98.585,INTESA SANPAOLO SPA,Financial,2026-11-19,1.0,BBB+,0.000100348,1250000000,N,,Sr Preferred,1,FIXED,19/11/2020,19/11/2025,19/11/2019,98.519,98.65,1.1334702258726899,0.13100000000000023,98.97586292054005,0.8657534246575342,99.8416163451976,0.39086292054005867,34.890359481068444,0.04313678608689635,7.200050124814351,60.82732598467549
XS2082345955,CCHLN 0 ⅝ 11/21/29,EUR,91.74003,COCA-COLA HBC FINANCE BV,"Consumer, Non-cyclical",2029-11-21,0.625,BBB+,0.014100174,500000000,Y,2029-08-21,Sr Unsecured,1,FIXED,21/11/2020,21/11/2028,21/11/2019,91.636,91.844,3.887748117727584,0.2079999999999984,94.24012429775459,0.0702054794520548,94.31032977720665,2.500094297754586,69.7574486624832,,,
XS2010038227,MCO 0.95 02/25/30,EUR,92.30965,MOODY'S CORPORATION,"Consumer, Non-cyclical",2030-02-25,0.95,BBB+,2.0364e-06,750000000,Y,2029-11-25,Sr Unsecured,1,FIXED,25/02/2020,25/02/2029,25/11/2019,92.086,92.533,4.1505817932922655,0.44700000000000273,95.03549307020032,0.8068493150684931,95.84234238526881,2.7258430702003125,71.14763653090169,0.03449072016380095,2.8630485683729066,11.023039568140693
XS2083147343,ALB 1 ⅝ 11/25/28,EUR,96.16023,ALBEMARLE NEW HOLDING,Basic Materials,2028-11-25,1.625,BBB-,0.012463838,500000000,Y,2028-08-25,Sr Unsecured,1,FIXED,25/11/2020,25/11/2027,25/11/2019,95.988,96.333,2.8993839835728954,0.34499999999999886,98.88724902917997,0.16472602739726028,99.05197505657723,2.7270190291799707,97.85832549168214,,,
FR0013463668,EFFP 0 ⅜ 11/27/27,EUR,95.925,ESSILORLUXOTTICA,"Consumer, Non-cyclical",2027-11-27,0.375,A,4.39364e-06,1500000000,Y,2027-08-27,Sr Unsecured,1,FIXED,27/11/2020,27/11/2026,27/11/2019,95.842,96.008,1.9028062970568105,0.16599999999999682,97.09997953642691,0.03595890410958904,97.1359384405365,1.1749795364269175,64.04239080277426,0.033900410968654635,2.879148190552993,11.110139780224914
FR0013463676,EFFP 0 ¾ 11/27/31,EUR,87.64795,ESSILORLUXOTTICA,"Consumer, Non-cyclical",2031-11-27,0.75,A,4.39364e-06,1000000000,Y,2031-08-27,Sr Unsecured,1,FIXED,27/11/2020,27/11/2030,27/11/2019,87.483,87.813,5.90280629705681,0.3299999999999983,91.27978923469753,0.07191780821917808,91.35170704291671,3.631839234697537,70.0953041223938,0.03799318009861989,1.9169946619513718,5.531041845733665
DE000A254P51,LEGGR 0 ⅞ 11/28/27,EUR,96.218,LEG IMMOBILIEN SE,Financial,2027-11-28,0.875,NR,0.002113952,500000000,Y,2027-08-28,Sr Unsecured,1,FIXED,28/11/2020,28/11/2026,28/11/2019,96.114,96.323,1.9055441478439425,0.20899999999998897,98.02254050764864,0.0815068493150685,98.1040473569637,1.804540507648639,97.81364270392184,0.029562954564951487,2.8914339103358118,11.204736531272067
DE000A254P69,LEGGR 1 ⅝ 11/28/34,EUR,82.13,LEG IMMOBILIEN SE,Financial,2034-11-28,1.625,NR,0.002113952,500000000,Y,2034-08-28,Sr Unsecured,1,FIXED,28/11/2020,28/11/2033,28/11/2019,81.827,82.433,8.906228610540726,0.6060000000000088,92.73419004667328,0.15136986301369865,92.88555990968698,10.604190046673281,146.02236406281864,0.03588026194353153,4.724915511277526,27.174233551825456
XS2081615473,HOLNSW 0 ½ 11/29/26,EUR,97.966,HOLCIM FINANCE LUX SA,Industrial,2026-11-29,0.5,BBB+,1.36262e-05,500000000,Y,2026-08-29,Sr Unsecured,1,FIXED,29/11/2020,29/11/2025,29/11/2019,97.901,98.03,0.9089664613278576,0.1290000000000049,98.72686810160204,0.045205479452054796,98.77207358105409,0.7608681016020427,85.0174598235905,0.02463811158278462,0.9759543283582087,1.9049737020822441
XS2084488209,FMEGR 1 ¼ 11/29/29,EUR,93.833,FRESENIUS MEDICAL CARE A,"Consumer, Non-cyclical",2029-11-29,1.25,BBB-,0.000235876,500000000,Y,2029-08-29,Sr Unsecured,1,FIXED,29/11/2020,29/11/2028,29/11/2019,93.591,94.074,3.909650924024641,0.4830000000000041,96.52255702891232,0.113013698630137,96.63557072754246,2.6895570289123185,73.57675863122978,,,
XS2084497705,FMEGR 0 ⅝ 11/30/26,EUR,98.066,FRESENIUS MEDICAL CARE A,"Consumer, Non-cyclical",2026-11-30,0.625,BBB-,0.000235876,400025000,Y,2026-08-30,Sr Unsecured,1,FIXED,30/11/2020,30/11/2025,29/11/2019,97.986,98.146,0.9117043121149897,0.1599999999999966,98.83511429867082,0.0547945205479452,98.88990881921876,0.7691142986708144,85.58189465848952,0.03941194134631531,7.1728265108947635,60.653029525369185
FR0013464815,AKEFP 0 ¾ 12/03/29,EUR,92.588,ARKEMA,Basic Materials,2029-12-03,0.75,BBB+,0.001210346,500000000,Y,2029-09-03,Sr Unsecured,1,FIXED,03/12/2020,03/12/2028,03/12/2019,92.43,92.747,3.923340177960301,0.31699999999999307,94.6389517253458,0.057534246575342465,94.69648597192115,2.0509517253458114,56.43910251326922,0.027587215032365817,0.9731534076827758,1.894055109769198
XS2085655590,FIS 1 12/03/28,EUR,94.705,FIDELITY NATL INFO SERV,Technology,2028-12-03,1.0,BBB,5.41796e-05,625000000,Y,2028-09-03,Sr Unsecured,1,FIXED,03/12/2020,03/12/2027,03/12/2019,94.587,94.823,2.924024640657084,0.23599999999999,97.1165571670954,0.07671232876712329,97.19326949586252,2.4115571670953955,86.76884902460357,0.03744918602011636,2.8655161350714864,11.01485741154297
XS2087639626,SYK 0 ¾ 03/01/29,EUR,93.754,STRYKER CORP,"Consumer, Non-cyclical",2029-03-01,0.75,BBB+,6.05078e-07,800000000,Y,2028-12-01,Sr Unsecured,1,FIXED,01/03/2021,01/03/2028,03/12/2019,93.656,93.853,3.167693360711841,0.19699999999998852,96.00490550161746,0.6246575342465753,96.62956303586404,2.250905501617453,75.45785312374743,0.04101441451584889,17.787105902889945,390.791872944893
XS2087643651,SYK 1 12/03/31,EUR,88.344,STRYKER CORP,"Consumer, Non-cyclical",2031-12-03,1.0,BBB+,6.05078e-07,750000000,Y,2031-09-03,Sr Unsecured,1,FIXED,03/12/2020,03/12/2030,03/12/2019,88.152,88.535,5.921971252566735,0.38299999999999557,92.62151079612082,0.07671232876712329,92.69822312488795,4.277510796120822,81.8894260444849,0.0331720227510955,5.653609982021037,37.96486268879625
DE000CZ45VC5,CMZB 0 ½ 12/04/26,EUR,98.08341,COMMERZBANK AG,Financial,2026-12-04,0.5,A,0.000516517,1000000000,N,,Sr Preferred,1,FIXED,04/12/2020,04/12/2025,04/12/2019,98.004,98.162,1.1745379876796715,0.15800000000000125,98.36406383085287,0.4123287671232877,98.77639259797616,0.2806538308528701,24.313158915904598,0.02831984312315354,1.935118965702234,5.635946573972076
XS2081500907,FCCSER 1.661 12/04/26,EUR,98.97,SERVICIOS MEDIO AMBIENTE,Industrial,2026-12-04,1.661,NR,0.000257581,500000000,Y,2026-09-23,Sr Unsecured,1,FIXED,04/12/2020,04/12/2025,04/12/2019,98.899,99.04,0.9774127310061602,0.14100000000000534,99.74934950385584,0.036405479452054794,99.7857549833079,0.7793495038558405,80.16593802899939,0.044161161856901845,11.356972702579503,154.1431853321558
XS2089229806,MRLSM 1 ⅞ 12/04/34,EUR,86.055,MERLIN PROPERTIES SOCIMI,Financial,2034-12-04,1.875,BBB+,3.63482e-05,600000000,Y,2034-09-04,Sr Unsecured,1,FIXED,04/12/2020,04/12/2033,04/12/2019,85.766,86.343,8.92539356605065,0.5769999999999982,94.70406997164027,0.1386986301369863,94.84276860177725,8.649069971640259,115.94214223553728,0.0267077538588026,0.9739869950738917,1.897301333146139
XS2084759757,CNUNZ 0 ⅞ 12/05/26,EUR,98.16685,CHORUS LTD,Communications,2026-12-05,0.875,BBB,3.29553e-05,300000000,N,,Sr Unsecured,1,FIXED,05/12/2020,05/12/2025,05/12/2019,98.094,98.24,1.1772758384668036,0.1460000000000008,98.79245746861865,0.7191780821917809,99.51163555081042,0.6256074686186537,53.935190981696095,0.030555114425406395,0.9703508196721312,1.883161426476754
XS2091606330,CB 0 ⅞ 12/15/29,EUR,91.997,CHUBB INA HOLDINGS LLC,Financial,2029-12-15,0.875,A,2.80507e-07,700000000,Y,2029-09-15,Sr Unsecured,1,FIXED,15/12/2020,15/12/2028,06/12/2019,91.85,92.144,3.9561943874058865,0.29400000000001114,95.05058716239992,0.038356164383561646,95.08894332678348,3.0535871623999213,83.58839390378375,0.0278031396457917,4.813266635381468,27.999567523805794
XS2089226026,DT 1 ¾ 12/09/49,EUR,64.51714,DEUTSCHE TELEKOM AG,Communications,2049-12-09,1.75,BBB+,0.000125821,715000000,N,,Sr Unsecured,1,FIXED,09/12/2020,09/12/2048,09/12/2019,64.056,64.978,24.188911704312115,0.921999999999997,80.56422324472585,1.419178082191781,81.98340132691763,16.047083244725854,117.58898525670332,0.03275081491965406,3.82483496122609,18.44056281210269
XS2090807293,IGIM 1 12/11/31,EUR,87.57818,ITALGAS SPA,Utilities,2031-12-11,1.0,BBB,3.11332e-05,500000000,N,,Sr Unsecured,1,FIXED,11/12/2020,11/12/2030,11/12/2019,87.384,87.772,6.193018480492813,0.38800000000000523,92.19747259215282,0.8054794520547945,93.00295204420762,4.619292592152817,85.2499818203737,0.03406753189846876,5.6664589977455115,38.05861200620023
DE000A2SBDE0,JABHOL 1 12/20/27,EUR,96.486,JAB HOLDINGS BV,Financial,2027-12-20,1.0,BBB,0.004836786,600000000,N,,Sr Unsecured,1,FIXED,20/12/2020,20/12/2026,18/12/2019,96.404,96.567,2.217659137577002,0.1629999999999967,97.91433798111309,0.7808219178082192,98.69515989892132,1.4283379811130885,66.59842130291658,0.027386757444720595,0.9733432835820894,1.8947942953887271
DE000A2SBDF7,JABHOL 2 ¼ 12/19/39,EUR,77.735,JAB HOLDINGS BV,Financial,2039-12-19,2.25,BBB,0.004836786,750000000,N,,Sr Unsecured,1,FIXED,19/12/2020,19/12/2038,18/12/2019,77.445,78.024,14.21492128678987,0.5790000000000077,94.20604567206924,1.763013698630137,95.96905937069937,16.471045672069238,158.7241505261838,0.028258331684022475,0.9725182565379823,1.8915835185993535
XS2093881030,AMCR 1 ½ 01/15/27,EUR,98.85968,BERRY GLOBAL INC,Industrial,2027-01-15,1.5,BBB,0.02423694,375000000,Y,2026-10-15,1st lien,2,FIXED,15/07/2020,15/07/2026,02/01/2020,98.499,99.22,1.0376454483230664,0.7210000000000036,99.578533467019,0.6926229508196722,100.27115641783867,0.7188534670190023,70.048173970118,0.030279966010744862,5.6890679677959985,38.35423930593485
CH0517825276,UBS 0.65 01/14/28,EUR,97.66581,UBS GROUP AG,Financial,2028-01-14,0.65,A-,0.000727758,1250000000,Y,2027-01-14,Sr Unsecured,1,VARIABLE,14/01/2021,14/01/2027,14/01/2020,97.574,97.757,1.2867898699520877,0.18300000000000693,98.39819624717036,0.46301369863013697,98.8612099458005,0.7323862471703677,58.041692344743055,0.030142819306073577,0.9707391841779974,1.8846691273971277
DE000A28RSR6,ALVGR 0 ½ 01/14/31,EUR,89.491,ALLIANZ FINANCE II B.V.,Financial,2031-01-14,0.5,AA,4.75964e-06,750000000,Y,2030-10-14,Sr Unsecured,1,FIXED,14/01/2021,14/01/2030,14/01/2020,89.249,89.732,5.034907597535934,0.4830000000000041,91.5994836905372,0.4821917808219178,92.08167547135912,2.1084836905371986,46.71745977580735,0.030225141168387454,3.8446128994274003,18.59816774780442
XS2098350965,MIZUHO 0.797 04/15/30,EUR,90.849,MIZUHO FINANCIAL GROUP,Financial,2030-04-15,0.797,A,0.000341565,750000000,N,,Sr Unsecured,1,FIXED,15/04/2020,15/04/2029,14/01/2020,90.721,90.976,4.5366187542778915,0.25499999999999545,93.80494801327814,0.36902191780821914,94.17396993108636,2.9559480132781317,71.5581766758129,0.03211338273820412,4.776080416607429,27.634488078188348
XS2099546488,ACAFP 0 ⅞ 01/14/32,EUR,86.468,CREDIT AGRICOLE SA,Financial,2032-01-14,0.875,A-,0.000125365,1250000000,N,,Sr Non Preferred,1,FIXED,14/01/2021,14/01/2031,14/01/2020,86.274,86.662,6.286105407255304,0.38800000000000523,91.32375734164516,0.6232876712328768,91.94704501287804,4.855757341645159,89.02195398925109,0.034907996807008235,0.9662694684796044,1.8673533714317143
XS2101349723,BBVASM 0 ½ 01/14/27,EUR,97.821,BANCO BILBAO VIZCAYA ARG,Financial,2027-01-14,0.5,A-,9.10572e-05,1250000000,N,,Sr Non Preferred,1,FIXED,14/01/2021,14/01/2026,14/01/2020,97.521,98.121,1.2867898699520877,0.5999999999999943,98.20951334704728,0.3561643835616438,98.56567773060893,0.38851334704727947,30.79213908936339,0.026916734353344365,1.9401898786579936,5.660811386452873
XS2102357014,BMW 0 ⅜ 01/14/27,EUR,97.61652,BMW FINANCE NV,"Consumer, Cyclical",2027-01-14,0.375,A,0.04472225,750000000,N,,Sr Unsecured,1,FIXED,14/01/2021,14/01/2026,14/01/2020,97.528,97.705,1.2867898699520877,0.1769999999999925,98.0522775969447,0.26712328767123283,98.31940088461594,0.43575759694471117,34.59778036832401,0.029458273525192372,0.9713846842725175,1.8871764096784367
XS2102357105,BMW 0 ⅞ 01/14/32,EUR,88.34762,BMW FINANCE NV,"Consumer, Cyclical",2032-01-14,0.875,A,0.04472225,500000000,N,,Sr Unsecured,1,FIXED,14/01/2021,14/01/2031,14/01/2020,88.052,88.643,6.286105407255304,0.590999999999994,91.32375734164516,0.6232876712328768,91.94704501287804,2.976137341645156,53.97434617279418,0.02833691752022388,0.9724439363817096,1.8912944188111087
FR0013476090,RENAUL 1 ⅛ 01/15/27,EUR,98.166,RCI BANQUE SA,"Consumer, Cyclical",2027-01-15,1.125,BBB,0.014077941,750000000,Y,2026-10-15,Sr Unsecured,1,FIXED,15/01/2021,15/01/2026,15/01/2020,98.074,98.258,1.0376454483230664,0.1839999999999975,99.18943826714349,1.0818493150684931,100.27128758221198,1.02343826714349,99.88554025554151,0.030036202938273984,0.9708396628656422,1.8850593019861472
FR0013476207,BPCEGP 0 ⅝ 01/15/30,EUR,91.093,BPCE SA,Financial,2030-01-15,0.625,A+,1.82924e-05,750000000,N,,Sr Preferred,1,FIXED,15/01/2021,15/01/2029,15/01/2020,90.975,91.211,4.290212183436003,0.2360000000000042,93.50655383233003,0.4434931506849315,93.95004698301496,2.413553832330024,61.56045614353291,0.029851357438270183,0.9710139165009942,1.8857360520771997
FR0013476595,VIEFP 0.664 01/15/31,EUR,88.404,VEOLIA ENVIRONNEMENT SA,Utilities,2031-01-15,0.664,BBB,0.000200524,500000000,Y,2030-10-15,Sr Unsecured,1,FIXED,15/01/2021,15/01/2030,15/01/2020,88.218,88.589,5.037645448323066,0.3709999999999951,92.36944897111078,0.6385315068493151,93.0079804779601,3.9654489711107885,88.28760893128332,0.030843296766146742,1.9352093579159204,5.627119420254451
FR0013476611,BNP 1 ⅛ 01/15/32,EUR,97.714,BNP PARIBAS,Financial,2032-01-15,1.125,BBB+,0.000632394,1000000000,Y,2027-01-15,Subordinated,1,VARIABLE,15/01/2021,15/01/2031,15/01/2020,97.636,97.791,1.2895277207392197,0.15500000000000114,98.99357590780035,0.7982876712328767,99.79186357903322,1.27957590780035,100.89054958765173,0.042434753710185076,0.9592926525529265,1.8404847864840594
XS2101357072,FREGR 0 ¾ 01/15/28,EUR,96.268,FRESENIUS SE & CO KGAA,"Consumer, Non-cyclical",2028-01-15,0.75,BBB-,2.02554e-05,750000000,Y,2027-10-15,Sr Unsecured,1,FIXED,15/01/2021,15/01/2027,15/01/2020,96.142,96.395,2.0369609856262834,0.2530000000000001,97.62659866713408,0.7212328767123288,98.34783154384641,1.3585986671340748,69.01742884252891,0.03439967262594091,3.8213284066159194,18.39850881787222
XS2101558307,UCGIM 2.731 01/15/32,EUR,99.79132,UNICREDIT SPA,Financial,2032-01-15,2.731,BBB-,0.000322889,1250000000,Y,2027-01-15,Subordinated,1,VARIABLE,15/01/2021,15/01/2031,15/01/2020,99.678,99.905,1.2895277207392197,0.22700000000000387,101.0179745653243,1.9378876712328765,102.95586223655717,1.2266545653242957,94.83185930721284,0.031783354075887026,3.831284521365754,18.49358883504052
XS2102283061,ABNANV 0.6 01/15/27,EUR,97.82786,ABN AMRO BANK NV,Financial,2027-01-15,0.6,BBB+,7.92244e-05,1250000000,N,,Sr Non Preferred,1,FIXED,15/01/2021,15/01/2026,15/01/2020,97.751,97.905,1.2895277207392197,0.15399999999999636,98.33180175138683,0.42575342465753424,98.75755517604436,0.503941751386833,39.83221096284096,0.03371446290480778,3.7810289843899634,18.147413147858046
XS2102360315,STANLN 0.85 01/27/28,EUR,97.90918,STANDARD CHARTERED PLC,Financial,2028-01-27,0.85,A-,0.000289262,750000000,Y,2027-01-27,Sr Unsecured,1,VARIABLE,27/01/2021,27/01/2027,16/01/2020,97.831,97.987,1.322381930184805,0.1559999999999917,98.61285955907422,0.5752054794520548,99.18806503852628,0.7036795590742173,54.15240881540246,0.0282184629082521,0.9725559655596556,1.891730212291348
XS2102924383,OPBANK 0.6 01/18/27,EUR,97.684,OP CORPORATE BANK PLC,Financial,2027-01-18,0.6,A-,1.29446e-05,500000000,N,,Sr Non Preferred,1,FIXED,18/01/2021,18/01/2026,16/01/2020,97.624,97.743,1.297741273100616,0.11899999999999977,98.32130277166034,0.42082191780821915,98.74212468946857,0.6373027716603445,50.09487048762171,0.028187124954075982,0.9725856079404467,1.8918455295457768
XS2102932055,MRKGR 0 ½ 07/16/28,EUR,95.061,MERCK FIN SERVICES GMBH,"Consumer, Non-cyclical",2028-07-16,0.5,A-,0.014005227,750000000,Y,2028-04-16,Sr Unsecured,1,FIXED,16/07/2020,16/07/2027,16/01/2020,94.96,95.162,2.54072553045859,0.2020000000000124,96.31953401478405,0.23013698630136986,96.54967100108543,1.258534014784047,51.92051338441245,0.033396087419170134,0.9676831683168315,1.8728214284874025
XS2103014291,EOANGR 0 ⅜ 09/29/27,EUR,96.289,E.ON SE,Utilities,2027-09-29,0.375,BBB+,0.00010082,1000000000,Y,2027-06-29,Sr Unsecured,1,FIXED,29/09/2020,29/09/2026,16/01/2020,96.196,96.381,1.7412731006160165,0.18500000000000227,97.35388750744976,0.09657534246575342,97.45046284991551,1.064887507449754,63.195898551024754,0.03049216268533102,3.7770791120414904,18.159147526961856
XS2103014457,EOANGR 0 ¾ 12/18/30,EUR,90.10544,E.ON SE,Utilities,2030-12-18,0.75,BBB+,0.00010082,500000000,Y,2030-09-18,Sr Unsecured,1,FIXED,18/12/2020,18/12/2029,16/01/2020,89.907,90.304,4.963723477070499,0.39700000000000557,92.90127800487207,0.02671232876712329,92.92799033363919,2.795838004872067,62.486352331489236,0.028960067205158938,3.834794303391095,18.549885058773658
FR0013476553,BFCM 0 ¾ 01/17/30,EUR,91.012,BANQUE FED CRED MUTUEL,Financial,2030-01-17,0.75,A-,1.08678e-05,1000000000,N,,Sr Non Preferred,1,FIXED,17/01/2021,17/01/2029,17/01/2020,90.885,91.139,4.295687885010267,0.2539999999999907,94.00496150078325,0.5280821917808219,94.53304369256408,2.9929615007832524,76.23210901588129,0.02824553535024061,0.972530359355638,1.8916305997368126
XS2100664114,DLR 1 ½ 03/15/30,EUR,93.105,DIGITAL DUTCH FINCO BV,Financial,2030-03-15,1.5,BBB,0.000167809,750000000,Y,2029-12-15,Sr Unsecured,1,FIXED,15/03/2021,15/03/2029,17/01/2020,92.901,93.309,4.205338809034908,0.40800000000000125,97.14487452158657,1.191780821917808,98.33665534350438,4.039874521586569,103.40467314081114,0.029501265647908333,0.9713441191066997,1.8870187954463409
DE000DL19U23,DB 1 ⅝ 01/20/27,EUR,98.836,DEUTSCHE BANK AG,Financial,2027-01-20,1.625,BBB+,0.000192593,1475000000,N,,Sr Non Preferred,1,FIXED,20/01/2021,20/01/2026,20/01/2020,98.784,98.888,1.3032169746748803,0.1039999999999992,99.61985066727524,1.1308219178082193,100.75067258508346,0.7838506672752459,60.63941465830217,0.031230069743041045,0.9697157107231922,1.8806971192467714
DK0009526998,NYKRE 0 ¾ 01/20/27,EUR,97.988,NYKREDIT REALKREDIT AS,Financial,2027-01-20,0.75,A-,0.008589489,750000000,N,,Sr Non Preferred,1,FIXED,20/01/2021,20/01/2026,20/01/2020,97.937,98.038,1.3032169746748803,0.10099999999999909,98.50536028533433,0.5219178082191781,99.0272780935535,0.517360285334334,40.39993960091514,0.030073023571746224,3.8378197898940964,18.556135214195816
XS2102934697,CLNXSM 1 04/20/27,EUR,97.736,CELLNEX TELECOM SA,Industrial,2027-04-20,1.0,BBB-,0.000790603,450000000,Y,2027-01-20,Sr Unsecured,1,FIXED,20/04/2021,20/04/2026,20/01/2020,97.657,97.816,1.3032169746748803,0.15900000000000603,98.823786108746,0.6958904109589041,99.51967651970492,1.087786108746002,84.92944505879363,0.031788451220924434,1.934660199300969,5.621558321392796
XS2104968404,UCGIM 1.8 01/20/30,EUR,95.362,UNICREDIT SPA,Financial,2030-01-20,1.8,BBB,0.000322889,750000000,N,,Sr Non Preferred,1,FIXED,20/01/2021,20/01/2029,20/01/2020,95.217,95.507,4.303901437371663,0.29000000000000625,98.26763394569899,1.2526027397260275,99.52023668542502,2.9056339456989946,71.77086586042286,0.03391657798903207,5.667357267846019,38.07033399927921
XS2107332640,GS 0 ⅞ 01/21/30,EUR,92.469,GOLDMAN SACHS GROUP INC,Financial,2030-01-21,0.875,A-,0.00026897,1250000000,N,,Sr Unsecured,1,FIXED,21/01/2021,21/01/2029,21/01/2020,92.316,92.621,4.306639288158795,0.3049999999999926,94.49604992718865,0.6065068493150686,95.10255677650372,2.0270499271886564,51.06425213572199,0.0318518258949014,1.9260724042860258,5.588037624590304
DE000CZ45VM4,CMZB 0 ⅞ 01/22/27,EUR,98.104,COMMERZBANK AG,Financial,2027-01-22,0.875,BBB,0.000516517,750000000,N,,Sr Non Preferred,1,FIXED,22/01/2021,22/01/2026,22/01/2020,98.037,98.172,1.3086926762491444,0.1349999999999909,98.6590262185675,0.604109589041096,99.2631358076086,0.5550262185675052,43.10515431383827,0.030149938833572396,0.9707324752475248,1.8846430770003728
FR0013479276,SOCGEN 0 ¾ 01/25/27,EUR,97.86292,SOCIETE GENERALE,Financial,2027-01-25,0.75,BBB,0.00033915,1500000000,N,,Sr Non Preferred,1,FIXED,25/01/2021,25/01/2026,23/01/2020,97.806,97.92,1.3169062286105406,0.11400000000000432,98.48984720568207,0.5116438356164383,99.00149104129851,0.6269272056820654,48.48375355898687,0.028146142446508912,0.9726243757725589,1.8919963526939196
XS2107435617,NYLIFE 0 ¼ 01/23/27,EUR,97.214,NEW YORK LIFE GLOBAL FDG,Financial,2027-01-23,0.25,AA+,0.011445898,800000000,N,,Secured,1,FIXED,23/01/2021,23/01/2026,23/01/2020,97.152,97.275,1.3114305270362765,0.12300000000000466,97.85524562489586,0.17191780821917807,98.02716343311504,0.6412456248958591,50.107354040343004,0.030038850250418414,0.9708371677018635,1.8850496123827527
BE0002681626,KBCBB 0 ¾ 01/24/30,EUR,91.61085,KBC GROUP NV,Financial,2030-01-24,0.75,A-,5.40632e-05,500000000,N,,Sr Unsecured,1,FIXED,24/01/2021,24/01/2029,24/01/2020,91.463,91.759,4.314852840520191,0.2960000000000065,93.97291758470801,0.5136986301369862,94.486616214845,2.362067584708015,59.71357308235643,0.03132311185073365,3.838113950114268,18.543097816849002
XS2103013210,REESM 0 ⅜ 07/24/28,EUR,94.6488,RED ELECTRICA FINANCI SA,Utilities,2028-07-24,0.375,A-,2.7585e-05,700000000,Y,2028-04-24,Sr Unsecured,1,FIXED,24/07/2020,24/07/2027,24/01/2020,94.514,94.784,2.5626283367556466,0.27000000000001023,95.97553396605217,0.1643835616438356,96.139917527696,1.3267339660521742,54.434734772699954,0.028743114756166928,3.8577150831434612,18.70066281235253
XS2108490090,PSA 0 ⅞ 01/24/32,EUR,86.542,PUBLIC STORAGE OP CO,Financial,2032-01-24,0.875,A,2.18521e-05,500000000,Y,2031-10-24,Sr Unsecured,1,FIXED,24/01/2021,24/01/2031,24/01/2020,86.304,86.78,6.061601642710472,0.4759999999999991,91.70515178605801,0.8198630136986302,92.52501479975665,5.163151786058009,97.8210525771738,0.02913095983306997,0.9716936318407958,1.8883770283199122
XS2109608724,BALDER 1 ¼ 01/28/28,EUR,96.307,FASTIGHETS AB BALDER,Financial,2028-01-28,1.25,NR,0.001221059,500000000,Y,2027-10-28,Sr Unsecured,1,FIXED,28/01/2021,28/01/2027,28/01/2020,96.23,96.384,2.0725530458590007,0.15399999999999636,98.58379185629715,1.1575342465753424,99.74132610287249,2.2767918562971516,113.39851903677682,0.03731773029224848,0.9640247831474598,1.8586875650450139
BE6318702253,ARGSPA 1 01/29/27,EUR,98.04398,ARGENTA SPAARBANK,Financial,2027-01-29,1.0,NR,,500000000,N,,Sr Non Preferred,1,FIXED,29/01/2021,29/01/2026,29/01/2020,97.916,98.172,1.3278576317590691,0.2560000000000002,98.80179897687732,0.6712328767123288,99.47303185358965,0.7578189768773171,57.99056852764609,0.02451004560345069,1.9459807438170411,5.692252946429794
XS2112816934,SAGAX 1 ⅛ 01/30/27,EUR,98.35664,SAGAX AB,Financial,2027-01-30,1.125,NR,0.000165974,375000000,Y,2026-10-30,Sr Unsecured,1,FIXED,30/01/2021,30/01/2026,30/01/2020,98.231,98.483,1.0787132101300478,0.25200000000000955,99.15734479633822,1.0356164383561643,100.19296123469438,0.8007047963382234,75.11454679691471,0.02910011182581935,1.9397238368355003,5.6510049531801805
XS2105735935,MQGAU 0 ⅝ 02/03/27,EUR,97.69049,MACQUARIE GROUP LTD,Financial,2027-02-03,0.625,A-,0.000126637,500000000,N,,Sr Unsecured,1,FIXED,03/02/2021,03/02/2026,03/02/2020,97.624,97.757,1.3415468856947297,0.13300000000000978,98.29811421467141,0.410958904109589,98.709073118781,0.6076242146714179,46.212465700141884,0.03725213766647711,8.289227900617332,78.72186014286
XS2112289207,TELEFO 0.664 02/03/30,EUR,90.854,TELEFONICA EMISIONES SAU,Communications,2030-02-03,0.664,BBB-,0.021357445,1000000000,Y,2029-11-03,Sr Unsecured,1,FIXED,03/02/2021,03/02/2029,03/02/2020,90.677,91.03,4.090349075975359,0.35299999999999443,94.01588782983453,0.6039671232876713,94.6198549531222,3.1618878298345265,84.47295425662327,0.0276652379326814,1.9339680379752917,5.633851269150453
XS2113167568,ESSITY 0 ½ 02/03/30,EUR,91.14786,ESSITY AB,"Consumer, Non-cyclical",2030-02-03,0.5,BBB+,4.90885e-07,300000000,Y,2029-11-03,Sr Unsecured,1,FIXED,03/02/2021,03/02/2029,03/02/2020,90.656,91.64,4.090349075975359,0.9839999999999947,93.379234701314,0.4547945205479452,93.83402922186195,2.23137470131401,59.56565766110313,0.02858679189332381,1.941433548405175,5.659530958339438
XS2113889351,SANTAN 0 ½ 02/04/27,EUR,97.65521,BANCO SANTANDER SA,Financial,2027-02-04,0.5,A-,0.000140759,1250000000,N,,Sr Non Preferred,1,FIXED,04/02/2021,04/02/2026,04/02/2020,97.582,97.728,1.3442847364818618,0.1460000000000008,98.13052950200924,0.3273972602739726,98.45792676228321,0.475319502009242,36.110315085243435,0.03300223721906397,5.70623230058328,38.44186449961993
XS2099128055,CAIAV 0 ⅞ 02/05/27,EUR,97.246,CA IMMOBILIEN ANLAGEN AG,Financial,2027-02-05,0.875,NR,0.000567076,500000000,Y,2026-11-05,Sr Unsecured,1,FIXED,05/02/2021,05/02/2026,05/02/2020,97.093,97.399,1.0951403148528405,0.3059999999999974,98.87617748969205,0.791095890410959,99.66727338010301,1.6301774896920591,151.70656661901103,0.03982861988615004,12.230487379985192,170.94646801210558
ES0213679JR9,BKTSM 0 ⅝ 10/06/27,EUR,96.478,BANKINTER SA,Financial,2027-10-06,0.625,BBB+,6.59992e-05,750000000,N,,Sr Non Preferred,1,FIXED,06/10/2020,06/10/2026,06/02/2020,96.364,96.592,2.0123203285420943,0.22799999999999443,97.41622896243963,0.6164383561643836,98.03266731860401,0.9382289624396378,48.21298775237499,0.030480668541979006,0.9704209215442092,1.883433529941424
XS2112475509,PLD 0 ⅜ 02/06/28,EUR,95.143,PROLOGIS EURO FINANCE,Financial,2028-02-06,0.375,A,0.010005575,550000000,Y,2027-11-06,Sr Unsecured,1,FIXED,06/02/2021,06/02/2027,06/02/2020,95.062,95.224,2.0971937029431897,0.16200000000000614,96.7796374909713,0.33801369863013697,97.11765118960143,1.636637490971296,81.43369095219772,0.031228809544459734,3.8260914727626796,18.466699227817244
XS2112475921,PLD 1 02/06/35,EUR,79.481,PROLOGIS EURO FINANCE,Financial,2035-02-06,1.0,A,0.010005575,650000000,Y,2034-11-06,Sr Unsecured,1,FIXED,06/02/2021,06/02/2034,06/02/2020,79.225,79.738,9.097878165639973,0.5130000000000052,87.48919722249131,0.9013698630136986,88.39056708550501,8.008197222491319,110.33049528375207,0.03470450261209411,3.827587413644915,18.435123407827703
XS2113911387,ABESM 1 ¼ 02/07/28,EUR,97.08833,ABERTIS INFRAESTRUCTURAS,"Consumer, Non-cyclical",2028-02-07,1.25,BBB-,0.016819763,600000000,Y,2027-11-06,Sr Unsecured,1,FIXED,07/02/2021,07/02/2027,07/02/2020,97.008,97.168,2.0971937029431897,0.1600000000000108,98.5612984169394,1.1267123287671232,99.68801074570652,1.4729684169393948,72.223748348651,0.03398280510759533,0.9671340713407133,1.8706966238961273
XS2115091717,IBM 0.3 02/11/28,EUR,95.094,IBM CORP,Technology,2028-02-11,0.3,A-,1.97547e-05,1300000000,N,,Sr Unsecured,1,FIXED,11/02/2021,11/02/2027,11/02/2020,94.981,95.207,2.3627652292950034,0.2259999999999991,96.14869846797566,0.19068493150684931,96.33938339948251,1.054698467975669,46.740984641314554,0.03101463678305548,3.849059677349854,18.617380059748815
XS2115091808,IBM 0.65 02/11/32,EUR,85.785,IBM CORP,Technology,2032-02-11,0.65,A-,1.97547e-05,1600000000,N,,Sr Unsecured,1,FIXED,11/02/2021,11/02/2031,11/02/2020,85.591,85.98,6.362765229295003,0.38900000000001,89.87324482459752,0.4131506849315069,90.28639550952903,4.088244824597524,74.5019137135288,0.04039736467089359,0.9611712158808935,1.8477002124759103
XS2115092012,IBM 1.2 02/11/40,EUR,70.571,IBM CORP,Technology,2040-02-11,1.2,A-,1.97547e-05,850000000,N,,Sr Unsecured,1,FIXED,11/02/2021,11/02/2039,11/02/2020,70.258,70.884,14.362765229295004,0.6260000000000048,81.59805703439632,0.7627397260273973,82.36079676042371,11.027057034396321,111.16641275564221,0.032834900570371466,0.9682089552238807,1.8748571619514371
XS2115094737,SEB 0 ⅜ 02/11/27,EUR,97.406,SKANDINAVISKA ENSKILDA,Financial,2027-02-11,0.375,A,5.4877e-05,1000000000,N,,Sr Non Preferred,1,FIXED,11/02/2021,11/02/2026,11/02/2020,97.357,97.455,1.3634496919917864,0.09799999999999898,97.93776569320536,0.23835616438356166,98.17612185758892,0.531765693205358,39.91794069278432,0.038752460884882094,0.9626932668329179,1.8535566520108715
XS2010032881,NDAQ 0 ⅞ 02/13/30,EUR,91.6689,NASDAQ INC,Financial,2030-02-13,0.875,BBB+,1.5499e-06,600000000,Y,2029-11-13,Sr Unsecured,1,FIXED,13/02/2021,13/02/2029,13/02/2020,91.533,91.805,4.117727583846681,0.27200000000000557,94.79192759306231,0.7719178082191782,95.56384540128148,3.123027593062318,82.45096133886759,0.033215140830966605,5.690000009969483,38.29077662713826
XS2118204200,WFC 0 ⅝ 08/14/30,EUR,89.5411,WELLS FARGO & COMPANY,Financial,2030-08-14,0.625,A,0.000286223,1000000000,N,,Sr Unsecured,1,FIXED,14/08/2020,14/08/2029,14/02/2020,89.383,89.699,4.867898699520876,0.3160000000000025,92.48578154466723,0.0821917808219178,92.56797332548915,2.944681544667233,67.27315526698433,0.03952634705181374,11.425730610272746,149.36280923828895
XS2117435904,ICPLN 1 ⅝ 02/17/27,EUR,98.285,ICG PLC,Financial,2027-02-17,1.625,BBB+,0.000379476,500000000,Y,2026-11-17,Sr Unsecured,1,FIXED,17/02/2021,17/02/2026,17/02/2020,98.167,98.404,1.1279945242984257,0.23699999999999477,99.67141884694527,1.4157534246575343,101.08717227160281,1.3864188469452756,124.11990641350314,0.029366841209263184,5.7502912630394345,38.92906575971009
XS2121207828,SHBASS 0 ½ 02/18/30,EUR,90.35352,SVENSKA HANDELSBANKEN AB,Financial,2030-02-18,0.5,A+,0.000129884,1000000000,N,,Sr Non Preferred,1,FIXED,18/02/2021,18/02/2029,18/02/2020,90.227,90.48,4.383299110198494,0.2530000000000001,92.82273278170139,0.3082191780821918,93.13095195978359,2.469212781701387,62.007682668015875,0.02723533055685835,2.9128825170301345,11.332818350803748
XS2121237908,BACRED 0 ¾ 07/15/27,EUR,96.838,MEDIOBANCA DI CRED FIN,Financial,2027-07-15,0.75,BBB-,0.000535005,300000000,N,,Sr Unsecured,1,FIXED,15/07/2021,15/07/2026,18/02/2020,96.742,96.934,1.78507871321013,0.19199999999999307,97.9365649148875,0.16027397260273973,98.09683888749024,1.098564914887504,63.314020393210285,0.03280428549632644,0.9682376555200273,1.874968315133838
FR0013484458,BNP 0 ½ 02/19/28,EUR,97.305,BNP PARIBAS,Financial,2028-02-19,0.5,A-,0.000632394,1250000000,Y,2027-02-19,Sr Non Preferred,1,VARIABLE,19/02/2021,19/11/2027,19/02/2020,97.246,97.364,1.3853524982888432,0.11800000000000921,98.0741866606628,0.30684931506849317,98.3810359757313,0.7691866606627968,56.82685576325968,0.02835647584500049,3.8742894096145926,18.812540286388266
XS2114852218,CMCSA 0 ¼ 05/20/27,EUR,96.51,COMCAST CORP,Communications,2027-05-20,0.25,A-,0.000379551,800000000,Y,2027-03-20,Sr Unsecured,1,FIXED,20/05/2020,20/05/2026,20/02/2020,96.427,96.593,1.4647501711156743,0.16599999999999682,97.60811359689902,0.13356164383561644,97.74167524073464,1.0981135968990117,77.21688569112702,0.03712601768969449,3.818443743477422,18.347859124552354
XS2114852564,CMCSA 0 ¾ 02/20/32,EUR,86.21685,COMCAST CORP,Communications,2032-02-20,0.75,A-,0.000379551,1400000000,Y,2031-11-20,Sr Unsecured,1,FIXED,20/02/2021,20/02/2031,20/02/2020,85.983,86.451,6.135523613963039,0.4679999999999893,90.86921380607541,0.6472602739726028,91.51647408004801,4.652363806075414,87.38424713006103,0.034930180829591734,0.9662487562189056,1.8672733177891645
XS2114852721,CMCSA 1 ¼ 02/20/40,EUR,72.93295,COMCAST CORP,Communications,2040-02-20,1.25,A-,0.000379551,800000000,Y,2039-08-20,Sr Unsecured,1,FIXED,20/02/2021,20/02/2039,20/02/2020,72.543,73.323,13.883641341546886,0.7799999999999869,82.86178020986502,0.14383561643835616,83.00561582630337,9.928830209865012,100.98253483054745,0.037482794779852474,5.609749139053695,37.46881659909505
XS2118273601,SIEGR 0 ½ 02/20/32,EUR,86.77227,SIEMENS FINANCIERINGSMAT,Industrial,2032-02-20,0.5,AA-,0.006816219,750000000,N,,Sr Unsecured,1,FIXED,20/02/2021,20/02/2031,20/02/2020,86.564,86.98,6.3874058863791925,0.416000000000011,88.94318394942646,0.30547945205479454,89.24866340148125,2.170913949426449,39.22445976693144,0.04760086183087987,10.845413278577706,138.54005020965525
XS2118276026,SIEGR 0 ¼ 02/20/29,EUR,92.96598,SIEMENS FINANCIERINGSMAT,Industrial,2029-02-20,0.25,AA-,0.006816219,1000000000,N,,Sr Unsecured,1,FIXED,20/02/2021,20/02/2028,20/02/2020,92.826,93.106,3.3894592744695413,0.28000000000000114,93.97937890750708,0.15273972602739727,94.13211863353447,1.0133989075070815,32.06102144645996,0.03181537828947377,0.9691656288916563,1.878564032449919
XS2123320033,JPM 0.389 02/24/28,EUR,97.20041,JPMORGAN CHASE & CO,Financial,2028-02-24,0.389,A+,0.0001373,1250000000,Y,2027-02-24,Sr Unsecured,1,VARIABLE,24/02/2021,24/11/2027,24/02/2020,97.14,97.261,1.3990417522245038,0.12099999999999511,97.90379518469618,0.2334,98.13719518469618,0.7033851846961738,51.52494604404645,0.028963826218876037,1.938753140900576,5.6477297736824585
XS2010032378,ASML 0 ¼ 02/25/30,EUR,90.351,ASML HOLDING NV,Technology,2030-02-25,0.25,A,9.22768e-08,750000000,Y,2029-11-25,Sr Unsecured,1,FIXED,25/02/2021,25/02/2029,25/02/2020,90.192,90.511,4.1505817932922655,0.3190000000000026,92.28042411540216,0.21232876712328766,92.49275288252544,1.9294241154021563,51.083382308312174,0.03309108479265154,5.67227358682371,38.13452402590635
XS2118213888,ANVAU 0 ⅝ 08/25/30,EUR,88.716,AUSNET SERVICES HOLDINGS,Utilities,2030-08-25,0.625,BBB+,0.017362557,500000000,N,,Sr Unsecured,1,FIXED,25/08/2020,25/08/2029,25/02/2020,88.605,88.827,4.898015058179329,0.2219999999999942,92.43312876827311,0.06335616438356165,92.49648493265667,3.7171287682731133,84.82483029794358,0.02895072030702338,2.908005331166791,11.294957135927557
XS2122485845,DOW 0 ½ 03/15/27,EUR,97.108,DOW CHEMICAL CO/THE,Basic Materials,2027-03-15,0.5,BBB,0.031593108,495507000,Y,2026-12-15,Sr Unsecured,1,FIXED,15/03/2021,15/03/2026,25/02/2020,97.05,97.165,1.2046543463381245,0.1150000000000091,98.32255461329034,0.3972602739726027,98.71981488726294,1.214554613290332,103.12616574010983,0.03657027691392243,5.670213272627183,38.031595939503646
XS2122486066,DOW 1 ⅛ 03/15/32,EUR,86.135,DOW CHEMICAL CO/THE,Basic Materials,2032-03-15,1.125,BBB,0.031593108,750000000,Y,2031-12-15,Sr Unsecured,1,FIXED,15/03/2021,15/03/2031,25/02/2020,85.932,86.337,6.203969883641341,0.40500000000000114,92.89722298076552,0.8938356164383561,93.79105859720387,6.7622229807655145,125.57006428753178,0.03082079455536874,0.9701007248610435,1.8821908327518444
XS2122933695,DOW 1 ⅞ 03/15/40,EUR,72.503,DOW CHEMICAL CO/THE,Basic Materials,2040-03-15,1.875,BBB,0.031593108,500000000,Y,2039-09-15,Sr Unsecured,1,FIXED,15/03/2021,15/03/2039,25/02/2020,72.178,72.829,13.95482546201232,0.6509999999999962,90.0353292385011,0.0821917808219178,90.11752101932302,17.532329238501106,178.00703032185578,0.027860817136795002,3.790045983623037,18.27343785416953
XS2125426796,DSVDC 0 ⅜ 02/26/27,EUR,97.28,DSV A/S,Industrial,2027-02-26,0.375,NR,0.000214373,500000000,Y,2026-11-26,Sr Unsecured,1,FIXED,26/02/2021,26/02/2026,26/02/2020,97.221,97.338,1.1526351813826146,0.11699999999999022,98.25318253487413,0.31746575342465755,98.57064828829878,0.9731825348741268,86.30717605235853,0.028578815504032757,3.800902814997361,18.33528425089207
XS2126161764,RELLN 0 ½ 03/10/28,EUR,95.4077,RELX FINANCE BV,"Consumer, Non-cyclical",2028-03-10,0.5,A-,5.964e-07,800000000,Y,2027-12-10,Sr Unsecured,1,FIXED,10/03/2021,10/03/2027,10/03/2020,95.288,95.528,2.190280629705681,0.2400000000000091,96.88369791757285,0.4041095890410959,97.28780750661394,1.4759979175728404,70.24228842174679,0.028098501939451754,3.749701851546243,18.00966102176921
XS2126162069,RELLN 0 ⅞ 03/10/32,EUR,86.948,RELX FINANCE BV,"Consumer, Non-cyclical",2032-03-10,0.875,A-,5.964e-07,500000000,Y,2031-12-10,Sr Unsecured,1,FIXED,10/03/2021,10/03/2031,10/03/2020,86.746,87.151,6.190280629705681,0.40500000000000114,91.48609809398624,0.7071917808219179,92.19328987480816,4.53809809398625,84.14013601321285,0.030377667835851302,3.7668059368512425,18.094164329388974
FR0013494168,SUFP 0 ¼ 03/11/29,EUR,92.503,SCHNEIDER ELECTRIC SE,Industrial,2029-03-11,0.25,NR,4.03484e-05,800000000,Y,2028-12-11,Sr Unsecured,1,FIXED,11/03/2021,11/03/2028,11/03/2020,92.402,92.604,3.1950718685831623,0.20199999999999818,94.42323174990369,0.20136986301369864,94.62460161291739,1.9202317499036923,64.44038249758046,0.024544526266921343,1.9181158958670308,5.583336288706411
XS2116701348,CDTFIN 0 ¾ 03/11/32,EUR,84.58933,CADENT FINANCE PLC,Utilities,2032-03-11,0.75,BBB+,0.007895117,500000000,N,,Sr Unsecured,1,FIXED,11/03/2021,11/03/2031,11/03/2020,84.401,84.778,6.442162902121835,0.37700000000000955,90.31662515420265,0.4191780821917809,90.73580323639443,5.7272951542026505,103.88131984292013,0.023109055200534162,0.977412911084044,1.9106719975075712
FR0013495181,BNFP 0.571 03/17/27,EUR,97.564,DANONE SA,"Consumer, Non-cyclical",2027-03-17,0.571,BBB+,1.13671e-06,800000000,Y,2026-12-17,Sr Unsecured,1,FIXED,17/03/2021,17/03/2026,17/03/2020,97.496,97.633,1.2101300479123889,0.13700000000000045,98.3990805652272,0.4505424657534246,98.84962303098062,0.8350805652272015,70.3947423194847,0.025745007180102752,3.811951233831797,18.44015561285853
XS2147133578,UNANA 1 ¾ 03/25/30,EUR,96.129,UNILEVER FINANCE,"Consumer, Non-cyclical",2030-03-25,1.75,A+,7.01173e-07,1000000000,Y,2029-12-25,Sr Unsecured,1,FIXED,25/03/2021,25/03/2029,25/03/2020,96.007,96.251,4.232717316906228,0.24399999999999977,98.11958386511597,1.3424657534246576,99.46204961854063,1.9905838651159655,49.763910726086024,0.025090364751056304,1.9318260116926131,5.634875459741414
FR0013505112,SANFP 1 ½ 04/01/30,EUR,94.93542,SANOFI SA,"Consumer, Non-cyclical",2030-04-01,1.5,AA-,2.18798e-05,1000000000,Y,2030-01-01,Sr Unsecured,1,FIXED,01/04/2021,01/04/2029,30/03/2020,94.774,95.097,4.251882272416153,0.3229999999999933,97.09801071359531,1.121917808219178,98.2199285218145,2.1625907135953213,54.24296822993546,0.026521482124633233,1.9256680624689926,5.605673999221604
XS2147995372,DHR 2 ½ 03/30/30,EUR,98.843,DANAHER CORP,"Consumer, Non-cyclical",2030-03-30,2.5,A-,1.40565e-05,800000000,Y,2029-12-30,Sr Unsecured,1,FIXED,30/03/2021,30/03/2029,30/03/2020,98.671,99.014,4.246406570841889,0.3429999999999893,101.1249179981345,1.8835616438356164,103.00847964197013,2.281917998134503,55.85929073189706,0.029863498586162652,0.9710024691358026,1.8856915901356512
XS2149379211,PHIANA 2 03/30/30,EUR,96.146,KONINKLIJKE PHILIPS NV,"Consumer, Non-cyclical",2030-03-30,2.0,BBB+,4.31505e-05,500000000,Y,2029-12-30,Sr Unsecured,1,FIXED,30/03/2021,30/03/2029,30/03/2020,96.018,96.274,4.246406570841889,0.2560000000000002,99.11421744495517,1.5068493150684932,100.62106676002367,2.9682174449551724,73.87598406605323,0.029142791320816347,3.805647397048664,18.359342321789264
XS2148370211,BAC 3.648 03/31/29,EUR,102.302,BANK OF AMERICA CORP,Financial,2029-03-31,3.648,A+,0.000123703,1500000000,Y,2028-03-31,Sr Unsecured,1,VARIABLE,31/03/2021,31/12/2028,31/03/2020,102.203,102.401,2.4969199178644765,0.1979999999999933,103.97667211622962,1.8389917808219178,105.81566389705154,1.6746721162296154,66.57827438351909,0.026637069922308524,0.974054054054054,1.8975626004382755
FR0013505260,CAFP 2 ⅝ 12/15/27,EUR,100.307,CARREFOUR SA,"Consumer, Non-cyclical",2027-12-15,2.625,NR,0.000487552,800000000,Y,2027-09-15,Sr Unsecured,1,FIXED,15/12/2020,15/12/2026,01/04/2020,100.213,100.4,1.9548254620123204,0.18700000000001182,101.29607142113171,0.11506849315068493,101.4111399142824,0.9890714211317118,50.76417792609654,0.031327733867533514,5.482360548618911,36.46743045172756
XS2148390755,NESNVX 1 ½ 04/01/30,EUR,95.965,NESTLE FINANCE INTL LTD,"Consumer, Non-cyclical",2030-04-01,1.5,AA-,0.016977096,1000000000,Y,2030-01-01,Sr Unsecured,1,FIXED,01/04/2021,01/04/2029,01/04/2020,95.812,96.119,4.251882272416153,0.30700000000000216,97.09801071359531,1.121917808219178,98.2199285218145,1.1330107135953114,28.264101053382124,0.025803880551027555,1.9318587070417206,5.632406463314316
XS2149280948,BERTEL 2 04/01/28,EUR,99.019,BERTELSMANN SE & CO KGAA,Communications,2028-04-01,2.0,BBB,0.009998721,750000000,Y,2028-01-01,Sr Unsecured,1,FIXED,01/04/2021,01/04/2027,01/04/2020,98.914,99.124,2.2505133470225873,0.20999999999999375,100.05742389519138,1.4958904109589042,101.55331430615028,1.0384238951913716,46.85879437878235,0.03123797691651678,5.50455700139652,36.66931232989966
XS2151059206,MNDILN 2 ⅜ 04/01/28,EUR,99.467,MONDI FINANCE EUROPE,Basic Materials,2028-04-01,2.375,BBB+,0.00114184,750000000,Y,2028-01-01,Sr Unsecured,1,FIXED,01/04/2021,01/04/2027,01/04/2020,99.381,99.554,2.2505133470225873,0.17300000000000182,100.875141177118,1.7763698630136988,102.6515110401317,1.4081411771179972,63.27171611520016,0.02642994048219502,0.9742506142506143,1.8983285187353989
FR0013505542,VIEFP 1 ¼ 04/02/27,EUR,98.314,VEOLIA ENVIRONNEMENT SA,Utilities,2027-04-02,1.25,NR,0.000200524,850000000,Y,2027-01-02,Sr Unsecured,1,FIXED,02/04/2021,02/04/2026,02/04/2020,98.238,98.39,1.2539356605065024,0.15200000000000102,99.1743898366606,0.9315068493150686,100.10589668597567,0.8603898366606018,69.48207334573024,0.023787777768999745,0.9767649328449328,1.9081394680711325
FR0013505567,AIFP 1 ⅜ 04/02/30,EUR,94.2666,AIR LIQUIDE FINANCE,Basic Materials,2030-04-02,1.375,A,0.010105715,500000000,Y,2030-01-02,Sr Unsecured,1,FIXED,02/04/2021,02/04/2029,02/04/2020,94.125,94.409,4.254620123203286,0.284000000000006,96.59166603143669,1.0246575342465754,97.61632356568326,2.325066031436691,58.52835660154525,0.02601325367288103,1.9177026137575768,5.576456128951343
XS2010032022,TMO 1 ¾ 04/15/27,EUR,99.11,THERMO FISHER SCIENTIFIC,"Consumer, Non-cyclical",2027-04-15,1.75,A-,3.83619e-05,600000000,Y,2027-02-15,Sr Unsecured,1,FIXED,15/04/2020,15/04/2026,02/04/2020,99.027,99.192,1.374401095140315,0.16499999999999204,99.76701888021579,1.093150684931507,100.86016956514729,0.6570188802157872,48.12293580356157,0.030904114865904504,3.751575596925218,17.98988449378693
XS2010032451,TMO 2 ⅜ 04/15/32,EUR,95.913,THERMO FISHER SCIENTIFIC,"Consumer, Non-cyclical",2032-04-15,2.375,A-,3.83619e-05,600000000,Y,2032-01-15,Sr Unsecured,1,FIXED,15/04/2020,15/04/2031,02/04/2020,95.749,96.076,6.288843258042436,0.3269999999999982,100.03285583353185,1.6852739726027397,101.7181298061346,4.119855833531858,71.0992069615119,0.03307893233205457,0.9679802469135802,1.8739715168297513
XS2150006307,DE 1.85 04/02/28,EUR,98.59388,JOHN DEERE CASH MANAGEME,Industrial,2028-04-02,1.85,A,0.000246194,600000000,N,,Sr Unsecured,1,FIXED,02/04/2021,02/04/2027,02/04/2020,98.5,98.688,2.5023956194387407,0.1880000000000024,99.64146970377624,0.9224657534246578,100.5639354572009,1.0475897037762394,42.75060803515311,0.032375912742521454,5.571658868465576,37.24705328069831
XS2150006562,DE 2.2 04/02/32,EUR,95.01608,JOHN DEERE CASH MANAGEME,Industrial,2032-04-02,2.2,A,0.000246194,600000000,N,,Sr Unsecured,1,FIXED,02/04/2021,02/04/2031,02/04/2020,94.812,95.22,6.50239561943874,0.40800000000000125,98.89088218097413,1.096986301369863,99.987868482344,3.874802180974129,65.23430389038221,0.03333096078172195,0.9677441574415743,1.8730575085246046
XS2150015555,ADNA 1 ¾ 04/02/27,EUR,99.13,KONINKIJKE AHOLD DLHAIZE,"Consumer, Non-cyclical",2027-04-02,1.75,BBB+,4.82756e-06,500000000,Y,2027-01-02,Sr Unsecured,1,FIXED,02/04/2021,02/04/2026,02/04/2020,99.064,99.196,1.2539356605065024,0.132000000000005,99.78751617225022,1.304109589041096,101.09162576129131,0.6575161722502258,52.72949579498486,0.029848861441137377,3.71769710484874,17.783099878692155
XS2150054372,SGOFP 2 ⅜ 10/04/27,EUR,99.99631,CIE DE SAINT-GOBAIN SA,Industrial,2027-10-04,2.375,BBB+,0.000335785,750000000,Y,2027-07-04,Sr Unsecured,1,FIXED,04/10/2020,04/10/2026,03/04/2020,99.909,100.084,1.754962354551677,0.17499999999999716,100.74971847714286,0.5791095890410959,101.32882806618396,0.7534084771428695,43.06405239969009,0.028728254637623712,3.7408589823709915,17.945332844217784
XS2152061904,VW 3 ⅜ 04/06/28,EUR,101.489,VOLKSWAGEN FINANCIAL SER,"Consumer, Non-cyclical",2028-04-06,3.375,BBB+,0.003521565,800000000,N,,Sr Unsecured,1,FIXED,06/04/2021,06/04/2027,06/04/2020,101.366,101.613,2.513347022587269,0.2469999999999999,103.3369355945043,1.645890410958904,104.9828260054632,1.8479355945042926,73.40125722027173,0.029782114417969293,0.9710792079207919,1.8859896561121454
DE000A28VQD2,ANNGR 2 ¼ 04/07/30,EUR,96.88285,VONOVIA SE,Financial,2030-04-07,2.25,BBB+,0.001036135,479700000,Y,2030-01-07,Sr Unsecured,1,FIXED,07/04/2021,07/04/2029,07/04/2020,96.738,97.028,4.268309377138946,0.29000000000000625,100.11223068469548,1.645890410958904,101.75812109565437,3.229380684695471,79.57315347241585,0.02763709440051958,0.9731061728395063,1.8938712472367023
FR0013506292,ORAFP 1 ¼ 07/07/27,EUR,98.008,ORANGE SA,Communications,2027-07-07,1.25,BBB+,2.14239e-05,750000000,Y,2027-04-07,Sr Unsecured,1,FIXED,07/07/2020,07/07/2026,07/04/2020,97.914,98.102,1.514031485284052,0.1880000000000024,99.00496384038934,0.6061643835616438,99.61112822395098,0.9969638403893413,66.94370390528326,0.02975868684421265,1.931203757243687,5.615502449110201
FR0013506300,ORAFP 1 ⅝ 04/07/32,EUR,91.33266,ORANGE SA,Communications,2032-04-07,1.625,BBB+,2.14239e-05,750000000,Y,2032-01-07,Sr Unsecured,1,FIXED,07/04/2021,07/04/2031,07/04/2020,91.088,91.578,6.26694045174538,0.4900000000000091,95.6991504086779,1.1886986301369862,96.88784903881488,4.36649040867789,77.80259019033934,0.03302333852178059,3.776793751027828,18.12813221745416
XS2152329053,FREGR 1 ⅝ 10/08/27,EUR,98.347,FRESENIUS SE & CO KGAA,"Consumer, Non-cyclical",2027-10-08,1.625,BBB-,2.02554e-05,750000000,Y,2027-07-08,Sr Unsecured,1,FIXED,08/10/2020,08/10/2026,08/04/2020,98.261,98.434,1.7659137577002053,0.17300000000000182,99.46413893203137,0.37842465753424653,99.84256358956563,1.1171389320313807,64.25957991558354,0.02653892722324222,1.9361031814957241,5.646272356989994
XS2152883406,TCLAU 3 04/08/30,EUR,100.0562,TRANSURBAN FINANCE CO,"Consumer, Non-cyclical",2030-04-08,3.0,BBB+,1.1415e-06,750000000,Y,2030-01-08,Secured,1,FIXED,08/04/2021,08/04/2029,08/04/2020,99.908,100.205,4.271047227926078,0.29699999999999704,103.14387704662413,2.186301369863014,105.33017841648714,3.0876770466241226,74.51093904147928,0.02831306399042359,2.859820439266354,11.050005744586416
FR0013506821,URWFP 2 ⅝ 04/09/30,EUR,99.076,UNIBAIL-RODAMCO-WESTFLD,Financial,2030-04-09,2.625,BBB,0.008889247,800000000,Y,2030-01-09,Sr Unsecured,1,FIXED,09/04/2021,09/04/2029,09/04/2020,98.876,99.277,4.27378507871321,0.40099999999999625,101.6275998877664,1.9058219178082192,103.53342180557462,2.5515998877664003,61.96581426624478,0.033172212960883164,5.47055195833109,36.32005794485232
FR0013506862,SUFP 1 04/09/27,EUR,98.079,SCHNEIDER ELECTRIC SE,Industrial,2027-04-09,1.0,NR,4.03484e-05,500000000,Y,2027-01-09,Sr Unsecured,1,FIXED,09/04/2021,09/04/2026,09/04/2020,98.022,98.136,1.273100616016427,0.11399999999999011,98.85068897445119,0.726027397260274,99.57671637171146,0.7716889744511946,61.551950442965925,0.027947216971360513,0.9728125953259532,1.8927286912496335
FR0013506516,ARRFP 1 ¼ 01/14/27,EUR,98.527,APRR SA,"Consumer, Non-cyclical",2027-01-14,1.25,A-,0.011186382,500000000,Y,2026-10-14,Sr Unsecured,1,FIXED,14/01/2021,14/01/2026,14/04/2020,98.48,98.574,1.0349075975359343,0.09399999999999409,99.3185065712914,1.2054794520547945,100.52398602334618,0.7915065712913929,77.26165633655746,0.030843717290984472,3.7784182745679207,18.163731176759292
FR0013507654,ENFP 1 ⅛ 07/24/28,EUR,96.45718,BOUYGUES SA,Industrial,2028-07-24,1.125,A-,3.58094e-05,1000000000,Y,2028-04-24,Sr Unsecured,1,FIXED,24/07/2021,24/07/2027,14/04/2020,96.364,96.551,2.5626283367556466,0.1869999999999976,97.82955367282419,0.4931506849315068,98.3227043577557,1.372373672824196,55.54870111411378,0.025420422373173098,0.9752097560975609,1.9020681367757282
XS2156598281,AKZANA 1 ⅝ 04/14/30,EUR,93.81,AKZO NOBEL NV,Basic Materials,2030-04-14,1.625,BBB,0.000134975,750000000,Y,2030-01-14,Sr Unsecured,1,FIXED,14/04/2021,14/04/2029,14/04/2020,93.638,93.983,4.287474332648871,0.34499999999999886,97.56953197139873,1.1575342465753424,98.72706621797407,3.7595319713987294,94.0599089451902,0.037993185676859345,7.600018881410187,69.92679991647479
FR0013507704,VIEFP 1 ¼ 04/15/28,EUR,97.30016,VEOLIA ENVIRONNEMENT SA,Utilities,2028-04-15,1.25,BBB,0.000200524,700000000,Y,2028-01-15,Sr Unsecured,1,FIXED,15/04/2021,15/04/2027,15/04/2020,97.178,97.423,2.2888432580424367,0.24500000000000455,98.38733952800223,0.886986301369863,99.27432582937209,1.087179528002224,48.8770126371468,0.032106182746812414,1.9267865571274365,5.589891048073181
FR0013507860,CAPFP 2 04/15/29,EUR,97.64091,CAPGEMINI SE,Technology,2029-04-15,2.0,NR,0.000167553,1000000000,Y,2029-01-15,Sr Unsecured,1,FIXED,15/04/2021,15/04/2028,15/04/2020,97.514,97.768,3.2908966461327855,0.2540000000000049,99.71809757233997,1.4191780821917808,101.13727565453175,2.077187572339966,65.34774451218071,0.027605035643864746,0.9731365313653135,1.8939894173554275
FR0013507878,CAPFP 2 ⅜ 04/15/32,EUR,94.94904,CAPGEMINI SE,Technology,2032-04-15,2.375,NR,0.000167553,1200000000,Y,2032-01-15,Sr Unsecured,1,FIXED,15/04/2021,15/04/2031,15/04/2020,94.743,95.155,6.288843258042436,0.41200000000000614,100.03285583353185,1.6852739726027397,101.7181298061346,5.083815833531858,88.1924802129803,0.02504667442108833,1.9293369065124333,5.625321367768253
PTEDPNOM0015,EDPPL 1 ⅝ 04/15/27,EUR,98.86208,EDP SA,Utilities,2027-04-15,1.625,BBB,0.000446403,750000000,Y,2027-01-15,Sr Unsecured,1,FIXED,15/04/2021,15/04/2026,15/04/2020,98.793,98.931,1.2895277207392197,0.13799999999999102,99.62383700914653,1.1530821917808218,100.77691920092735,0.7617570091465211,59.54152975806028,0.02930460792156894,0.9715297029702972,1.887739927507108
XS2156787173,SSELN 1 ¾ 04/16/30,EUR,95.05,SSE PLC,Utilities,2030-04-16,1.75,BBB+,3.05599e-05,500000000,Y,2030-01-16,Sr Unsecured,1,FIXED,16/04/2021,16/04/2029,16/04/2020,94.913,95.187,4.292950034223135,0.2740000000000009,98.07252551485598,1.2369863013698632,99.30951181622585,3.0225255148559853,74.98210149326576,0.03312978204560089,5.566984934233807,37.187506425792364
DE000A28V301,JABHOL 2 ½ 04/17/27,EUR,99.959,JAB HOLDINGS BV,Financial,2027-04-17,2.5,BBB,0.004836786,500000000,N,,Sr Unsecured,1,FIXED,17/04/2021,17/04/2026,17/04/2020,99.893,100.025,1.541409993155373,0.132000000000005,100.86353725625456,1.143835616438356,102.00737287269291,0.9045372562545566,58.66980682995831,0.029897754822786726,3.8239681840678723,18.468785272094628
DE000A28V319,JABHOL 3 ⅜ 04/17/35,EUR,96.816,JAB HOLDINGS BV,Financial,2035-04-17,3.375,BBB,0.004836786,500000000,N,,Sr Unsecured,1,FIXED,17/04/2021,17/04/2034,17/04/2020,96.504,97.128,9.541409993155373,0.6239999999999952,106.99740939590824,1.5441780821917808,108.54158747810001,10.181409395908233,120.10548772753053,0.028731071857938145,1.919219937826016,5.572629437998081
FR0013508710,BNP 1 ⅛ 04/17/29,EUR,96.02138,BNP PARIBAS,Financial,2029-04-17,1.125,A-,0.000632394,1250000000,Y,2028-04-17,Sr Non Preferred,1,VARIABLE,17/04/2021,17/01/2029,17/04/2020,95.933,96.11,2.543463381245722,0.1769999999999925,97.84889220906864,0.5147260273972603,98.3636182364659,1.8275122090686438,74.68122964534392,0.029852156245984675,2.883359685675237,11.160882315857762
BE6321076711,LONNVX 1 ⅝ 04/21/27,EUR,98.895,LONZA FINANCE INTL NV,"Consumer, Non-cyclical",2027-04-21,1.625,NR,2.65213e-06,500000000,Y,2027-01-21,Sr Unsecured,1,FIXED,21/04/2021,21/04/2026,21/04/2020,98.796,98.993,1.3059548254620124,0.19699999999998852,99.61905421925086,1.1263698630136987,100.74542408226455,0.7240542192508599,55.88068339796325,0.03127494656037894,3.825914880754478,18.465013243275177
XS2156236452,TOYOTA 2.28 10/21/27,EUR,99.567,TOYOTA FINANCE AUSTRALIA,"Consumer, Cyclical",2027-10-21,2.28,A+,0.008313509,500000000,N,,Sr Unsecured,1,FIXED,21/10/2020,21/10/2026,21/04/2020,99.479,99.655,2.0533880903490758,0.17600000000000193,100.65608993060715,2.1550684931506847,102.81115842375783,1.0890899306071589,53.55688858413836,0.029784181792205808,3.7559653125215036,18.030961111310422
XS2126169742,GIVNVX 1 04/22/27,EUR,98.1245,GIVAUDAN FIN EUROPE,Basic Materials,2027-04-22,1.0,NR,8.9403e-07,500000000,Y,2027-01-22,Sr Unsecured,1,FIXED,22/04/2021,22/04/2026,22/04/2020,98.03,98.219,1.3086926762491444,0.18899999999999295,98.8188981895801,0.6904109589041096,99.5093091484842,0.6943981895800988,53.88448807340699,0.03320550182467442,3.7829900434301575,18.165907347632967
XS2126170161,GIVNVX 1 ⅝ 04/22/32,EUR,90.95,GIVAUDAN FIN EUROPE,Basic Materials,2032-04-22,1.625,NR,8.9403e-07,500000000,Y,2032-01-22,Sr Unsecured,1,FIXED,22/04/2021,22/04/2031,22/04/2020,90.771,91.129,6.308008213552362,0.3580000000000041,95.65575843121849,1.121917808219178,96.77767623943767,4.705758431218484,83.52639929360635,0.03356521834228416,3.7543942021065475,17.977805870339807
XS2160857798,TLSAU 1 04/23/30,EUR,92.602,TELSTRA GROUP LTD,Communications,2030-04-23,1.0,A-,1.00035e-08,500000000,Y,2030-01-23,Sr Unsecured,1,FIXED,23/04/2021,23/04/2029,23/04/2020,92.435,92.768,4.312114989733059,0.3329999999999984,94.99752116511524,0.6876712328767123,95.68519239799195,2.395521165115241,60.19192530705719,,,
FR0013509643,DECFP 2 ⅝ 04/24/28,EUR,99.52438,JCDECAUX SE,Communications,2028-04-24,2.625,BBB-,0.000533272,599900000,Y,2028-01-24,Sr Unsecured,1,FIXED,24/04/2021,24/04/2027,24/04/2020,99.378,99.67,2.3134839151266258,0.2920000000000016,101.44496486751379,1.797945205479452,103.24291007299324,1.9205848675137958,83.858427668008,0.02954646443004355,3.783467171197885,18.211325533774104
XS2163333656,SWFP 1 04/27/29,EUR,94.383,SODEXO SA,"Consumer, Cyclical",2029-04-27,1.0,BBB+,0.000685589,800000000,Y,2029-01-27,Sr Unsecured,1,FIXED,27/04/2021,27/04/2028,27/04/2020,94.22,94.546,3.323750855578371,0.3260000000000076,96.51485777239755,0.6767123287671233,97.19157010116467,2.1318577723975523,67.93080698629664,0.028003930284684793,0.9727589268292683,1.8925198594520598
BE6321529396,ELIATB 0 ⅞ 04/28/30,EUR,91.65272,ELIA TRANSMISSION BE,Utilities,2030-04-28,0.875,NR,0.008230541,800000000,Y,2030-01-28,Sr Unsecured,1,FIXED,28/04/2021,28/04/2029,28/04/2020,91.501,91.804,4.32580424366872,0.30299999999999727,94.46615972031832,0.5897260273972603,95.05588574771558,2.813439720318314,70.89237209259362,0.031124764833063343,2.8588557944154576,11.025159226669778
XS2159887590,EXOIM 2 ¼ 04/29/30,EUR,97.291,EXOR NV,Financial,2030-04-29,2.25,NR,2.32729e-06,500000000,Y,2030-01-29,Sr Unsecured,1,FIXED,29/04/2021,29/04/2029,29/04/2020,97.113,97.468,4.328542094455853,0.355000000000004,100.09222520033882,1.5102739726027399,101.60249917294156,2.80122520033882,67.96582786583474,0.030235016844337055,1.9363548678735525,5.633777492071909
DE000A289NF1,DWNIGY 1 ½ 04/30/30,EUR,93.28439,DEUTSCHE WOHNEN SE,Financial,2030-04-30,1.5,NR,0.000298165,587300000,Y,2030-01-30,Sr Unsecured,1,FIXED,30/04/2021,30/04/2029,30/04/2020,93.009,93.559,4.331279945242985,0.5499999999999972,97.01839553890309,1.0027397260273974,98.02113526493049,3.734005538903091,92.84782813437006,0.03436688532802835,5.675753601639119,38.13476000998352
XS2164646304,APAAU 2 07/15/30,EUR,95.00037,APA INFRASTRUCTURE LTD,Utilities,2030-07-15,2.0,BBB,0.025590344,600000000,Y,2030-04-15,Sr Unsecured,1,FIXED,15/07/2020,15/07/2029,30/04/2020,94.789,95.212,4.5366187542778915,0.4230000000000018,98.95468039402553,0.9260273972602739,99.8807077912858,3.9543103940255264,93.01763011110869,0.033830733597064795,0.9672763320941759,1.8712470052591246
XS2166619663,DSFIR 1 ⅜ 10/30/26,EUR,99.03,FIRMENICH PRODUCTIONS,Basic Materials,2026-10-30,1.375,NR,5.61341e-06,750000000,Y,2026-07-30,Sr Unsecured,1,FIXED,30/10/2020,30/10/2025,30/04/2020,98.969,99.091,0.8268309377138946,0.12199999999999989,99.54656511044453,0.23732876712328768,99.78389387756782,0.5165651104445317,62.73026360695685,,,
XS2166619820,DSFIR 1 ¾ 04/30/30,EUR,95.51735,FIRMENICH PRODUCTIONS,Basic Materials,2030-04-30,1.75,NR,5.61341e-06,750000000,Y,2030-01-30,Sr Unsecured,1,FIXED,30/04/2021,30/04/2029,30/04/2020,95.402,95.633,4.331279945242985,0.23099999999999454,98.04270420473411,1.1698630136986303,99.21256721843274,2.525354204734114,61.96890615841758,0.030203137338005347,3.787719609228854,18.23116948554463
FR0013510823,HITTFP 2 ½ 05/04/27,EUR,99.70779,ABERTIS FRANCE SAS,"Consumer, Non-cyclical",2027-05-04,2.5,BBB-,0.016819763,600000000,Y,2027-02-04,Sr Unsecured,1,FIXED,04/05/2021,04/05/2026,04/05/2020,99.63,99.786,1.3442847364818618,0.1560000000000059,100.75702489735252,1.636986301369863,102.39401119872238,1.0492348973525196,77.97865250034299,0.03025672260418715,1.9363139684131412,5.633539703503914
XS2167007918,WFC 1.741 05/04/30,EUR,96.129,WELLS FARGO & COMPANY,Financial,2030-05-04,1.741,A,0.000286223,1500000000,Y,2029-05-04,Sr Unsecured,1,VARIABLE,04/05/2021,04/02/2030,04/05/2020,96.015,96.242,3.589322381930185,0.22700000000000387,98.63162652925683,0.7154794520547946,99.34710598131163,2.5026265292568297,73.1419591448735,0.033131913150348156,0.9679306071871128,1.8737793206592255
XS2166122304,APD 0 ½ 05/05/28,EUR,95.173,AIR PRODUCTS & CHEMICALS,Basic Materials,2028-05-05,0.5,A,2.39346e-05,500000000,Y,2028-02-05,Sr Unsecured,1,FIXED,05/05/2021,05/05/2027,05/05/2020,95.093,95.254,2.346338124572211,0.16100000000000136,96.63235582672381,0.32602739726027397,96.95838322398409,1.459355826723808,65.01686767388344,0.029278817682359643,2.895908186012164,11.229947571009145
XS2166122486,APD 0.8 05/05/32,EUR,85.921,AIR PRODUCTS & CHEMICALS,Basic Materials,2032-05-05,0.8,A,2.39346e-05,500000000,Y,2032-02-05,Sr Unsecured,1,FIXED,05/05/2021,05/05/2031,05/05/2020,85.747,86.095,6.346338124572211,0.347999999999999,90.78272413893994,0.5216438356164383,91.30436797455638,4.861724138939934,88.67310627649621,0.027469439370521397,0.9732649572649571,1.894489354079917
XS2168285000,RABOBK 0 ⅞ 05/05/28,EUR,97.574,COOPERATIEVE RABOBANK UA,Financial,2028-05-05,0.875,A-,5.75847e-06,1000000000,Y,2027-05-05,Sr Non Preferred,1,VARIABLE,05/05/2021,05/02/2028,05/05/2020,97.488,97.66,1.5906913073237507,0.17199999999999704,98.36677104881036,0.3571917808219178,98.72396282963228,0.7927710488103656,50.93249304796287,0.029783268667031605,2.855604806937984,11.017807500430003
XS2168478068,CRHID 1 ¼ 11/05/26,EUR,98.848,CRH SMW FINANCE DAC,Industrial,2026-11-05,1.25,BBB+,5.66045e-05,750000000,Y,2026-08-05,Sr Unsecured,1,FIXED,05/11/2020,05/11/2025,05/05/2020,98.798,98.898,0.8432580424366872,0.09999999999999432,99.43517200606996,0.1952054794520548,99.63037748552202,0.587172006069963,70.04846551396848,0.04644600286368244,0.9556154806491886,1.8264018937127595
XS2169281487,CRHID 1 ⅝ 05/05/30,EUR,94.816,CRH FUNDING,Industrial,2030-05-05,1.625,BBB+,5.66045e-05,750000000,Y,2030-02-05,Sr Unsecured,1,FIXED,05/05/2021,05/05/2029,05/05/2020,94.628,95.004,4.347707049965777,0.3760000000000048,97.51596437615262,1.0595890410958904,98.57555341724851,2.6999643761526215,66.30572731072651,0.029827982146057305,5.766780082687894,39.066199201296
XS2168625544,PEP 0 ½ 05/06/28,EUR,95.169,PEPSICO INC,"Consumer, Non-cyclical",2028-05-06,0.5,A+,2.5576e-06,1000000000,Y,2028-02-06,Sr Unsecured,1,FIXED,06/05/2021,06/05/2027,06/05/2020,95.066,95.271,2.349075975359343,0.2049999999999983,96.62795647688725,0.32465753424657534,96.95261401113382,1.458956476887252,64.92657848270986,0.03233419075489085,0.9686785625774473,1.876676315194219
FR0013511227,CMARK 0 ⅞ 05/07/27,EUR,97.64,CREDIT MUTUEL ARKEA,Financial,2027-05-07,0.875,A+,1.22381e-05,750000000,N,,Sr Preferred,1,FIXED,07/05/2021,07/05/2026,07/05/2020,97.548,97.731,1.596167008898015,0.18299999999999272,98.36075055469746,0.35239726027397267,98.71314781497144,0.7207505546974602,46.13379859245958,0.031058812219703746,1.9323660913267118,5.615306070046287
XS2166219720,ASML 0 ⅝ 05/07/29,EUR,93.477,ASML HOLDING NV,Technology,2029-05-07,0.625,A,9.22768e-08,750000000,Y,2029-02-07,Sr Unsecured,1,FIXED,07/05/2021,07/05/2028,07/05/2020,93.349,93.605,3.353867214236824,0.2560000000000002,95.26367811251325,0.4041095890410959,95.66778770155435,1.7866781125132434,56.8286371830376,0.037765405537609084,8.198246395033832,77.54023853715196
XS2128499105,LIGHT 2 ⅜ 05/11/27,EUR,99.638,SIGNIFY NV,Industrial,2027-05-11,2.375,BBB-,0.000292969,600000000,Y,2027-02-11,Sr Unsecured,1,FIXED,11/05/2021,11/05/2026,11/05/2020,99.552,99.723,1.3634496919917864,0.17099999999999227,100.60117380877804,1.5095890410958905,102.11076284987394,0.9631738087780377,70.66316492502091,0.033952212889217445,0.9671626865671642,1.8708073245756298
FR0013512233,LIFP 2 05/12/29,EUR,97.23154,KLEPIERRE SA,Financial,2029-05-12,2.0,A-,2.73016e-05,750000000,Y,2029-02-12,Sr Unsecured,1,FIXED,12/05/2021,12/05/2028,12/05/2020,97.073,97.391,3.3675564681724848,0.31800000000001205,99.66627666719958,1.2657534246575342,100.93203009185711,2.434736667199587,75.08294430973433,0.03583057660897646,5.621392799176612,37.61218706099471
XS2170362672,NESNVX 0 ⅛ 11/12/27,EUR,95.681,NESTLE FINANCE INTL LTD,"Consumer, Non-cyclical",2027-11-12,0.125,AA-,0.016977096,850000000,Y,2027-08-12,Sr Unsecured,1,FIXED,12/11/2020,12/11/2026,12/05/2020,95.577,95.784,1.8617385352498288,0.20700000000000784,96.7115548649468,0.017123287671232876,96.72867815261804,1.030554864946808,57.53351848694594,0.026828215510888875,1.918356889702091,5.576085665948018
XS2170362912,NESNVX 0 ⅜ 05/12/32,EUR,85.865,NESTLE FINANCE INTL LTD,"Consumer, Non-cyclical",2032-05-12,0.375,AA-,0.016977096,1000000000,Y,2032-02-12,Sr Unsecured,1,FIXED,12/05/2021,12/05/2031,12/05/2020,85.683,86.047,6.365503080082136,0.3639999999999901,88.25277072156473,0.23732876712328765,88.49009948868802,2.387770721564735,43.53231273213979,0.029853146181367026,3.795953596113421,18.288405686375157
AT0000A2GH08,ERSTBK 0 ⅞ 05/13/27,EUR,97.71545,ERSTE GROUP BANK AG,Financial,2027-05-13,0.875,A,0.000194493,750000000,N,,Sr Preferred,1,FIXED,13/05/2021,13/05/2026,13/05/2020,97.637,97.794,1.6125941136208077,0.15699999999999648,98.34269618066084,0.338013698630137,98.68070987929097,0.6272461806608334,39.73165676509308,0.03629095985089012,6.475361309463355,49.290552447155996
FR0013512407,KERFP 0 ¾ 05/13/28,EUR,95.499,KERING,"Consumer, Cyclical",2028-05-13,0.75,NR,0.001163335,600000000,Y,2028-02-13,Sr Unsecured,1,FIXED,13/05/2021,13/05/2027,13/05/2020,95.384,95.615,2.3682409308692676,0.23099999999999454,97.17004354025606,0.4726027397260274,97.64264627998209,1.6710435402560648,73.54957431417016,0.041280015722975155,11.696499447236127,160.74976780091467
FR0013512449,VIEFP 1 ¼ 05/14/35,EUR,81.02157,VEOLIA ENVIRONNEMENT SA,Utilities,2035-05-14,1.25,NR,0.000200524,750000000,Y,2035-02-14,Sr Unsecured,1,FIXED,14/05/2021,14/05/2034,14/05/2020,80.753,81.29,9.371663244353183,0.5370000000000061,89.22663055763765,0.7842465753424657,90.01087713298011,8.205060557637651,108.94622536604145,0.029415728550779487,2.9029352305977567,11.265317093896071
XS2171874519,NDAFH 0 ½ 05/14/27,EUR,97.19985,NORDEA BANK ABP,Financial,2027-05-14,0.5,AA-,4.21953e-05,1250000000,N,,Sr Preferred,1,FIXED,14/05/2021,14/05/2026,14/05/2020,97.141,97.258,1.6153319644079398,0.11699999999999022,97.7493428672839,0.1917808219178082,97.9411236892017,0.5494928672839023,34.91554919293514,0.03296535607280086,4.739088410701217,27.33401938236061
XS2171713006,EUROGR 1.113 05/15/32,EUR,86.874,EUROGRID GMBH,Utilities,2032-05-15,1.113,NR,0.009725752,750000000,Y,2032-02-15,Sr Unsecured,1,FIXED,15/05/2021,15/05/2031,15/05/2020,86.686,87.062,6.373716632443532,0.37599999999999056,92.57557281047973,0.6952438356164383,93.27081664609616,5.701572810479732,102.85851957694726,0.027523786611086676,0.9732134798534797,1.8942889547370385
XS2171872570,NOKIA 3 ⅛ 05/15/28,EUR,100.85,NOKIA OYJ,Communications,2028-05-15,3.125,BB+,3.36088e-05,500000000,Y,2028-02-15,Sr Unsecured,1,FIXED,15/05/2021,15/05/2027,15/05/2020,100.744,100.956,2.3737166324435317,0.2120000000000033,102.61708714930963,1.952054794520548,104.56914194383018,1.7670871493096314,74.54238245589808,0.03032671596599114,3.836849073805293,18.54683811488111
XS2176558620,BERTEL 1 ½ 05/15/30,EUR,94.477,BERTELSMANN SE & CO KGAA,Communications,2030-05-15,1.5,BBB,0.009998721,750000000,Y,2030-02-15,Sr Unsecured,1,FIXED,15/05/2021,15/05/2029,15/05/2020,94.292,94.663,4.375085557837098,0.3709999999999951,96.97464860774953,0.9369863013698629,97.91163490911939,2.4976486077495252,61.12392590583623,0.037827653318977965,0.9635511221945139,1.8568615301646145
XS2176560444,VZ 1.3 05/18/33,EUR,85.827,VERIZON COMMUNICATIONS,Communications,2033-05-18,1.3,BBB+,0.000164108,1350000000,Y,2033-02-18,Sr Unsecured,1,FIXED,18/05/2021,18/05/2032,18/05/2020,85.604,86.05,7.383983572895278,0.44599999999999795,92.30693182521595,0.8013698630136987,93.10830168822966,6.479931825215957,102.94044861378048,0.033737293327517764,5.717100832217618,38.52134812777613
XS2176561095,VZ 1.85 05/18/40,EUR,76.13926,VERIZON COMMUNICATIONS,Communications,2040-05-18,1.85,BBB+,0.000164108,800000000,Y,2039-11-18,Sr Unsecured,1,FIXED,18/05/2021,18/05/2039,18/05/2020,75.799,76.48,14.130047912388775,0.6809999999999974,89.56858971285332,1.6067123287671234,91.17530204162044,13.429329712853331,131.58580810202824,0.031304260092542835,3.833113024127695,18.51107789472527
XS2176715667,SAPGR 0 ⅜ 05/18/29,EUR,92.732,SAP SE,Technology,2029-05-18,0.375,NR,3.31915e-07,800000000,Y,2029-02-18,Sr Unsecured,1,FIXED,18/05/2021,18/05/2028,18/05/2020,92.606,92.859,3.383983572895277,0.2530000000000001,94.39637380901905,0.23116438356164384,94.6275381925807,1.6643738090190539,52.768749337475434,0.029393320918783796,2.891916486327793,11.208460450902688
FR0013512621,DGFP 1 05/19/31,EUR,89.571,COFIROUTE SA,"Consumer, Non-cyclical",2031-05-19,1.0,NR,0.006323982,950000000,Y,2031-02-19,Sr Unsecured,1,FIXED,19/05/2021,19/05/2030,19/05/2020,89.418,89.724,5.385352498288843,0.3059999999999974,93.42627092186777,0.6136986301369863,94.03996955200475,3.8552709218677705,79.99808813361058,0.031597332360862394,5.663073205474161,38.08800894306845
XS2176562812,WPPLN 2 ⅜ 05/19/27,EUR,99.63273,WPP FINANCE SA,Communications,2027-05-19,2.375,BBB,0.006265143,750000000,N,,Sr Unsecured,1,FIXED,19/05/2021,19/05/2026,19/05/2020,99.545,99.72,1.6290212183436004,0.17499999999999716,100.70580224429642,0.8784246575342465,101.58422690183068,1.0730722442964264,66.08461040387057,0.02217739932235712,0.978303766707169,1.9141565199068706
XS2177013765,RKTLN 0 ¾ 05/19/30,EUR,91.52171,RECKITT BENCKISER TSY NL,"Consumer, Non-cyclical",2030-05-19,0.75,A-,3.08946e-06,850000000,Y,2030-02-19,Sr Unsecured,1,FIXED,19/05/2021,19/05/2029,19/05/2020,91.379,91.665,4.386036960985626,0.28600000000000136,93.85410061022051,0.4602739726027397,94.31437458282325,2.3323906102205143,58.08709639383796,0.027914016954580262,1.938300392527536,5.6498047920490135
XS2177021271,LIN 0 ¼ 05/19/27,EUR,96.596,LINDE FINANCE BV,Basic Materials,2027-05-19,0.25,A,0.063121921,750000000,Y,2027-02-19,Sr Unsecured,1,FIXED,19/05/2021,19/05/2026,19/05/2020,96.523,96.67,1.3853524982888432,0.14700000000000557,97.73598731944607,0.15342465753424658,97.88941197698031,1.139987319446064,84.6537135284833,0.03355602374293981,4.748325671894822,27.39492548105878
XS2177021602,LIN 0.55 05/19/32,EUR,84.891,LINDE FINANCE BV,Basic Materials,2032-05-19,0.55,A,0.063121921,750000000,Y,2032-02-19,Sr Unsecured,1,FIXED,19/05/2021,19/05/2031,19/05/2020,84.71,85.072,6.38466803559206,0.362000000000009,89.24316971520473,0.33753424657534253,89.58070396178007,4.352169715204724,79.51736363536307,0.04173182875893288,0.9599399503722086,1.842969416641197
FR0013513538,LRFP 0 ¾ 05/20/30,EUR,91.17925,LEGRAND SA,Industrial,2030-05-20,0.75,NR,6.83986e-06,600000000,Y,2030-02-20,Sr Unsecured,1,FIXED,20/05/2021,20/05/2029,20/05/2020,91.034,91.325,4.388774811772758,0.2909999999999968,93.8495370912713,0.4582191780821918,94.30775626935349,2.6702870912713053,66.5881463235321,0.03519950409114578,0.9659973715674747,1.8663018437505392
XS2177122624,DHLGR 0 ¾ 05/20/29,EUR,93.8,DEUTSCHE POST AG,Industrial,2029-05-20,0.75,A-,0.000114015,750000000,Y,2029-02-20,Sr Unsecured,1,FIXED,20/05/2021,20/05/2028,20/05/2020,93.653,93.947,3.3894592744695413,0.29399999999999693,95.59999940937061,0.4582191780821918,96.0582185874528,1.7999994093706135,56.54266222878318,0.03603842956502381,5.524746770009365,36.74166460197521
XS2177122897,DHLGR 1 05/20/32,EUR,88.362,DEUTSCHE POST AG,Industrial,2032-05-20,1.0,A-,0.000114015,750000000,Y,2032-02-20,Sr Unsecured,1,FIXED,20/05/2021,20/05/2031,20/05/2020,88.164,88.559,6.3874058863791925,0.394999999999996,91.88942750353027,0.6109589041095891,92.50038640763987,3.5274275035302765,63.00350164668949,0.03509677261431893,3.742019252944951,17.880935897761322
XS2177555062,AMSSM 2 ⅞ 05/20/27,EUR,100.643,AMADEUS IT GROUP SA,"Consumer, Cyclical",2027-05-20,2.875,BBB,5.97683e-07,500000000,Y,2027-02-20,Sr Unsecured,1,FIXED,20/05/2021,20/05/2026,20/05/2020,100.567,100.719,1.3880903490759753,0.15200000000000102,101.28958848160846,1.7565068493150686,103.04609533092354,0.646588481608461,46.23940782108544,0.02965020495518855,3.7500060091161527,17.993996851042223
XS2177580250,EOANGR 0 ¾ 02/20/28,EUR,96.082,E.ON SE,Utilities,2028-02-20,0.75,BBB+,0.00010082,500000000,Y,2027-11-20,Sr Unsecured,1,FIXED,20/02/2021,20/02/2027,20/05/2020,95.989,96.176,2.135523613963039,0.1869999999999976,97.49022605565486,0.6472602739726028,98.13748632962746,1.4082260556548647,68.36588746323476,0.027557679647200333,0.973181379310345,1.894163994072771
XS2177580508,EOANGR 0 ⅞ 08/20/31,EUR,88.754,E.ON SE,Utilities,2031-08-20,0.875,BBB+,0.00010082,500000000,Y,2031-05-20,Sr Unsecured,1,FIXED,20/08/2020,20/08/2030,20/05/2020,88.557,88.95,5.631759069130732,0.3930000000000007,92.39876775508834,0.3212328767123288,92.72000063180067,3.6447677550883384,72.94444768422615,0.029654140311310907,0.9711999018404908,1.8864584986699577
XS2176534795,WURTH 0 ¾ 11/22/27,EUR,96.71395,WUERTH FINANCE INTL BV,Industrial,2027-11-22,0.75,NR,0.014471374,750000000,Y,2027-08-22,Sr Unsecured,1,FIXED,22/11/2020,22/11/2026,21/05/2020,96.64,96.788,1.88911704312115,0.14799999999999613,97.81066571841032,0.0821917808219178,97.89285749923224,1.096715718410323,59.837039794049105,0.028887950033796683,1.9283493309128572,5.6075601403174815
XS2177441990,TELEFO 1.201 08/21/27,EUR,97.7599,TELEFONICA EMISIONES SAU,Communications,2027-08-21,1.201,BBB-,0.021357445,1250000000,Y,2027-05-21,Sr Unsecured,1,FIXED,21/08/2021,21/08/2026,21/05/2020,97.654,97.866,1.6344969199178645,0.2120000000000033,98.83786204686827,0.4376246575342466,99.27548670440251,1.0779620468682651,67.24252267268481,0.034103320353791135,5.505334155721492,36.611533631244434
XS2177442295,TELEFO 1.807 05/21/32,EUR,90.458,TELEFONICA EMISIONES SAU,Communications,2032-05-21,1.807,BBB-,0.021357445,750000000,Y,2031-11-21,Sr Unsecured,1,FIXED,21/05/2021,21/05/2031,21/05/2020,90.221,90.694,6.138261464750171,0.472999999999999,96.87006128227274,1.5545150684931506,98.42457635076589,6.412061282272745,116.91833674758637,0.04051054405957343,9.917201802046385,117.6071301872795
DE000A254TM8,ALVGR 2.121 07/08/50,EUR,94.90045,ALLIANZ SE,Financial,2050-07-08,2.121,A+,4.75964e-06,1000000000,Y,2030-07-08,Subordinated,1,VARIABLE,08/07/2020,12/04/2050,22/05/2020,94.724,95.077,4.766598220396989,0.35299999999999443,99.37488002205062,0.493931506849315,99.86881152889994,4.474430022050612,100.48325410865239,0.032603896155792796,3.785310472641233,18.187803129374068
DE000A289XG8,MBGGR 2 ⅜ 05/22/30,EUR,97.805,MERCEDES-BENZ GROUP AG,"Consumer, Cyclical",2030-05-22,2.375,A,0.001270443,750000000,N,,Sr Unsecured,1,FIXED,22/05/2021,22/05/2029,22/05/2020,97.618,97.992,4.63791923340178,0.37400000000000944,100.53945602653783,0.8589041095890412,101.39836013612688,2.7344560265378277,61.95923089321409,0.03471807584895915,3.7911984886900023,18.201170958766646
XS2175967343,ACHMEA 1 ½ 05/26/27,EUR,98.77791,ACHMEA BV,Financial,2027-05-26,1.5,BBB+,0.001426012,750000000,Y,2027-02-26,Sr Unsecured,1,FIXED,26/05/2021,26/05/2026,26/05/2020,98.651,98.905,1.404517453798768,0.2540000000000049,99.41916817933478,0.8917808219178083,100.31094900125258,0.6412581793347698,46.118082315885005,0.03906436432384858,5.391742910080038,35.48553889871814
XS2179959817,VVOYHT 1 ⅞ 05/27/27,EUR,98.94099,KOJAMO OYJ,Financial,2027-05-27,1.875,NR,0.000833013,500000000,Y,2027-02-27,Sr Unsecured,1,FIXED,27/05/2021,27/05/2026,27/05/2020,98.841,99.041,1.4072553045859,0.20000000000000284,99.93326185027661,1.1095890410958904,101.0428508913725,0.9922718502766088,71.01190992000974,0.03854800111883462,0.9628827930174565,1.8542865461781963
XS2180007549,T 1.6 05/19/28,EUR,97.52995,AT&T INC,Communications,2028-05-19,1.6,BBB,0.000147481,1750000000,Y,2028-02-19,Sr Unsecured,1,FIXED,19/05/2021,19/05/2027,27/05/2020,97.422,97.638,2.3846680355920604,0.21600000000000819,99.10846368613304,0.9819178082191782,100.09038149435221,1.5785136861330358,67.97070567175102,0.03277257004894431,0.9682673891625615,1.8750834738313669
XS2180008513,T 2.05 05/19/32,EUR,92.73,AT&T INC,Communications,2032-05-19,2.05,BBB,0.000147481,750000000,Y,2032-02-19,Sr Unsecured,1,FIXED,19/05/2021,19/05/2031,27/05/2020,92.539,92.921,6.38466803559206,0.382000000000005,98.07842707948302,1.2580821917808218,99.33650927126384,5.348427079483017,92.77413736510933,0.030246086610584522,1.9363340092561332,5.633656219899564
XS2180009081,T 2.6 05/19/38,EUR,86.422,AT&T INC,Communications,2038-05-19,2.6,BBB,0.000147481,500000000,Y,2037-11-19,Sr Unsecured,1,FIXED,19/05/2021,19/05/2037,27/05/2020,86.118,86.726,12.134154688569472,0.6080000000000041,99.38982035756295,2.250958904109589,101.64077926167255,12.967820357562957,133.50387760945694,0.03175316100853809,2.895717574340966,11.21102781042141
XS2178769159,FMEGR 1 ½ 05/29/30,EUR,93.497,FRESENIUS MEDICAL CARE A,"Consumer, Non-cyclical",2030-05-29,1.5,BBB-,0.000235876,750000000,Y,2030-02-28,Sr Unsecured,1,FIXED,29/05/2021,29/05/2029,29/05/2020,93.222,93.773,4.4106776180698155,0.5510000000000019,96.93919589642556,0.8835616438356164,97.82275754026118,3.4421958964255595,84.03812092568965,0.033267169157894856,1.9234176312089428,5.572675576142273
FR0013515749,BFCM 1 ¼ 06/03/30,EUR,91.83366,BANQUE FED CRED MUTUEL,Financial,2030-06-03,1.25,A-,1.08678e-05,1000000000,N,,Sr Non Preferred,1,FIXED,03/06/2021,03/06/2029,03/06/2020,91.667,92.001,4.670773442847365,0.3340000000000032,95.58221327714608,0.410958904109589,95.99317218125567,3.7485532771460868,87.61662979198468,0.03417249000098341,3.793288050986056,18.22093481888058
XS2181959110,SRENVX 2.714 06/04/52,EUR,93.73,SWISS RE FINANCE UK,Financial,2052-06-04,2.714,BBB+,4.56415e-06,800000000,Y,2032-06-04,Subordinated,1,VARIABLE,04/06/2021,04/06/2051,04/06/2020,93.463,93.996,6.674880219028063,0.5330000000000013,101.9487863806793,0.8848383561643836,102.83362473684367,8.21878638067929,135.73763721911538,0.03371905192469857,0.9673808353808353,1.8716513613242454
DE000A289DC9,BASGR 0 ¼ 06/05/27,EUR,96.529,BASF SE,Basic Materials,2027-06-05,0.25,A-,0.000440507,1000000000,Y,2027-03-05,Sr Unsecured,1,FIXED,05/06/2021,05/06/2026,05/06/2020,96.442,96.616,1.4236824093086926,0.1740000000000066,97.6742265710438,0.14383561643835616,97.81806218748216,1.145226571043807,82.81199909406944,0.03232699900407716,3.7933409891810292,18.24273300684111
FR0013515871,FLYFP 1 ½ 06/05/27,EUR,98.27914,SOCIETE FONCIERE LYONNAI,Financial,2027-06-05,1.5,NR,7.06812e-05,599000000,Y,2027-03-05,Sr Unsecured,1,FIXED,05/06/2021,05/06/2026,05/06/2020,98.181,98.377,1.4236824093086926,0.19599999999999795,99.41136720404035,0.8630136986301369,100.27438090267049,1.1322272040403476,80.54918566787818,0.033378004734124646,5.681613361248629,38.2114531617038
FR0013516077,EFFP 0 ½ 06/05/28,EUR,95.17096,ESSILORLUXOTTICA,"Consumer, Non-cyclical",2028-06-05,0.5,A,4.39364e-06,1250000000,Y,2028-03-05,Sr Unsecured,1,FIXED,05/06/2021,05/06/2027,05/06/2020,95.069,95.273,2.425735797399042,0.20399999999999352,96.50359612841807,0.2876712328767123,96.79126736129479,1.3326361284180734,57.477934979806186,0.03784415424670424,0.9635358024691361,1.856802485279684
FR0013517026,BNFP 0.395 06/10/29,EUR,92.162,DANONE SA,"Consumer, Non-cyclical",2029-06-10,0.395,BBB+,1.13671e-06,800000000,Y,2029-03-10,Sr Unsecured,1,FIXED,10/06/2021,10/06/2028,10/06/2020,92.044,92.28,3.4387405886379194,0.2360000000000042,94.34377573846021,0.22184931506849317,94.5656250535287,2.1817757384602032,68.32412368078981,0.03667274957986662,0.9646245648930879,1.8610011023903583
FR0013517307,CMARK 1 ¼ 06/11/29,EUR,96.045,CREDIT MUTUEL ARKEA,Financial,2029-06-11,1.25,A,1.22381e-05,750000000,Y,2028-06-11,Sr Non Preferred,1,VARIABLE,11/06/2021,11/03/2029,11/06/2020,95.92,96.17,2.6940451745379876,0.25,98.02189398891798,0.3835616438356165,98.4054556327536,1.976893988917979,76.34356940847901,0.036265817093272985,5.547602086518868,36.94112716776458
FR0013518057,SOCGEN 1 ¼ 06/12/30,EUR,92.02386,SOCIETE GENERALE,Financial,2030-06-12,1.25,BBB,0.00033915,1000000000,N,,Sr Non Preferred,1,FIXED,12/06/2021,12/06/2029,12/06/2020,91.874,92.174,4.695414099931554,0.30000000000001137,95.55260091813761,0.3801369863013699,95.93273790443898,3.528740918137615,81.98800200993084,0.03676611273652693,3.7487301666684463,17.905156267509803
XS2177443343,MHK 1 ¾ 06/12/27,EUR,98.431,MOHAWK CAPITAL FINANCE,Industrial,2027-06-12,1.75,BBB+,0.000277386,500000000,Y,2027-04-12,Sr Unsecured,1,FIXED,12/06/2021,12/06/2026,12/06/2020,98.369,98.492,1.5277207392197125,0.12300000000000466,99.73977161193191,0.8246575342465755,100.56442914617848,1.3087716119319168,86.66858876459135,0.032633982121939666,3.8280421247562066,18.4625969375515
XS2188805845,COVEGR 1 ⅜ 06/12/30,EUR,93.133,COVESTRO AG,Basic Materials,2030-06-12,1.375,NR,1.31297e-07,500000000,Y,2030-03-12,Sr Unsecured,1,FIXED,12/06/2021,12/06/2029,12/06/2020,92.877,93.388,4.4435318275154,0.5110000000000099,96.3817738129466,0.7647260273972604,97.14649984034386,3.2487738129466095,78.96758933965434,0.03123094192501358,2.8687544911532186,11.075539459866674
FR0013517059,VIEFP 0.8 01/15/32,EUR,86.40485,VEOLIA ENVIRONNEMENT SA,Utilities,2032-01-15,0.8,BBB,0.000200524,500000000,Y,2031-10-15,Sr Unsecured,1,FIXED,15/01/2021,15/01/2031,15/06/2020,86.214,86.595,6.036960985626283,0.3810000000000002,91.32750512642878,0.7693150684931508,92.09682019492193,4.922655126428779,93.72107923470776,0.03423891275778807,0.9668945808019442,1.8697702607683353
DE000A289N78,DBOERS 1 ¼ 06/16/47,EUR,97.558,DEUTSCHE BOERSE AG,Financial,2047-06-16,1.25,NR,4.58215e-08,600000000,Y,2027-03-16,Jr Subordinated,1,VARIABLE,16/06/2021,16/06/2046,16/06/2020,97.264,97.852,1.4537987679671458,0.5880000000000081,99.04446042907497,0.6815068493150684,99.72596727839004,1.4864604290749668,104.12250244030183,0.03279999927160068,3.80565951226662,18.31653421829339
XS2189931335,MET 0.55 06/16/27,EUR,96.993,MET LIFE GLOB FUNDING I,Financial,2027-06-16,0.55,AA-,0.011569751,500000000,N,,Secured,1,FIXED,16/06/2021,16/06/2026,16/06/2020,96.918,97.069,1.7056810403832992,0.15099999999999625,97.70068836912266,0.16123287671232878,97.86192124583499,0.7076883691226641,42.66033154158264,0.03552115069464809,4.6238295817234745,26.40287069768407
XS2187529180,PRIFII 1 ⅝ 06/17/32,EUR,89.37867,PROLOGIS INTL FUND II,Financial,2032-06-17,1.625,A-,0.002987741,500000000,Y,2032-03-17,Sr Unsecured,1,FIXED,17/06/2021,17/06/2031,17/06/2020,89.191,89.566,6.458590006844627,0.375,95.49379744526107,0.8815068493150685,96.37530429457614,6.115127445261066,107.18029213424407,0.03372448651474231,3.7740863109144613,18.102645760630207
XS2189970317,ZURNVX 1 ⅞ 09/17/50,EUR,93.41019,ZURICH FINANCE IRELAND,Financial,2050-09-17,1.875,A+,0.001491281,750000000,Y,2030-06-17,Subordinated,1,VARIABLE,17/09/2020,17/06/2050,17/06/2020,93.183,93.637,4.7091033538672145,0.4539999999999935,98.30799905488995,0.5445205479452054,98.85251960283516,4.897809054889947,112.27881567594874,0.034196862421195594,5.702997831333873,38.38340616723724
XS2190256706,SRGIM 0 ¾ 06/17/30,EUR,90.716,SNAM SPA,Utilities,2030-06-17,0.75,BBB+,2.41679e-05,750000000,Y,2030-03-17,Sr Unsecured,1,FIXED,17/06/2021,17/06/2029,17/06/2020,90.57,90.861,4.457221081451061,0.291000000000011,93.73556272451513,0.40684931506849314,94.14241203958363,3.01956272451514,74.39614852883717,0.03685732046616338,0.964452852153667,1.8603386080546864
FR0013518537,EDENFP 1 ⅜ 06/18/29,EUR,95.067,EDENRED SE,"Consumer, Non-cyclical",2029-06-18,1.375,NR,0.000992738,600000000,Y,2029-03-18,Sr Unsecured,1,FIXED,18/06/2021,18/06/2028,18/06/2020,94.932,95.202,3.460643394934976,0.269999999999996,97.53727251546287,0.7421232876712329,98.27939580313411,2.470272515462881,75.31301033560445,0.043055242335333845,5.467916102195159,36.076834689424295
XS2189786226,RBIAV 2 ⅞ 06/18/32,EUR,99.46928,RAIFFEISEN BANK INTL,Financial,2032-06-18,2.875,NR,0.001639958,500000000,Y,2027-06-18,Subordinated,1,VARIABLE,18/06/2021,18/06/2031,18/06/2020,99.266,99.673,1.7111567419575633,0.4069999999999965,101.56762454700872,0.8270547945205479,102.39467934152927,2.098344547008722,122.92083552170978,0.0316702621671797,0.9693019530284304,1.879092552289459
FR0013519071,CAPFP 1 ⅛ 06/23/30,EUR,92.043,CAPGEMINI SE,Technology,2030-06-23,1.125,NR,0.000167553,800000000,Y,2030-03-23,Sr Unsecured,1,FIXED,23/06/2021,23/06/2029,23/06/2020,91.888,92.198,4.473648186173854,0.30999999999998806,95.29243134833787,0.5917808219178081,95.88421217025568,3.2494313483378647,79.05051651827713,0.03308210672136711,5.5181645282657374,36.749911692534496
FR0013519261,LAMON 2 ⅛ 06/23/31,EUR,93.566,LA MONDIALE,Financial,2031-06-23,2.125,NR,0.001831588,500000000,Y,2031-03-23,Subordinated,1,FIXED,23/06/2021,23/06/2030,23/06/2020,93.309,93.824,5.47296372347707,0.5150000000000006,99.0381584532582,1.117808219178082,100.15596667243629,5.472158453258203,108.8036194015436,0.031236351313529587,2.861747025430377,11.039306133333453
FR0013519279,COVFP 1 ⅝ 06/23/30,EUR,93.562,COVIVIO,Financial,2030-06-23,1.625,NR,0.00050927,599000000,Y,2030-03-23,Sr Unsecured,1,FIXED,23/06/2021,23/06/2029,23/06/2020,93.359,93.764,4.473648186173854,0.40500000000000114,97.4046554854649,0.8547945205479451,98.25945000601284,3.8426554854649027,92.47603274963815,0.035132100363845196,4.7047057506089605,27.031655542110375
XS2193978363,DSFIR 0 ¼ 06/23/28,EUR,94.49316,DSM BV,Basic Materials,2028-06-23,0.25,A-,5.61341e-06,500000000,Y,2028-03-23,Sr Unsecured,1,FIXED,23/06/2021,23/06/2027,23/06/2020,94.395,94.591,2.4750171115674195,0.19599999999999795,95.82727293512123,0.13150684931506848,95.9587797844363,1.334112935121226,56.70605954349589,0.031634131352382286,2.85372257544501,10.995064548558812
XS2193979254,DSFIR 0 ⅝ 06/23/32,EUR,85.069,DSM BV,Basic Materials,2032-06-23,0.625,A-,5.61341e-06,500000000,Y,2032-03-23,Sr Unsecured,1,FIXED,23/06/2021,23/06/2031,23/06/2020,84.884,85.255,6.4750171115674195,0.3709999999999951,89.51249786836259,0.3287671232876712,89.84126499165026,4.443497868362584,80.04378150864689,0.03757051075949065,5.489987046493832,36.395969552553304
XS2193982803,VTRS 1.362 06/23/27,EUR,97.75887,UPJOHN FINANCE BV,"Consumer, Non-cyclical",2027-06-23,1.362,BBB-,0.000970976,850000000,Y,2027-04-23,Sr Unsecured,1,FIXED,23/06/2021,23/06/2026,23/06/2020,97.63,97.888,1.5578370978781657,0.2580000000000098,99.14262772461413,0.6007726027397261,99.74340032735385,1.383757724614128,90.40308517033183,,,
XS2193983108,VTRS 1.908 06/23/32,EUR,87.5559,UPJOHN FINANCE BV,"Consumer, Non-cyclical",2032-06-23,1.908,BBB-,0.000970976,1250000000,Y,2032-03-23,Sr Unsecured,1,FIXED,23/06/2021,23/06/2031,23/06/2020,87.299,87.813,6.4750171115674195,0.5139999999999958,97.16452729410841,1.0036602739726026,98.16818756808101,9.608627294108416,169.56228121193323,0.028831620193826922,2.8516002102739533,11.003776738526751
XS2194370727,SANTAN 1 ⅛ 06/23/27,EUR,98.02066,BANCO SANTANDER SA,Financial,2027-06-23,1.125,A-,0.000140759,1000000000,N,,Sr Non Preferred,1,FIXED,23/06/2021,23/06/2026,23/06/2020,97.937,98.105,1.7248459958932238,0.16800000000000637,98.6395374401282,0.3082191780821918,98.94775661821039,0.6188774401281876,36.588809933776865,0.03962145563290259,4.550531983943591,25.774103803210522
XS2194192527,IFXGR 2 06/24/32,EUR,92.985,INFINEON TECHNOLOGIES AG,Technology,2032-06-24,2.0,NR,0.000124785,650000000,Y,2032-03-24,Sr Unsecured,1,FIXED,24/06/2021,24/06/2031,24/06/2020,92.781,93.189,6.477754962354552,0.40799999999998704,97.71124666317745,1.0465753424657533,98.7578220056432,4.726246663177449,80.81516826796489,0.03326289719593106,3.811066751288551,18.345906247417165
XS2194283839,IFXGR 1 ⅝ 06/24/29,EUR,95.771,INFINEON TECHNOLOGIES AG,Technology,2029-06-24,1.625,NR,0.000124785,750000000,Y,2029-03-24,Sr Unsecured,1,FIXED,24/06/2021,24/06/2028,24/06/2020,95.642,95.901,3.477070499657769,0.25900000000000034,98.34730911859558,0.8503424657534246,99.197651584349,2.5763091185955744,77.79956887909755,0.030013418353151404,1.9225026009788913,5.58078955527665
XS2191362859,DLR 1 ¼ 02/01/31,EUR,89.78531,DIGITAL DUTCH FINCO BV,Financial,2031-02-01,1.25,BBB,0.000167809,500000000,Y,2030-11-01,Sr Unsecured,1,FIXED,01/02/2021,01/02/2030,26/06/2020,89.601,89.97,5.084188911704312,0.3689999999999998,95.07844094447137,1.143835616438356,96.22227656090972,5.293130944471372,115.60690924181111,0.03265990057354152,3.8279434118258986,18.46165382032222
XS2193658619,CLNXSM 1 ⅞ 06/26/29,EUR,96.367,CELLNEX TELECOM SA,Industrial,2029-06-26,1.875,BBB-,0.000790603,750000000,Y,2029-03-26,Sr Unsecured,1,FIXED,26/06/2021,26/06/2028,26/06/2020,96.259,96.474,3.482546201232033,0.2150000000000034,99.17343121224376,0.970890410958904,100.14432162320266,2.8064312122437514,84.24657309840043,0.02300513722795931,1.913779164624937,5.571909715378106
FR0013521267,URWFP 2 06/29/32,EUR,90.716,UNIBAIL-RODAMCO-WESTFLD,Financial,2032-06-29,2.0,BBB,0.008889247,750000000,Y,2032-03-29,Sr Unsecured,1,FIXED,29/06/2021,29/06/2031,29/06/2020,90.472,90.959,6.491444216290212,0.487000000000009,97.70133405716238,1.0191780821917809,98.72051213935417,6.98533405716239,120.7317397657521,0.03632161286579704,5.660776786062237,37.95313801037661
XS2193974701,WMG 2 ¾ 07/15/28,EUR,99.587,WMG ACQUISITION CORP,"Consumer, Cyclical",2028-07-15,2.75,BBB-,1.39594e-05,325000000,Y,2025-11-28,1st lien,2,FIXED,15/01/2021,15/01/2028,29/06/2020,99.209,99.965,0.15879534565366188,0.7560000000000002,100.11911437486346,0.9415760869565218,101.06069046181997,0.532114374863454,332.2258810601724,0.03633678556334644,3.7571738523007188,17.96416718453062
XS2195092601,ABESM 2 ¼ 03/29/29,EUR,98.205,ABERTIS INFRAESTRUCTURAS,"Consumer, Non-cyclical",2029-03-29,2.25,BBB-,0.016819763,900000000,Y,2028-12-29,Sr Unsecured,1,FIXED,29/03/2021,29/03/2028,30/06/2020,98.083,98.327,3.24435318275154,0.24399999999999977,100.52681522443521,1.7013698630136986,102.2281850874489,2.3218152244352126,73.73949867494633,0.03476078619993628,3.8053503787716108,18.291594455159885
XS2197076651,HELNSW 2 ¾ 09/30/41,EUR,94.598,HELVETIA EUROPE SA,Financial,2041-09-30,2.75,NR,5.80647e-07,600000000,Y,2031-06-30,Subordinated,1,VARIABLE,30/09/2020,30/09/2040,30/06/2020,94.394,94.802,5.7440109514031485,0.40800000000000125,102.23509667814736,0.7006849315068493,102.93578160965421,7.637096678147358,143.97826723840492,0.0407149375906752,0.9608779156327543,1.846572737501493
XS2197356186,IREIM 1 07/01/30,EUR,91.42,IREN SPA,Utilities,2030-07-01,1.0,BBB,6.77917e-05,484000000,Y,2030-04-01,Sr Unsecured,1,FIXED,01/07/2021,01/07/2029,01/07/2020,91.266,91.574,4.498288843258043,0.3079999999999927,94.72896628247986,0.5013698630136987,95.23033614549355,3.308966282479858,80.40894200477521,0.033555843231343314,2.8728523997235085,11.0801580177179
XS2196317742,SESGFP 2 07/02/28,EUR,98.084,SES SA,Communications,2028-07-02,2.0,BBB-,0.006157273,400000000,Y,2028-04-02,Sr Unsecured,1,FIXED,02/07/2021,02/07/2027,02/07/2020,97.766,98.401,2.5023956194387407,0.6349999999999909,100.0037631053984,0.9972602739726028,101.001023379371,1.9197631053984026,78.48273707853224,0.03560586072145587,5.585828576367275,37.29885174929099
XS2198580271,WKLNA 0 ¾ 07/03/30,EUR,90.707,WOLTERS KLUWER NV,"Consumer, Non-cyclical",2030-07-03,0.75,NR,8.87712e-06,500000000,Y,2030-04-03,Sr Unsecured,1,FIXED,03/07/2021,03/07/2029,03/07/2020,90.566,90.849,4.503764544832307,0.28300000000000125,93.65825757402125,0.3719178082191781,94.03017538224043,2.9512575740212554,72.00879878929682,0.042166357059957166,11.571307563306346,158.3218828493865
XS2199351375,STLA 4 ½ 07/07/28,EUR,104.2517,STELLANTIS NV,"Consumer, Cyclical",2028-07-07,4.5,BBB,0.024239666,1000000000,Y,2028-04-07,Sr Unsecured,1,FIXED,07/07/2021,07/07/2027,07/07/2020,104.111,104.392,2.516084873374401,0.2809999999999917,106.07167838722846,2.182191780821918,108.25387016805038,1.8199783872284598,70.81703818033769,0.03234964482970598,3.793253729936697,18.241907538937802
XS2200513070,NGGLN 0.823 07/07/32,EUR,85.096,NATL GRID ELECT TRANS,Utilities,2032-07-07,0.823,BBB+,0.006406846,750000000,Y,2032-04-07,Sr Unsecured,1,FIXED,07/07/2021,07/07/2031,07/07/2020,84.894,85.298,6.5160848733744015,0.40399999999999636,90.62278560477172,0.39909863013698627,91.02188423490871,5.526785604771717,98.88117775352262,0.044022710756851956,11.620765528800888,159.10236546544232
XS2198574209,HANRUE 1 ¾ 10/08/40,EUR,93.103,HANNOVER RE,Financial,2040-10-08,1.75,NR,1.34716e-07,500000000,Y,2030-07-08,Subordinated,1,VARIABLE,08/10/2020,09/07/2040,08/07/2020,92.931,93.274,4.766598220396989,0.3430000000000035,97.71044382337953,0.4075342465753425,98.11797806995487,4.6074438233795405,104.67282473124071,0.024785032883212103,0.9758144078144076,1.904427516996366
DE000A28ZQQ5,ANNGR 1 07/09/30,EUR,90.9,VONOVIA SE,Financial,2030-07-09,1.0,BBB+,0.001036135,704100000,Y,2030-04-09,Sr Unsecured,1,FIXED,09/07/2021,09/07/2029,09/07/2020,90.724,91.076,4.520191649555099,0.35199999999998965,94.69751317828188,0.4794520547945205,95.1769652330764,3.797513178281875,92.12326796483684,0.03398737343015375,4.605703996494645,26.288465284978585
XS2197348324,TACHEM 0 ¾ 07/09/27,EUR,96.80845,TAKEDA PHARMACEUTICAL,"Consumer, Non-cyclical",2027-07-09,0.75,BBB+,3.17812e-05,750000000,Y,2027-05-09,Sr Unsecured,1,FIXED,09/07/2021,09/07/2026,09/07/2020,96.727,96.89,1.6016427104722792,0.1629999999999967,98.1595968512974,0.297945205479452,98.45754205677684,1.3511468512974005,86.62467096520776,0.019789087393581917,0.9805949214026601,1.9231327997613779
XS2197348597,TACHEM 1 07/09/29,EUR,93.38226,TAKEDA PHARMACEUTICAL,"Consumer, Non-cyclical",2029-07-09,1.0,BBB+,3.17812e-05,850000000,Y,2029-04-09,Sr Unsecured,1,FIXED,09/07/2021,09/07/2028,09/07/2020,93.245,93.519,3.5208761122518824,0.2740000000000009,96.20206500198388,0.4794520547945205,96.6815170567784,2.8198050019838803,85.4993426162438,0.03491075797942385,3.749176868220552,17.92900930483997
XS2197349645,TACHEM 1 ⅜ 07/09/32,EUR,88.37713,TAKEDA PHARMACEUTICAL,"Consumer, Non-cyclical",2032-07-09,1.375,BBB+,3.17812e-05,1000000000,Y,2032-04-09,Sr Unsecured,1,FIXED,09/07/2021,09/07/2031,09/07/2020,88.161,88.593,6.521560574948666,0.43200000000000216,93.92733640223801,0.6592465753424657,94.58658297758048,5.550206402238018,97.09519084130784,0.030084189566056067,1.9317878414833445,5.616591878829313
XS2198582301,TACHEM 2 07/09/40,EUR,76.91675,TAKEDA PHARMACEUTICAL,"Consumer, Non-cyclical",2040-07-09,2.0,BBB+,3.17812e-05,1000000000,Y,2040-01-09,Sr Unsecured,1,FIXED,09/07/2021,09/07/2039,09/07/2020,76.647,77.187,14.272416153319645,0.539999999999992,91.20243138556569,1.452054794520548,92.65448618008624,14.285681385565695,138.09789453151956,0.03571237533896145,5.675261728508647,38.09763473592401
XS2199604096,UQA 1 ⅜ 07/09/30,EUR,93.125,UNIQA INSURANCE GROUP AG,Financial,2030-07-09,1.375,NR,3.2817e-06,600000000,Y,2030-04-09,Sr Unsecured,1,FIXED,09/07/2021,09/07/2029,09/07/2020,92.906,93.344,4.520191649555099,0.4379999999999882,96.29728637727197,0.6592465753424657,96.95653295261444,3.1722863772719734,75.87925091568175,0.033522671082661,1.9202063251173775,5.559332334121706
XS2197675288,TELEFO 1.864 07/13/40,EUR,73.88616,TELEFONICA EMISIONES SAU,Communications,2040-07-13,1.864,BBB-,0.021357445,600000000,Y,2040-01-13,Sr Unsecured,1,FIXED,13/07/2021,13/07/2039,13/07/2020,73.518,74.254,14.283367556468173,0.7360000000000042,89.58069832010318,1.3328876712328768,90.91358599133606,15.694538320103177,154.95577356459657,0.039029301663304705,5.476857394832513,36.24604356694786
XS2201946634,MRLSM 2 ⅜ 07/13/27,EUR,99.899,MERLIN PROPERTIES SOCIMI,Financial,2027-07-13,2.375,NR,3.63482e-05,500000000,Y,2027-04-13,Sr Unsecured,1,FIXED,13/07/2021,13/07/2026,13/07/2020,99.775,100.023,1.5304585900068446,0.24799999999999045,100.67190452928719,1.1126712328767123,101.7845757621639,0.7729045292871888,50.53526312529421,0.040355749324584876,0.9612096637608967,1.8478480354146718
XS2201857534,ASSGEN 2.429 07/14/31,EUR,95.609,GENERALI,Financial,2031-07-14,2.429,BBB+,6.64834e-07,600000000,Y,2031-01-14,Subordinated,1,FIXED,14/07/2021,14/07/2030,14/07/2020,95.342,95.877,5.286789869952088,0.5349999999999966,100.64171825605223,1.7302465753424656,102.37196483139469,5.0327182560522346,102.05253181955298,0.033160081772263664,0.9679042170160296,1.8736771466348265
XS2203802462,NEPSJ 3 ⅜ 07/14/27,EUR,101.369,NE PROPERTY BV,Financial,2027-07-14,3.375,BBB,0.003935961,250003000,Y,2027-04-14,Sr Unsecured,1,FIXED,14/07/2021,14/07/2026,14/07/2020,101.193,101.545,1.5331964407939767,0.35200000000000387,102.16802691643524,1.571917808219178,103.73994472465442,0.7990269164352384,51.47932152592041,0.03850084590733612,5.421223081075479,35.76092983971361
FR0013523602,ACAFP 2 07/17/30,EUR,94.522,CREDIT AGRICOLE ASSRNCES,Financial,2030-07-17,2.0,NR,0.001735407,1000000000,N,,Subordinated,1,FIXED,17/07/2021,17/07/2029,17/07/2020,94.306,94.737,4.791238877481177,0.4309999999999974,98.81909695836475,0.41643835616438357,99.23553531452913,4.297096958364747,96.29197771610413,0.03760496858191529,8.422296383744351,80.39657116255941
XS2203996132,SWFP 1 07/17/28,EUR,96.15742,SODEXO SA,"Consumer, Cyclical",2028-07-17,1.0,BBB+,0.000685589,500000000,Y,2028-04-17,Sr Unsecured,1,FIXED,17/07/2021,17/07/2027,17/07/2020,96.047,96.268,2.543463381245722,0.22100000000000364,97.54214541175776,0.4575342465753425,97.99967965833311,1.3847254117577563,56.58531788948079,0.03937267170230706,0.9621188118811882,1.8513452163513384
XS2209023402,TRNIM 0 ¾ 07/24/32,EUR,85.002,TERNA RETE ELETTRICA,Utilities,2032-07-24,0.75,BBB+,2.09814e-05,500000000,N,,Sr Unsecured,1,FIXED,24/07/2021,24/07/2031,24/07/2020,84.771,85.233,6.811772758384668,0.4620000000000033,89.66156245586109,0.14178082191780822,89.8033432777789,4.659562455861092,80.16028783948238,0.03406432790686112,3.8226017656442006,18.410655420487174
XS2211183244,PRXNA 1.539 08/03/28,EUR,96.548,PROSUS NV,Communications,2028-08-03,1.539,BBB,1.50291e-05,850000000,Y,2028-05-03,Sr Unsecured,1,FIXED,03/08/2021,03/08/2027,03/08/2020,96.234,96.863,2.5872689938398357,0.6290000000000049,98.83774276327856,0.636682191780822,99.47442495505938,2.2897427632785536,91.57439273793528,0.02947309161651587,1.9377916317491708,5.642133990390091
XS2211183756,PRXNA 2.031 08/03/32,EUR,90.156,PROSUS NV,Communications,2032-08-03,2.031,BBB,1.50291e-05,750000000,Y,2032-05-03,Sr Unsecured,1,FIXED,03/08/2021,03/08/2031,03/08/2020,89.819,90.492,6.587268993839836,0.6730000000000018,97.82005804477045,0.8402219178082193,98.66027996257867,7.664058044770442,131.10999186395088,0.03450117496153742,5.645641970051127,37.8613413053098
DE000CZ45V82,CMZB 0 ⅜ 09/01/27,EUR,96.48142,COMMERZBANK AG,Financial,2027-09-01,0.375,A,0.000516517,750000000,N,,Sr Preferred,1,FIXED,01/09/2021,01/09/2026,01/09/2020,96.363,96.6,1.9164955509924708,0.23699999999999477,97.07850906938954,0.030821917808219176,97.10933098719777,0.5970890693895399,32.22353053649503,0.046275571287283164,0.9557711442786072,1.8269969604712766
FR0013532280,BNP 0 ½ 09/01/28,EUR,96.19783,BNP PARIBAS,Financial,2028-09-01,0.5,A-,0.000632394,1000000000,Y,2027-09-01,Sr Non Preferred,1,VARIABLE,01/09/2021,01/06/2028,01/09/2020,96.115,96.281,1.9164955509924708,0.16600000000001103,97.31154150853648,0.0410958904109589,97.35263739894744,1.1137115085364826,60.153890610255296,0.03773448738258702,5.644709509683217,37.77538491687028
XS2225207468,HEIBOS 1 ⅜ 03/03/27,EUR,98.12129,HEIMSTADEN BOSTAD TRESRY,Financial,2027-03-03,1.375,BBB-,0.010536501,700000000,Y,2026-12-03,Sr Unsecured,1,FIXED,03/03/2021,03/03/2026,03/09/2020,97.99,98.253,1.1718001368925393,0.26300000000000523,99.37161971196426,1.1376712328767125,100.50929094484097,1.2503297119642554,108.0163350917438,0.046061232511604,0.9559669825436408,1.827745743427187
XS2226645278,SAMPFH 2 ½ 09/03/52,EUR,92.888,SAMPO OYJ,Financial,2052-09-03,2.5,BBB+,1.08227e-09,684174000,Y,2032-06-03,Subordinated,1,VARIABLE,03/09/2021,03/06/2052,03/09/2020,92.624,93.152,6.672142368240931,0.5280000000000058,100.63705616273086,0.821917808219178,101.45897397095004,7.749056162730852,128.75816370891806,0.046083863253624596,0.9559463013698629,1.827666662205442
XS2224621420,ADSGR 0 ⅝ 09/10/35,EUR,76.43,ADIDAS AG,"Consumer, Cyclical",2035-09-10,0.625,A-,6.62362e-05,500000000,Y,2035-06-10,Sr Unsecured,1,FIXED,10/09/2021,10/09/2034,08/09/2020,76.204,76.656,9.689253935660506,0.4520000000000124,83.54742553302044,0.1934931506849315,83.74091868370537,7.1174255330204375,94.75338849970302,0.03706654215170103,5.630313611325227,37.66262402235619
XS2227196404,BACRED 1 09/08/27,EUR,97.174,MEDIOBANCA DI CRED FIN,Financial,2027-09-08,1.0,BBB-,0.000535005,500000000,N,,Sr Preferred,1,FIXED,08/09/2021,08/09/2026,08/09/2020,97.098,97.249,1.9356605065023955,0.15099999999999625,98.22516018161633,0.06301369863013699,98.28817388024648,1.051160181616325,55.79903087306955,0.036194943630244364,2.8913824900320004,11.15664504619251
DE000A289QR9,MBGGR 0 ¾ 09/10/30,EUR,90.221,MERCEDES-BENZ GROUP AG,"Consumer, Cyclical",2030-09-10,0.75,A,0.001270443,1000000000,N,,Sr Unsecured,1,FIXED,10/09/2021,10/09/2029,10/09/2020,90.035,90.407,4.941820670773443,0.3719999999999999,92.93702965714228,0.04315068493150685,92.98018034207378,2.716029657142272,60.914123965680744,0.037230626155025384,3.8032480892563183,18.249255009939446
XS2227905903,AMT 0 ½ 01/15/28,EUR,95.31357,AMERICAN TOWER CORP,Financial,2028-01-15,0.5,BBB,0.000108738,750000000,Y,2027-10-15,Sr Unsecured,1,FIXED,15/01/2021,15/01/2027,10/09/2020,95.214,95.414,2.0369609856262834,0.20000000000000284,97.13173171276541,0.4808219178082192,97.61255363057363,1.8181617127654164,92.94196156035902,0.03990374104558203,4.669644116043972,26.68153933378925
XS2227906208,AMT 1 01/15/32,EUR,86.923,AMERICAN TOWER CORP,Financial,2032-01-15,1.0,BBB,0.000108738,650000000,Y,2031-10-15,Sr Unsecured,1,FIXED,15/01/2021,15/01/2031,10/09/2020,86.74,87.105,6.036960985626283,0.3650000000000091,92.44678423606804,0.9616438356164384,93.40842807168448,5.523784236068039,104.75437973352425,0.032073283817712836,1.9280460470504819,5.594890781435584
XS2229434852,ERGIM 0 ½ 09/11/27,EUR,96.055,ERG SPA,Energy,2027-09-11,0.5,NR,0.000152986,600000000,Y,2027-06-11,Sr Unsecured,1,FIXED,11/09/2021,11/09/2026,11/09/2020,95.98,96.129,1.6919917864476386,0.1490000000000009,97.63756245708568,0.15342465753424658,97.79098711461992,1.5825624570856718,96.65109690258461,0.02798186374087856,2.914534142058704,11.33588684665216
XS2229470146,KPN 0 ⅞ 12/14/32,EUR,84.69323,KONINKLIJKE KPN NV,Communications,2032-12-14,0.875,BBB,1.5647e-06,600000000,Y,2032-09-14,Sr Unsecured,1,FIXED,14/12/2020,14/12/2031,14/09/2020,84.496,84.89,6.954140999315538,0.39400000000000546,90.2080390286252,0.04075342465753425,90.24879245328273,5.514809028625194,93.24624868003085,0.035496275117499386,2.849656953458115,10.94707404796685
XS2230266301,ELIAV 0 ¼ 09/15/27,EUR,95.83569,ELISA OYJ,Communications,2027-09-15,0.25,BBB,4.87918e-07,300000000,Y,2027-06-15,Sr Unsecured,1,FIXED,15/09/2021,15/09/2026,15/09/2020,95.752,95.92,1.702943189596167,0.16800000000000637,97.2069616045722,0.07397260273972603,97.28093420731193,1.3712716045722004,83.43083524888192,0.037071760389529564,2.8760479335646467,11.071599283291137
XS2231330965,JCI 0 ⅜ 09/15/27,EUR,95.95311,JOHNSON CONTROLS/TYCO FI,Industrial,2027-09-15,0.375,BBB+,1.13265e-05,500000000,Y,2027-07-15,Sr Unsecured,1,FIXED,15/09/2021,15/09/2026,15/09/2020,95.85,96.057,1.78507871321013,0.20700000000000784,97.28492956959747,0.08013698630136987,97.36506655589884,1.3318195695974708,77.26837680585876,0.030231152951815138,2.9081570035885353,11.286371939214776
XS2231331344,JCI 1 09/15/32,EUR,85.67484,JOHNSON CONTROLS/TYCO FI,Industrial,2032-09-15,1.0,BBB+,1.13265e-05,500000000,Y,2032-06-15,Sr Unsecured,1,FIXED,15/09/2021,15/09/2031,15/09/2020,85.462,85.888,6.704996577686516,0.42600000000000193,91.38950476723788,0.2958904109589041,91.68539517819679,5.714664767237878,99.21296948960541,0.03335178471071491,6.688598989737605,51.56714723591541
FR0013534484,ORAFP 0 ⅛ 09/16/29,EUR,90.232,ORANGE SA,Communications,2029-09-16,0.125,BBB+,2.14239e-05,500000000,Y,2029-06-16,Sr Unsecured,1,FIXED,16/09/2021,16/09/2028,16/09/2020,90.095,90.368,3.707049965776865,0.27299999999999613,92.81813380358871,0.03664383561643836,92.85477763920515,2.5861338035887087,76.30818588242657,0.03786793901820585,12.62682497744886,178.6353880578732
FR0013534500,TEREGA 0 ⅞ 09/17/30,EUR,89.594,TEREGA SA,Utilities,2030-09-17,0.875,NR,0.004120595,500000000,Y,2030-06-17,Sr Unsecured,1,FIXED,17/09/2021,17/09/2029,17/09/2020,89.392,89.795,4.7091033538672145,0.4030000000000058,93.87306629566896,0.2541095890410959,94.12717588471006,4.279066295668969,100.68292200113402,0.04390885007037009,0.9579380421313506,1.8352905851248904
FR0013535101,SCOR 1 ⅜ 09/17/51,EUR,88.35367,SCOR SE,Financial,2051-09-17,1.375,NR,4.3925e-05,300000000,Y,2031-03-17,Subordinated,1,VARIABLE,17/09/2021,17/09/2050,17/09/2020,88.085,88.622,5.456536618754278,0.5370000000000061,95.2278906159019,0.7458904109589041,95.9737810268608,6.874220615901905,141.62618667840613,0.036278142377475946,2.883586408316593,11.115982420152015
XS2228897158,AKFAST 1 01/17/28,EUR,95.789,AKELIUS RESIDENTIAL PROP,Financial,2028-01-17,1.0,NR,0.006442526,500000000,Y,2027-10-17,Sr Unsecured,1,FIXED,17/01/2021,17/01/2027,17/09/2020,95.672,95.905,2.0424366872005475,0.2330000000000041,98.1151665513859,0.9561643835616438,99.07133093494754,2.326166551385896,118.0036037138506,0.03695396822827816,4.695797820921813,26.932029863576076
FR0013534278,ARRFP 0 ⅛ 01/18/29,EUR,92.40916,APRR SA,"Consumer, Non-cyclical",2029-01-18,0.125,A-,0.011186382,500000000,Y,2028-10-18,Sr Unsecured,1,FIXED,18/01/2021,18/01/2028,18/09/2020,92.307,92.511,3.047227926078029,0.20399999999999352,94.39660307481881,0.11917808219178082,94.5157811570106,1.9874430748188132,69.87498915444402,0.03621659983904045,5.635384762927095,37.72830384761122
XS2231183646,HITTFP 1 ⅝ 09/18/29,EUR,94.613,ABERTIS FRANCE SAS,"Consumer, Non-cyclical",2029-09-18,1.625,BBB-,0.016819763,600000000,Y,2029-06-18,Sr Unsecured,1,FIXED,18/09/2021,18/09/2028,18/09/2020,94.475,94.752,3.7125256673511293,0.277000000000001,98.11143654647536,0.4674657534246575,98.57890229990002,3.498436546475361,99.88357200970113,0.03785281010615565,1.9184588226144652,5.537181863986168
XS2231259305,NGGLN 0.553 09/18/29,EUR,91.198,NATIONAL GRID PLC,Utilities,2029-09-18,0.553,BBB,4.6004e-05,500000000,Y,2029-06-18,Sr Unsecured,1,FIXED,18/09/2021,18/09/2028,18/09/2020,91.066,91.33,3.7125256673511293,0.2639999999999958,94.319215631021,0.15908219178082192,94.47829782280182,3.121215631021002,91.27713719166901,0.040606994150557484,5.5731196435928565,37.06860909236536
XS2233154538,KO 0 ⅛ 03/15/29,EUR,91.806,COCA-COLA CO/THE,"Consumer, Non-cyclical",2029-03-15,0.125,A+,6.77015e-08,1000000000,N,,Sr Unsecured,1,FIXED,15/03/2021,15/03/2028,18/09/2020,91.682,91.929,3.4524298425735798,0.2469999999999999,93.42376615103274,0.0684931506849315,93.49225930171767,1.6177661510327397,50.640450043665204,0.03647814354293996,1.9296113598338918,5.585100000000001
XS2233155261,KO 0 ⅜ 03/15/33,EUR,81.788,COCA-COLA CO/THE,"Consumer, Non-cyclical",2033-03-15,0.375,A+,6.77015e-08,750000000,N,,Sr Unsecured,1,FIXED,15/03/2021,15/03/2032,18/09/2020,81.584,81.991,7.452429842573579,0.4069999999999965,85.9388467359895,0.2054794520547945,86.14432618804429,4.150846735989504,67.28400050165801,0.026183741435470313,3.7201049526066843,17.839568680601683
XS2233155345,KO 0.8 03/15/40,EUR,68.00137,COCA-COLA CO/THE,"Consumer, Non-cyclical",2040-03-15,0.8,A+,6.77015e-08,850000000,N,,Sr Unsecured,1,FIXED,15/03/2021,15/03/2039,18/09/2020,67.721,68.282,14.453114305270363,0.5609999999999928,76.68311691292065,0.4383561643835616,77.12147307730422,8.681746912920659,88.82010707123375,0.02840199141525074,1.9313878957564055,5.621135338734272
FR0013536661,SOCGEN 0 ⅞ 09/22/28,EUR,96.632,SOCIETE GENERALE,Financial,2028-09-22,0.875,BBB,0.00033915,1000000000,Y,2027-09-22,Sr Non Preferred,1,VARIABLE,22/09/2021,22/06/2028,22/09/2020,96.549,96.714,1.9739904175222451,0.16499999999999204,97.94822605042398,0.021575342465753426,97.96980139288974,1.3162260504239782,68.78093875326414,0.02852276642244761,1.9264734630824178,5.601584718522418
XS2235987224,MDLZ 0 ⅜ 09/22/29,EUR,90.909,MONDELEZ INTL HLDINGS NE,"Consumer, Non-cyclical",2029-09-22,0.375,BBB+,6.19362e-06,750000000,Y,2029-06-22,Sr Unsecured,1,FIXED,22/09/2021,22/09/2028,22/09/2020,90.756,91.062,3.7234770704996576,0.3059999999999974,93.66610193041642,0.10376712328767122,93.76986905370408,2.757101930416411,80.6060062321546,0.03589184013983603,3.8381833123395412,18.489055369384058
XS2221845683,MUNRE 1 ¼ 05/26/41,EUR,89.01974,MUNICH RE,Financial,2041-05-26,1.25,A,1.20016e-07,1250000000,Y,2030-11-26,Subordinated,1,VARIABLE,26/05/2021,26/02/2041,23/09/2020,88.818,89.222,5.152635181382615,0.40399999999999636,94.98819293168471,1.0582191780821917,96.0464121097669,5.968452931684709,129.29083924989627,0.03166720501640958,6.543652560338815,50.134161703109164
XS2232115423,DLR 1 01/15/32,EUR,86.086,DIGITAL DUTCH FINCO BV,Financial,2032-01-15,1.0,BBB,0.000167809,750000000,Y,2031-10-15,Sr Unsecured,1,FIXED,15/01/2021,15/01/2031,23/09/2020,85.91,86.262,6.036960985626283,0.35200000000000387,92.44678423606804,0.9616438356164384,93.40842807168448,6.360784236068042,121.21570421171789,0.02392970834118427,0.9766295399515739,1.9076105166120456
XS2234567233,VW 0 ⅞ 09/22/28,EUR,94.494,VOLKSWAGEN INTL FIN NV,"Consumer, Cyclical",2028-09-22,0.875,BBB+,0.042120067,1250000000,N,,Sr Unsecured,1,FIXED,22/09/2021,22/09/2027,23/09/2020,94.36,94.629,2.976043805612594,0.26900000000000546,96.70120068012376,0.021575342465753426,96.72277602258951,2.207200680123762,78.21481225936138,0.03708402486406033,1.9247624788769784,5.564222114700885
XS2234567662,VW 1 ¼ 09/23/32,EUR,85.295,VOLKSWAGEN INTL FIN NV,"Consumer, Cyclical",2032-09-23,1.25,BBB+,0.042120067,750000000,N,,Sr Unsecured,1,FIXED,23/09/2021,23/09/2031,23/09/2020,85.041,85.55,6.978781656399726,0.5090000000000003,92.56407211181052,0.0273972602739726,92.59146937208449,7.269072111810516,121.88343655129994,0.03539038276686108,5.677158485655125,38.12246203353598
XS2235996217,NOVNVX 0 09/23/28,EUR,93.085,NOVARTIS FINANCE SA,"Consumer, Non-cyclical",2028-09-23,0.0,AA-,1.31566e-06,1850000000,Y,2028-06-23,Sr Unsecured,1,FIXED,23/09/2021,23/09/2027,23/09/2020,92.975,93.195,2.726899383983573,0.21999999999999886,94.70937074946136,0.0,94.70937074946136,1.624370749461363,63.398202334531554,0.04140825423148983,12.05173479063934,167.42827822056398
XS2237434803,UNIIM 3 ¼ 09/23/30,EUR,102.3694,UNIPOL ASSICURAZIONI SPA,Financial,2030-09-23,3.25,BBB,2.62952e-06,1000000000,Y,2030-06-23,Sr Unsecured,1,FIXED,23/09/2021,23/09/2029,23/09/2020,101.935,102.804,4.725530458590007,0.8689999999999998,104.41570539031555,0.8904109589041096,105.30611634921966,2.0463053903155526,44.311102846396274,0.04387292666612383,17.805450458574192,391.079424360127
XS2233121792,SATOYH 1 ⅜ 02/24/28,EUR,97.18988,SATO-OYJ,Financial,2028-02-24,1.375,NR,0.011473614,300000000,Y,2027-11-24,Sr Unsecured,1,FIXED,24/02/2021,24/02/2027,24/09/2020,96.988,97.392,2.1464750171115674,0.40399999999999636,98.77672057289294,1.1715753424657536,99.9482959153587,1.586840572892939,75.96367635254754,0.035089540789827005,1.9321999896491042,5.600095199999997
XS2236363573,AMSSM 1 ⅞ 09/24/28,EUR,98.126,AMADEUS IT GROUP SA,"Consumer, Cyclical",2028-09-24,1.875,BBB,5.97683e-07,500000000,Y,2028-06-24,Sr Unsecured,1,FIXED,24/09/2021,24/09/2027,24/09/2020,97.994,98.258,2.729637234770705,0.2639999999999958,99.63379469306254,0.5085616438356164,100.14235633689816,1.5077946930625359,56.69049699794366,0.032772067102027305,0.9682678606965173,1.8750853001156202
XS2237901355,TRNIM 0 ⅜ 09/25/30,EUR,88.219,TERNA RETE ELETTRICA,Utilities,2030-09-25,0.375,BBB+,2.09814e-05,500000000,Y,2030-06-25,Sr Unsecured,1,FIXED,25/09/2021,25/09/2029,25/09/2020,88.061,88.377,4.731006160164271,0.3159999999999883,91.61219013292765,0.10068493150684932,91.7128750644345,3.393190132927657,80.31077837182957,0.03055867191114727,4.780719872246633,27.697988675147933
XS2237447961,FREGR 1 ⅛ 01/28/33,EUR,87.35905,FRESENIUS SE & CO KGAA,"Consumer, Non-cyclical",2033-01-28,1.125,BBB-,2.02554e-05,500000000,Y,2032-10-28,Sr Unsecured,1,FIXED,28/01/2021,28/01/2032,28/09/2020,87.063,87.655,7.0746064339493495,0.5919999999999987,91.61700292570842,1.0417808219178082,92.65878374762623,4.257952925708423,69.71321231472358,0.024564484004234617,1.9510509458705156,5.711846300990134
XS2238777374,PPFTEL 3 ¼ 09/29/27,EUR,100.837,E& PPF TELECOM GROUP BV,Communications,2027-09-29,3.25,BBB-,0.004987877,500000000,Y,2027-06-29,Sr Unsecured,1,FIXED,29/09/2021,29/09/2026,29/09/2020,100.586,101.088,1.7412731006160165,0.5019999999999953,102.22848651766681,0.836986301369863,103.06547281903667,1.3914865176668059,79.43256786869875,0.034752577057228035,5.734384251512185,38.65124793199724
XS2238789460,MDT 0 ⅜ 10/15/28,EUR,93.68652,MEDTRONIC GLOBAL HLDINGS,"Consumer, Non-cyclical",2028-10-15,0.375,A-,1.28812e-06,1000000000,Y,2028-07-15,Sr Unsecured,1,FIXED,15/10/2021,15/10/2027,29/09/2020,93.567,93.806,2.7871321013004793,0.23900000000000432,95.5916482478321,0.08013698630136987,95.67178523413347,1.9051282478320957,72.41957351647306,0.03986532290045537,19.350097198903306,439.3226152303445
XS2238792175,MDT 0 ¾ 10/15/32,EUR,85.1575,MEDTRONIC GLOBAL HLDINGS,"Consumer, Non-cyclical",2032-10-15,0.75,A-,1.28812e-06,1000000000,Y,2032-07-15,Sr Unsecured,1,FIXED,15/10/2021,15/10/2031,29/09/2020,84.947,85.368,6.787132101300479,0.42099999999999227,89.70493423396236,0.16027397260273973,89.8652082065651,4.547434233962363,78.41489376841545,0.03117619449909365,1.9263930518185655,5.5917111821214505
XS2238792332,MDT 1 ⅜ 10/15/40,EUR,71.054,MEDTRONIC GLOBAL HLDINGS,"Consumer, Non-cyclical",2040-10-15,1.375,A-,1.28812e-06,1000000000,Y,2040-04-15,Sr Unsecured,1,FIXED,15/10/2021,15/10/2039,29/09/2020,70.721,71.386,14.537987679671458,0.664999999999992,83.45172740578181,0.6366438356164383,84.08837124139825,12.397727405781808,123.3754425017607,0.024960951923485394,0.9756469240348692,1.9037738407574034
XS2238792688,MDT 1 ⅝ 10/15/50,EUR,59.505,MEDTRONIC GLOBAL HLDINGS,"Consumer, Non-cyclical",2050-10-15,1.625,A-,1.28812e-06,1000000000,Y,2050-04-15,Sr Unsecured,1,FIXED,15/10/2021,15/10/2049,29/09/2020,59.183,59.827,24.536618754277892,0.6439999999999984,78.15006228983039,0.7523972602739726,78.90245955010435,18.645062289830385,141.62741487661634,,,
XS2240505268,ADSGR 0 10/05/28,EUR,93.33492,ADIDAS AG,"Consumer, Cyclical",2028-10-05,0.0,A-,6.62362e-05,500000000,Y,2028-07-05,Sr Unsecured,1,FIXED,05/10/2021,05/10/2027,05/10/2020,93.232,93.438,2.759753593429158,0.20600000000000307,94.6416854357893,0.0,94.6416854357893,1.306765435789302,50.34579003772315,0.036609827675921,1.9244166366262334,5.564581926462033
DE000AAR0264,AARB 0 ½ 04/07/27,EUR,97.31092,AAREAL BANK AG,Financial,2027-04-07,0.5,BBB+,0.008489954,500000000,N,,Sr Preferred,1,FIXED,07/04/2021,07/04/2026,07/10/2020,97.124,97.498,1.514031485284052,0.37400000000000944,97.89741009232851,0.24246575342465754,98.13987584575317,0.5864900923285177,39.69493051539732,0.03138298659494316,4.578508799504301,26.12084579384609
XS2241387096,MIZUHO 0.693 10/07/30,EUR,89.196,MIZUHO FINANCIAL GROUP,Financial,2030-10-07,0.693,A,0.000341565,1000000000,N,,Sr Unsecured,1,FIXED,07/10/2021,07/10/2029,07/10/2020,89.079,89.314,5.01574264202601,0.23499999999999943,92.5461719802782,0.6816082191780821,93.22778019945629,3.350171980278205,74.54944241062066,0.046312623171870106,0.955737298636927,1.8268675680116213
FR00140003P3,BFCM 0.1 10/08/27,EUR,95.45524,BANQUE FED CRED MUTUEL,Financial,2027-10-08,0.1,A+,1.08678e-05,750000000,N,,Sr Preferred,1,FIXED,08/10/2021,08/10/2026,08/10/2020,95.389,95.521,2.0177960301163584,0.132000000000005,96.37824311439566,0.09808219178082192,96.47632530617648,0.9230031143956552,47.682732384361586,0.035307027202516765,4.7646289081191835,27.48970755733305
XS2242633258,PEP 0.4 10/09/32,EUR,83.6,PEPSICO INC,"Consumer, Non-cyclical",2032-10-09,0.4,A+,2.5576e-06,750000000,Y,2032-07-09,Sr Unsecured,1,FIXED,09/10/2021,09/10/2031,09/10/2020,83.421,83.78,6.770704996577686,0.35899999999999466,87.55883650957753,0.09205479452054795,87.65089130409808,3.9588365095775373,69.1597561772982,0.03108500157949384,4.690175268579813,26.988759622053173
XS2242633332,PEP 1.05 10/09/50,EUR,55.165,PEPSICO INC,"Consumer, Non-cyclical",2050-10-09,1.05,A+,2.5576e-06,750000000,Y,2050-04-09,Sr Unsecured,1,FIXED,09/10/2021,09/10/2049,09/10/2020,54.823,55.508,24.520191649555098,0.6850000000000023,67.99666493667469,0.5034246575342466,68.50008959420894,12.831664936674692,101.17960484117565,0.03556349802571099,3.760151450290264,17.99206967631128
ES0239140017,COLSM 1.35 10/14/28,EUR,96.62347,INMOBILIARIA COLONIAL SO,Financial,2028-10-14,1.35,NR,0.000362068,500000000,Y,2028-07-14,Sr Unsecured,1,FIXED,14/10/2021,14/10/2027,14/10/2020,96.487,96.76,2.784394250513347,0.27300000000001035,98.21025917334282,0.2921917808219178,98.50245095416474,1.5867891733428223,59.14626159789315,0.03373287321585355,0.9673679012345681,1.871601312677946
FR00140005J1,BNP 0 ⅜ 10/14/27,EUR,97.93056,BNP PARIBAS,Financial,2027-10-14,0.375,A-,0.000632394,750000000,Y,2026-10-14,Sr Non Preferred,1,VARIABLE,14/10/2021,14/07/2027,14/10/2020,97.864,97.997,1.0349075975359343,0.13299999999999557,98.43002051222182,0.36164383561643837,98.79166434783825,0.4994605122218161,49.12240533058495,0.031431183829305265,4.780366531753341,27.679721668811936
FR00140005T0,AKEFP 0 ⅛ 10/14/26,EUR,97.78587,ARKEMA,Basic Materials,2026-10-14,0.125,BBB+,0.001210346,300000000,Y,2026-07-14,Sr Unsecured,1,FIXED,14/10/2021,14/10/2025,14/10/2020,97.735,97.837,0.783025325119781,0.10200000000000387,98.60711487722939,0.027054794520547945,98.63416967174994,0.8212448772293897,106.70540554345132,0.028320463368296203,2.9024757491116975,11.270926856436475
XS2242921711,RTOLN 0 ½ 10/14/28,EUR,94.009,RENTOKIL INITIAL PLC,"Consumer, Non-cyclical",2028-10-14,0.5,BBB,0.000212507,600000000,Y,2028-07-14,Sr Unsecured,1,FIXED,14/10/2021,14/10/2027,14/10/2020,93.885,94.133,2.784394250513347,0.24799999999999045,95.9314368917465,0.10821917808219178,96.0396560698287,1.9224368917465,72.97351381562777,0.02543111804445638,1.9418015401716062,5.672547760465442
XS2243298069,ISPIM 2.925 10/14/30,EUR,99.027,INTESA SANPAOLO SPA,Financial,2030-10-14,2.925,BBB-,0.000100348,500000000,N,,Subordinated,1,FIXED,14/10/2021,14/10/2029,14/10/2020,98.756,99.297,5.034907597535934,0.5409999999999968,103.05885405810733,2.8208219178082192,105.87967597591555,4.031854058107328,83.86718181095264,0.025032263433438257,1.9481465747664846,5.6987749663333584
XS2243299463,LUNDC 0 ⅞ 10/14/27,EUR,96.41,H LUNDBECK A/S,"Consumer, Non-cyclical",2027-10-14,0.875,NR,6.62307e-05,500000000,Y,2027-07-14,Sr Unsecured,1,FIXED,14/10/2021,14/10/2026,14/10/2020,96.297,96.523,1.782340862422998,0.2259999999999991,98.15676617381165,0.18938356164383563,98.34614973545548,1.7467661738116504,100.9776345124298,0.03862188332947509,8.509903438315645,81.45731534113767
FR00140007J7,BFCM 0 ⅝ 02/21/31,EUR,86.892,BANQUE FED CRED MUTUEL,Financial,2031-02-21,0.625,A-,1.08678e-05,1250000000,N,,Sr Non Preferred,1,FIXED,21/02/2021,21/02/2030,21/10/2020,86.723,87.061,5.390828199863107,0.33800000000000807,91.52987613033117,0.3801369863013699,91.91001311663254,4.637876130331179,97.80330033945928,0.036359666854261063,5.748875705525065,38.74096750857771
XS2247936342,SANTAN 1 ⅝ 10/22/30,EUR,93.227,BANCO SANTANDER SA,Financial,2030-10-22,1.625,BBB,0.000140759,1000000000,N,,Subordinated,1,FIXED,22/10/2021,22/10/2029,22/10/2020,92.978,93.476,5.0568104038329915,0.49800000000000466,96.89383237519903,1.5315068493150685,98.42533922451409,3.6668323751990215,78.83620983505726,0.04054332254104625,12.74791501111848,180.63267988153288
XS2247549731,CLNXSM 1 ¾ 10/23/30,EUR,93.374,CELLNEX TELECOM SA,Industrial,2030-10-23,1.75,BBB-,0.000790603,1000000000,Y,2030-07-23,Sr Unsecured,1,FIXED,23/10/2021,23/10/2029,23/10/2020,93.201,93.546,4.80766598220397,0.3450000000000131,97.67972475595504,0.3356164383561644,98.0153411943112,4.3057247559550405,96.89673103533015,0.027132430515926474,1.944681189394128,5.677511487926997
XS2247718435,BPPEHX 1 ¼ 04/26/27,EUR,97.946,BLACKSTONE PP EUR HOLD,Financial,2027-04-26,1.25,NR,0.021241973,600000000,Y,2027-01-26,Sr Unsecured,1,FIXED,26/04/2021,26/04/2026,26/10/2020,97.845,98.047,1.319644079397673,0.20199999999999818,99.13150578674592,0.8493150684931506,99.98082085523907,1.1855057867459209,91.18943187662914,0.03964923750770649,5.71022369730025,38.31385891714939
XS2248451978,BAC 0.654 10/26/31,EUR,88.647,BANK OF AMERICA CORP,Financial,2031-10-26,0.654,A+,0.000123703,1500000000,Y,2030-10-26,Sr Unsecured,1,VARIABLE,26/10/2021,26/07/2031,26/10/2020,88.502,88.791,5.06776180698152,0.2890000000000015,92.2667331976048,0.6092054794520548,92.87593867705685,3.6197331976047877,80.03643961434277,0.03354258048200383,2.8692967565920893,11.061929423733735
XS2250008245,MS 0.495 10/26/29,EUR,93.368,MORGAN STANLEY,Financial,2029-10-26,0.495,A,2.70627e-05,1750000000,Y,2028-10-26,Sr Unsecured,1,VARIABLE,26/10/2021,26/07/2029,26/10/2020,93.284,93.451,3.0691307323750854,0.16699999999998738,95.43433575465967,0.46109589041095883,95.89543164507063,2.0663357546596757,71.64641653407368,0.03685746622755711,1.923564181728058,5.560408717262491
ES0205045026,CAIXAB 0 ⅞ 10/28/27,EUR,96.78686,CRITERIA CAIXA SA,Financial,2027-10-28,0.875,BBB+,0.000900001,600000000,N,,Sr Unsecured,1,FIXED,28/10/2021,28/10/2026,28/10/2020,96.654,96.92,2.0725530458590007,0.26600000000000534,97.82892382881313,0.8102739726027398,98.63919780141588,1.0420638288131272,51.87225705588055,0.03214209982288073,4.765460558010232,27.551987329101554
XS2234579675,SUMIBK 0.303 10/28/27,EUR,95.75943,SUMITOMO MITSUI FINL GRP,Financial,2027-10-28,0.303,A,0.000331437,500000000,N,,Sr Unsecured,1,FIXED,28/10/2021,28/10/2026,28/10/2020,95.671,95.848,2.0725530458590007,0.1769999999999925,96.67749846422421,0.280586301369863,96.95808476559408,0.9180684642242198,46.079976056584016,0.026528037737339527,1.9473170479093722,5.6900084083745055
XS2250024010,INVSA 0 ⅜ 10/29/35,EUR,73.908,INVESTOR AB,Financial,2035-10-29,0.375,AA-,4.82318e-08,600000000,Y,2035-07-29,Sr Unsecured,1,FIXED,29/10/2021,29/10/2034,29/10/2020,73.679,74.137,9.82340862422998,0.4579999999999984,81.17887932200841,0.06575342465753425,81.24463274666594,7.270879322008412,97.34095010592726,0.025959740040058767,1.9483962543525215,5.696315904845254
FR0014000D31,MLFP 0 11/02/28,EUR,92.606,CIE GENERALE DES ESTABLI,"Consumer, Cyclical",2028-11-02,0.0,A,7.14317e-05,500000000,Y,2028-08-02,Sr Unsecured,1,FIXED,02/11/2021,02/11/2027,02/11/2020,92.485,92.727,2.836413415468857,0.24200000000000443,94.48394109162918,0.0,94.48394109162918,1.8779410916291823,70.73090545564837,0.03080413539245372,4.761701315904227,27.546569932919613
FR0014000D49,MLFP 0 ¼ 11/02/32,EUR,82.038,CIE GENERALE DES ESTABLI,"Consumer, Cyclical",2032-11-02,0.25,A,7.14317e-05,500000000,Y,2032-08-02,Sr Unsecured,1,FIXED,02/11/2021,02/11/2031,02/11/2020,81.788,82.287,6.836413415468857,0.49900000000000944,86.483214292055,0.0410958904109589,86.52431018246595,4.445214292054999,77.76266775931968,0.024714909653434803,1.9268371158523467,5.616768176018895
FR0014000D56,MLFP 0 ⅝ 11/02/40,EUR,63.90513,CIE GENERALE DES ESTABLI,"Consumer, Cyclical",2040-11-02,0.625,A,7.14317e-05,500000000,Y,2040-08-02,Sr Unsecured,1,FIXED,02/11/2021,02/11/2039,02/11/2020,63.526,64.284,14.836413415468858,0.7580000000000027,73.9097562131003,0.10273972602739725,74.01249593912769,10.004626213100295,103.58503070209615,0.02716754307813414,2.859738189304061,11.057684072181376
CH0576402181,UBS 0 ¼ 11/05/28,EUR,95.267,UBS GROUP AG,Financial,2028-11-05,0.25,A-,0.000727758,1500000000,Y,2027-11-05,Sr Unsecured,1,VARIABLE,05/11/2021,05/11/2027,05/11/2020,95.181,95.353,2.0944558521560577,0.17199999999999704,96.5301904603938,0.22602739726027396,96.75621785765406,1.2631904603938011,62.93269674043863,0.03171013556030551,1.9360416171732233,5.627198265706109
XS2251626896,ENGSM 0 ⅜ 11/05/32,EUR,81.15962,ENAGAS FINANCIACIONES SA,Utilities,2032-11-05,0.375,BBB+,1.61394e-05,500000000,Y,2032-08-05,Sr Unsecured,1,FIXED,05/11/2021,05/11/2031,05/11/2020,80.948,81.371,6.844626967830253,0.4230000000000018,87.24992683415813,0.058561643835616434,87.30848847799375,6.0903068341581275,106.94016318536029,0.032044484050371046,3.7737557663924566,18.119835963752493
XS2251233651,AKFAST 1 ⅛ 01/11/29,EUR,93.737,AKELIUS RESIDENTIAL PROP,Financial,2029-01-11,1.125,NR,0.006442526,500000000,Y,2028-10-11,Sr Unsecured,1,FIXED,11/01/2021,11/01/2028,11/11/2020,93.593,93.881,3.028062970568104,0.2879999999999967,97.3528399557073,1.0941780821917808,98.44701803789907,3.615839955707301,126.36037007655413,0.04166215415183196,1.9187614994798394,5.5248601069720085
ES0205032040,FERSM 0.54 11/12/28,EUR,94.04,FERROVIAL EMISIONES SA,Industrial,2028-11-12,0.54,BBB,2.32163e-06,500000000,Y,2028-08-12,Sr Unsecured,1,FIXED,12/11/2021,12/11/2027,12/11/2020,93.938,94.142,2.863791923340178,0.20399999999999352,95.91579738996252,0.07397260273972603,95.98976999270225,1.8757973899625142,69.26703935724855,0.02757532845564234,1.9438419378917893,5.672614221743082
XS2251736992,HSBC 0.77 11/13/31,EUR,88.87437,HSBC HOLDINGS PLC,Financial,2031-11-13,0.77,A-,9.28921e-05,1000000000,Y,2030-11-13,Sr Unsecured,1,VARIABLE,13/11/2021,13/08/2031,13/11/2020,88.736,89.012,5.117043121149897,0.27599999999999625,92.73258585320384,0.6792876712328768,93.41187352443671,3.858215853203845,84.38616583957665,0.03437385337269474,4.781711401952666,27.63773503548099
AT0000A2KW37,ERSTBK 0.1 11/16/28,EUR,95.0906,ERSTE GROUP BANK AG,Financial,2028-11-16,0.1,A,0.000194493,750000000,Y,2027-11-16,Sr Preferred,1,VARIABLE,16/11/2021,16/08/2028,16/11/2020,94.99,95.191,2.1245722108145104,0.20100000000000762,96.16507899890506,0.0873972602739726,96.25247625917903,1.0744789989050645,52.879453284129696,0.039163208391918926,4.62759370045821,26.371802322064703
XS2258389415,OPBANK 0.1 11/16/27,EUR,95.19592,OP CORPORATE BANK PLC,Financial,2027-11-16,0.1,AA-,1.29446e-05,1000000000,N,,Sr Preferred,1,FIXED,16/11/2021,16/11/2026,16/11/2020,95.118,95.273,2.1245722108145104,0.15500000000000114,96.16507899890506,0.0873972602739726,96.25247625917903,0.9691589989050584,47.66987962793599,0.05172118236750879,0.9508223441396509,1.8081262602304415
FR0014000KT3,LIFP 0 ⅞ 02/17/31,EUR,89.923,KLEPIERRE SA,Financial,2031-02-17,0.875,A-,2.73016e-05,700000000,Y,2030-11-17,Sr Unsecured,1,FIXED,17/02/2021,17/02/2030,17/11/2020,89.681,90.166,5.127994524298426,0.48499999999999943,93.21825201324738,0.7623287671232878,93.98058078037067,3.295252013247378,71.4705919897637,0.038909106542134496,13.342827925067906,200.31372810043362
XS2125914833,ABBV 2 ⅝ 11/15/28,EUR,100.296,ABBVIE INC,"Consumer, Non-cyclical",2028-11-15,2.625,A-,2.03341e-05,427793000,Y,2028-08-15,Sr Unsecured,1,FIXED,15/11/2021,15/11/2027,17/11/2020,100.205,100.386,2.8720054757015743,0.18099999999999739,101.66507958024772,0.33801369863013697,102.00309327887786,1.369079580247714,48.29293119526601,0.03185383096823561,1.9296618710514606,5.601945048869843
XS2125914916,ABBV 2 ⅛ 06/01/29,EUR,98.317,ABBVIE INC,"Consumer, Non-cyclical",2029-06-01,2.125,A-,2.03341e-05,506088000,Y,2029-03-01,Sr Unsecured,1,FIXED,01/06/2021,01/06/2028,17/11/2020,98.212,98.421,3.4140999315537304,0.20900000000000318,100.04288429268021,1.2458904109589042,101.28877470363912,1.7258842926802203,52.20052339196014,0.040099122009121524,1.9228936528055833,5.546279999999999
XS2258452478,INTNED 0 ¼ 02/18/29,EUR,94.42455,ING GROEP NV,Financial,2029-02-18,0.25,A-,8.33832e-05,1250000000,Y,2028-02-18,Sr Unsecured,1,VARIABLE,18/02/2021,18/11/2028,17/11/2020,94.332,94.517,2.3819301848049284,0.18500000000000227,95.99909339274377,0.1541095890410959,96.15320298178487,1.5745433927437773,69.49557367996961,0.03697190874154978,3.849551658120557,18.549064844445034
DE000DL19VS4,DB 1 ¾ 11/19/30,EUR,94.62,DEUTSCHE BANK AG,Financial,2030-11-19,1.75,BBB+,0.000192593,1700000000,Y,2029-11-19,Sr Non Preferred,1,VARIABLE,19/11/2021,19/08/2030,19/11/2020,94.494,94.746,4.134154688569473,0.25199999999999534,98.19711007188998,1.515068493150685,99.71217856504066,3.577110071889976,92.18966165341557,0.0409984290316454,3.789039037548747,18.11466058285148
XS2257961818,UPMFH 0 ⅛ 11/19/28,EUR,92.396,UPM-KYMMENE OYJ,Basic Materials,2028-11-19,0.125,BBB,3.6273e-05,750000000,Y,2028-08-19,Sr Unsecured,1,FIXED,19/11/2021,19/11/2027,19/11/2020,92.295,92.496,2.8829568788501025,0.2009999999999934,94.73502867786027,0.014726027397260274,94.74975470525753,2.33902867786027,86.76135283185593,0.0408798320716013,1.919459520182481,5.530308603851139
DE000A289LU4,AARB 0 ¼ 11/23/27,EUR,95.185,AAREAL BANK AG,Financial,2027-11-23,0.25,BBB+,0.008489954,750000000,N,,Sr Preferred,1,FIXED,23/11/2021,23/11/2026,23/11/2020,94.993,95.376,2.1437371663244353,0.3830000000000098,96.43887566772138,0.2136986301369863,96.65257429785837,1.253875667721374,61.0902662635116,0.034509394876049704,3.828325974395381,18.44218114631093
XS2261215011,HOLNSW 0 ½ 04/23/31,EUR,86.714,HOLCIM FINANCE LUX SA,Industrial,2031-04-23,0.5,BBB+,1.36262e-05,850000000,Y,2031-01-23,Sr Unsecured,1,FIXED,23/04/2021,23/04/2030,23/11/2020,86.512,86.915,5.3114305270362765,0.4030000000000058,91.05570443397204,0.34383561643835614,91.3995400504104,4.3417044339720405,92.979132160921,0.028983995616998173,2.868179504987123,11.08853660030355
BE6325355822,AGSBB 1 ⅞ 11/24/51,EUR,90.891,AGEAS,Financial,2051-11-24,1.875,A-,4.2946e-07,500000000,Y,2031-05-24,Subordinated,1,VARIABLE,24/11/2021,24/08/2051,24/11/2020,90.655,91.128,5.642710472279261,0.472999999999999,97.6351600808957,0.6678082191780822,98.30296830007379,6.744160080895696,132.4695222944034,0.0259958822017362,1.9492255825652274,5.699415435667178
FR0014000S75,RCFFP 0 ¼ 11/26/27,EUR,95.31994,TELEPERFORMANCE,Technology,2027-11-26,0.25,NR,0.006239894,500000000,Y,2027-08-26,Sr Unsecured,1,FIXED,26/11/2021,26/11/2026,26/11/2020,95.164,95.476,1.9000684462696784,0.3119999999999976,96.8732198522054,0.024657534246575342,96.89787738645197,1.5532798522053923,85.10504814830782,0.034576919475276545,6.625682919720717,50.88224190451668
XS2264193819,NGGLN 0.872 11/26/40,EUR,66.17709,NATL GRID ELECT TRANS,Utilities,2040-11-26,0.872,BBB+,0.006406846,640000000,N,,Sr Unsecured,1,FIXED,26/11/2021,26/11/2039,26/11/2020,65.842,66.512,15.154004106776181,0.6700000000000017,76.43439673854385,0.738213698630137,77.17261043717399,10.257306738543846,102.68477974702633,0.029514388953182022,6.799322161118751,52.83517925792069
XS2264692737,OTEVFH 0 ⅞ 05/26/28,EUR,95.591,METSO OYJ,Industrial,2028-05-26,0.875,BBB,2.28288e-05,300000000,Y,2028-02-26,Sr Unsecured,1,FIXED,26/05/2021,26/05/2027,26/11/2020,95.474,95.708,2.403832991101985,0.23399999999999466,97.41192763712978,0.5202054794520549,97.93213311658184,1.8209276371297847,78.89770448031106,0.0381536429945277,13.051292208653292,186.63454696305024
FR0014000PF1,DGFP 0 11/27/28,EUR,92.438,VINCI SA,Industrial,2028-11-27,0.0,A-,4.03887e-05,500000000,Y,2028-08-27,Sr Unsecured,1,FIXED,27/11/2021,27/11/2027,27/11/2020,92.334,92.541,2.9048596851471595,0.20699999999999363,94.34332011530859,0.0,94.34332011530859,1.9053201153085837,70.18706025119862,0.030066883599460595,1.9381461854588389,5.641345568689102
XS2264161964,TELIAS 0 ⅛ 11/27/30,EUR,86.94025,TELIA COMPANY AB,Communications,2030-11-27,0.125,BBB+,1.15493e-05,500000000,Y,2030-08-27,Sr Unsecured,1,FIXED,27/11/2021,27/11/2029,27/11/2020,86.772,87.109,4.903490759753593,0.3369999999999891,90.11915214101387,0.011986301369863013,90.13113844238373,3.1789021410138645,73.37883091895496,0.035296272213213895,0.9659070807453416,1.8659529772679755
BE6325493268,COFBBB 0 ⅞ 12/02/30,EUR,88.32165,COFINIMMO,Financial,2030-12-02,0.875,NR,0.000224375,500000000,Y,2030-09-02,Sr Unsecured,1,FIXED,02/12/2021,02/12/2029,02/12/2020,88.078,88.565,4.919917864476386,0.48699999999999477,93.5507503321792,0.0695205479452055,93.62027088012441,5.2291003321792004,118.95423919478263,0.039305294251406865,4.672563662150243,26.713967814479076
XS2264977146,CCEP 0.2 12/02/28,EUR,92.67613,COCA-COLA EUROPACIFIC,"Consumer, Non-cyclical",2028-12-02,0.2,BBB+,5.8577e-06,750000000,Y,2028-09-02,Sr Unsecured,1,FIXED,02/12/2021,02/12/2027,02/12/2020,92.573,92.78,2.921286789869952,0.20700000000000784,94.87160075533855,0.015890410958904113,94.88749116629745,2.1954707553385475,80.25027413505296,0.03317797266773977,1.9165564057563769,5.546431362041648
XS2265360359,STERV 0 ⅝ 12/02/30,EUR,89.608,STORA ENSO OYJ,Industrial,2030-12-02,0.625,BBB-,0.001439436,500000000,Y,2030-09-02,Sr Unsecured,1,FIXED,02/12/2021,02/12/2029,02/12/2020,89.352,89.864,4.919917864476386,0.5120000000000005,92.39487055399938,0.04965753424657535,92.44452808824596,2.7868705539993783,63.01551402688429,0.04274776541706894,1.9180093847528485,5.5181400000000025
XS2265521620,ADRIT 1 ⅝ 02/02/29,EUR,96.391,AEROPORTI DI ROMA SPA,Industrial,2029-02-02,1.625,BBB-,0.010770069,300000000,Y,2028-11-02,Sr Unsecured,1,FIXED,02/02/2022,02/02/2028,02/12/2020,96.276,96.505,3.0882956878850103,0.2289999999999992,98.74520656845775,1.4825342465753426,100.22774081503309,2.354206568457741,79.40071011012131,0.02747772932239365,1.9452673693566638,5.678522367432137
XS2265968284,SHBASS 0.01 12/02/27,EUR,95.016,SVENSKA HANDELSBANKEN AB,Financial,2027-12-02,0.01,A+,0.000129884,500000000,N,,Sr Non Preferred,1,FIXED,02/12/2021,02/12/2026,02/12/2020,94.943,95.09,2.1683778234086244,0.14700000000000557,95.88848781908625,0.0083013698630137,95.89678918894927,0.8724878190862455,42.127763828803864,0.03461037552901631,4.767966638333689,27.527695895683184
FR0014000UL9,BNP 0 ⅝ 12/03/32,EUR,82.652,BNP PARIBAS,Financial,2032-12-03,0.625,A-,0.000632394,1800000000,N,,Sr Non Preferred,1,FIXED,03/12/2021,03/12/2031,03/12/2020,82.442,82.861,7.173169062286106,0.41900000000001114,88.1858193576824,0.517123287671233,88.70294264535364,5.533819357682404,92.22198094253132,0.03780171840181246,3.751544704997273,17.91147829426791
XS2263684776,NESNVX 0 03/03/33,EUR,81.578,NESTLE FINANCE INTL LTD,"Consumer, Non-cyclical",2033-03-03,0.0,AA-,0.016977096,500000000,Y,2032-12-03,Sr Unsecured,1,FIXED,03/03/2021,03/03/2032,03/12/2020,81.403,81.752,7.173169062286106,0.34899999999998954,84.09170060172596,0.0,84.09170060172596,2.513700601725958,42.279063743940746,0.03160324574350274,4.820556451420326,27.98712788934188
XS2263684933,NESNVX 0 ⅜ 12/03/40,EUR,63.212,NESTLE FINANCE INTL LTD,"Consumer, Non-cyclical",2040-12-03,0.375,AA-,0.016977096,500000000,Y,2040-09-03,Sr Unsecured,1,FIXED,03/12/2021,03/12/2039,03/12/2020,62.924,63.501,14.924024640657084,0.5769999999999982,70.68754651699665,0.028767123287671233,70.71631364028431,7.475546516996644,77.46948694613887,0.035225909887862936,4.603967894340375,26.254901065741695
XS2265371042,MQGAU 0.35 03/03/28,EUR,94.917,MACQUARIE GROUP LTD,Financial,2028-03-03,0.35,A-,0.000126637,750000000,N,,Sr Unsecured,1,FIXED,03/03/2021,03/03/2027,03/12/2020,94.818,95.016,2.4202600958247777,0.1980000000000075,96.16169461678207,0.2032876712328767,96.36498228801494,1.2446946167820698,53.91959624270845,0.030195785139747102,2.912067825625055,11.306852028054175
FR0014000UC8,URWFP 0 ⅝ 05/04/27,EUR,97.1944,UNIBAIL-RODAMCO-WESTFLD,Financial,2027-05-04,0.625,BBB,0.008889247,1000000000,Y,2027-02-04,Sr Unsecured,1,FIXED,04/05/2021,04/05/2026,04/12/2020,97.127,97.262,1.3442847364818618,0.13500000000000512,98.29468546421818,0.4092465753424657,98.70393203956064,1.1002854642181745,83.72556585641406,0.03160422977936802,6.739615600872629,52.14942834587
FR0014000UD6,URWFP 1 ⅜ 12/04/31,EUR,88.601,UNIBAIL-RODAMCO-WESTFLD,Financial,2031-12-04,1.375,BBB,0.008889247,1000000000,Y,2031-09-04,Sr Unsecured,1,FIXED,04/12/2021,04/12/2030,04/12/2020,88.396,88.807,5.924709103353867,0.41100000000000136,94.67980342226984,0.10171232876712329,94.78151575103696,6.078803422269843,115.95069201074458,0.032062375462940974,2.8991995996998905,11.226759573447882
XS2267889991,ATOSTR 2 12/04/28,EUR,97.49,AUTOSTRADE PER L'ITALIA,"Consumer, Non-cyclical",2028-12-04,2.0,BBB-,0.009300628,1250000000,Y,2028-09-04,Sr Unsecured,1,FIXED,04/12/2021,04/12/2027,04/12/2020,97.38,97.601,2.926762491444216,0.22100000000000364,99.9286734958204,0.14794520547945206,100.07661870129985,2.43867349582041,85.96604963952493,0.03235172141130951,1.9360773938485925,5.625006699373607
XS2268340010,SRGIM 0 12/07/28,EUR,91.969,SNAM SPA,Utilities,2028-12-07,0.0,BBB+,2.41679e-05,600000000,Y,2028-09-07,Sr Unsecured,1,FIXED,07/12/2021,07/12/2027,07/12/2020,91.866,92.072,2.9349760438056127,0.20600000000000307,94.28151320627433,0.0,94.28151320627433,2.312513206274332,84.5545800231999,0.03657666405891806,1.9244783628090667,5.564938599936029
FR0014000Y93,ACAFP 0 ⅛ 12/09/27,EUR,94.963,CREDIT AGRICOLE SA,Financial,2027-12-09,0.125,A-,0.000125365,1000000000,N,,Sr Non Preferred,1,FIXED,09/12/2021,09/12/2026,09/12/2020,94.87,95.057,2.187542778918549,0.1869999999999976,96.09264222338513,0.10136986301369863,96.19401208639883,1.129642223385133,54.05943039951073,0.03878604868430085,4.748024657430655,27.30112845956702
XS2270406452,MOLNLY 0 ⅝ 01/15/31,EUR,87.181,MOLNLYCKE HOLDING AB,"Consumer, Non-cyclical",2031-01-15,0.625,NR,0.00462818,400000000,Y,2030-10-15,Sr Unsecured,1,FIXED,15/01/2022,15/01/2030,10/12/2020,86.994,87.368,5.037645448323066,0.3739999999999952,92.18506119631941,0.601027397260274,92.78608859357968,5.004061196319412,112.21101809274003,0.030005465347514155,2.8975387070712095,11.233109063030382
FR00140010J1,ALTAFP 1 ¾ 01/16/30,EUR,92.59235,ALTAREA,Financial,2030-01-16,1.75,NR,0.000407773,300000000,Y,2029-10-16,Sr Unsecured,1,FIXED,16/01/2022,16/01/2029,16/12/2020,92.235,92.95,4.041067761806982,0.7150000000000034,98.27091884133375,1.678082191780822,99.94900103311457,5.678568841333757,151.20864131653624,0.02941871165565677,1.9366723129005787,5.637983023085442
XS2275029085,IREIM 0 ¼ 01/17/31,EUR,86.73236,IREN SPA,Utilities,2031-01-17,0.25,BBB,6.77917e-05,500000000,Y,2030-10-17,Sr Unsecured,1,FIXED,17/01/2022,17/01/2030,17/12/2020,86.553,86.911,5.04312114989733,0.3580000000000041,90.40009634676855,0.23904109589041095,90.63913744265896,3.6677363467685495,82.51984283881396,0.02791077812842393,1.9437022408169446,5.67083731911136
XS2262806933,ISPVIT 2 ⅜ 12/22/30,EUR,94.82188,INTESA SANPAOLO ASSICURA,Financial,2030-12-22,2.375,NR,0.001700295,600000000,N,,Subordinated,1,FIXED,22/12/2021,22/12/2029,22/12/2020,94.452,95.191,5.223819301848049,0.7390000000000043,100.3955533630653,1.8414383561643837,102.23699171922969,5.573673363065311,114.81046293314819,0.029333514863825568,1.9417580014945985,5.658056483339995
FR0014001EW8,ALOFP 0 01/11/29,EUR,91.462,ALSTOM SA,Industrial,2029-01-11,0.0,NR,0.00084863,750000000,Y,2028-10-11,Sr Unsecured,1,FIXED,11/01/2022,11/01/2028,11/01/2021,91.299,91.625,3.028062970568104,0.3259999999999934,94.07914881963038,0.0,94.07914881963038,2.6171488196303727,93.10751082433706,0.029735796215069745,0.9711228877112289,1.886159326073192
XS2280845145,BMW 0.2 01/11/33,EUR,81.66673,BMW FINANCE NV,"Consumer, Cyclical",2033-01-11,0.2,A,0.04472225,500000000,N,,Sr Unsecured,1,FIXED,11/01/2022,11/01/2032,11/01/2021,81.32,82.013,7.279945242984257,0.693000000000012,85.15283499539132,0.14410958904109591,85.29694458443241,3.4861049953913152,57.78549795341949,0.03201838495527593,4.818585582848874,27.96438109239392
XS2281155254,INTNED 0 ¼ 02/01/30,EUR,91.671,ING GROEP NV,Financial,2030-02-01,0.25,A-,8.33832e-05,1500000000,Y,2029-02-01,Sr Unsecured,1,VARIABLE,01/02/2022,01/11/2029,11/01/2021,91.567,91.775,3.3374401095140316,0.20800000000001262,94.09790327336704,0.16575342465753426,94.26365669802458,2.4269032733670315,78.47024259768689,0.0294420424130121,0.9713999999999999,1.8872359199999997
XS2282101539,GYCGR 0 ⅛ 01/11/28,EUR,94.069,GRAND CITY PROPERTIES SA,Financial,2028-01-11,0.125,NR,0.00073146,1000000000,Y,2027-10-11,Sr Unsecured,1,FIXED,11/01/2022,11/01/2027,11/01/2021,93.922,94.216,2.026009582477755,0.29399999999999693,96.41105629884616,0.12157534246575342,96.53263164131191,2.3420562988461597,121.37869774715477,0.031329688387369756,3.7630912585532923,18.059299190835933
FR0014001GA9,SOCGEN 0 ½ 06/12/29,EUR,94.015,SOCIETE GENERALE,Financial,2029-06-12,0.5,BBB,0.00033915,1000000000,Y,2028-06-12,Sr Non Preferred,1,VARIABLE,12/06/2021,12/03/2029,12/01/2021,93.917,94.114,2.6967830253251197,0.19700000000000273,96.0706638108341,0.15205479452054796,96.22271860535466,2.0556638108341048,80.48221702410828,0.03502324299633121,6.622567577687171,50.83585212935193
XS2280835260,DLR 0 ⅝ 07/15/31,EUR,85.466,DIGITAL INTREPID HOLDING,Financial,2031-07-15,0.625,BBB,0.000167809,1000000000,Y,2031-04-15,Sr Unsecured,1,FIXED,15/07/2021,15/07/2030,12/01/2021,85.299,85.633,5.535934291581109,0.333999999999989,91.263077072834,0.2893835616438356,91.55246063447782,5.797077072834,120.26933175877586,0.036623581077742176,4.758332882457099,27.418123047842478
XS2282095970,VW 0 ½ 01/12/29,EUR,92.927,VOLKSWAGEN LEASING GMBH,"Consumer, Cyclical",2029-01-12,0.5,A-,0.013881583,750000000,N,,Sr Unsecured,1,FIXED,12/01/2022,12/01/2028,12/01/2021,92.779,93.076,3.2826830937713893,0.29699999999999704,95.00869567775048,0.3589041095890411,95.36759978733953,2.0816956777504743,67.82894055164448,0.03643873317433266,1.927197396179155,5.575925201202929
XS2282195176,ATH 0 ⅝ 01/12/28,EUR,95.563,ATHENE GLOBAL FUNDING,Financial,2028-01-12,0.625,A+,0.011195219,500000000,N,,Secured,1,FIXED,12/01/2022,12/01/2027,12/01/2021,95.494,95.632,2.2806297056810405,0.13800000000000523,97.01416512980651,0.4486301369863014,97.46279526679281,1.4511651298065118,66.28765404176544,0.03168962596081448,2.8927678808508777,11.196259083067632
XS2282210231,SWEDA 0.2 01/12/28,EUR,95.027,SWEDBANK AB,Financial,2028-01-12,0.2,A,3.10849e-05,750000000,N,,Sr Non Preferred,1,FIXED,12/01/2022,12/01/2027,12/01/2021,94.947,95.106,2.2806297056810405,0.15899999999999181,96.07536166397209,0.14356164383561645,96.2189233078077,1.0483616639720879,48.13426590831632,0.030736421154886562,4.762031292291716,27.550316494986205
BE0002766476,KBCBB 0 ⅛ 01/14/29,EUR,94.62111,KBC GROUP NV,Financial,2029-01-14,0.125,A-,5.40632e-05,750000000,Y,2028-01-14,Sr Unsecured,1,VARIABLE,14/01/2022,14/10/2028,14/01/2021,94.53,94.712,2.2861054072553046,0.18200000000000216,95.89894090844118,0.08904109589041095,95.98798200433158,1.2778309084411745,58.682278680466695,0.029825327399931278,3.8841538400488425,18.858313816457702
FR0014001G29,BPCEGP 0.01 01/14/27,EUR,97.122,BPCE SA,Financial,2027-01-14,0.01,A+,1.82924e-05,750000000,N,,Sr Preferred,1,FIXED,14/01/2022,14/01/2026,14/01/2021,97.06,97.184,1.2867898699520877,0.12399999999999523,97.59314920664524,0.007123287671232876,97.60027249431647,0.4711492066452365,37.582635046458485,0.04161952720616562,0.9600434456928839,1.8433668352357309
FR0014001G37,BPCEGP 0 ¼ 01/14/31,EUR,86.559,BPCE SA,Financial,2031-01-14,0.25,A+,1.82924e-05,1250000000,N,,Sr Preferred,1,FIXED,14/01/2022,14/01/2030,14/01/2021,86.404,86.714,5.286789869952088,0.3100000000000023,89.86785031710615,0.1780821917808219,90.04593250888696,3.308850317106149,71.31751598597968,0.034378413369153454,6.62706922815593,50.90289257594209
FR0014001I50,VIEFP 0 01/14/27,EUR,97.14,VEOLIA ENVIRONNEMENT SA,Utilities,2027-01-14,0.0,BBB,0.000200524,700000000,Y,2026-10-14,Sr Unsecured,1,FIXED,14/01/2022,14/01/2026,14/01/2021,97.07,97.211,1.0349075975359343,0.14100000000000534,98.04924077262058,0.0,98.04924077262058,0.9092407726205778,89.96161206223134,0.03811950434240991,1.9255625037793622,5.5636075819331445
XS2278566299,ATOSTR 2 01/15/30,EUR,95.802,AUTOSTRADE PER L'ITALIA,"Consumer, Non-cyclical",2030-01-15,2.0,BBB-,0.009300628,1000000000,Y,2029-10-15,Sr Unsecured,1,FIXED,15/01/2022,15/01/2029,15/01/2021,95.628,95.975,4.03832991101985,0.3469999999999942,99.2319957628549,1.9232876712328768,101.15528343408776,3.4299957628548867,89.72562216562791,0.03189382620906929,4.758831173092442,27.5051783178804
CH0591979627,UBS 0 ⅝ 01/18/33,EUR,82.408,UBS GROUP AG,Financial,2033-01-18,0.625,A-,0.000727758,1500000000,N,,Sr Unsecured,1,FIXED,18/01/2022,18/01/2032,18/01/2021,82.212,82.605,7.299110198494182,0.3930000000000007,87.93613069253249,0.4383561643835616,88.37448685691605,5.528130692532486,90.84019289784177,0.03585609984455281,1.9295232869655672,5.586995176951463
FR0014001IM0,ICADFP 0 ⅝ 01/18/31,EUR,86.349,ICADE,Financial,2031-01-18,0.625,NR,0.002670412,650000000,Y,2030-10-18,Sr Unsecured,1,FIXED,18/01/2022,18/01/2030,18/01/2021,86.186,86.511,5.045859000684462,0.32499999999998863,92.16972913491504,0.595890410958904,92.76561954587395,5.820729134915041,130.95051829113274,0.03417632572223326,2.871099417782861,11.066719033205263
FR0014001I68,BFCM 0 ¼ 07/19/28,EUR,93.56602,BANQUE FED CRED MUTUEL,Financial,2028-07-19,0.25,A-,1.08678e-05,1000000000,N,,Sr Non Preferred,1,FIXED,19/07/2021,19/07/2027,19/01/2021,93.462,93.67,2.7980835044490076,0.2079999999999984,95.23624729528665,0.050684931506849315,95.2869322267935,1.6702272952866508,63.33203418467539,0.02902529368257248,1.9419621948491417,5.659979393558709
FR0014001JT3,BNP 0 ½ 01/19/30,EUR,92.475,BNP PARIBAS,Financial,2030-01-19,0.5,A-,0.000632394,1000000000,Y,2029-01-19,Sr Non Preferred,1,VARIABLE,19/01/2022,19/10/2029,19/01/2021,92.37,92.579,3.3018480492813143,0.20899999999998897,94.96932890443361,0.3493150684931507,95.31864397292676,2.4943289044336154,81.01974568285726,0.043771605900146636,12.608613370051046,185.07240294009267
XS2283188683,EXOIM 0 ⅞ 01/19/31,EUR,89.952,EXOR NV,Financial,2031-01-19,0.875,NR,2.32729e-06,500000000,Y,2030-10-19,Sr Unsecured,1,FIXED,19/01/2022,19/01/2030,19/01/2021,89.754,90.151,5.048596851471594,0.39699999999999136,93.34897051825814,0.8318493150684932,94.18081983332664,3.3969705182581436,74.74770059587276,0.038012748014900996,4.723860417562504,27.129263941000566
XS2286044370,ABBNVX 0 01/19/30,EUR,88.909,ABB FINANCE BV,Industrial,2030-01-19,0.0,A,7.69064e-07,800000000,Y,2029-10-19,Sr Unsecured,1,FIXED,19/01/2022,19/01/2029,19/01/2021,88.784,89.034,4.049281314168378,0.25,91.53499169187256,0.0,91.53499169187256,2.6259916918725565,71.83502882737587,0.03094142139985245,4.8237016761579925,28.023447950166695
XS2286441964,HOLNSW 0 ⅛ 07/19/27,EUR,96.12435,HOLCIM FINANCE LUX SA,Industrial,2027-07-19,0.125,BBB+,1.36262e-05,500000000,Y,2027-04-19,Sr Unsecured,1,FIXED,19/07/2021,19/07/2026,19/01/2021,96.053,96.196,1.5468856947296372,0.14300000000000068,97.28370746868623,0.05650684931506849,97.3402143180013,1.159357468686224,77.46878298476463,0.029791445516105422,1.9347532813315955,5.629171161714844
XS2286442186,HOLNSW 0 ⅝ 01/19/33,EUR,82.76079,HOLCIM FINANCE LUX SA,Industrial,2033-01-19,0.625,BBB+,1.36262e-05,650000000,Y,2032-10-19,Sr Unsecured,1,FIXED,19/01/2022,19/01/2032,19/01/2021,82.546,82.976,7.049965776865161,0.4299999999999926,88.43127437790368,0.5941780821917808,89.02545246009545,5.670484377903676,95.91527479469583,0.028419498276234297,1.9422443144392838,5.6632974838939205
XS2288948859,EOANGR 0.1 12/19/28,EUR,92.98,E.ON SE,Utilities,2028-12-19,0.1,BBB+,0.00010082,600000000,Y,2028-09-19,Sr Unsecured,1,FIXED,19/12/2021,19/12/2027,19/01/2021,92.846,93.115,2.967830253251198,0.26899999999999125,94.49951996233874,0.003287671232876712,94.50280763357162,1.5195199623387339,54.63820180360192,0.03535282356497562,2.8861804551182764,11.13594538861953
XS2289133758,UCGIM 0.85 01/19/31,EUR,89.344,UNICREDIT SPA,Financial,2031-01-19,0.85,BBB+,0.000322889,1000000000,N,,Sr Preferred,1,FIXED,19/01/2022,19/01/2030,19/01/2021,89.16,89.528,5.300479123887748,0.3680000000000092,92.81185279450062,0.5938356164383563,93.40568841093898,3.4678527945006294,73.17644225261051,0.03155404879723728,4.833836093221025,28.090611497553617
XS2287624584,MOTOPG 0 ⅛ 07/20/28,EUR,93.434,MOTABILITY OPERATIONS GR,"Consumer, Non-cyclical",2028-07-20,0.125,A-,0.024813777,500000000,Y,2028-04-20,Sr Unsecured,1,FIXED,20/07/2021,20/07/2027,20/01/2021,93.313,93.555,2.5516769336071183,0.24200000000000443,95.3788913277942,0.056164383561643834,95.43505571135584,1.9448913277941955,80.75900816375015,0.044392623495456814,13.081260229132976,194.45000188045572
XS2288925568,BALDER 1 01/20/29,EUR,93.216,BALDER FINLAND OYJ,Financial,2029-01-20,1.0,NR,0.001221059,600000000,Y,2028-10-20,Sr Unsecured,1,FIXED,20/01/2022,20/01/2028,20/01/2021,93.09,93.342,3.052703627652293,0.25199999999999534,96.94934214852945,0.947945205479452,97.89728735400891,3.7333421485294593,129.892943699459,0.03134586967106919,4.788260634647065,27.742239716890744
XS2289408440,NGGLN 0.163 01/20/28,EUR,94.75058,NATIONAL GRID PLC,Utilities,2028-01-20,0.163,BBB,4.6004e-05,500000000,Y,2027-10-20,Sr Unsecured,1,FIXED,20/01/2022,20/01/2027,20/01/2021,94.672,94.829,2.0506502395619437,0.15699999999999648,96.43811729061706,0.1545150684931507,96.59263235911021,1.6875372906170583,86.10227925902119,0.03251364682974356,3.84354869397586,18.56388171407537
XS2289841087,VW 1 ½ 01/21/41,EUR,68.838,VOLKSWAGEN INTL FIN NV,"Consumer, Cyclical",2041-01-21,1.5,BBB+,0.042120067,300000000,N,,Sr Unsecured,1,FIXED,21/01/2022,21/01/2040,21/01/2021,68.467,69.209,15.307323750855579,0.7420000000000044,84.06637130341683,1.0397260273972604,85.1060973308141,15.228371303416836,148.20767654735758,0.02962890637832551,4.829950953738529,28.095683491224865
XS2289797248,NORTEG 0.905 01/22/31,EUR,87.034,NORTEGAS ENERGIA GRUPO S,Utilities,2031-01-22,0.905,NR,0.007585032,550000000,Y,2030-10-22,Sr Unsecured,1,FIXED,22/01/2022,22/01/2030,22/01/2021,86.781,87.288,5.0568104038329915,0.5069999999999908,93.47776430644213,0.8529315068493151,94.33069581329144,6.4437643064421195,143.91337520511314,0.029673368906278134,1.9374137624728265,5.639935628953718
AT0000A2N837,ERSTBK 0 ¼ 01/27/31,EUR,87.0096,ERSTE GROUP BANK AG,Financial,2031-01-27,0.25,A,0.000194493,500000000,N,,Sr Preferred,1,FIXED,27/01/2022,27/01/2030,25/01/2021,86.834,87.186,5.322381930184805,0.35200000000000387,89.79043343669271,0.16917808219178082,89.95961151888449,2.7808334366927028,59.41055490748493,0.027438026128563154,1.9117390641648717,5.548136902949587
XS2291340433,SAGAX 0 ¾ 01/26/28,EUR,95.73331,SAGAX EURO MTN,Financial,2028-01-26,0.75,NR,0.000165974,500000000,Y,2027-10-26,Sr Unsecured,1,FIXED,26/01/2022,26/01/2027,26/01/2021,95.604,95.863,2.0670773442847366,0.25900000000000034,97.58488156438585,0.6986301369863013,98.28351170137215,1.85157156438585,92.97424111845177,0.02871299716802109,1.942184937514813,5.66199018641614
XS2292954893,GS 0 ¼ 01/26/28,EUR,95.029,GOLDMAN SACHS GROUP INC,Financial,2028-01-26,0.25,A-,0.00026897,1750000000,Y,2027-10-26,Sr Unsecured,1,FIXED,26/01/2022,26/01/2027,26/01/2021,94.939,95.12,2.0670773442847366,0.1810000000000116,96.58096887590848,0.2328767123287671,96.81384558823724,1.5519688759084858,78.41942533372875,0.0378159814317578,9.05217700098507,93.98388205098271
XS2289877941,TSCOLN 0 ⅜ 07/27/29,EUR,91.152,TESCO CORP TREASURY SERV,"Consumer, Non-cyclical",2029-07-27,0.375,BBB-,0.022513089,750000000,Y,2029-04-27,Sr Unsecured,1,FIXED,27/07/2021,27/07/2028,27/01/2021,91.028,91.276,3.57015742642026,0.24799999999999045,93.99493641858756,0.1613013698630137,94.15623778845057,2.8429364185875556,86.3875335553742,,,
BE0002767482,GBLBBB 0 ⅛ 01/28/31,EUR,86.183,GRP BRUXELLES LAMBERT SA,Financial,2031-01-28,0.125,NR,2.28257e-06,500000000,Y,2030-10-28,Sr Unsecured,1,FIXED,28/01/2022,28/01/2030,28/01/2021,86.015,86.351,5.073237508555784,0.3359999999999985,89.7392503397821,0.11575342465753424,89.85500376443964,3.556250339782096,79.86808618834719,0.029930244320924386,2.8759930737496373,11.122220909524765
DE000A287179,ANNGR 1 01/28/41,EUR,62.90917,VONOVIA SE,Financial,2041-01-28,1.0,BBB+,0.001036135,500000000,Y,2040-10-28,Sr Unsecured,1,FIXED,28/01/2022,28/01/2040,28/01/2021,62.624,63.195,15.07460643394935,0.570999999999998,78.13786808812705,0.9260273972602739,79.06389548538732,15.228698088127047,157.10976833454947,0.03618844060542999,6.345983450157674,47.9715771211081
XS2292547317,IGIM 0.579 01/29/31,EUR,88.341,ITALGAS RETI SPA,Utilities,2031-01-29,0.579,BBB,3.11332e-05,500000000,Y,2030-10-29,Sr Unsecured,1,FIXED,29/01/2022,29/01/2030,29/01/2021,88.122,88.56,5.075975359342916,0.4380000000000024,91.89453555249955,0.5345835616438356,92.42911911414339,3.5535355524995538,78.61814456418682,0.03401304502423661,5.7231633621373215,38.568946337999286
XS2292263121,MS 0.497 02/07/31,EUR,89.823,MORGAN STANLEY,Financial,2031-02-07,0.497,A,2.70627e-05,1750000000,Y,2030-02-07,Sr Unsecured,1,VARIABLE,07/02/2022,07/11/2030,08/02/2021,89.719,89.927,4.353182751540041,0.20800000000001262,92.86734643622775,0.32134794520547943,93.18869438143322,3.0443464362277552,77.17793639688611,0.04526146038710041,12.29336622913669,171.59849911306665
XS2297177664,ESSITY 0 ¼ 02/08/31,EUR,87.56258,ESSITY AB,"Consumer, Non-cyclical",2031-02-08,0.25,NR,4.90885e-07,700000000,Y,2030-11-08,Sr Unsecured,1,FIXED,08/02/2022,08/02/2030,08/02/2021,87.167,87.958,5.103353867214237,0.7909999999999968,90.26816623773662,0.22397260273972602,90.49213884047634,2.7055862377366253,59.91713600921435,0.02881033665286537,2.915989364726067,11.337325300260705
XS2297549391,CABKSM 0 ½ 02/09/29,EUR,95.27659,CAIXABANK SA,Financial,2029-02-09,0.5,BBB+,0.000118254,1000000000,Y,2028-02-09,Sr Non Preferred,1,VARIABLE,09/02/2022,09/11/2028,09/02/2021,95.182,95.371,2.3572895277207393,0.18899999999999295,96.61476048727394,0.32054794520547947,96.93530843247942,1.338170487273942,59.31558218947996,0.031185416986555168,1.9395154033933324,5.642580000000002
XS2296203123,LHAGR 3 ¾ 02/11/28,EUR,101.9325,DEUTSCHE LUFTHANSA AG,"Consumer, Cyclical",2028-02-11,3.75,BBB-,0.001895778,850000000,Y,2027-11-11,Sr Unsecured,1,FIXED,11/02/2022,11/02/2027,11/02/2021,101.821,102.044,2.11088295687885,0.22299999999999898,103.67150038270277,3.328767123287671,107.00026750599045,1.7390003827027698,81.62678694895932,0.03692460438253035,6.636538783433761,50.91676753180369
XS2298304499,SANTAN 0.2 02/11/28,EUR,94.879,BANCO SANTANDER SA,Financial,2028-02-11,0.2,A+,0.000140759,1250000000,N,,Sr Preferred,1,FIXED,11/02/2022,11/02/2027,11/02/2021,94.786,94.972,2.3627652292950034,0.18599999999999284,95.92006526334295,0.1271232876712329,96.04718855101419,1.0410652633429436,46.21445678408021,0.034980803151252675,4.693752948359563,26.949947625347217
XS2298459426,BDX 1.213 02/12/36,EUR,78.938,BECTON DICKINSON EURO,"Consumer, Non-cyclical",2036-02-12,1.213,BBB,1.17832e-05,600000000,Y,2035-11-12,Sr Unsecured,1,FIXED,12/02/2022,12/02/2035,12/02/2021,78.689,79.187,10.113620807665983,0.49800000000000466,88.07662274880684,1.0734219178082194,89.15004466661506,9.138622748806839,115.12502705132631,0.03365603359368449,5.710414191539996,38.463311216405145
XS2300292617,CLNXSM 0 ¾ 11/15/26,EUR,98.157,CELLNEX FINANCE CO SA,Industrial,2026-11-15,0.75,BBB-,0.013805613,500000000,Y,2026-08-15,Sr Unsecured,1,FIXED,15/11/2021,15/11/2025,15/02/2021,98.098,98.216,0.8706365503080082,0.117999999999995,98.99153228632314,0.09657534246575342,99.08810762878889,0.8345322863231388,97.07840778051936,0.029737112845992685,1.940996455487993,5.65362018837203
XS2300292963,CLNXSM 1 ¼ 01/15/29,EUR,95.069,CELLNEX FINANCE CO SA,Industrial,2029-01-15,1.25,BBB-,0.013805613,750000000,Y,2028-10-15,Sr Unsecured,1,FIXED,15/01/2022,15/01/2028,15/02/2021,94.973,95.165,3.0390143737166326,0.19200000000000728,97.70141823547013,1.202054794520548,98.90347302999068,2.6324182354701264,90.97159474038365,0.03384686362672242,0.9672612406947891,1.8711886155008457
XS2300293003,CLNXSM 2 02/15/33,EUR,90.14526,CELLNEX FINANCE CO SA,Industrial,2033-02-15,2.0,BBB-,0.013805613,1250000000,Y,2032-11-15,Sr Unsecured,1,FIXED,15/02/2022,15/02/2032,15/02/2021,89.924,90.367,7.123887748117728,0.44299999999999784,97.23538965171244,1.7534246575342465,98.98881430924668,7.090129651712445,113.07347565547383,0.029981621479171907,1.941682240766553,5.655389009980646
XS2296204444,PLD 0 ½ 02/16/32,EUR,84.49,PROLOGIS EURO FINANCE,Financial,2032-02-16,0.5,A,0.010005575,850000000,Y,2031-11-16,Sr Unsecured,1,FIXED,16/02/2022,16/02/2031,16/02/2021,84.296,84.684,6.12457221081451,0.387999999999991,89.47141835701304,0.436986301369863,89.90840465838289,4.981418357013041,94.78129643276834,0.0289667620131284,4.8460905363280355,28.23279700246453
XS2296206068,PLD 1 02/16/41,EUR,64.01398,PROLOGIS EURO FINANCE,Financial,2041-02-16,1.0,A,0.010005575,500000000,Y,2040-08-16,Sr Unsecured,1,FIXED,16/02/2022,16/02/2040,16/02/2021,63.757,64.271,14.874743326488707,0.5140000000000029,78.43269269740372,0.12602739726027398,78.558720094664,14.41871269740372,148.9088172084537,0.0368872969154797,3.811907690104845,18.308770703778293
XS2297190097,TEL 0 02/16/29,EUR,91.832,TYCO ELECTRONICS GROUP S,Industrial,2029-02-16,0.0,A-,1.73345e-06,550000000,Y,2028-11-16,Sr Unsecured,1,FIXED,16/02/2022,16/02/2028,16/02/2021,91.703,91.961,3.1266255989048597,0.25799999999999557,93.83006714809015,0.0,93.83006714809015,1.9980671480901577,68.79556172115534,0.02823533531880881,1.9425926261122124,5.665328053570967
XS2299001888,IGIM 0 02/16/28,EUR,94.043,ITALGAS SPA,Utilities,2028-02-16,0.0,BBB,3.11332e-05,500000000,N,,Sr Unsecured,1,FIXED,16/02/2022,16/02/2027,16/02/2021,93.958,94.129,2.3764544832306638,0.17100000000000648,95.43436635938207,0.0,95.43436635938207,1.3913663593820615,61.75826693303715,0.03164750787719457,1.9361592980459945,5.627882085145635
XS2299002423,IGIM 0 ½ 02/16/33,EUR,80.619,ITALGAS SPA,Utilities,2033-02-16,0.5,BBB,3.11332e-05,500000000,N,,Sr Unsecured,1,FIXED,16/02/2022,16/02/2032,16/02/2021,80.409,80.829,7.378507871321013,0.4199999999999875,86.9394723757523,0.31095890410958904,87.25043127986189,6.320472375752303,104.05584308852667,0.029493021493250633,1.9402164155121306,5.651482569932015
DE000DL19VU0,DB 1 ⅜ 02/17/32,EUR,90.41366,DEUTSCHE BANK AG,Financial,2032-02-17,1.375,BBB+,0.000192593,1176200000,Y,2031-02-17,Sr Non Preferred,1,VARIABLE,17/02/2022,17/11/2031,17/02/2021,90.235,90.593,5.379876796714579,0.3580000000000041,95.31909493434489,0.8513698630136987,96.17046479735859,4.905434934344896,101.21701497238578,0.03539682259174789,6.619961743516558,50.79706722774601
XS2300175655,JPM 0.597 02/17/33,EUR,85.182,JPMORGAN CHASE & CO,Financial,2033-02-17,0.597,A+,0.0001373,1500000000,Y,2032-02-17,Sr Unsecured,1,VARIABLE,17/02/2022,17/11/2032,17/02/2021,85.011,85.352,6.379192334017796,0.3410000000000082,89.53051452647034,0.36964931506849313,89.90016384153884,4.348514526470339,79.359018823245,0.02795329738808564,1.9418919849957792,5.663636930427932
FR00140022B3,SOCGEN 0 ⅛ 02/18/28,EUR,94.547,SOCIETE GENERALE,Financial,2028-02-18,0.125,A,0.00033915,1000000000,N,,Sr Preferred,1,FIXED,18/02/2022,18/02/2027,18/02/2021,94.465,94.628,2.3819301848049284,0.1629999999999967,95.71104456275519,0.07705479452054795,95.78809935727574,1.164044562755194,51.379651788803095,0.03292339344537634,4.706210083090345,27.081129288539273
XS2303052695,CTPNV 0 ¾ 02/18/27,EUR,97.45157,CTP NV,Financial,2027-02-18,0.75,BBB-,0.000240028,500000000,Y,2026-11-18,Sr Unsecured,1,FIXED,18/02/2022,18/02/2026,18/02/2021,97.357,97.546,1.1307323750855578,0.18900000000000716,98.70141282961927,0.6513698630136986,99.35278269263297,1.2498428296192685,112.63678093947196,0.035557243490712764,2.889372395132693,11.150895169696769
XS2303089697,MINGNO 0.01 02/18/28,EUR,94.28209,SPAREBANK 1 SMN,Financial,2028-02-18,0.01,NR,1.51834e-05,500000000,N,,Sr Preferred,1,FIXED,18/02/2022,18/02/2027,18/02/2021,94.148,94.417,2.3819301848049284,0.26900000000000546,95.44603963916569,0.006164383561643836,95.45220402272733,1.1639496391656934,51.48017721833923,0.0333501257987159,6.634257735308488,51.01004780670493
DE000A3H2465,DBOERS 0 ⅛ 02/22/31,EUR,87.269,DEUTSCHE BOERSE AG,Financial,2031-02-22,0.125,NR,4.58215e-08,500000000,Y,2030-11-22,Sr Unsecured,1,FIXED,22/02/2022,22/02/2030,22/02/2021,87.044,87.494,5.1416837782340865,0.45000000000000284,89.5820503639844,0.10719178082191781,89.68924214480631,2.313050363984388,50.98442266291093,0.03015291154227962,1.9414593480163318,5.653896599999998
XS2301127119,AKFAST 0 ¾ 02/22/30,EUR,89.254,AKELIUS RESIDENTIAL PROP,Financial,2030-02-22,0.75,NR,0.006442526,600000000,Y,2029-11-22,Sr Unsecured,1,FIXED,22/02/2022,22/02/2029,22/02/2021,89.064,89.445,4.142368240930869,0.3810000000000002,94.262146078495,0.6431506849315068,94.9052967634265,5.008146078494988,133.32308914097626,0.03227158804913593,2.8828724474871823,11.140996682963667
XS2303927227,SECUSS 0 ¼ 02/22/28,EUR,95.063,SECURITAS AB,"Consumer, Non-cyclical",2028-02-22,0.25,NR,9.99522e-06,350000000,Y,2027-11-22,Sr Unsecured,1,FIXED,22/02/2022,22/02/2027,22/02/2021,94.958,95.169,2.1409993155373033,0.21099999999999852,96.44394579787517,0.21438356164383562,96.65832935951902,1.380945797875171,67.40851104571182,0.03839801816680392,0.9630218687872766,1.854822239525078
XS2306517876,DNBNO 0 ¼ 02/23/29,EUR,94.436,DNB BANK ASA,Financial,2029-02-23,0.25,A,5.1959e-05,1000000000,Y,2028-02-23,Sr Non Preferred,1,VARIABLE,23/02/2022,23/11/2028,23/02/2021,94.346,94.527,2.3956194387405887,0.18099999999999739,95.97389756770491,0.1506849315068493,96.12458249921175,1.5378975677049027,67.49619604857558,0.04008191094734782,4.628322186991403,26.362250691928665
CH0595205524,UBS 0 ¼ 02/24/28,EUR,94.83117,UBS GROUP AG,Financial,2028-02-24,0.25,A-,0.000727758,1000000000,N,,Sr Unsecured,1,FIXED,24/02/2022,24/02/2027,24/02/2021,94.736,94.927,2.3983572895277208,0.1910000000000025,95.96885942513761,0.15,96.11885942513761,1.1376894251376086,49.77224180151796,0.033730739633647644,4.759753554387398,27.4799424610641
CH0595205532,UBS 0 ⅝ 02/24/33,EUR,82.20441,UBS GROUP AG,Financial,2033-02-24,0.625,A-,0.000727758,1250000000,N,,Sr Unsecured,1,FIXED,24/02/2022,24/02/2032,24/02/2021,82.013,82.396,7.40041067761807,0.38299999999999557,87.73618666781464,0.375,88.11118666781464,5.53177666781464,89.90234991396889,0.031471235290154824,3.8568671232721807,18.66222470887033
DK0030484548,NYKRE 0 ⅜ 01/17/28,EUR,95.355,NYKREDIT REALKREDIT AS,Financial,2028-01-17,0.375,A-,0.008589489,750000000,N,,Sr Non Preferred,1,FIXED,17/01/2022,17/01/2027,24/02/2021,95.269,95.442,2.294318959616701,0.1729999999999876,96.43828050543243,0.26404109589041097,96.70232160132284,1.0832805054324268,49.315746177762065,0.02800621912960742,1.9274503752447776,5.607250103871854
XS2304664597,ISPIM 1.35 02/24/31,EUR,91.17842,INTESA SANPAOLO SPA,Financial,2031-02-24,1.35,BBB,0.000100348,750000000,N,,Sr Non Preferred,1,FIXED,24/02/2022,24/02/2030,24/02/2021,90.99,91.366,5.3990417522245036,0.3760000000000048,95.17022203612129,0.81,95.98022203612129,3.9918020361212854,81.75563571456608,0.030364335763953396,1.9398141372942665,5.64673618286884
XS2303070911,HMBSS 0 ¼ 08/25/29,EUR,90.74841,H&M FINANCE BV,"Consumer, Cyclical",2029-08-25,0.25,NR,7.02746e-06,500000000,Y,2029-05-25,Sr Unsecured,1,FIXED,25/08/2021,25/08/2028,25/02/2021,90.594,90.903,3.646817248459959,0.3090000000000117,93.39566398491004,0.08835616438356164,93.4840201492936,2.647253984910037,79.05959296703773,0.03282524690659995,4.789113545802668,27.722396065656095
XS2306851853,RABOBK 0 ⅝ 02/25/33,EUR,83.327,COOPERATIEVE RABOBANK UA,Financial,2033-02-25,0.625,A-,5.75847e-06,850000000,N,,Sr Non Preferred,1,FIXED,25/02/2022,25/02/2032,25/02/2021,83.11,83.545,7.403148528405202,0.4350000000000023,87.73079377796178,0.3732876712328767,88.10408144919465,4.403793777961781,71.06131021207489,0.034774309375440404,3.8081967634767118,18.309722655658618
XS2307309380,TOYOTA 0 02/25/28,EUR,94.23161,TOYOTA MOTOR FINANCE BV,"Consumer, Cyclical",2028-02-25,0.0,A+,0.023525151,300000000,N,,Sr Unsecured,1,FIXED,25/02/2022,25/02/2027,25/02/2021,94.139,94.324,2.401095140314853,0.18500000000000227,95.38320920732845,0.0,95.38320920732845,1.1515992073284451,50.554251838431675,0.029078727711812098,1.9385361201177682,5.646466515506983
XS2307853098,NWG 0.78 02/26/30,EUR,93.10806,NATWEST GROUP PLC,Financial,2030-02-26,0.78,A-,0.000171391,1000000000,Y,2029-02-26,Sr Unsecured,1,VARIABLE,26/02/2022,26/11/2029,26/02/2021,92.999,93.217,3.405886379192334,0.21800000000000352,95.66783196648167,0.46372602739726027,96.13155799387893,2.5597719664816765,80.32312845954833,0.030802506113020444,3.845264385334434,18.595445805456222
XS2307768734,GM 0.6 05/20/27,EUR,96.88,GENERAL MOTORS FINL CO,"Consumer, Cyclical",2027-05-20,0.6,BBB,0.020203048,750000000,Y,2027-03-20,Sr Unsecured,1,FIXED,20/05/2021,20/05/2026,01/03/2021,96.787,96.973,1.4647501711156743,0.18599999999999284,98.10835872819194,0.32054794520547947,98.42890667339742,1.2283587281919495,86.03339651664868,0.029356191007547782,2.9106343685279845,11.30559440856397
XS2304675791,ENAPHO 1.816 03/02/31,EUR,90.243,EP INFRASTRUCTURE AS,Utilities,2031-03-02,1.816,BBB-,0.003085091,500000000,Y,2030-12-02,Sr Unsecured,1,FIXED,02/03/2022,02/03/2030,02/03/2021,89.935,90.551,5.169062286105407,0.6159999999999997,97.70719126335867,1.5075287671232875,99.21472003048196,7.464191263358671,159.6665605509532,0.03303750768826633,6.663343125167728,51.318563398088
FR00140027U2,BPCEGP 0 ¾ 03/03/31,EUR,88.11399,BPCE SA,Financial,2031-03-03,0.75,BBB+,1.82924e-05,1000000000,N,,Sr Non Preferred,1,FIXED,03/03/2022,03/03/2030,03/03/2021,87.872,88.356,5.418206707734429,0.48399999999999466,92.11173412299668,0.43561643835616437,92.54735056135284,3.9977441229966786,83.27292364303428,0.03896081554437334,13.207483756900734,197.5839673713307
XS2305026929,NTT 0.342 03/03/30,EUR,89.60966,NTT FINANCE CORP,Communications,2030-03-03,0.342,A-,0.007284632,1000000000,Y,2029-12-03,Sr Unsecured,1,FIXED,03/03/2022,03/03/2029,03/03/2021,89.461,89.759,4.172484599589322,0.2980000000000018,92.59771784099317,0.28296986301369864,92.88068770400687,2.9880578409931644,79.00612664519586,0.03215002126827386,2.8951950381517073,11.205458306106026
XS2306601746,EZJLN 1 ⅞ 03/03/28,EUR,98.22372,EASYJET FINCO BV,"Consumer, Cyclical",2028-03-03,1.875,BBB,0.000650727,1200000000,Y,2027-12-03,Sr Unsecured,1,FIXED,03/03/2022,03/03/2027,03/03/2021,98.087,98.36,2.1711156741957565,0.27299999999999613,99.81011073200789,1.5513698630136987,101.36148059502159,1.5863907320078852,74.5030330693662,0.03569741642825838,0.9655329675810472,1.8645078229717271
XS2308586911,SPOLNO 0 ⅛ 03/03/28,EUR,94.432,SPAREBANK 1 OESTLANDET,Financial,2028-03-03,0.125,NR,4.03742e-05,500000000,N,,Sr Preferred,1,FIXED,03/03/2022,03/03/2027,03/03/2021,94.35,94.513,2.4202600958247777,0.16300000000001091,95.6356733229644,0.07260273972602739,95.70827606269042,1.2036733229643914,52.341062313033326,0.038353578680230815,6.520374864908721,49.68603186560929
XS2308616841,DSVDC 0 ½ 03/03/31,EUR,87.359,DSV FINANCE BV,Industrial,2031-03-03,0.5,A-,0.000214373,500000000,Y,2030-12-03,Sr Unsecured,1,FIXED,03/03/2022,03/03/2030,03/03/2021,87.206,87.513,5.171800136892539,0.30700000000000216,91.32964662294398,0.4136986301369863,91.74334525308097,3.9706466229439883,86.84411582934466,0.03382309064934438,6.604481733303635,50.689498340655035
XS2306082293,WPC 0.95 06/01/30,EUR,90.71157,WPC EUROBOND BV,Financial,2030-06-01,0.95,BBB+,7.04222e-05,525000000,Y,2030-03-01,Sr Unsecured,1,FIXED,01/06/2021,01/06/2029,08/03/2021,90.551,90.872,4.413415468856948,0.32099999999999795,94.6425619108246,0.556986301369863,95.19954821219446,3.930991910824602,97.66011526917424,0.03690726370902912,6.556505463647145,50.100147236675966
XS2308322002,BKNG 0 ½ 03/08/28,EUR,95.38645,BOOKING HOLDINGS INC,Communications,2028-03-08,0.5,A-,6.00979e-06,750000000,Y,2027-12-08,Sr Unsecured,1,FIXED,08/03/2022,08/03/2027,08/03/2021,95.271,95.502,2.184804928131417,0.23099999999999454,96.89253737882379,0.40684931506849314,97.29938669389229,1.5060873788237927,71.85784014922923,0.031945877422717456,2.88467162806853,11.152618978898271
XS2310748483,ETN 0.577 03/08/30,EUR,90.713,EATON CAPITAL ULC,Industrial,2030-03-08,0.577,A-,4.03266e-05,600000000,Y,2029-12-08,Sr Unsecured,1,FIXED,08/03/2022,08/03/2029,08/03/2021,90.562,90.864,4.186173853524983,0.3020000000000067,93.50211832130951,0.46950410958904104,93.97162243089855,2.789118321309516,72.98293955137791,0.038157176877336274,6.4714879513499595,49.19372912449954
XS2307863642,KO 0 ⅛ 03/09/29,EUR,92.04,COCA-COLA CO/THE,"Consumer, Non-cyclical",2029-03-09,0.125,A+,6.77015e-08,700000000,N,,Sr Unsecured,1,FIXED,09/03/2022,09/03/2028,09/03/2021,91.917,92.163,3.436002737850787,0.2459999999999951,93.4629881107671,0.07054794520547945,93.53353605597258,1.4229881107670934,44.68961298316788,0.02978232136911553,1.9347704887211004,5.6292711663988735
XS2307863998,KO 0 ½ 03/09/33,EUR,82.73008,COCA-COLA CO/THE,"Consumer, Non-cyclical",2033-03-09,0.5,A+,6.77015e-08,650000000,N,,Sr Unsecured,1,FIXED,09/03/2022,09/03/2032,09/03/2021,82.544,82.916,7.436002737850787,0.3719999999999999,86.82028537494624,0.2821917808219178,87.10247715576816,4.090205374946237,66.01534059095809,0.029890930157272875,1.939465834927683,5.6471126769279865
XS2307864020,KO 1 03/09/41,EUR,67.565,COCA-COLA CO/THE,"Consumer, Non-cyclical",2041-03-09,1.0,A+,6.77015e-08,650000000,N,,Sr Unsecured,1,FIXED,09/03/2022,09/03/2040,09/03/2021,67.287,67.843,15.436002737850787,0.5559999999999974,77.62499082276646,0.5643835616438356,78.1893743844103,10.059990822766466,98.25411462226661,0.03555674071748292,6.5922412550690215,50.508393105296335
DE000MHB64E1,MUNHYP 0 ⅜ 03/09/29,EUR,91.99983,MUENCHENER HYPOTHEKENBNK,Financial,2029-03-09,0.375,NR,0.009189739,500000000,N,,Sr Non Preferred,1,FIXED,09/03/2022,09/03/2028,10/03/2021,91.791,92.209,3.436002737850787,0.41800000000000637,94.2839581620612,0.21164383561643835,94.49560199767764,2.2841281620611937,71.65432345447735,0.041216248624364585,12.78805583262362,188.91668488549888
XS2304340263,EQIX 0 ¼ 03/15/27,EUR,96.79468,EQUINIX INC,Financial,2027-03-15,0.25,BBB,5.36876e-05,500000000,Y,2027-01-15,Sr Unsecured,1,FIXED,15/03/2022,15/03/2026,10/03/2021,96.712,96.877,1.2895277207392197,0.16499999999999204,97.8906189804445,0.1773972602739726,98.06801624071848,1.095938980444501,87.2623075367496,0.029628429024444576,3.8618591135732068,18.71672372940594
XS2304340693,EQIX 1 03/15/33,EUR,82.878,EQUINIX INC,Financial,2033-03-15,1.0,BBB,5.36876e-05,600000000,Y,2032-12-15,Sr Unsecured,1,FIXED,15/03/2022,15/03/2032,10/03/2021,82.662,83.094,7.2060232717316905,0.43199999999998795,90.58713662128037,0.7945205479452054,91.38165716922558,7.709136621280365,127.56695733009991,0.03752795351330193,6.50096935781114,49.5138355341833
DE000A3H3JM4,MBGGR 0 ¾ 03/11/33,EUR,83.8337,MERCEDES-BENZ GROUP AG,"Consumer, Cyclical",2033-03-11,0.75,A,0.001270443,1000000000,N,,Sr Unsecured,1,FIXED,11/03/2022,11/03/2032,11/03/2021,83.58,84.087,7.441478439425051,0.507000000000005,88.50160480495404,0.4191780821917809,88.92078288714582,4.667904804954048,74.70793723776963,0.03293945056627322,3.8342788229600293,18.499116918752463
FR0014002BJ9,CMARK 0 ⅞ 03/11/33,EUR,82.905,CREDIT MUTUEL ARKEA,Financial,2033-03-11,0.875,A,1.22381e-05,650000000,N,,Sr Non Preferred,1,FIXED,11/03/2022,11/03/2032,11/03/2021,82.702,83.108,7.441478439425051,0.4060000000000059,89.34793043182599,0.48904109589041106,89.8369715277164,6.442930431825985,103.63945978981516,0.031117544717530032,4.797301014184371,27.816193842793314
XS2315784715,APAAU 0 ¾ 03/15/29,EUR,93.111,APA INFRASTRUCTURE LTD,Utilities,2029-03-15,0.75,BBB,0.025590344,600000000,Y,2028-12-15,Sr Unsecured,1,FIXED,15/03/2022,15/03/2028,15/03/2021,93.001,93.221,3.2060232717316905,0.21999999999999886,95.93467662768091,0.595890410958904,96.53056703863982,2.8236766276809107,93.89549470265719,0.034012839540480184,6.5516037789833765,50.14164319034552
XS2315784806,APAAU 1 ¼ 03/15/33,EUR,84.495,APA INFRASTRUCTURE LTD,Utilities,2033-03-15,1.25,BBB,0.025590344,500000000,Y,2032-12-15,Sr Unsecured,1,FIXED,15/03/2022,15/03/2032,15/03/2021,84.339,84.65,7.2060232717316905,0.31100000000000705,92.2315177649046,0.9931506849315068,93.2246684498361,7.73651776490459,126.63957226547778,0.033527003383352925,4.785756587002953,27.683984839274974
XS2317069685,ISPIM 0 ¾ 03/16/28,EUR,95.735,INTESA SANPAOLO SPA,Financial,2028-03-16,0.75,BBB+,0.000100348,1250000000,N,,Sr Preferred,1,FIXED,16/03/2022,16/03/2027,16/03/2021,95.643,95.826,2.455852156057495,0.18299999999999272,97.04818889649589,0.4089041095890411,97.45709300608493,1.3131888964958875,55.72120182968564,0.03744247798913313,5.574646748544763,37.155879722570894
XS2312722916,MDLZ 0 ¼ 03/17/28,EUR,94.758,MONDELEZ INTERNATIONAL,"Consumer, Non-cyclical",2028-03-17,0.25,BBB,6.19362e-06,750000000,Y,2027-12-17,Sr Unsecured,1,FIXED,17/03/2022,17/03/2027,17/03/2021,94.643,94.873,2.209445585215606,0.23000000000000398,96.31729638128253,0.19726027397260273,96.51455665525513,1.559296381282536,73.92816308342319,0.03169685553357068,2.8964750233359156,11.215346048440605
XS2312723138,MDLZ 0 ¾ 03/17/33,EUR,82.88017,MONDELEZ INTERNATIONAL,"Consumer, Non-cyclical",2033-03-17,0.75,BBB,6.19362e-06,600000000,Y,2032-12-17,Sr Unsecured,1,FIXED,17/03/2022,17/03/2032,17/03/2021,82.666,83.094,7.211498973305955,0.42799999999999727,88.93244902290635,0.5917808219178082,89.52422984482416,6.0522790229063474,100.18942269875726,0.03466714876717632,5.681422700892379,38.178309377431276
XS2312723302,MDLZ 1 ⅜ 03/17/41,EUR,69.72004,MONDELEZ INTERNATIONAL,"Consumer, Non-cyclical",2041-03-17,1.375,BBB,6.19362e-06,650000000,Y,2040-12-17,Sr Unsecured,1,FIXED,17/03/2022,17/03/2040,17/03/2021,69.408,70.032,15.211498973305956,0.6239999999999952,82.61443526082317,1.084931506849315,83.69936676767249,12.894395260823174,125.2584354094016,0.03968539213502713,8.221155317585952,77.7397794093705
XS2317288301,ADNA 0 ⅜ 03/18/30,EUR,90.37218,KONINKIJKE AHOLD DLHAIZE,"Consumer, Non-cyclical",2030-03-18,0.375,BBB+,4.82756e-06,600000000,Y,2029-12-18,Sr Unsecured,1,FIXED,18/03/2022,18/03/2029,18/03/2021,90.243,90.502,4.213552361396304,0.25900000000000034,92.64553454533474,0.2948630136986301,92.94039755903337,2.2733545453347404,59.29268915604766,0.03333634311637509,3.828676201443185,18.45834449636161
XS2310797696,SPG 1 ⅛ 03/19/33,EUR,84.08273,SIMON INTL FINANCE SCA,Financial,2033-03-19,1.125,A-,0.007584055,750000000,Y,2032-12-19,Sr Unsecured,1,FIXED,19/03/2022,19/03/2032,19/03/2021,83.798,84.367,7.216974674880219,0.5690000000000026,91.39208384059837,0.8815068493150685,92.27359068991345,7.3093538405983765,119.84632477924316,0.029456366434264705,4.7804573978868925,27.715594203895492
XS2320438653,CDTFIN 0 ⅝ 03/19/30,EUR,90.14861,CADENT FINANCE PLC,Utilities,2030-03-19,0.625,BBB+,0.007895117,625000000,Y,2029-12-19,Sr Unsecured,1,FIXED,19/03/2022,19/03/2029,19/03/2021,89.981,90.317,4.216290212183436,0.3359999999999985,93.63864886811056,0.4897260273972603,94.12837489550782,3.4900388681105596,90.96714989645781,0.03691483274898455,6.582676053763924,50.36712183066282
XS2321526480,NDAFH 0 ½ 03/19/31,EUR,88.077,NORDEA BANK ABP,Financial,2031-03-19,0.5,A,4.21953e-05,500000000,N,,Sr Non Preferred,1,FIXED,19/03/2022,19/03/2030,19/03/2021,87.912,88.242,5.462012320328542,0.3299999999999983,90.76170790974933,0.2684931506849315,91.03020106043427,2.684707909749335,55.58711439649969,0.03474991532288367,4.767297744362902,27.52008071942286
XS2322254249,GS 1 03/18/33,EUR,85.263,GOLDMAN SACHS GROUP INC,Financial,2033-03-18,1.0,A-,0.00026897,1250000000,Y,2032-12-18,Sr Unsecured,1,FIXED,18/03/2022,18/03/2032,19/03/2021,85.031,85.494,7.214236824093087,0.46299999999999386,90.57336141395292,0.7863013698630137,91.35966278381593,5.3103614139529185,86.53662718925234,0.03455395962548067,2.877305920384518,11.095989489279455
XS2320453884,UPMFH 0 ½ 03/22/31,EUR,87.066,UPM-KYMMENE OYJ,Basic Materials,2031-03-22,0.5,NR,3.6273e-05,500000000,Y,2030-12-22,Sr Unsecured,1,FIXED,22/03/2022,22/03/2030,22/03/2021,86.898,87.234,5.223819301848049,0.3359999999999985,91.2274379043464,0.38767123287671235,91.61510913722311,4.1614379043464,90.3243473869477,0.03936094634397583,6.462691751842839,49.06724631927086
XS2320745156,HANRUE 1 ⅜ 06/30/42,EUR,87.476,HANNOVER RE,Financial,2042-06-30,1.375,NR,1.34716e-07,750000000,Y,2031-12-30,Subordinated,1,VARIABLE,30/06/2021,31/03/2042,22/03/2021,87.247,87.705,6.245037645448323,0.4579999999999984,94.27931435113751,1.0359589041095891,95.3152732552471,6.803314351137516,124.4518449040704,0.033281252858540264,4.761923083991601,27.50458723744813
XS2320759538,VZ 0 ⅜ 03/22/29,EUR,92.12064,VERIZON COMMUNICATIONS,Communications,2029-03-22,0.375,BBB+,0.000164108,1000000000,Y,2028-12-22,Sr Unsecured,1,FIXED,22/03/2022,22/03/2028,22/03/2021,91.975,92.266,3.2251882272416155,0.291000000000011,94.74062272581149,0.2907534246575343,95.03137615046903,2.6199827258114965,87.26006466218186,0.03330412497747555,1.9281512365802715,5.5908674179093225
XS2320759884,VZ 0 ¾ 03/22/32,EUR,85.508,VERIZON COMMUNICATIONS,Communications,2032-03-22,0.75,BBB+,0.000164108,1000000000,Y,2031-12-22,Sr Unsecured,1,FIXED,22/03/2022,22/03/2031,22/03/2021,85.294,85.723,6.223134839151267,0.42900000000000205,90.71116077697337,0.5815068493150686,91.29266762628843,5.203160776973377,96.87034949853033,0.034311141631103485,9.184641260079431,96.04050369044022
XS2320760114,VZ 1 ⅛ 09/19/35,EUR,78.827,VERIZON COMMUNICATIONS,Communications,2035-09-19,1.125,BBB+,0.000164108,750000000,Y,2035-06-19,Sr Unsecured,1,FIXED,19/09/2021,19/09/2034,22/03/2021,78.563,79.091,9.713894592744696,0.5279999999999916,87.80009022317648,0.32054794520547947,88.12063816838196,8.973090223176484,117.14475388485201,0.04049364396889353,6.531068451619787,49.72789354495689
XS2321427408,BAC 0.694 03/22/31,EUR,90.266,BANK OF AMERICA CORP,Financial,2031-03-22,0.694,A+,0.000123703,1500000000,Y,2030-03-22,Sr Unsecured,1,VARIABLE,22/03/2022,22/12/2030,22/03/2021,90.149,90.382,4.470910335386721,0.2330000000000041,93.4763799998806,0.36696438356164385,93.84334438344224,3.210379999880601,79.08873549056037,0.029618049016469875,1.9399805118703555,5.650108952772369
XS2314267449,TELBSS 0 ¾ 03/23/31,EUR,89.929,TELE2 AB,Communications,2031-03-23,0.75,NR,2.20048e-06,300000000,Y,2030-12-23,Sr Unsecured,1,FIXED,23/03/2022,23/03/2030,23/03/2021,89.633,90.225,5.2265571526351815,0.5919999999999987,92.44507386318251,0.5794520547945206,93.02452591797703,2.5160738631825126,53.64148015517782,0.035013011592145565,0.9661714285714287,1.8669744587755104
XS2314657409,PRIFII 0 ¾ 03/23/33,EUR,82.142,PROLOGIS INTL FUND II,Financial,2033-03-23,0.75,A-,0.002987741,500000000,Y,2032-12-23,Sr Unsecured,1,FIXED,23/03/2022,23/03/2032,23/03/2021,81.935,82.35,7.227926078028747,0.41499999999999204,88.9015436233284,0.5794520547945206,89.48099567812291,6.759543623328398,112.17250496080302,0.03389499416013183,2.8541899651460856,10.981609608749297
DE000A3E5FR9,ANNGR 0 ⅝ 03/24/31,EUR,87.12302,VONOVIA SE,Financial,2031-03-24,0.625,BBB+,0.001036135,600000000,Y,2030-12-24,Sr Unsecured,1,FIXED,24/03/2022,24/03/2030,24/03/2021,86.946,87.3,5.229295003422314,0.3539999999999992,91.82849223246802,0.4811643835616438,92.30965661602967,4.705472232468026,101.937731905471,0.0415865663462898,4.615605789792226,26.24029870981438
DE000A3KNP96,TRAGR 0 ¾ 03/24/29,EUR,92.414,TRATON FINANCE LUX SA,"Consumer, Cyclical",2029-03-24,0.75,BBB,0.014312228,1250000000,Y,2028-12-24,Sr Unsecured,1,FIXED,24/03/2022,24/03/2028,24/03/2021,92.295,92.533,3.2306639288158796,0.23799999999999955,95.88958342745565,0.5773972602739725,96.46698068772962,3.4755834274556463,115.15943051006765,0.031200398601911716,4.796903172655574,27.811632310273886
DE000A3KNQA0,TRAGR 1 ¼ 03/24/33,EUR,83.83977,TRATON FINANCE LUX SA,"Consumer, Cyclical",2033-03-24,1.25,BBB,0.014312228,750000000,Y,2032-12-24,Sr Unsecured,1,FIXED,24/03/2022,24/03/2032,24/03/2021,83.623,84.056,7.230663928815879,0.4329999999999927,92.19525911755194,0.9623287671232876,93.15758788467522,8.35548911755194,136.89153448170688,0.03135313509486297,2.861414262842843,11.036762360418267
XS2322253944,OPBANK 0 ¾ 03/24/31,EUR,88.30275,OP CORPORATE BANK PLC,Financial,2031-03-24,0.75,A-,1.29446e-05,300000000,N,,Sr Non Preferred,1,FIXED,24/03/2022,24/03/2030,24/03/2021,88.107,88.499,5.475701574264202,0.3919999999999959,92.01223462654923,0.3924657534246575,92.40470037997389,3.7094846265492265,76.43462514707319,0.03521784185569518,4.74028082515909,27.3039278336871
FI4000496286,NESVFH 0 ¾ 03/25/28,EUR,95.086,NESTE OYJ,Energy,2028-03-25,0.75,,0.000436086,500000000,Y,2027-12-25,Sr Unsecured,1,FIXED,25/03/2022,25/03/2027,25/03/2021,94.994,95.178,2.2313483915126624,0.1839999999999975,97.35807773120084,0.5753424657534246,97.93342019695426,2.272077731200838,106.21780680630758,0.037019107286783384,1.9236551850210837,5.560182957646373
AT0000A2QL75,VIGAV 1 03/26/36,EUR,79.711,VIENNA INSURANCE GRP AGW,Financial,2036-03-26,1.0,NR,4.22664e-06,500000000,Y,2035-12-26,Sr Unsecured,1,FIXED,26/03/2022,26/03/2035,26/03/2021,79.332,80.09,10.234086242299794,0.7580000000000098,85.97662752824112,0.7643835616438356,86.74101108988496,6.265627528241126,77.81885007611945,0.03417712822387683,5.706908638975419,38.418990983687415
DE000A3H3JU7,LEGGR 0 ⅞ 03/30/33,EUR,80.982,LEG IMMOBILIEN SE,Financial,2033-03-30,0.875,NR,0.002113952,700000000,Y,2032-12-30,Sr Unsecured,1,FIXED,30/03/2022,30/03/2032,30/03/2021,80.729,81.234,7.2470910335386725,0.5049999999999955,89.6919137472466,0.6592465753424659,90.35116032258907,8.709913747246603,145.1505089290805,0.031363228594016565,1.9366936541824347,5.630987641797899
XS2324836878,WKLNA 0 ¼ 03/30/28,EUR,94.80817,WOLTERS KLUWER NV,"Consumer, Non-cyclical",2028-03-30,0.25,NR,8.87712e-06,500000000,Y,2027-12-30,Sr Unsecured,1,FIXED,30/03/2022,30/03/2027,30/03/2021,94.679,94.938,2.245037645448323,0.25900000000000034,96.25152366274932,0.18835616438356165,96.43987982713288,1.4433536627493169,67.35397477850265,0.03566325124240638,6.591490339998292,50.49729463385863
XS2325733413,STLA 0 ⅝ 03/30/27,EUR,97.221,STELLANTIS NV,"Consumer, Cyclical",2027-03-30,0.625,BBB,0.024239666,1250000000,Y,2026-12-30,Sr Unsecured,1,FIXED,30/03/2022,30/03/2026,30/03/2021,97.112,97.329,1.2457221081451062,0.21699999999999875,98.41829647951842,0.4708904109589041,98.88918689047732,1.197296479518414,98.21650798183919,0.03070253868007694,3.842791445935424,18.580689907627367
FR0014002PC4,TKOFP 1 ⅝ 03/31/29,EUR,95.04606,TIKEHAU CAPITAL SCA,Financial,2029-03-31,1.625,BBB-,1.06585e-05,500000000,Y,2028-12-31,Sr Unsecured,1,FIXED,31/03/2022,31/03/2028,31/03/2021,94.759,95.333,3.249828884325804,0.5739999999999981,98.57858727855835,1.2198630136986301,99.79845029225697,3.532527278558348,114.23738591393371,0.03295915090216284,4.788472655986977,27.715060722039112
XS2325328313,STBNO 1 ⅞ 09/30/51,EUR,89.87872,STOREBRAND LIVSFORSIKRIN,Financial,2051-09-30,1.875,NR,0.001744408,300000000,Y,2031-03-31,Subordinated,1,VARIABLE,30/09/2021,31/03/2051,31/03/2021,89.599,90.158,5.494866529774128,0.5589999999999975,97.74517642880365,0.9452054794520549,98.6903819082557,7.8664564288036445,159.24410133453415,0.04305539854079803,12.811929272707086,189.2086644689692
XS2326546350,UBS 0 ½ 03/31/31,EUR,88.042,UBS AG LONDON,Financial,2031-03-31,0.5,A+,0.003128996,1000000000,N,,Sr Unsecured,1,FIXED,31/03/2022,31/03/2030,31/03/2021,87.879,88.205,5.494866529774128,0.3259999999999934,90.6977705674358,0.25205479452054796,90.94982536195634,2.6557705674357948,54.69444965647386,0.03584931188635408,4.689484364518601,26.90232144875133
FR0014002QG3,CARDFP 1 ⅝ 04/01/29,EUR,95.739,CARMILA SA,Financial,2029-04-01,1.625,BBB,0.000144503,325000000,Y,2029-01-01,Sr Unsecured,1,FIXED,01/04/2022,01/04/2028,01/04/2021,95.489,95.99,3.252566735112936,0.5009999999999906,98.57577940187723,1.2154109589041096,99.79119036078134,2.836779401877223,91.33004155983554,0.035918847060719634,2.851955292247929,10.955940335331512
XS2325562697,FREGR 0 ⅞ 10/01/31,EUR,88.057,FRESENIUS FIN IRELAND PL,"Consumer, Non-cyclical",2031-10-01,0.875,BBB-,2.02554e-05,500000000,Y,2031-07-01,Sr Unsecured,1,FIXED,01/10/2021,01/10/2030,01/04/2021,87.869,88.245,5.746748802190281,0.3760000000000048,92.21408014374695,0.2205479452054795,92.43462808895244,4.157080143746953,81.98842048546965,0.03680362696276405,3.7903692420811064,18.171672744833955
XS2325565104,FREGR 0 ½ 10/01/28,EUR,93.935,FRESENIUS FIN IRELAND PL,"Consumer, Non-cyclical",2028-10-01,0.5,BBB-,2.02554e-05,500000000,Y,2028-07-01,Sr Unsecured,1,FIXED,01/10/2021,01/10/2027,01/04/2021,93.798,94.072,2.74880219028063,0.2740000000000009,95.98795567361826,0.12602739726027398,96.11398307087853,2.052955673618257,78.93559650728199,0.03445587403964307,6.580593998811066,50.42448058268982
XS2327420977,EOANGR 0.6 10/01/32,EUR,84.945,E.ON SE,Utilities,2032-10-01,0.6,BBB+,0.00010082,750000000,Y,2032-07-01,Sr Unsecured,1,FIXED,01/10/2021,01/10/2031,01/04/2021,84.698,85.191,6.74880219028063,0.4930000000000092,88.84311004676597,0.15123287671232877,88.9943429234783,3.8981100467659786,67.69312112816696,0.03102705876924859,2.8946429224719807,11.210734712122418
XS2327299298,LSELN 0 ¼ 04/06/28,EUR,94.488,LSEG NETHERLANDS BV,Financial,2028-04-06,0.25,A-,3.28737e-06,500000000,Y,2028-02-06,Sr Unsecured,1,FIXED,06/04/2022,06/04/2027,06/04/2021,94.368,94.609,2.349075975359343,0.24099999999999966,96.05959814823707,0.16232876712328767,96.22192691536036,1.5715981482370722,70.28718249631173,0.03229561482375463,1.933707885396096,5.616028912587866
XS2327299884,LSELN 0 ¾ 04/06/33,EUR,82.822,LSEG NETHERLANDS BV,Financial,2033-04-06,0.75,A-,3.28737e-06,500000000,Y,2033-01-06,Sr Unsecured,1,FIXED,06/04/2022,06/04/2032,06/04/2021,82.541,83.104,7.266255989048597,0.5630000000000024,88.82951261861281,0.5506849315068493,89.38019755011966,6.007512618612807,98.81314680814262,0.03793078533290029,0.9634553807740325,1.8564925414848719
XS2328418186,HOLNSW 0 ⅝ 04/06/30,EUR,90.926,HOLCIM FINANCE LUX SA,Industrial,2030-04-06,0.625,BBB+,1.36262e-05,500000000,Y,2030-01-06,Sr Unsecured,1,FIXED,06/04/2022,06/04/2029,06/04/2021,90.788,91.065,4.265571526351814,0.277000000000001,93.55054709979832,0.4589041095890411,94.00945120938736,2.6245470997983205,67.36976074347751,0.037583241656137335,6.579886607591626,50.3172792050084
DE000A3H25P4,DWNIGY 0 ½ 04/07/31,EUR,87.303,DEUTSCHE WOHNEN SE,Financial,2031-04-07,0.5,NR,0.000298165,325700000,Y,2031-01-07,Sr Unsecured,1,FIXED,07/04/2022,07/04/2030,07/04/2021,86.953,87.653,5.2676249144421625,0.7000000000000028,91.14150682767153,0.36575342465753424,91.50726025232908,3.8385068276715373,82.55830954594045,0.03285814024451695,1.9218181989178877,5.567946101437976
DE000A3H25Q2,DWNIGY 1.3 04/07/41,EUR,67.286,DEUTSCHE WOHNEN SE,Financial,2041-04-07,1.3,NR,0.000298165,334300000,Y,2041-01-07,Sr Unsecured,1,FIXED,07/04/2022,07/04/2040,07/04/2021,66.82,67.751,15.268993839835728,0.9310000000000116,81.60941756826519,0.950958904109589,82.56037647237477,14.323417568265185,141.35269014081132,0.04692691012596052,0.9551765174129352,1.824724358834206
XS2314312179,AXASA 1 ⅜ 10/07/41,EUR,90.046,AXA SA,Financial,2041-10-07,1.375,A,6.89119e-06,1000000000,Y,2031-04-07,Subordinated,1,VARIABLE,07/10/2021,07/07/2041,07/04/2021,89.881,90.21,5.514031485284052,0.3289999999999935,95.15980898272427,0.6667808219178082,95.82658980464208,5.113808982724265,103.34748794927853,0.03184344978190901,2.8886332885281933,11.173804824404964
BE6327721237,VGPBB 1 ½ 04/08/29,EUR,94.14957,VGP NV,Financial,2029-04-08,1.5,NR,0.000530973,579900000,Y,2029-01-08,Sr Unsecured,1,FIXED,08/04/2022,08/04/2028,08/04/2021,93.976,94.323,3.271731690622861,0.3469999999999942,98.16448045820664,1.093150684931507,99.25763114313814,4.014910458206643,129.70164335546963,0.03040442579994416,1.9252544806457301,5.590069613938951
XS2328823104,HTHROW 1 ⅛ 10/08/30,EUR,90.654,HEATHROW FUNDING LTD,Industrial,2030-10-08,1.125,BBB+,0.024398591,500000000,Y,2030-07-08,1st lien,1,FIXED,08/10/2022,08/10/2029,08/04/2021,90.496,90.813,4.766598220396989,0.3170000000000073,94.90647448599563,0.261986301369863,95.16846078736549,4.252474485995634,98.22247746428174,0.04039117026636033,1.9186323523568645,5.5288584684184565
XS2329144591,MIZUHO 0.843 04/12/33,EUR,84.054,MIZUHO FINANCIAL GROUP,Financial,2033-04-12,0.843,A,0.000341565,750000000,N,,Sr Unsecured,1,FIXED,12/04/2022,12/04/2032,12/04/2021,83.845,84.262,7.529089664613279,0.4170000000000016,88.97494513474278,0.39724931506849315,89.37219444981127,4.92094513474278,77.808381550214,0.03386429106452026,4.759109289371064,27.472626134575844
XS2332186001,RENEPL 0 ½ 04/16/29,EUR,92.65247,REN FINANCE BV,Utilities,2029-04-16,0.5,BBB,2.07679e-05,300000000,Y,2029-01-16,Sr Unsecured,1,FIXED,16/04/2022,16/04/2028,16/04/2021,92.486,92.819,3.293634496919918,0.3329999999999984,94.98619729755806,0.35342465753424657,95.33962195509231,2.3337272975580703,75.91123034325433,0.03322730052397197,2.8423898030951027,10.925465196681687
FR0014003182,ACAFP 0 ⅜ 04/20/28,EUR,94.556,CREDIT AGRICOLE SA,Financial,2028-04-20,0.375,A-,0.000125365,1000000000,N,,Sr Non Preferred,1,FIXED,20/04/2022,20/04/2027,20/04/2021,94.465,94.647,2.5516769336071183,0.18200000000000216,95.994319040875,0.1684931506849315,96.16281219155994,1.438319040875001,59.28809910699188,0.03425045610246477,4.663167274186326,26.726803226110988
XS2332234413,SGSNVX 0 ⅛ 04/21/27,EUR,96.46597,SGS NEDERLAND HLDG BV,"Consumer, Non-cyclical",2027-04-21,0.125,NR,9.21926e-06,750000000,Y,2027-01-21,Sr Unsecured,1,FIXED,21/04/2022,21/04/2026,21/04/2021,96.371,96.561,1.3059548254620124,0.19000000000001194,97.70454492701886,0.08664383561643836,97.7911887626353,1.2385749270188597,97.63071619079196,0.02510541415255199,0.9755094317072684,1.9032373026996756
XS2333297625,EUROGR 0.741 04/21/33,EUR,81.727,EUROGRID GMBH,Utilities,2033-04-21,0.741,NR,0.009725752,500000000,Y,2033-01-21,Sr Unsecured,1,FIXED,21/04/2022,21/04/2032,21/04/2021,81.56,81.894,7.307323750855578,0.3340000000000032,88.69251980154743,0.5136246575342466,89.20614445908168,6.96551980154743,114.76418902976854,0.035102481900914875,1.922375284011393,5.562082406249057
XS2331921390,ANIMIM 1 ½ 04/22/28,EUR,96.597,ANIMA HOLDING SPA,Financial,2028-04-22,1.5,NR,2.97992e-06,300000000,N,,Sr Unsecured,1,FIXED,22/04/2022,22/04/2027,22/04/2021,96.372,96.822,2.5571526351813825,0.45000000000000284,98.76015293640268,0.6657534246575343,99.42590636106021,2.163152936402682,87.49614268363858,0.03419823483146355,2.885690303185642,11.141703497188496
SK4000018925,TATSK 0 ½ 04/23/28,EUR,95.99524,TATRA BANKA AS,Financial,2028-04-23,0.5,NR,1.14196e-05,300000000,Y,2027-04-23,Sr Preferred,1,VARIABLE,23/04/2022,23/01/2028,23/04/2021,95.73,96.261,1.5578370978781657,0.5309999999999917,97.8333311517138,0.22054794520547946,98.05387909691927,1.8380911517137974,121.78724288713893,0.034960702557355255,6.570371113952707,50.3037208449305
DE000A3E5S00,HOTGR 0 ⅝ 04/26/29,EUR,92.78619,HOCHTIEF AKTIENGESELLSCH,Industrial,2029-04-26,0.625,NR,0.001012461,500000000,Y,2029-01-26,Sr Unsecured,1,FIXED,26/04/2022,26/04/2028,26/04/2021,92.641,92.931,3.3210130047912387,0.28999999999999204,95.32729562762367,0.4246575342465753,95.75195316187025,2.541105627623665,81.89192065758027,0.03972917985877866,12.713772772642505,187.57290035109935
XS2332552541,LOUDRE 1 ⅝ 04/28/28,EUR,97.29318,LOUIS DREYFUS FINANCE BV,"Consumer, Non-cyclical",2028-04-28,1.625,NR,0.009689061,500000000,Y,2028-01-28,Sr Unsecured,1,FIXED,28/04/2022,28/04/2027,28/04/2021,97.17,97.416,2.324435318275154,0.2459999999999951,99.19905895252796,1.0952054794520547,100.29426443198001,1.9058789525279565,84.2330026610905,0.02611589736665271,1.9478507257661086,5.693611559961273
XS2332689681,DNFSDC 0 ⅜ 10/28/28,EUR,93.093,DANFOSS FIN I BV,Industrial,2028-10-28,0.375,BBB,0.007629293,700000000,Y,2028-07-28,Sr Unsecured,1,FIXED,28/10/2021,28/10/2027,28/04/2021,92.938,93.249,2.8227241615331966,0.31099999999999284,95.53099873037043,0.06678082191780821,95.59777955228823,2.437998730370424,91.83490881815054,0.029941328176385226,3.859158422467556,18.69549397475905
XS2332689764,DNFSDC 0 ¾ 04/28/31,EUR,88.058,DANFOSS FIN 2 BV,Industrial,2031-04-28,0.75,BBB,0.007629293,500000000,Y,2031-01-28,Sr Unsecured,1,FIXED,28/04/2022,28/04/2030,28/04/2021,87.874,88.243,5.325119780971937,0.3689999999999998,92.2733527307968,0.5054794520547945,92.7788321828516,4.215352730796795,89.25788547336283,0.036154416556839625,9.185059885783007,95.93743522751852
XS2332590475,NEXIIM 2 ⅛ 04/30/29,EUR,96.633,NEXI SPA,"Consumer, Non-cyclical",2029-04-30,2.125,BB+,0.001578836,1050000000,Y,2029-01-30,Sr Unsecured,2,FIXED,30/10/2021,30/10/2028,29/04/2021,96.351,96.916,3.3319644079397674,0.5649999999999977,100.12331743636003,0.36379076086956524,100.48710819722959,3.49031743636003,109.64545831481149,0.03604129605733509,4.713936469519877,27.087041981606383
XS2337326727,ADRIT 1 ¾ 07/30/31,EUR,92.421,AEROPORTI DI ROMA SPA,Industrial,2031-07-30,1.75,BBB-,0.010770069,500000000,Y,2031-04-30,Sr Unsecured,1,FIXED,30/07/2022,30/07/2030,30/04/2021,92.243,92.598,5.577002053388091,0.355000000000004,97.03426468770866,0.7383561643835617,97.77262085209222,4.61326468770865,90.88066403272289,0.03971453959272406,4.706385707400086,26.966065632703526
XS2338643740,MS 0.406 10/29/27,EUR,97.947,MORGAN STANLEY,Financial,2027-10-29,0.406,A,2.70627e-05,1750000000,Y,2026-10-29,Sr Unsecured,1,VARIABLE,29/10/2021,29/07/2027,30/04/2021,97.897,97.998,1.0759753593429158,0.10099999999999909,98.40097986916392,0.374854794520548,98.77583466368446,0.4539798691639163,42.94852809142912,0.03538562174678299,4.739469957148369,27.294764601782425
XS2338355014,BPPEHX 1 05/04/28,EUR,95.232,BLACKSTONE PP EUR HOLD,Financial,2028-05-04,1.0,NR,0.021241973,550000000,Y,2028-02-04,Sr Unsecured,1,FIXED,04/05/2022,04/05/2027,04/05/2021,95.116,95.347,2.3436002737850785,0.23099999999999454,97.77089246163726,0.6547945205479452,98.42568698218521,2.5388924616372606,112.89578893291437,0.03823242168530281,1.9201795555577983,5.542465408938926
XS2337061670,CCEP 0 ½ 09/06/29,EUR,91.80717,CCEP FINANCE IRELAND DAC,"Consumer, Non-cyclical",2029-09-06,0.5,BBB+,5.8577e-06,700000000,Y,2029-06-06,Sr Unsecured,1,FIXED,06/09/2021,06/09/2028,06/05/2021,91.696,91.918,3.679671457905544,0.2220000000000084,94.19831385904287,0.16027397260273973,94.35858783164561,2.39114385904287,70.30435594314984,0.03157291853533063,1.9375400073033706,5.633506932746288
XS2337061753,CCEP 0 ⅞ 05/06/33,EUR,83.971,CCEP FINANCE IRELAND DAC,"Consumer, Non-cyclical",2033-05-06,0.875,BBB+,5.8577e-06,1000000000,Y,2033-02-06,Sr Unsecured,1,FIXED,06/05/2022,06/05/2032,06/05/2021,83.799,84.143,7.351129363449692,0.3439999999999941,89.50749504366753,0.5681506849315069,90.07564572859904,5.536495043667529,89.45527559291133,0.029929214793635063,4.778159024043961,27.68938263378827
XS2337061837,CCEP 1 ½ 05/06/41,EUR,72.453,CCEP FINANCE IRELAND DAC,"Consumer, Non-cyclical",2041-05-06,1.5,BBB+,5.8577e-06,750000000,Y,2040-11-06,Sr Unsecured,1,FIXED,06/05/2022,06/05/2040,06/05/2021,72.196,72.709,15.099247091033538,0.5130000000000052,84.29612565312377,1.3520547945205479,85.64818044764431,11.843125653123764,113.36583019908021,0.037945113669902844,12.759975284644398,188.67876810414512
XS2338955805,TOYOTA 0 ⅛ 11/05/27,EUR,95.21507,TOYOTA MOTOR CREDIT CORP,"Consumer, Cyclical",2027-11-05,0.125,A+,0.018648239,1000000000,N,,Sr Unsecured,1,FIXED,05/11/2021,05/11/2026,06/05/2021,95.116,95.314,2.0944558521560577,0.1979999999999933,96.27598973066952,0.11301369863013698,96.38900342929966,1.060919730669525,52.90435819970271,0.0363573584002118,2.8649541353711636,11.019671798880777
XS2339398971,KO 0.4 05/06/30,EUR,90.356,COCA-COLA CO/THE,"Consumer, Non-cyclical",2030-05-06,0.4,A+,6.77015e-08,650000000,N,,Sr Unsecured,1,FIXED,06/05/2022,06/05/2029,06/05/2021,90.211,90.501,4.594113620807666,0.29000000000000625,91.99228428069216,0.16219178082191782,92.15447606151407,1.6362842806921662,39.3319469410186,0.02645286487590642,0.9742288557213931,1.8982437266404302
XS2339399359,KO 0.95 05/06/36,EUR,77.961,COCA-COLA CO/THE,"Consumer, Non-cyclical",2036-05-06,0.95,A+,6.77015e-08,500000000,N,,Sr Unsecured,1,FIXED,06/05/2022,06/05/2035,06/05/2021,77.714,78.208,10.595482546201232,0.4939999999999998,84.8986583996981,0.3852054794520548,85.28386387915016,6.937658399698108,84.67795694018044,0.03688026439479891,4.73225737324718,27.213329048138505
XS2342060360,BACR 1.106 05/12/32,EUR,88.754,BARCLAYS PLC,Financial,2032-05-12,1.106,BBB+,0.000347936,1250000000,Y,2031-05-12,Sr Unsecured,1,VARIABLE,12/05/2022,12/05/2031,12/05/2021,88.59,88.919,5.6098562628336754,0.3289999999999935,93.64112153640257,0.43027945205479456,94.07140098845736,4.88712153640256,98.04899120383642,0.036581211307116314,4.7215184737337434,27.13600788625795
FR0014003GX7,NK 1 07/15/31,EUR,86.761,IMERYS SA,Industrial,2031-07-15,1.0,BBB-,0.0010981,300000000,Y,2031-04-15,Sr Unsecured,1,FIXED,15/07/2021,15/07/2030,14/05/2021,86.461,87.06,5.535934291581109,0.5990000000000038,93.19849542073244,0.46301369863013697,93.66150911936258,6.437495420732446,132.3131693604023,0.033358498554028046,2.8880556508994677,11.159921277936657
XS2338570331,EQTSS 0 ⅞ 05/14/31,EUR,87.987,EQT AB,Financial,2031-05-14,0.875,NR,1.27226e-05,500000000,Y,2031-02-14,Sr Unsecured,1,FIXED,14/05/2022,14/05/2030,14/05/2021,87.779,88.195,5.371663244353183,0.4159999999999968,92.81977003581139,0.548972602739726,93.36874263855111,4.832770035811393,101.48643749201527,0.03329111663520376,4.74232612526787,27.35330366164073
XS2342058117,HITTFP 0 ⅝ 09/14/28,EUR,93.9525,ABERTIS FRANCE SAS,"Consumer, Non-cyclical",2028-09-14,0.625,BBB-,0.016819763,600000000,Y,2028-06-14,Sr Unsecured,1,FIXED,14/09/2021,14/09/2027,14/05/2021,93.816,94.089,2.702258726899384,0.27299999999999613,96.38739824985109,0.18664383561643835,96.57404208546752,2.434898249851088,95.11024611981045,0.03011906104827054,0.9707615729218517,1.8847560629234152
AT0000A2RAA0,ERSTBK 0 ⅛ 05/17/28,EUR,94.211,ERSTE GROUP BANK AG,Financial,2028-05-17,0.125,A,0.000194493,500000000,N,,Sr Preferred,1,FIXED,17/05/2022,17/05/2027,17/05/2021,94.075,94.348,2.625598904859685,0.27299999999999613,95.23479016906236,0.046917808219178084,95.28170797728154,1.0237901690623659,41.177691601613084,0.03330446069470856,2.877182947189701,11.104267322863778
DK0030486402,ENXFP 0 ¾ 05/17/31,EUR,89.726,EURONEXT NV,Financial,2031-05-17,0.75,NR,4.25259e-07,600000000,Y,2031-02-17,Sr Unsecured,1,FIXED,17/05/2022,17/05/2030,17/05/2021,89.559,89.892,5.379876796714579,0.3329999999999984,92.17823735362379,0.46438356164383565,92.64262091526763,2.4522373536237865,50.95171205843253,0.03801398709850899,6.472535288727979,49.20880153297808
DK0030486592,ENXFP 1 ½ 05/17/41,EUR,74.11823,EURONEXT NV,Financial,2041-05-17,1.5,NR,4.25259e-07,600000000,Y,2041-02-17,Sr Unsecured,1,FIXED,17/05/2022,17/05/2040,17/05/2021,73.806,74.43,15.381245722108146,0.6240000000000094,83.98559986046133,0.9287671232876713,84.914366983749,9.867369860461338,92.01115045358046,0.03314654035332156,6.662588860910552,51.30723351854828
XS2342227837,SAGAX 1 05/17/29,EUR,92.63473,SAGAX EURO MTN,Financial,2029-05-17,1.0,NR,0.000165974,500000000,Y,2029-02-17,Sr Unsecured,1,FIXED,17/05/2022,17/05/2028,17/05/2021,92.469,92.8,3.381245722108145,0.33100000000000307,96.423361560624,0.6191780821917808,97.04253964281578,3.7886315606239975,119.87638684302655,0.03831686127756136,3.77038901665342,18.026266893321353
XS2343340852,AIB 0 ½ 11/17/27,EUR,97.91,AIB GROUP PLC,Financial,2027-11-17,0.5,BBB+,0.000187645,750000000,Y,2026-11-17,Sr Unsecured,1,VARIABLE,17/11/2021,17/11/2026,17/05/2021,97.845,97.975,1.1279945242984257,0.12999999999999545,98.42828068395987,0.43561643835616437,98.86389712231603,0.5182806839598726,46.77498663684504,0.03476706234134983,4.720525797841868,27.159702889224945
XS2343114687,ERFFP 0 ⅞ 05/19/31,EUR,87.36639,EUROFINS SCIENTIFIC SE,"Consumer, Non-cyclical",2031-05-19,0.875,BBB-,8.83627e-05,750000000,Y,2031-02-19,Sr Unsecured,1,FIXED,19/05/2022,19/05/2030,19/05/2021,87.036,87.697,5.385352498288843,0.6610000000000014,92.79750394402996,0.5369863013698631,93.33449024539982,5.43111394402996,114.18687656063335,0.04219208173161619,0.9595160215941063,1.841341991391563
XS2343822503,VW 0 ⅝ 07/19/29,EUR,91.792,VOLKSWAGEN LEASING GMBH,"Consumer, Cyclical",2029-07-19,0.625,A-,0.013881583,750000000,N,,Sr Unsecured,1,FIXED,19/07/2021,19/07/2028,19/05/2021,91.626,91.958,3.7973990417522243,0.33199999999999363,94.41197376405256,0.1267123287671233,94.53868609281969,2.6199737640525598,74.7247300526411,0.03873593375319388,6.442739107143937,48.8830558949336
XS2343846940,BWA 1 05/19/31,EUR,88.052,BORGWARNER INC,"Consumer, Cyclical",2031-05-19,1.0,BBB,7.49128e-05,1000000000,Y,2031-02-19,Sr Unsecured,1,FIXED,19/05/2022,19/05/2030,19/05/2021,87.823,88.282,5.385352498288843,0.4590000000000032,93.42627092186777,0.6136986301369863,94.03996955200475,5.374270921867762,112.48056838775565,0.03691814784486352,1.9214054040337971,5.55186450991891
XS2343510520,K 0 ½ 05/20/29,EUR,92.03,KELLANOVA,"Consumer, Non-cyclical",2029-05-20,0.5,BBB+,2.94464e-12,300000000,Y,2029-03-20,Sr Unsecured,1,FIXED,20/05/2022,20/05/2028,20/05/2021,91.886,92.173,3.46611909650924,0.28700000000000614,94.63291233047438,0.2671232876712329,94.90003561814562,2.602912330474382,80.91109217233569,0.03476361535309704,2.8694421365564664,11.054021257315286
XS2343850033,MQGAU 0.95 05/21/31,EUR,89.206,MACQUARIE GROUP LTD,Financial,2031-05-21,0.95,A-,0.000126637,705000000,N,,Sr Unsecured,1,FIXED,21/05/2022,21/05/2030,21/05/2021,88.996,89.417,5.634496919917864,0.4210000000000065,92.78787546089056,0.3461643835616438,93.1340398444522,3.581875460890558,71.44434975671261,0.036192160936326864,0.9650719602977668,1.8627277771059485
XS2346206902,AMT 0.45 01/15/27,EUR,97.513,AMERICAN TOWER CORP,Financial,2027-01-15,0.45,BBB,0.000108738,750000000,Y,2026-11-15,Sr Unsecured,1,FIXED,15/01/2022,15/01/2026,21/05/2021,97.439,97.587,1.1225188227241616,0.14800000000001035,98.38085367086477,0.3945205479452055,98.77537421880997,0.8678536708647613,78.88408689401754,0.032467078630009145,4.803559094446913,27.84028192601523
XS2346207892,AMT 0 ⅞ 05/21/29,EUR,93.09839,AMERICAN TOWER CORP,Financial,2029-05-21,0.875,BBB,0.000108738,750000000,Y,2029-02-21,Sr Unsecured,1,FIXED,21/05/2022,21/05/2028,21/05/2021,92.965,93.232,3.3921971252566734,0.2669999999999959,96.00049103421507,0.5321917808219179,96.53268281503699,2.902101034215079,91.3746551853609,0.03186631612285028,2.892268259308953,11.192403504515486
XS2346208197,AMT 1 ¼ 05/21/33,EUR,84.57334,AMERICAN TOWER CORP,Financial,2033-05-21,1.25,BBB,0.000108738,500000000,Y,2033-02-21,Sr Unsecured,1,FIXED,21/05/2022,21/05/2032,21/05/2021,84.351,84.795,7.392197125256674,0.4440000000000026,91.95878266999648,0.7602739726027398,92.71905664259923,7.385442669996479,118.11358242676337,0.03714968346979456,2.8663560839224287,11.021282331168242
XS2343540519,REESM 0 ½ 05/24/33,EUR,82.67,RED ELECTRICA FINANCI SA,Utilities,2033-05-24,0.5,A-,2.7585e-05,600000000,Y,2033-02-24,Sr Unsecured,1,FIXED,24/05/2022,24/05/2032,24/05/2021,82.446,82.894,7.40041067761807,0.4480000000000075,86.89406102980574,0.3,87.19406102980574,4.224061029805739,68.49249510410363,0.032308282158539176,1.9264072130869803,5.587694299867799
XS2345315142,BALDER 1 ⅜ 05/24/30,EUR,91.047,BALDER FINLAND OYJ,Financial,2030-05-24,1.375,NR,0.001221059,500000000,Y,2030-02-24,Sr Unsecured,1,FIXED,24/05/2022,24/05/2029,24/05/2021,90.924,91.171,4.399726214921286,0.2469999999999999,96.43029444985248,0.825,97.25529444985249,5.383294449852485,133.59459459244584,0.031972865426239075,4.76824847030943,27.576505786778522
XS2345798271,BAC 1.102 05/24/32,EUR,89.271,BANK OF AMERICA CORP,Financial,2032-05-24,1.102,A+,0.000123703,1500000000,Y,2031-05-24,Sr Unsecured,1,VARIABLE,24/05/2022,24/02/2032,24/05/2021,89.123,89.42,5.642710472279261,0.29699999999999704,93.57380252124784,0.3924931506849315,93.96629567193277,4.302802521247841,85.6134697228222,0.03519883034929951,4.728222086234608,27.211468262573085
XS2345799089,BAC 0.583 08/24/28,EUR,96.511,BANK OF AMERICA CORP,Financial,2028-08-24,0.583,A+,0.000123703,1000000000,Y,2027-08-24,Sr Unsecured,1,VARIABLE,24/08/2021,24/05/2028,24/05/2021,96.438,96.584,1.894592744695414,0.1460000000000008,97.49624325422263,0.0606958904109589,97.55693914463359,0.9852432542226381,53.706369874206565,0.03340774092037203,3.789180780723848,18.203398908316093
FR0014003MI6,URWFP 1 ⅜ 05/25/33,EUR,84.933,UNIBAIL-RODAMCO-WESTFLD,Financial,2033-05-25,1.375,BBB,0.008889247,600000000,Y,2033-02-25,Sr Unsecured,1,FIXED,25/05/2022,25/05/2032,25/05/2021,84.688,85.177,7.403148528405202,0.4890000000000043,92.78523337839731,0.8212328767123287,93.60646625510964,7.852233378397301,125.07412731558018,0.03559231274123207,6.5402166305717975,49.97523792923749
FR0014003MJ4,URWFP 0 ¾ 10/25/28,EUR,94.42686,UNIBAIL-RODAMCO-WESTFLD,Financial,2028-10-25,0.75,BBB,0.008889247,650000000,Y,2028-07-25,Sr Unsecured,1,FIXED,25/10/2021,25/10/2027,25/05/2021,94.296,94.557,2.8145106091718,0.2609999999999957,96.56099532302964,0.13972602739726028,96.7007213504269,2.134135323029639,79.88830396452391,0.028234283054841196,2.898881495971596,11.252934191525883
XS2345996743,ERICB 1 05/26/29,EUR,93.059,TELEFONAKTIEBOLAGET LM E,Communications,2029-05-26,1.0,BB+,2.87208e-06,500000000,Y,2029-02-26,Sr Unsecured,1,FIXED,26/05/2022,26/05/2028,26/05/2021,92.89,93.228,3.405886379192334,0.33799999999999386,96.38421987427387,0.5945205479452055,96.97874042221908,3.32521987427387,104.24807671019472,0.030327578350463416,0.9705651105651103,1.8839932676925295
XS2346253730,CABKSM 0 ¾ 05/26/28,EUR,97.231,CAIXABANK SA,Financial,2028-05-26,0.75,BBB+,0.000118254,1000000000,Y,2027-05-26,Sr Non Preferred,1,VARIABLE,26/05/2022,28/02/2028,26/05/2021,97.149,97.314,1.648186173853525,0.16499999999999204,98.10287941728943,0.263013698630137,98.36589311591956,0.8718794172894349,54.22914982040661,0.028070716306700914,1.9332005193215405,5.629389610552068
FR0014003N69,AIFP 0 ⅜ 05/27/31,EUR,86.94055,AIR LIQUIDE FINANCE,Basic Materials,2031-05-27,0.375,A,0.010105715,500000000,Y,2031-02-27,Sr Unsecured,1,FIXED,27/05/2022,27/05/2030,27/05/2021,86.759,87.122,5.4072553045859,0.36299999999999955,90.23730861890053,0.2219178082191781,90.4592264271197,3.296758618900526,69.39181900052348,0.03076026397962636,2.899124022321367,11.23582314558415
XS2346225878,MET 0 ½ 05/25/29,EUR,92.42775,MET LIFE GLOB FUNDING I,Financial,2029-05-25,0.5,AA-,0.011569751,600000000,N,,Secured,1,FIXED,25/05/2022,25/05/2028,27/05/2021,92.278,92.578,3.646817248459959,0.29999999999999716,94.2649747940719,0.17671232876712328,94.44168712283903,1.8372247940719006,54.29682172919783,0.03232975915811664,1.9361186093318743,5.625246142472922
XS2345877497,VVOYHT 0 ⅞ 05/28/29,EUR,92.076,KOJAMO OYJ,Financial,2029-05-28,0.875,NR,0.000833013,550000000,Y,2029-02-28,Sr Unsecured,1,FIXED,28/05/2022,28/05/2028,28/05/2021,91.873,92.279,3.4113620807665983,0.4059999999999917,95.96786101298378,0.5154109589041097,96.48327197188789,3.8918610129837816,122.55509009620353,0.031603649038120095,1.9241726791254847,5.581563845277688
XS2347284742,TEFP 1 ⅛ 05/28/28,EUR,95.984,TECHNIP ENERGIES NV,Industrial,2028-05-28,1.125,NR,1.71574e-05,600000000,Y,2028-02-28,Sr Unsecured,1,FIXED,28/05/2022,28/05/2027,28/05/2021,95.781,96.187,2.409308692676249,0.4059999999999917,97.987625967689,0.6626712328767124,98.65029720056572,2.003625967689004,86.32545052231775,0.04542960946476076,0.9565445544554455,1.829954969316733
BE0002799808,KBCBB 0 ¾ 05/31/31,EUR,88.855,KBC GROUP NV,Financial,2031-05-31,0.75,A-,5.40632e-05,700000000,N,,Sr Unsecured,1,FIXED,31/05/2022,31/05/2030,31/05/2021,88.68,89.03,5.661875427789186,0.3499999999999943,91.69147309277713,0.25273972602739725,91.94421281880453,2.8364730927771262,56.491592071854924,0.03888814508903271,0.9625675340768278,1.85307251531749
FR0014003S72,MWDP 1 06/01/31,EUR,88.629,WENDEL SE,Financial,2031-06-01,1.0,NR,6.01261e-05,300000000,Y,2031-03-01,Sr Unsecured,1,FIXED,01/06/2022,01/06/2030,01/06/2021,88.355,88.903,5.412731006160164,0.5480000000000018,93.38469717305694,0.5863013698630137,93.97099854291994,4.75569717305693,98.74218791288665,0.0341669891621017,1.9265363540326448,5.581518096270314
XS2347367018,MRLSM 1 ⅜ 06/01/30,EUR,92.75218,MERLIN PROPERTIES SOCIMI,Financial,2030-06-01,1.375,NR,3.63482e-05,500000000,Y,2030-03-01,Sr Unsecured,1,FIXED,01/06/2022,01/06/2029,01/06/2021,92.578,92.926,4.413415468856948,0.347999999999999,96.41506303798486,0.8061643835616439,97.22122742154652,3.6628830379848694,89.7915138627409,0.028145288000450998,2.9102933081725246,11.312710625105236
XS2348638433,ABNANV 1 06/02/33,EUR,84.386,ABN AMRO BANK NV,Financial,2033-06-02,1.0,BBB+,7.92244e-05,1000000000,N,,Sr Non Preferred,1,FIXED,02/06/2022,02/06/2032,02/06/2021,84.16,84.611,7.668720054757015,0.4510000000000076,89.81925481897201,0.3315068493150685,90.15076166828707,5.433254818972017,84.29672823462847,0.03661635563795699,13.390676164472795,201.54609917560083
FR0014003SA0,BFCM 0 ⅝ 11/03/28,EUR,93.76033,BANQUE FED CRED MUTUEL,Financial,2028-11-03,0.625,A-,1.08678e-05,1500000000,N,,Sr Non Preferred,1,FIXED,03/11/2021,03/11/2027,03/06/2021,93.632,93.889,3.0910335386721424,0.2569999999999908,95.77471781897567,0.5684931506849316,96.3432109696606,2.0143878189756776,69.17876725941348,0.03228876354068755,7.561310401687521,65.39264422880578
XS2344772426,HMSOLN 1 ¾ 06/03/27,EUR,98.755,HAMMERSON IRELAND,Financial,2027-06-03,1.75,BBB+,0.000812072,700000000,Y,2027-03-03,Sr Unsecured,1,FIXED,03/06/2022,03/06/2026,03/06/2021,98.612,98.899,1.4182067077344285,0.28700000000000614,99.75970318013624,1.0164383561643835,100.77614153630063,1.0047031801362465,71.47252046796969,0.033249585875155245,1.9282533991776236,5.591459148807864
XS2345035963,WAB 1 ¼ 12/03/27,EUR,97.01224,WABTEC TRANSPORTATION,Industrial,2027-12-03,1.25,BBB,7.76403e-06,500000000,Y,2027-10-03,Sr Unsecured,1,FIXED,03/12/2021,03/12/2026,03/06/2021,96.891,97.133,2.004106776180698,0.24199999999999022,98.64619007558038,1.2431506849315068,99.88934076051189,1.6339500755803726,83.80856579624826,0.039601080000316286,4.6711202743378575,26.697932974452282
XS2347663507,AZN 0 ⅜ 06/03/29,EUR,92.371,ASTRAZENECA PLC,"Consumer, Non-cyclical",2029-06-03,0.375,A+,1.9238e-05,800000000,Y,2029-03-03,Sr Unsecured,1,FIXED,03/06/2022,03/06/2028,03/06/2021,92.235,92.506,3.4195756331279945,0.2710000000000008,94.31943047134317,0.21780821917808219,94.53723869052125,1.9484304713431726,61.280044622280506,0.04184463224000277,0.9598360149439602,1.8425703511670044
XS2348030425,NOVOB 0 ⅛ 06/04/28,EUR,94.073,NOVO NORDISK FINANCE NL,"Consumer, Non-cyclical",2028-06-04,0.125,AA-,0.030358286,650000000,Y,2028-03-04,Sr Unsecured,1,FIXED,04/06/2022,04/06/2027,04/06/2021,93.99,94.155,2.42299794661191,0.16500000000000625,95.6303158119809,0.07226027397260273,95.70257608595351,1.5573158119809136,67.77318766037442,0.040161630452483374,2.8652836012746308,10.994560988730964
XS2348237871,CLNXSM 1 ½ 06/08/28,EUR,96.83031,CELLNEX FINANCE CO SA,Industrial,2028-06-08,1.5,BBB-,0.013805613,1000000000,Y,2028-03-08,Sr Unsecured,1,FIXED,08/06/2022,08/06/2027,08/06/2021,96.731,96.93,2.433949349760438,0.19900000000001228,98.84120436544549,0.8506849315068493,99.69188929695234,2.0108943654454947,85.23424264428728,0.039287693860856024,6.513681286075963,49.58868384357085
XS2348241048,RABKAS 1 06/09/28,EUR,96.611,RAIFFEISENBANK AS,Financial,2028-06-09,1.0,NR,,350000000,Y,2027-06-09,Sr Non Preferred,1,VARIABLE,09/06/2022,09/03/2028,09/06/2021,96.347,96.874,1.6865160848733745,0.527000000000001,98.4669330885818,0.31232876712328766,98.77926185570509,1.8559330885817928,113.06131246868172,0.045672384325519004,12.55893899730279,183.89912951653866
XS2350756446,INTNED 0 ⅞ 06/09/32,EUR,97.099,ING GROEP NV,Financial,2032-06-09,0.875,BBB,8.33832e-05,500000000,Y,2027-03-09,Subordinated,1,VARIABLE,09/06/2022,09/06/2031,09/06/2021,96.983,97.214,1.434633812457221,0.23099999999999454,98.53175406866228,0.4938356164383562,99.02558968510064,1.4327540686622768,102.1454212404631,0.03663197935923151,0.9646625030978934,1.8611474897661862
XS2351220814,DANBNK 0 ¾ 06/09/29,EUR,94.928,DANSKE BANK A/S,Financial,2029-06-09,0.75,A-,0.000122718,500000000,Y,2028-06-09,Sr Non Preferred,1,VARIABLE,09/06/2022,09/06/2028,09/06/2021,94.848,95.009,2.6885694729637235,0.16100000000000136,96.7314022841346,0.23424657534246573,96.96564885947707,1.8034022841346058,70.3790794103227,0.033319867775824144,1.931787470130224,5.604886703710591
XS2350632472,NESNVX 0 ¼ 06/14/29,EUR,92.72,NESTLE FINANCE INTL LTD,"Consumer, Non-cyclical",2029-06-14,0.25,AA-,0.016977096,750000000,Y,2029-03-14,Sr Unsecured,1,FIXED,14/06/2022,14/06/2028,14/06/2021,92.615,92.824,3.4496919917864477,0.20900000000000318,93.84235690137315,0.13767123287671232,93.98002813424986,1.122356901373152,34.96259375189456,0.038617585451743444,6.49307454400069,49.3995816270423
XS2350744434,NESNVX 0 ⅞ 06/14/41,EUR,68.271,NESTLE FINANCE INTL LTD,"Consumer, Non-cyclical",2041-06-14,0.875,AA-,0.016977096,650000000,Y,2040-12-14,Sr Unsecured,1,FIXED,14/06/2022,14/06/2040,14/06/2021,67.978,68.565,15.203285420944558,0.5870000000000033,76.39755249456837,0.6976027397260275,77.0951552342944,8.126552494568372,79.86023202683272,0.03160739873424192,2.893000450508785,11.198054049729299
XS2350746215,NESNVX 0 ⅝ 02/14/34,EUR,81.89679,NESTLE FINANCE INTL LTD,"Consumer, Non-cyclical",2034-02-14,0.625,AA-,0.016977096,500000000,Y,2033-11-14,Sr Unsecured,1,FIXED,14/02/2022,14/02/2033,14/06/2021,81.704,82.09,8.120465434633813,0.3860000000000099,86.32751047434344,0.5496575342465754,86.87716800859002,4.430720474343445,66.46859995835796,0.038529859587734534,1.9124241273722509,5.511538479540326
XS2351301499,AXACOR 0 ¾ 06/14/28,EUR,95.096,ACEF HOLDING SCA,Financial,2028-06-14,0.75,NR,0.000632394,500000000,Y,2028-03-14,Sr Unsecured,1,FIXED,14/06/2022,14/06/2027,14/06/2021,94.92,95.272,2.4503764544832305,0.35200000000000387,97.05567044026135,0.4130136986301369,97.46868413889149,1.9596704402613483,83.61284031314085,0.033319092938051534,1.9295828615155504,5.59635541556449
BE6328904428,ECLEAR 1 ⅜ 06/16/51,EUR,88.47865,EUROCLEAR HOLDING NV,Financial,2051-06-16,1.375,A,0.001962336,350000000,Y,2031-03-16,Jr Subordinated,1,VARIABLE,16/06/2022,16/06/2050,16/06/2021,88.131,88.826,5.453798767967146,0.6949999999999932,95.23113784390448,0.7496575342465753,95.98079537815106,6.7524878439044755,139.08387019532572,0.033866651508056476,2.8792434171171744,11.110871451786073
DE000A3E5MG8,ANNGR 0 ⅜ 06/16/27,EUR,96.34354,VONOVIA SE,Financial,2027-06-16,0.375,BBB+,0.001036135,1000000000,Y,2027-03-16,Sr Unsecured,1,FIXED,16/06/2022,16/06/2026,16/06/2021,96.283,96.404,1.4537987679671458,0.12099999999999511,97.80307820637896,0.20445205479452055,98.00753026117347,1.4595382063789515,103.40652362517082,0.047305321726133095,6.405020353531105,48.24261337781182
DE000A3E5MH6,ANNGR 0 ⅝ 12/14/29,EUR,90.5921,VONOVIA SE,Financial,2029-12-14,0.625,BBB+,0.001036135,1000000000,Y,2029-09-14,Sr Unsecured,1,FIXED,14/12/2021,14/12/2028,16/06/2021,90.407,90.777,3.9534565366187544,0.37000000000000455,94.11548997745143,0.029109589041095892,94.14459956649253,3.52338997745143,97.3774234370375,0.04436523273876556,5.431431148083045,35.72401847972873
DE000A3E5MJ2,ANNGR 1 06/16/33,EUR,82.375,VONOVIA SE,Financial,2033-06-16,1.0,BBB+,0.001036135,1000000000,Y,2033-03-16,Sr Unsecured,1,FIXED,16/06/2022,16/06/2032,16/06/2021,82.116,82.635,7.455167693360712,0.5190000000000055,90.17155837704874,0.5452054794520548,90.71676385650079,7.79655837704874,125.545395293599,0.045313360273417584,0.9566509316770188,1.8303620101570166
DE000A3E5MK0,ANNGR 1 ½ 06/14/41,EUR,67.211,VONOVIA SE,Financial,2041-06-14,1.5,BBB+,0.001036135,500000000,Y,2041-03-14,Sr Unsecured,1,FIXED,14/06/2022,14/06/2040,16/06/2021,66.956,67.465,15.449691991786448,0.5090000000000003,83.91083783423454,0.8260273972602739,84.73686523149482,16.699837834234543,163.44253543919703,0.0345242233570017,2.8629538916444486,11.022315796158615
XS2353366268,SABSM 0 ⅞ 06/16/28,EUR,97.31033,BANCO DE SABADELL SA,Financial,2028-06-16,0.875,BBB,0.000318274,500000000,Y,2027-06-16,Sr Non Preferred,1,VARIABLE,16/06/2022,16/06/2027,16/06/2021,97.245,97.376,1.7056810403832992,0.13100000000000023,98.24059186928628,0.25650684931506856,98.49709871860135,0.9302618692862836,55.883991191457866,0.033308897074643906,1.9318080193918632,5.605005871532035
XS2354246816,OPBANK 0 ⅜ 06/16/28,EUR,94.369,OP CORPORATE BANK PLC,Financial,2028-06-16,0.375,A-,1.29446e-05,500000000,N,,Sr Non Preferred,1,FIXED,16/06/2022,16/06/2027,16/06/2021,94.276,94.462,2.707734428473648,0.18600000000000705,95.72715006428247,0.10993150684931507,95.83708157113179,1.3581500642824693,52.901291654570024,0.03249748123969144,2.8831107088105483,11.140606144446112
XS2354444379,JDEPNA 1 ⅛ 06/16/33,EUR,83.48958,JDE PEET'S NV,"Consumer, Non-cyclical",2033-06-16,1.125,BBB-,3.16277e-05,500000000,Y,2033-03-16,Sr Unsecured,1,FIXED,16/06/2022,16/06/2032,16/06/2021,83.254,83.725,7.455167693360712,0.4709999999999894,91.01928948212137,0.6133561643835617,91.63264564650493,7.529709482121362,120.3635203755123,0.04158093984034246,0.9600790123456789,1.8435034198933087
XS2354569407,JDEPNA 0 ½ 01/16/29,EUR,92.497,JDE PEET'S NV,"Consumer, Non-cyclical",2029-01-16,0.5,BBB-,3.16277e-05,750000000,Y,2028-10-16,Sr Unsecured,1,FIXED,16/01/2022,16/01/2028,16/06/2021,92.36,92.633,3.0417522245037647,0.27299999999999613,95.50576008943813,0.4794520547945205,95.98521214423265,3.008760089438127,105.71645583207471,0.03419957997725624,1.9264754119184782,5.581165426635198
XS2353473692,RBIAV 1 ⅜ 06/17/33,EUR,95.31642,RAIFFEISEN BANK INTL,Financial,2033-06-17,1.375,NR,0.001639958,500000000,Y,2028-03-17,Subordinated,1,VARIABLE,17/06/2022,17/06/2032,17/06/2021,95.121,95.512,2.458590006844627,0.39100000000000534,98.52819822881378,0.7458904109589041,99.27408863977269,3.2117782288137846,135.96567397503225,0.033330943619532226,2.8918647360147385,11.179752565067178
XS2353478063,EQH 0.6 06/16/28,EUR,94.79761,EQUITABLE FINANCIAL LIFE,Financial,2028-06-16,0.6,A+,0.000267114,500000000,N,,Secured,1,FIXED,16/06/2022,16/06/2027,17/06/2021,94.675,94.92,2.707734428473648,0.24500000000000455,96.31411438200277,0.17589041095890412,96.49000479296167,1.5165043820027648,58.86459842842036,0.03487832394841008,1.9264228374700878,5.578527318645089
XS2356040357,STLA 0 ¾ 01/18/29,EUR,92.597,STELLANTIS NV,"Consumer, Cyclical",2029-01-18,0.75,BBB,0.024239666,1250000000,Y,2028-10-18,Sr Unsecured,1,FIXED,18/01/2022,18/01/2028,18/06/2021,92.444,92.75,3.047227926078029,0.3059999999999974,96.22629573786598,0.7150684931506849,96.94136423101666,3.629295737865988,127.071691100604,0.034095438789959936,1.9315701109563679,5.601246040134642
XS2356041165,STLA 1 ¼ 06/20/33,EUR,79.66218,STELLANTIS NV,"Consumer, Cyclical",2033-06-20,1.25,BBB,0.024239666,1250000000,Y,2033-03-20,Sr Unsecured,1,FIXED,20/06/2022,20/06/2032,18/06/2021,79.392,79.932,7.4661190965092405,0.5400000000000063,91.85112190888341,0.6678082191780822,92.5189301280615,12.188941908883407,199.13425259800275,0.036461279747729725,7.4912772433518064,64.41493553381696
FR0014003XZ7,MACIFS 2 ⅛ 06/21/52,EUR,88.053,MUTUELLE ASSURANCE,Financial,2052-06-21,2.125,NR,0.001751634,850000000,Y,2032-03-21,Subordinated,1,VARIABLE,21/06/2022,21/03/2052,21/06/2021,87.821,88.285,6.469541409993155,0.46399999999999864,98.46214299115502,1.1294520547945206,99.59159504594955,10.409142991155022,183.11306671620048,0.038482853053737824,4.736925712249888,27.221323148101106
FR0014003Y09,MACIFS 0 ⅝ 06/21/27,EUR,96.263,MUTUELLE ASSURANCE,Financial,2027-06-21,0.625,NR,0.001751634,500000000,Y,2027-03-21,Subordinated,1,FIXED,21/06/2022,21/06/2026,21/06/2021,96.158,96.369,1.4674880219028064,0.21099999999999852,98.14067411157909,0.3321917808219178,98.472865892401,1.8776741115790827,131.66850089498232,0.038131141765270875,9.19584202532462,95.97096330607353
XS2356030556,CTPNV 1 ¼ 06/21/29,EUR,93.824,CTP NV,Financial,2029-06-21,1.25,BBB-,0.000240028,500000000,Y,2029-03-21,Sr Unsecured,1,FIXED,21/06/2022,21/06/2028,21/06/2021,93.648,94.001,3.468856947296372,0.35300000000000864,97.11284022696798,0.6643835616438356,97.7772237886118,3.2888402269679773,100.77239011706199,0.037158425589713794,5.530280729016214,36.76564168136562
XS2356049069,SEB 0 ⅜ 06/21/28,EUR,94.371,SKANDINAVISKA ENSKILDA,Financial,2028-06-21,0.375,A,5.4877e-05,1000000000,N,,Sr Non Preferred,1,FIXED,21/06/2022,21/06/2027,21/06/2021,94.295,94.447,2.7214236824093088,0.15200000000000102,95.70376729338943,0.10479452054794522,95.80856181393737,1.3327672933894377,51.65890842642998,0.034153891019389614,4.770156036118126,27.552629192007604
ES0239140025,COLSM 0 ¾ 06/22/29,EUR,92.963,INMOBILIARIA COLONIAL SO,Financial,2029-06-22,0.75,NR,0.000362068,625000000,Y,2029-03-22,Sr Unsecured,1,FIXED,22/06/2022,22/06/2028,22/06/2021,92.811,93.115,3.4715947980835042,0.30399999999998784,95.45086576199165,0.39657534246575343,95.8474411044574,2.4878657619916567,76.72833703470772,0.0348620257733625,1.9276751441179993,5.58342624198304
ES0213679OF4,BKTSM 1 ¼ 12/23/32,EUR,97.208,BANKINTER SA,Financial,2032-12-23,1.25,BBB,6.59992e-05,750000000,Y,2027-06-23,Subordinated,1,VARIABLE,23/12/2021,23/12/2031,23/06/2021,97.094,97.322,1.7248459958932238,0.22800000000000864,98.8494993308023,0.3424657534246575,99.19196508422696,1.6414993308023043,97.38420530377465,0.03429322207900029,1.9258157308442636,5.5782781702828625
XS2349343090,AREIT 0 ¾ 06/23/28,EUR,94.92204,ASCENDAS REIT,Financial,2028-06-23,0.75,NR,4.29611e-06,300000000,Y,2028-03-23,Sr Unsecured,1,FIXED,23/06/2022,23/06/2027,23/06/2021,94.456,95.389,2.4750171115674195,0.9329999999999927,97.02201434994485,0.3945205479452054,97.41653489789006,2.0999743499448584,88.81223398292258,0.03677804831836104,6.5836385051483335,50.3813265684989
XS2357205587,TRNIM 0 ⅜ 06/23/29,EUR,91.686,TERNA RETE ELETTRICA,Utilities,2029-06-23,0.375,BBB+,2.09814e-05,600000000,Y,2029-03-23,Sr Unsecured,1,FIXED,23/06/2022,23/06/2028,23/06/2021,91.543,91.829,3.4743326488706368,0.28599999999998715,94.20126079732397,0.1972602739726027,94.39852107129657,2.515260797323961,78.20819530114746,0.05109961190168169,0.9513846153846154,1.8102653727810647
XS2357417257,SANTAN 0 ⅝ 06/24/29,EUR,94.56054,BANCO SANTANDER SA,Financial,2029-06-24,0.625,A-,0.000140759,1000000000,Y,2028-06-24,Sr Non Preferred,1,VARIABLE,24/06/2022,24/06/2028,24/06/2021,94.46,94.661,2.729637234770705,0.20100000000000762,96.34708386986192,0.1695205479452055,96.51660441780713,1.7865438698619158,68.88432410161181,0.038148669094211114,1.9191192666237538,5.5386775428285775
FR0014004750,BFCM 0 ¼ 06/29/28,EUR,93.99,BANQUE FED CRED MUTUEL,Financial,2028-06-29,0.25,A+,1.08678e-05,750000000,N,,Sr Preferred,1,FIXED,29/06/2022,29/06/2027,29/06/2021,93.907,94.073,2.7433264887063653,0.16599999999999682,95.33608902384867,0.06438356164383562,95.40047258549251,1.346089023848677,51.91084775211781,0.04120145820134386,0.9604289276807981,1.844847450252176
FR0014004A06,ORAFP 0 ¾ 06/29/34,EUR,80.213,ORANGE SA,Communications,2034-06-29,0.75,BBB+,2.14239e-05,800000000,Y,2034-03-29,Sr Unsecured,1,FIXED,29/06/2022,29/06/2033,29/06/2021,79.962,80.463,8.490075290896646,0.5009999999999906,86.5473585218436,0.38219178082191785,86.92955030266552,6.334358521843612,92.31528895363401,0.03175016069760949,5.7363473579971025,38.743742539840326
DE000A3E5VK1,LEGGR 0 ¾ 06/30/31,EUR,86.148,LEG IMMOBILIEN SE,Financial,2031-06-30,0.75,NR,0.002113952,700000000,Y,2031-03-30,Sr Unsecured,1,FIXED,30/06/2022,30/06/2030,30/06/2021,85.961,86.334,5.492128678986996,0.37300000000000466,91.98384666688469,0.3801369863013699,92.36398365318605,5.835846666884692,121.40888389502642,0.035557640408109874,1.9283447926452744,5.583515934931992
FR00140049A8,GFCFP 0 ⅞ 06/30/36,EUR,75.946,GECINA,Financial,2036-06-30,0.875,A-,0.000165878,600000000,Y,2036-03-30,Sr Unsecured,1,FIXED,30/06/2022,30/06/2035,30/06/2021,75.642,76.249,10.494182067077345,0.6069999999999993,84.38547552049559,0.4434931506849316,84.82896867118052,8.439475520495591,105.24793766619592,0.0354729117142513,2.859195425169368,10.996295293359381
XS2357754097,ASSGEN 1.713 06/30/32,EUR,89.403,GENERALI,Financial,2032-06-30,1.713,BBB+,6.64834e-07,500000000,Y,2031-12-30,Subordinated,1,FIXED,30/06/2022,30/06/2031,30/06/2021,89.167,89.64,6.245037645448323,0.472999999999999,96.23029379604621,1.2906164383561642,97.52091023440238,6.827293796046206,123.32113909995923,0.04278436969362345,0.958971028971029,1.8392508688115086
XS2358231798,SRGIM 0 ⅝ 06/30/31,EUR,87.371,SNAM SPA,Utilities,2031-06-30,0.625,BBB+,2.41679e-05,500000000,Y,2031-03-30,Sr Unsecured,1,FIXED,30/06/2022,30/06/2030,30/06/2021,87.212,87.529,5.492128678986996,0.31699999999999307,91.3434713158226,0.3167808219178082,91.6602521377404,3.9724713158226024,82.11273107617043,0.040233972199487385,6.3176013074836055,47.564799620692874
XS2358471246,YBS 0 ½ 07/01/28,EUR,94.326,YORKSHIRE BUILDING SOC,Financial,2028-07-01,0.5,A,8.82047e-06,600000000,N,,Sr Preferred,1,FIXED,01/07/2022,01/07/2027,01/07/2021,94.215,94.437,2.74880219028063,0.2219999999999942,95.98795567361826,0.12602739726027398,96.11398307087853,1.661955673618266,63.76932542731093,0.03441312863134453,4.7320396822299235,27.254490597934854
XS2360310044,UCGIM 0.8 07/05/29,EUR,95.0,UNICREDIT SPA,Financial,2029-07-05,0.8,BBB+,0.000322889,1000000000,Y,2028-07-05,Sr Preferred,1,VARIABLE,05/07/2022,05/04/2029,05/07/2021,94.902,95.098,2.759753593429158,0.19599999999999795,96.76788335211891,0.19287671232876713,96.96076006444768,1.7678833521189148,67.22594615271076,0.02886899837139063,2.819239177119695,10.835962664267283
XS2360881549,DSVDC 0 ¾ 07/05/33,EUR,82.216,DSV FINANCE BV,Industrial,2033-07-05,0.75,A-,0.000214373,600000000,Y,2033-04-05,Sr Unsecured,1,FIXED,05/07/2022,05/07/2032,05/07/2021,81.992,82.44,7.509924709103354,0.4479999999999933,88.37420522433082,0.36780821917808215,88.74201344350891,6.158205224330828,98.72457236761942,0.033743219800094405,2.872322804603423,11.076097089182335
AT0000A2RZL4,ERSTEI 0 ¾ 07/06/28,EUR,95.852,ERSTE&STEIERMAR BANK DD,Financial,2028-07-06,0.75,NR,6.68761e-06,400000000,Y,2027-07-06,Sr Preferred,1,VARIABLE,06/07/2022,06/04/2028,06/07/2021,95.597,96.107,1.7604380561259412,0.5100000000000051,97.96644675425789,0.17876712328767122,98.14521387754556,2.1144467542578838,124.16592425280241,0.046325711658236915,0.9557253433208488,1.8268218637315088
FR0014004EF7,CCAMA 0 ¾ 07/07/28,EUR,94.204,CAISSE NAT REASSURANCE,Financial,2028-07-07,0.75,NR,0.001619129,500000000,Y,2028-04-07,Subordinated,1,FIXED,07/07/2022,07/07/2027,07/07/2021,94.055,94.352,2.516084873374401,0.29699999999999704,96.96597821514692,0.36369863013698633,97.3296768452839,2.761978215146925,115.39180640874474,0.033757243380484046,3.8386592423698884,18.517554890998355
FR0014004GE5,SOCGEN 0 ¼ 07/08/27,EUR,96.283,SOCIETE GENERALE,Financial,2027-07-08,0.25,A,0.00033915,1000000000,N,,Sr Preferred,1,FIXED,08/07/2022,08/07/2026,08/07/2021,96.198,96.368,1.7659137577002053,0.1700000000000017,97.1001844855578,0.05821917808219178,97.15840366364,0.817184485557803,47.86640496744563,0.03751843300541035,6.546964201188473,49.983431838884464
FR0014004FR9,DGFP 0 ½ 01/09/32,EUR,85.59261,VINCI SA,Industrial,2032-01-09,0.5,A-,4.03887e-05,750000000,Y,2031-10-09,Sr Unsecured,1,FIXED,09/01/2022,09/01/2031,09/07/2021,85.435,85.75,6.020533880903491,0.3149999999999977,89.68186598139322,0.48904109589041095,90.17090707728363,4.089255981393222,78.52671998950524,0.03712885973573449,1.9226977155735383,5.556098576008284
XS2363117321,HNDA 0.3 07/07/28,EUR,93.82001,AMERICAN HONDA FINANCE,"Consumer, Cyclical",2028-07-07,0.3,A-,0.018898578,1150000000,N,,Sr Unsecured,1,FIXED,07/07/2022,07/07/2027,09/07/2021,93.715,93.925,2.7652292950034223,0.20999999999999375,95.42928145367537,0.07068493150684932,95.49996638518222,1.609271453675376,61.623109894190165,0.03327408696247706,3.848043921848586,18.583705141236816
XS2360853332,PRXNA 1.288 07/13/29,EUR,93.676,PROSUS NV,Communications,2029-07-13,1.288,BBB,1.50291e-05,1000000000,Y,2029-04-13,Sr Unsecured,1,FIXED,13/07/2022,13/07/2028,13/07/2021,93.354,93.997,3.5318275154004106,0.6430000000000007,97.15583831533678,0.6034191780821918,97.75925749341897,3.479838315336778,104.87547085065755,0.03561159264392543,0.9656129837702873,1.8648168688515143
XS2362968906,WSTPNZ 0.1 07/13/27,EUR,95.993,WESTPAC SEC NZ/LONDON,Financial,2027-07-13,0.1,A+,,750000000,N,,Sr Unsecured,1,FIXED,13/07/2022,13/07/2026,13/07/2021,95.912,96.075,1.7796030116358659,0.1629999999999967,96.81712930860948,0.021917808219178082,96.83904711682865,0.8241293086094856,48.02061280989152,0.034562159600551444,1.9298674966813363,5.592979580701398
XS2363203089,PRXNA 1.985 07/13/33,EUR,87.776,PROSUS NV,Communications,2033-07-13,1.985,BBB,1.50291e-05,850000000,Y,2033-04-13,Sr Unsecured,1,FIXED,13/07/2022,13/07/2032,13/07/2021,87.454,88.098,7.531827515400411,0.6440000000000055,96.78684301273785,0.929958904109589,97.71680191684743,9.010843012737851,138.60865892163898,0.042766741774186316,12.785106075384931,188.70121512614645
DE000A3KPTG6,JABHOL 1 07/14/31,EUR,88.959,JAB HOLDINGS BV,Financial,2031-07-14,1.0,BBB,0.004836786,305700000,N,,Sr Unsecured,1,FIXED,14/07/2022,14/07/2030,14/07/2021,88.751,89.166,5.782340862422998,0.41499999999999204,92.8290417954663,0.21643835616438356,93.04548015163068,3.8700417954662925,75.46177044940617,,,
XS2363235107,LHAGR 3 ½ 07/14/29,EUR,101.738,DEUTSCHE LUFTHANSA AG,"Consumer, Cyclical",2029-07-14,3.5,BBB-,0.001895778,500000000,Y,2029-04-14,Sr Unsecured,1,FIXED,14/07/2022,14/07/2028,14/07/2021,101.619,101.858,3.5345653661875427,0.23900000000000432,104.61618736708058,1.63013698630137,106.24632435338195,2.878187367080585,82.17769856968691,0.04202836789317208,1.9107371420554815,5.4927631539237245
FR0014004QI5,FMUFP 1 07/27/29,EUR,93.33201,COVIVIO HOTELS SACA,Financial,2029-07-27,1.0,NR,0.000352439,599000000,Y,2029-04-27,Sr Unsecured,1,FIXED,27/07/2022,27/07/2028,27/07/2021,93.193,93.471,3.57015742642026,0.2780000000000058,96.12427159983754,0.4301369863013699,96.5544085861389,2.792261599837545,83.57461358348094,0.037377338740680985,1.92545144825845,5.565831060917175
FR0014004QX4,ALOFP 0 ⅛ 07/27/27,EUR,95.692,ALSTOM SA,Industrial,2027-07-27,0.125,NR,0.00084863,500000000,Y,2027-04-27,Sr Unsecured,1,FIXED,27/07/2022,27/07/2026,27/07/2021,95.615,95.768,1.568788501026694,0.1530000000000058,97.24378035853711,0.053767123287671234,97.29754748182478,1.5517803585371155,102.49591307673363,0.03938060212766481,5.653727940607753,37.81637832973316
FR0014004R72,ALOFP 0 ½ 07/27/30,EUR,89.406,ALSTOM SA,Industrial,2030-07-27,0.5,NR,0.00084863,700000000,Y,2030-04-27,Sr Unsecured,1,FIXED,27/07/2022,27/07/2029,27/07/2021,89.237,89.575,4.569472963723477,0.33800000000000807,92.47178814393176,0.21506849315068494,92.68685663708244,3.065788143931755,74.4216203093777,0.04729606690758549,18.010510080365354,406.5259205975989
XS2369906644,NDAQ 0.9 07/30/33,EUR,82.725,NASDAQ INC,Financial,2033-07-30,0.9,BBB+,1.5499e-06,615000000,Y,2033-04-30,Sr Unsecured,1,FIXED,30/07/2022,30/07/2032,30/07/2021,82.489,82.96,7.578370978781656,0.4709999999999894,89.27958249222101,0.3797260273972603,89.65930851961826,6.554582492221016,103.8470791767204,0.043762494113513364,0.958072363818091,1.8358053086239692
XS2373642102,BACR 0.577 08/09/29,EUR,94.061,BARCLAYS PLC,Financial,2029-08-09,0.577,BBB+,0.000347936,1500000000,Y,2028-08-09,Sr Unsecured,1,VARIABLE,09/08/2022,09/08/2028,09/08/2021,93.958,94.164,2.855578370978782,0.20600000000000307,96.03017320938022,0.0837835616438356,96.11395677102406,1.969173209380216,72.89514250188587,0.03581153053152685,1.9283658513558093,5.582685694270856
XS2374594823,VW 0 ⅜ 02/12/30,EUR,89.11099,VOLKSWAGEN FINANCIAL SER,"Consumer, Non-cyclical",2030-02-12,0.375,BBB+,0.003521565,750000000,N,,Sr Unsecured,1,FIXED,12/02/2022,12/02/2029,12/08/2021,88.897,89.325,4.3668720054757015,0.42799999999999727,92.33766665101686,0.23732876712328765,92.57499541814015,3.2266766510168594,81.93400304763166,0.03693276341124937,1.9262780314237515,5.570608784312246
XS2374595044,VW 0 ⅛ 02/12/27,EUR,96.682,VOLKSWAGEN FINANCIAL SER,"Consumer, Non-cyclical",2027-02-12,0.125,BBB+,0.003521565,1000000000,N,,Sr Unsecured,1,FIXED,12/02/2022,12/02/2026,12/08/2021,96.598,96.767,1.3661875427789185,0.16899999999999693,97.60009474778461,0.07910958904109588,97.6792043368257,0.9180947477846075,69.14040941843594,0.0389820762682294,6.56815584895196,50.15309065594574
XS2375844144,BDX 0.334 08/13/28,EUR,94.065,BECTON DICKINSON EURO,"Consumer, Non-cyclical",2028-08-13,0.334,BBB,1.17832e-05,900000000,Y,2028-05-13,Sr Unsecured,1,FIXED,13/08/2022,13/08/2027,13/08/2021,93.946,94.184,2.614647501711157,0.23799999999999955,95.78301778421245,0.12902465753424658,95.91204244174669,1.7180177842124493,69.35572683051507,0.03829140132795396,5.623018291025197,37.568246330519386
XS2375844656,BDX 1.336 08/13/41,EUR,67.928,BECTON DICKINSON EURO,"Consumer, Non-cyclical",2041-08-13,1.336,BBB,1.17832e-05,900000000,Y,2041-02-13,Sr Unsecured,1,FIXED,13/08/2022,13/08/2040,13/08/2021,67.637,68.219,15.370294318959617,0.5819999999999936,81.93775318529075,0.8418630136986301,82.77961619898937,14.009753185290748,136.88535212940212,0.026273245523808678,2.9156250357199482,11.354136172481525
XS2367081523,WMG 2 ¼ 08/15/31,EUR,94.918,WMG ACQUISITION CORP,"Consumer, Cyclical",2031-08-15,2.25,BBB-,1.39594e-05,445000000,Y,2026-08-15,1st lien,2,FIXED,15/02/2022,15/02/2031,16/08/2021,94.54,95.297,0.8706365503080082,0.7569999999999908,100.28637612003077,0.28736413043478265,100.57374025046555,5.36837612003076,633.6920284640332,0.035222198854403926,3.8331261463293638,18.464557754259715
FR00140057U9,BNP 0 ⅞ 08/31/33,EUR,93.74158,BNP PARIBAS,Financial,2033-08-31,0.875,BBB+,0.000632394,1000000000,Y,2028-08-31,Subordinated,1,VARIABLE,31/08/2022,31/08/2032,31/08/2021,93.594,93.889,2.915811088295688,0.2950000000000017,96.77506718499919,0.0743150684931507,96.84938225349234,3.0334871849991885,110.07307411785496,0.03657708603040525,1.928927684813542,5.582106377853352
DE000A3MP4U9,ANNGR 0 ¼ 09/01/28,EUR,93.397,VONOVIA SE,Financial,2028-09-01,0.25,BBB+,0.001036135,1250000000,Y,2028-06-01,Sr Unsecured,1,FIXED,01/09/2022,01/09/2027,01/09/2021,93.268,93.527,2.6666666666666665,0.25900000000000034,95.47609506822913,0.08356164383561644,95.55965671206475,2.0790950682291225,82.67372893997965,0.037829362552662824,1.9224436591740885,5.552623363766082
DE000A3MP4V7,ANNGR 0 ¾ 09/01/32,EUR,83.254,VONOVIA SE,Financial,2032-09-01,0.75,BBB+,0.001036135,1169100000,Y,2032-06-01,Sr Unsecured,1,FIXED,01/09/2022,01/09/2031,01/09/2021,83.042,83.465,6.666666666666667,0.4230000000000018,89.9175904308938,0.25068493150684934,90.16827536240065,6.663590430893791,118.1087196816141,0.04249645044945925,2.8551007699067834,10.92614578317088
DE000A3MP4W5,ANNGR 1 ⅝ 09/01/51,EUR,55.033,VONOVIA SE,Financial,2051-09-01,1.625,BBB+,0.001036135,750000000,Y,2051-06-01,Sr Unsecured,1,FIXED,01/09/2022,01/09/2050,01/09/2021,54.741,55.324,25.66461327857632,0.5829999999999984,77.4790744187685,0.5431506849315069,78.02222510370001,22.446074418768504,173.28183801063741,,,
XS2381599898,RBIAV 0.05 09/01/27,EUR,95.85514,RAIFFEISEN BANK INTL,Financial,2027-09-01,0.05,NR,0.001639958,500000000,N,,Sr Preferred,1,FIXED,01/09/2022,01/09/2026,01/09/2021,95.702,96.008,1.9164955509924708,0.3059999999999974,96.47262472760755,0.00410958904109589,96.47673431664865,0.6174847276075468,33.48941214555897,0.039357802406427174,1.9178501880054029,5.529506380150568
XS2381671671,UBS 0 ¼ 09/01/28,EUR,93.67922,UBS AG LONDON,Financial,2028-09-01,0.25,A+,0.003128996,1231000000,N,,Sr Unsecured,1,FIXED,01/09/2022,01/09/2027,01/09/2021,93.6,93.759,2.91854893908282,0.15900000000000603,95.01707397536157,0.02054794520547945,95.03762192056705,1.3378539753615684,48.671839373048435,0.03607856194315796,1.9278682088403176,5.579805914256464
XS2381853279,NGGLN 0 ¼ 09/01/28,EUR,93.477,NATIONAL GRID PLC,Utilities,2028-09-01,0.25,BBB,4.6004e-05,850000000,Y,2028-06-01,Sr Unsecured,1,FIXED,01/09/2022,01/09/2027,01/09/2021,93.364,93.591,2.6666666666666665,0.22699999999998965,95.47609506822913,0.08356164383561644,95.55965671206475,1.9990950682291242,79.45865325007215,0.050332125521411045,0.9520798,1.8129118911360804
XS2381853436,NGGLN 0 ¾ 09/01/33,EUR,81.033,NATIONAL GRID PLC,Utilities,2033-09-01,0.75,BBB,4.6004e-05,750000000,Y,2033-06-01,Sr Unsecured,1,FIXED,01/09/2022,01/09/2032,01/09/2021,80.824,81.241,7.665982203969883,0.4170000000000016,88.08499975827075,0.25068493150684934,88.33568468977761,7.051999758270753,111.82548952573107,0.029304309261208274,2.903251504346055,11.267766394520953
XS2381261424,MUNRE 1 05/26/42,EUR,85.08641,MUNICH RE,Financial,2042-05-26,1.0,A,1.20016e-07,1000000000,Y,2031-11-26,Subordinated,1,VARIABLE,26/05/2022,26/02/2042,02/09/2021,84.888,85.285,6.151950718685832,0.39699999999999136,92.26290778938706,0.8465753424657534,93.10948313185281,7.1764977893870565,135.20208739807472,0.03982274525042606,4.730525034055117,27.14903652471621
XS2381362966,BNS 0 ¼ 11/01/28,EUR,93.227,BANK OF NOVA SCOTIA,Financial,2028-11-01,0.25,A,2.92086e-06,750000000,N,,Sr Unsecured,1,FIXED,01/11/2022,01/11/2027,02/09/2021,93.139,93.315,3.0855578370978782,0.17600000000000193,94.6744287551248,0.22876712328767124,94.90319587841246,1.4474287551247897,50.03009721783569,0.03969701238939884,1.9149925134598158,5.517311910085833
XS2384273715,HOLNSW 0 ½ 09/03/30,EUR,88.905,HOLCIM FINANCE LUX SA,Industrial,2030-09-03,0.5,BBB+,1.36262e-05,1000000000,Y,2030-06-03,Sr Unsecured,1,FIXED,03/09/2022,03/09/2029,03/09/2021,88.706,89.103,4.670773442847365,0.39699999999999136,92.281719345573,0.1643835616438356,92.44610290721683,3.376719345572994,80.5243380206942,0.02885859893221149,0.9719508599508602,1.8893769483184333
XS2345317510,SHBASS 0.05 09/06/28,EUR,93.162,SVENSKA HANDELSBANKEN AB,Financial,2028-09-06,0.05,AA,0.000129884,1000000000,N,,Sr Preferred,1,FIXED,06/09/2022,06/09/2027,06/09/2021,93.06,93.263,2.9322381930184807,0.20300000000000296,94.42814609390274,0.003424657534246575,94.431570751437,1.2661460939027336,46.028707569681,0.03645832230203999,3.8284693403261887,18.42001336653992
XS2383901761,MIZUHO 0.47 09/06/29,EUR,93.732,MIZUHO FINANCIAL GROUP,Financial,2029-09-06,0.47,A,0.000341565,1000000000,Y,2028-09-06,Sr Unsecured,1,VARIABLE,06/09/2022,06/06/2029,06/09/2021,93.637,93.828,2.9322381930184807,0.1910000000000025,95.61267840493771,0.0321917808219178,95.64487018575963,1.8806784049377114,68.01623129246138,0.05155718398325037,0.9509706321553013,1.808690286443707
XS2384269366,HEIBOS 0 ¾ 09/06/29,EUR,90.334,HEIMSTADEN BOSTAD TRESRY,Financial,2029-09-06,0.75,BBB-,0.010536501,750000000,Y,2029-06-06,Sr Unsecured,1,FIXED,06/09/2022,06/09/2028,06/09/2021,90.101,90.567,3.679671457905544,0.465999999999994,95.07515870714062,0.2404109589041096,95.31556966604472,4.741158707140613,140.34621879303074,0.04100510806604855,4.705068983595708,26.933912346092043
BE0002819002,KBCBB 0 ⅝ 12/07/31,EUR,97.86,KBC GROUP NV,Financial,2031-12-07,0.625,BBB,5.40632e-05,750000000,Y,2026-09-07,Subordinated,1,VARIABLE,07/12/2021,07/12/2030,07/09/2021,97.798,97.922,0.9336071184120466,0.12399999999999523,98.80854123857434,0.0410958904109589,98.8496371289853,0.9485412385743359,103.20760586258879,0.03455090944067055,2.8921953066592088,11.172661219977924
XS2384274366,GM 0.65 09/07/28,EUR,93.797,GENERAL MOTORS FINL CO,"Consumer, Cyclical",2028-09-07,0.65,BBB,0.020203048,600000000,Y,2028-06-07,Sr Unsecured,1,FIXED,07/09/2022,07/09/2027,07/09/2021,93.664,93.929,2.6830937713894594,0.26500000000000057,96.48027647667283,0.20657534246575346,96.68685181913858,2.6832764766728303,105.6106175226258,0.036291321921912215,5.690748587327589,38.22222759956566
XS2381560411,ASBBNK 0 ¼ 09/08/28,EUR,93.631,ASB BANK LIMITED,Financial,2028-09-08,0.25,AA-,,750000000,N,,Sr Unsecured,1,FIXED,08/09/2022,08/09/2027,08/09/2021,93.552,93.71,2.937713894592745,0.15799999999998704,94.98226544196605,0.015753424657534248,94.99801886662358,1.3512654419660493,48.86220488825871,0.04263699463889398,12.870339648372953,190.4204969735978
XS2383886947,LXSGR 0 09/08/27,EUR,95.20798,LANXESS AG,Basic Materials,2027-09-08,0.0,NR,0.003328192,500000000,Y,2027-06-08,Sr Unsecured,1,FIXED,08/09/2022,08/09/2026,08/09/2021,95.065,95.351,1.6837782340862424,0.28600000000000136,96.82945165091452,0.0,96.82945165091452,1.6214716509145148,100.22626271033468,0.046398130415007406,4.569699786335341,25.812675839818883
XS2384473992,OPBANK 0 ⅜ 12/08/28,EUR,92.762,OP CORPORATE BANK PLC,Financial,2028-12-08,0.375,A-,1.29446e-05,500000000,N,,Sr Non Preferred,1,FIXED,08/12/2021,08/12/2027,08/09/2021,92.66,92.863,3.186858316221766,0.20300000000000296,94.82397673057913,0.3051369863013699,95.1291137168805,2.0619767305791328,69.22623492284283,0.05301760268231357,0.9496517412935324,1.803676859483676
BE6330288687,AEDBB 0 ¾ 09/09/31,EUR,85.60332,AEDIFICA SA,Financial,2031-09-09,0.75,NR,9.12819e-05,500000000,Y,2031-06-09,Sr Unsecured,1,FIXED,09/09/2022,09/09/2030,09/09/2021,85.275,85.932,5.686516084873374,0.6569999999999965,91.64919146748358,0.23424657534246573,91.88343804282604,6.045871467483579,122.19294636338013,0.03850478649123071,1.9198889434846773,5.540378943949456
XS2356311139,AIA 0.88 09/09/33,EUR,94.17,AIA GROUP LTD,Financial,2033-09-09,0.88,A,2.22133e-05,750000000,Y,2028-06-09,Subordinated,1,VARIABLE,09/09/2022,09/09/2032,09/09/2021,94.083,94.258,2.6885694729637235,0.17499999999999716,97.06818967050462,0.27484931506849314,97.34303898557312,2.898189670504621,113.47845521952075,0.029188962441497088,1.9358901698651845,5.635780359167327
XS2383811424,CAJAMA 1 ¾ 03/09/28,EUR,98.896,BANCO DE CREDITO SOCIAL,Financial,2028-03-09,1.75,BBB-,1.22612e-05,500000000,Y,2027-03-09,Sr Preferred,1,VARIABLE,09/03/2022,09/03/2027,09/09/2021,98.814,98.978,1.434633812457221,0.16400000000000148,99.75698291161625,0.9876712328767124,100.74465414449296,0.8609829116162473,60.51379215353136,0.035600762557110616,2.88925044144537,11.14995532501833
XS2384697830,PSA 0 ½ 09/09/30,EUR,88.485,PUBLIC STORAGE OP CO,Financial,2030-09-09,0.5,A,2.18521e-05,700000000,Y,2030-06-09,Sr Unsecured,1,FIXED,09/09/2022,09/09/2029,09/09/2021,88.332,88.637,4.687200547570157,0.3050000000000068,92.25095716452527,0.15616438356164383,92.40712154808692,3.7659571645252754,89.72313594344692,0.043293753226639295,0.9585028156329481,1.8374552951525787
XS2384715244,DXC 0.45 09/15/27,EUR,95.525,DXC CAPITAL FUNDING LTD,Technology,2027-09-15,0.45,BBB-,0.010140361,750000000,Y,2027-07-15,Sr Unsecured,1,FIXED,15/09/2022,15/09/2026,09/09/2021,95.389,95.662,1.78507871321013,0.27300000000001035,97.41525663865548,0.09616438356164385,97.51142102221712,1.8902566386554724,109.86694824276584,0.027965796938903935,0.9727950122249387,1.8926602716194372
XS2384716721,DXC 0.95 09/15/31,EUR,86.014,DXC CAPITAL FUNDING LTD,Technology,2031-09-15,0.95,BBB-,0.010140361,600000000,Y,2031-06-15,Sr Unsecured,1,FIXED,15/09/2022,15/09/2030,09/09/2021,85.627,86.401,5.702943189596167,0.7740000000000009,92.68231601256154,0.2810958904109589,92.9634119029725,6.668316012561547,133.96604563831934,0.036255344741078936,2.887417336284345,11.135833149332871
XS2384723263,MDLZ 0 ¼ 09/09/29,EUR,91.01279,MONDELEZ INTL HLDINGS NE,"Consumer, Non-cyclical",2029-09-09,0.25,BBB+,6.19362e-06,650000000,Y,2029-06-09,Sr Unsecured,1,FIXED,09/09/2022,09/09/2028,09/09/2021,90.871,91.155,3.6878850102669403,0.284000000000006,93.30293175075353,0.07808219178082192,93.38101394253435,2.290141750753534,67.57274179434397,0.036594158367044244,1.9269080634424387,5.574251801364146
XS2384726282,MDLZ 0 ⅝ 09/09/32,EUR,84.06,MONDELEZ INTL HLDINGS NE,"Consumer, Non-cyclical",2032-09-09,0.625,BBB+,6.19362e-06,650000000,Y,2032-06-09,Sr Unsecured,1,FIXED,09/09/2022,09/09/2031,09/09/2021,83.873,84.247,6.6885694729637235,0.3739999999999952,89.11074303585029,0.1952054794520548,89.30594851530235,5.050743035850289,88.87764581447142,0.033668652240730984,6.658978935392448,51.2530272963864
XS2384726449,MDLZ 1 ¼ 09/09/41,EUR,67.102,MONDELEZ INTL HLDINGS NE,"Consumer, Non-cyclical",2041-09-09,1.25,BBB+,6.19362e-06,700000000,Y,2041-06-09,Sr Unsecured,1,FIXED,09/09/2022,09/09/2040,09/09/2021,66.81,67.393,15.68788501026694,0.5829999999999984,80.46407223108342,0.3904109589041096,80.85448318998753,13.362072231083417,129.40040044426843,0.04046461425392338,19.70742356173697,461.57426076708185
XS2378468420,WUWGR 2 ⅛ 09/10/41,EUR,89.00291,WUESTENROT&WUERTTEMBERG,Financial,2041-09-10,2.125,NR,0.002174,300000000,Y,2031-03-10,Subordinated,1,VARIABLE,10/09/2022,10/06/2041,10/09/2021,88.331,89.675,5.437371663244353,1.343999999999994,99.05713866489371,1.1934931506849316,100.25063181557864,10.054228664893714,206.2879316726208,0.04256209379589449,23.12277214972528,702.888180929756
AT0000A2STV4,CESSPO 0 ½ 09/13/28,EUR,95.44,CESKA SPORITELNA AS,Financial,2028-09-13,0.5,A-,1.07101e-05,500000000,Y,2027-09-13,Sr Non Preferred,1,VARIABLE,13/09/2022,13/06/2028,13/09/2021,95.202,95.678,1.949349760438056,0.4759999999999991,97.263995892901,0.024657534246575342,97.28865342714757,1.8239958929009958,97.2766130138035,0.03793115714440391,1.9203003217206749,5.544000848217236
XS2385791046,SANUK 0.603 09/13/29,EUR,93.8618,SANTANDER UK GROUP HLDGS,Financial,2029-09-13,0.603,BBB+,8.63915e-06,750000000,Y,2028-09-13,Sr Unsecured,1,VARIABLE,13/09/2022,13/09/2028,13/09/2021,93.751,93.972,2.951403148528405,0.22099999999998943,95.95936001936627,0.02973698630136986,95.98909700566765,2.09756001936627,75.28180393091904,0.03631650224450387,4.772455959523701,27.532064022231282
XS2386287689,BACRED 0 ¾ 11/02/28,EUR,95.845,MEDIOBANCA DI CRED FIN,Financial,2028-11-02,0.75,BB+,0.000535005,500000000,Y,2027-11-02,Sr Non Preferred,1,VARIABLE,02/11/2022,02/08/2028,13/09/2021,95.77,95.92,2.086242299794661,0.15000000000000568,97.55835620842778,0.6842465753424658,98.24260278377025,1.7133562084277827,85.20922231271,0.03611661882722013,7.4876326867203185,64.3871343574252
AT0000A2SUH1,ERSTBK 0 ¼ 09/14/29,EUR,90.737,ERSTE GROUP BANK AG,Financial,2029-09-14,0.25,A,0.000194493,500000000,N,,Sr Preferred,1,FIXED,14/09/2022,14/09/2028,14/09/2021,90.607,90.868,3.9534565366187544,0.2609999999999957,92.70600626436827,0.011643835616438357,92.71765009998471,1.969006264368275,54.47538517291144,0.03985432944186146,11.52637044170707,151.11012838310432
XS2382950330,NWG 1.043 09/14/32,EUR,96.85,NATWEST GROUP PLC,Financial,2032-09-14,1.043,BBB+,0.000171391,750000000,Y,2027-06-14,Subordinated,1,VARIABLE,14/09/2022,14/09/2031,14/09/2021,96.74,96.96,1.700205338809035,0.21999999999999886,98.52479111796448,0.3114712328767123,98.8362623508412,1.6747911179644888,101.07196425144666,0.03981139262660473,0.9617128712871287,1.8497832935986664
XS2385386029,EUROB 2 ¼ 03/14/28,EUR,99.46829,EUROBANK SA,Financial,2028-03-14,2.25,BBB-,,500000000,Y,2027-03-14,Sr Preferred,1,VARIABLE,14/03/2022,14/03/2027,14/09/2021,99.281,99.655,1.4483230663928817,0.3739999999999952,100.461447506874,1.2390410958904108,101.70048860276441,0.9931575068739988,68.75530313222336,0.03708938001897001,5.492998127076632,36.43370125321706
XS2385398206,CMCSA 0 ¼ 09/14/29,EUR,90.56561,COMCAST CORP,Communications,2029-09-14,0.25,A-,0.000379551,500000000,Y,2029-06-14,Sr Unsecured,1,FIXED,14/09/2022,14/09/2028,14/09/2021,90.43,90.702,3.701574264202601,0.27199999999999136,93.2720464103517,0.07465753424657534,93.34670394459827,2.7064364103516994,79.77117325660312,0.03740080330325751,4.729750046221143,27.185049073367093
XS2385790667,NWIDE 0 ¼ 09/14/28,EUR,93.538,NATIONWIDE BLDG SOCIETY,Financial,2028-09-14,0.25,A+,0.002994077,750000000,N,,Sr Preferred,1,FIXED,14/09/2022,14/09/2027,14/09/2021,93.449,93.628,2.954140999315537,0.17900000000000205,94.9524425534505,0.011643835616438357,94.96408638906694,1.414442553450499,50.89701937782646,0.03399984288410161,2.8937434517659155,11.184607210332628
XS2386186063,LLY 0 ½ 09/14/33,EUR,82.383,ELI LILLY & CO,"Consumer, Non-cyclical",2033-09-14,0.5,A+,1.33291e-05,600000000,Y,2033-06-14,Sr Unsecured,1,FIXED,14/09/2022,14/09/2032,14/09/2021,82.169,82.598,7.701574264202601,0.42900000000000205,86.27324293341992,0.14931506849315068,86.42255800191307,3.890242933419927,60.9940813641795,0.04094482427554535,1.9176099053217615,5.522971116897325
XS2386186576,LLY 1 ⅛ 09/14/51,EUR,54.584,ELI LILLY & CO,"Consumer, Non-cyclical",2051-09-14,1.125,A+,1.33291e-05,500000000,Y,2051-03-14,Sr Unsecured,1,FIXED,14/09/2022,14/09/2050,14/09/2021,54.301,54.868,25.44832306639288,0.5670000000000002,68.53970320975748,0.6195205479452054,69.15922375770268,13.955703209757473,108.20181796989115,0.036510131397613416,2.8681513106749668,11.03502064881106
XS2386220698,LLY 1 ⅜ 09/14/61,EUR,48.045,ELI LILLY & CO,"Consumer, Non-cyclical",2061-09-14,1.375,A+,1.33291e-05,700000000,Y,2061-03-14,Sr Unsecured,1,FIXED,14/09/2022,14/09/2060,14/09/2021,47.711,48.378,35.449691991786445,0.6670000000000016,67.13377313986315,0.7571917808219177,67.89096492068506,19.08877313986315,132.717619473555,0.038392097098186,9.192865488581994,95.91393878190293
XS2387060259,NWG 0.67 09/14/29,EUR,94.092,NATWEST GROUP PLC,Financial,2029-09-14,0.67,A-,0.000171391,1000000000,Y,2028-09-14,Sr Unsecured,1,VARIABLE,14/09/2022,14/06/2029,14/09/2021,94.008,94.175,2.954140999315537,0.1670000000000016,96.14564564018994,0.031205479452054798,96.176851119642,2.0536456401899414,73.52497662981305,0.03528961523993751,6.675386366792415,51.36752648460399
CH1130818847,SLHNVX 0 ½ 09/15/31,EUR,85.913,SWISS LIFE FINANCE I AG,Financial,2031-09-15,0.5,NR,2.0393e-07,600000000,Y,2031-06-15,Sr Unsecured,1,FIXED,15/09/2022,15/09/2030,15/09/2021,85.697,86.129,5.702943189596167,0.43200000000000216,90.29441435404914,0.14794520547945206,90.44235955952858,4.3814143540491415,88.26423310341622,0.03974147943111686,1.9186055542504559,5.531054839340631
XS2385121582,EJRAIL 0.773 09/15/34,EUR,80.57778,EAST JAPAN RAILWAY CO,Industrial,2034-09-15,0.773,A+,6.4501e-05,500000000,N,,Sr Unsecured,1,FIXED,15/09/2022,15/09/2033,15/09/2021,80.382,80.773,8.955509924709103,0.39099999999999113,85.87027664242522,0.03388493150684932,85.90416157393207,5.29249664242522,73.48356581422443,0.038663069297893655,1.924305417610899,5.556825500735655
XS2385121749,EJRAIL 1.104 09/15/39,EUR,71.201,EAST JAPAN RAILWAY CO,Industrial,2039-09-15,1.104,A+,6.4501e-05,700000000,N,,Sr Unsecured,1,FIXED,15/09/2022,15/09/2038,15/09/2021,70.866,71.536,13.95482546201232,0.6700000000000017,81.06458577860032,0.048394520547945206,81.11298029914826,9.863585778600324,101.2066742539583,0.03568839809797645,4.775444799014588,27.566165425272178
XS2385393405,CLNXSM 1 09/15/27,EUR,97.133,CELLNEX FINANCE CO SA,Industrial,2027-09-15,1.0,BBB-,0.013805613,1000000000,Y,2027-06-15,Sr Unsecured,1,FIXED,15/09/2022,15/09/2026,15/09/2021,97.035,97.231,1.702943189596167,0.19599999999999795,98.45091560528849,0.2958904109589041,98.74680601624739,1.3179156052884906,79.31314716658935,0.04031477246976904,0.9612475247524753,1.847993607685522
XS2385393587,CLNXSM 2 09/15/32,EUR,90.956,CELLNEX FINANCE CO SA,Industrial,2032-09-15,2.0,BBB-,0.013805613,850000000,Y,2032-06-15,Sr Unsecured,1,FIXED,15/09/2022,15/09/2031,15/09/2021,90.763,91.15,6.704996577686516,0.38700000000000045,97.548260388723,0.5917808219178082,98.1400412106408,6.592260388722991,110.50304379983538,0.03461463037046918,1.9281372642181276,5.586101313592185
XS2386650274,ERGIM 0 ⅞ 09/15/31,EUR,87.1515,ERG SPA,Energy,2031-09-15,0.875,NR,0.000152986,500000000,Y,2031-06-15,Sr Unsecured,1,FIXED,15/09/2022,15/09/2030,15/09/2021,86.928,87.375,5.702943189596167,0.44700000000000273,92.28433240280948,0.25890410958904114,92.54323651239852,5.132832402809484,102.4782162024722,0.039110626490353614,4.759202318700834,27.38110649494042
XS2386877133,ESSITY 0 ¼ 09/15/29,EUR,91.158,ESSITY CAPITAL BV,"Consumer, Non-cyclical",2029-09-15,0.25,NR,0.002706861,600000000,Y,2029-06-15,Sr Unsecured,1,FIXED,15/09/2022,15/09/2028,15/09/2021,90.764,91.552,3.704312114989733,0.7880000000000109,93.26587085592486,0.07397260273972603,93.33984345866459,2.1078708559248582,61.883526929577286,0.03496334742279525,2.883538484271025,11.125143262607708
XS2384274440,WOWAU 0 ⅜ 11/15/28,EUR,92.99419,WOOLWORTHS GROUP LTD,"Consumer, Non-cyclical",2028-11-15,0.375,BBB,4.61308e-06,550000000,Y,2028-08-15,Sr Unsecured,1,FIXED,15/11/2021,15/11/2027,16/09/2021,92.876,93.112,2.8720054757015743,0.23599999999999,95.44711883637702,0.04828767123287671,95.49540650760989,2.452928836377012,90.91129527939674,0.0385482179538739,6.598043131684928,50.47147967012435
XS2387052744,CASTSS 0 ⅞ 09/17/29,EUR,92.245,CASTELLUM HELSINKI,Financial,2029-09-17,0.875,NR,0.000642648,650000000,Y,2029-06-17,Sr Unsecured,1,FIXED,17/09/2022,17/09/2028,17/09/2021,92.013,92.477,3.7097878165639973,0.46399999999999864,95.46290110912004,0.2541095890410959,95.71701069816113,3.217901109120035,93.47806010311503,0.022693825423669527,0.9778097560975612,1.912223838239144
XS2387735470,DSVDC 0 ⅞ 09/17/36,EUR,75.764,DSV FINANCE BV,Industrial,2036-09-17,0.875,A-,0.000214373,500000000,Y,2036-06-17,Sr Unsecured,1,FIXED,17/09/2022,17/09/2035,17/09/2021,75.545,75.983,10.710472279260781,0.4380000000000024,84.00141005148865,0.2541095890410959,84.25551964052974,8.237410051488652,101.1334459539733,0.03597145329987768,2.8807081025660763,11.103379660567924
FR0014005HY8,AIFP 0 ⅜ 09/20/33,EUR,80.73579,AIR LIQUIDE FINANCE,Basic Materials,2033-09-20,0.375,A,0.010105715,500000000,Y,2033-06-20,Sr Unsecured,1,FIXED,20/09/2022,20/09/2032,20/09/2021,80.531,80.941,7.7180013689253935,0.4099999999999966,85.3648607039531,0.10582191780821917,85.47068262176131,4.629070703953104,73.21670231500835,0.033671572548620014,5.6873014370546455,38.2553733738696
FR0014005J14,ACAFP 0 ½ 09/21/29,EUR,93.445,CREDIT AGRICOLE SA,Financial,2029-09-21,0.5,A-,0.000125365,1000000000,Y,2028-09-21,Sr Non Preferred,1,VARIABLE,21/09/2022,21/06/2029,21/09/2021,93.338,93.553,2.973305954825462,0.2150000000000034,95.6324205802009,0.0136986301369863,95.64611921033789,2.1874205802009072,78.16265313369253,0.04669382638671264,0.9553892215568861,1.8255371293341458
XS2386592484,ADENVX 0 ⅛ 09/21/28,EUR,92.93,ADECCO INT FINANCIAL SVS,"Consumer, Non-cyclical",2028-09-21,0.125,BBB+,0.001753951,500000000,Y,2028-06-21,Sr Unsecured,1,FIXED,21/09/2022,21/09/2027,21/09/2021,92.806,93.054,2.7214236824093088,0.24800000000000466,95.04835999136712,0.03493150684931507,95.08329149821644,2.1183599913671145,82.85288638384905,0.03843061799185576,1.9196559475739352,5.539744705166773
XS2386592567,ADENVX 0 ½ 09/21/31,EUR,86.171,ADECCO INT FINANCIAL SVS,"Consumer, Non-cyclical",2031-09-21,0.5,BBB+,0.001753951,500000000,Y,2031-06-21,Sr Unsecured,1,FIXED,21/09/2022,21/09/2030,21/09/2021,85.967,86.376,5.71937029431896,0.409000000000006,90.2626918758055,0.13972602739726028,90.40241790320276,4.091691875805495,82.08658810323163,0.03523360298678045,1.9221305702052107,5.560668778344359
XS2388141892,ADENVX 1 03/21/2082,EUR,97.086,ADECCO INT FINANCIAL SVS,"Consumer, Non-cyclical",2082-03-21,1.0,BBB-,0.001753951,500000000,Y,2026-12-21,Jr Subordinated,1,VARIABLE,21/03/2022,21/03/2081,21/09/2021,96.776,97.396,1.2210814510609171,0.6200000000000045,98.89723797855028,0.7780821917808219,99.6753201703311,1.811237978550281,151.32610821527265,0.03982479672478763,4.658386184239316,26.596670287517476
XS2388449758,NNGRNV 0 ½ 09/21/28,EUR,94.371,NN BANK NV NETHERLANDS,Financial,2028-09-21,0.5,NR,,500000000,N,,Sr Non Preferred,1,FIXED,21/09/2022,21/09/2027,21/09/2021,94.235,94.507,2.973305954825462,0.27200000000000557,95.6324205802009,0.0136986301369863,95.64611921033789,1.2614205802009053,44.8524551507709,,,
XS2360041474,SGROLN 0 ½ 09/22/31,EUR,84.77654,SEGRO CAPITAL SARL,Financial,2031-09-22,0.5,NR,0.000228406,500000000,Y,2031-06-22,Sr Unsecured,1,FIXED,22/09/2022,22/09/2030,22/09/2021,84.601,84.952,5.722108145106092,0.3509999999999991,90.25740651307972,0.13835616438356163,90.39576267746328,5.480866513079718,110.80642340790033,0.048237186181544676,0.9539825653798257,1.8201654700973469
XS2388182573,SW 0 ½ 09/22/29,EUR,91.60477,SMURFIT KAPPA TREASURY,Industrial,2029-09-22,0.5,BBB,0.001115092,500000000,Y,2029-06-22,Sr Unsecured,1,FIXED,22/09/2022,22/09/2028,22/09/2021,91.426,91.784,3.7234770704996576,0.3580000000000041,94.1095477629653,0.13835616438356163,94.24790392734887,2.504777762965304,72.90353007559294,0.034092405044343875,6.683543977244366,51.490725456064176
XS2388183381,SW 1 09/22/33,EUR,83.19905,SMURFIT KAPPA TREASURY,Industrial,2033-09-22,1.0,BBB,0.001115092,500000000,Y,2033-06-22,Sr Unsecured,1,FIXED,22/09/2022,22/09/2032,22/09/2021,82.923,83.476,7.723477070499658,0.5529999999999973,89.72948930911483,0.27671232876712326,90.00620163788194,6.530439309114826,101.40966379008275,0.04093037576701989,20.012764673786446,471.3026693213801
DE000A3E5VX4,AMPRIO 0 ⅝ 09/23/33,EUR,80.51,AMPRION GMBH,Utilities,2033-09-23,0.625,BBB+,0.007095178,800000000,Y,2033-06-23,Sr Unsecured,1,FIXED,23/09/2022,23/09/2032,23/09/2021,80.321,80.7,7.72621492128679,0.3790000000000049,87.09831849932755,0.17123287671232876,87.26955137603987,6.588318499327542,104.14566145554453,0.0486598876602083,0.9535980271270038,1.8186983946810276
XS2388172855,ALPHA 2 ½ 03/23/28,EUR,100.2255,ALPHA BANK SA,Financial,2028-03-23,2.5,NR,0.000253708,500000000,Y,2027-03-23,Sr Preferred,1,VARIABLE,23/03/2022,23/03/2027,23/09/2021,99.962,100.49,1.4729637234770705,0.5279999999999916,100.82856172828924,1.3150684931506849,102.14363022143993,0.6030617282892479,40.84752387121871,0.026534585547724795,2.914879552414459,11.348339484927973
XS2389343380,ABNANV 0 ½ 09/23/29,EUR,91.339,ABN AMRO BANK NV,Financial,2029-09-23,0.5,BBB+,7.92244e-05,1000000000,N,,Sr Non Preferred,1,FIXED,23/09/2022,23/09/2028,23/09/2021,91.222,91.456,3.978097193702943,0.23400000000000887,93.59617106708907,0.010958904109589041,93.60712997119866,2.2571710670890752,61.801648509664595,0.03661080332247904,1.9268770830652484,5.5740726365312
XS2389353264,GS 0 ¾ 03/23/32,EUR,85.99328,GOLDMAN SACHS GROUP INC,Financial,2032-03-23,0.75,A-,0.00026897,1250000000,Y,2031-12-23,Sr Unsecured,1,FIXED,23/03/2022,23/03/2031,23/09/2021,85.781,86.206,6.225872689938399,0.42499999999999716,90.70623055776473,0.5794520547945206,91.28568261255924,4.712950557764728,87.45984078310974,0.03635101884878488,6.560463399210004,50.158209693938964
XS2389757944,ANZNZ 0.2 09/23/27,EUR,95.73,ANZ NEW ZEALAND INTL/LDN,Financial,2027-09-23,0.2,A+,,750000000,N,,Sr Unsecured,1,FIXED,23/09/2022,23/09/2026,23/09/2021,95.656,95.803,1.9767282683093772,0.14699999999999136,96.64772574696853,0.004383561643835617,96.65210930861237,0.9177257469685287,48.28080889468596,0.032677452866091486,0.968356573705179,1.8754289076760675
XS2388491289,HSBC 0.641 09/24/29,EUR,93.947,HSBC HOLDINGS PLC,Financial,2029-09-24,0.641,A-,9.28921e-05,1000000000,Y,2028-09-24,Sr Unsecured,1,VARIABLE,24/09/2022,24/06/2029,24/09/2021,93.828,94.066,2.9815195071868583,0.23799999999999955,96.02367033653684,0.012293150684931508,96.03596348722176,2.0766703365368357,73.75841851541651,0.0362255111601853,3.8026790634917282,18.257333391460474
XS2389688875,BG 1 09/24/28,EUR,95.208,BUNGE FINANCE EUROPE BV,"Consumer, Non-cyclical",2028-09-24,1.0,BBB+,0.000725484,700000000,Y,2028-06-24,Sr Unsecured,1,FIXED,24/09/2022,24/09/2027,24/09/2021,95.02,95.397,2.729637234770705,0.37700000000000955,97.33309711682209,0.27123287671232876,97.60432999353442,2.12509711682209,81.49583577381065,0.035527942905285055,4.789012651784353,27.673375594631832
XS2390546849,CTPNV 1 ½ 09/27/31,EUR,88.943,CTP NV,Financial,2031-09-27,1.5,BBB-,0.000240028,549500000,Y,2031-06-27,Sr Unsecured,1,FIXED,27/09/2022,27/09/2030,27/09/2021,88.734,89.151,5.735797399041752,0.4170000000000016,95.56603819030106,0.3945205479452054,95.96055873824626,6.62303819030106,129.80136311953993,0.03895327133094161,4.6626565324918365,26.643971179206872
DE000CZ45WP5,CMZB 1 ⅜ 12/29/31,EUR,98.447,COMMERZBANK AG,Financial,2031-12-29,1.375,BBB-,0.000516517,500000000,Y,2026-09-29,Subordinated,1,VARIABLE,29/12/2021,29/12/2030,28/09/2021,98.394,98.499,0.9938398357289527,0.10499999999998977,99.46699818547287,0.007534246575342466,99.47453243204822,1.019998185472872,103.63582334492492,0.03999687179405032,1.9152111707810582,5.517095417534737
XS2390506546,INTNED 0 ⅜ 09/29/28,EUR,95.756,ING GROEP NV,Financial,2028-09-29,0.375,A-,8.33832e-05,1500000000,Y,2027-09-29,Sr Unsecured,1,VARIABLE,29/09/2022,29/06/2028,29/09/2021,95.673,95.838,1.9931553730321698,0.16499999999999204,96.95840548651744,0.0020547945205479454,96.96046028103798,1.202405486517435,62.683660704081916,0.03550990937073177,2.8820032624444627,11.11333585875066
XS2391861064,LIN 0 ⅜ 09/30/33,EUR,81.384,LINDE PLC,Basic Materials,2033-09-30,0.375,A,1.66545e-07,500000000,Y,2033-06-30,Sr Unsecured,1,FIXED,30/09/2022,30/09/2032,30/09/2021,81.105,81.663,7.745379876796714,0.5579999999999927,85.30598707499446,0.09554794520547946,85.40153502019994,3.921987074994462,61.59247230534915,0.029941695683860983,0.970928746928747,1.8854052632252538
XS2391865305,LIN 1 09/30/51,EUR,52.152,LINDE PLC,Basic Materials,2051-09-30,1.0,A,1.66545e-07,700000000,Y,2051-03-30,Sr Unsecured,1,FIXED,30/09/2022,30/09/2050,30/09/2021,51.831,52.473,25.492128678986994,0.6419999999999959,66.23640326481431,0.5068493150684932,66.7432525798828,14.084403264814313,111.6653694003636,0.025366756997389776,1.946799859767229,5.692283084563604
XS2392996109,PSHNA 1 ⅜ 10/01/27,EUR,96.671,PERSHING SQUARE HOLDINGS,Financial,2027-10-01,1.375,BBB+,,500000000,Y,2027-08-01,Sr Unsecured,1,FIXED,01/10/2022,01/10/2026,01/10/2021,96.427,96.915,1.8316221765913758,0.48799999999999955,98.99425762765877,0.22979452054794522,99.22405214820671,2.323257627658762,130.24064256304817,0.03950954528248144,4.695285525143369,26.884557317202667
XS2393080077,NYLIFE 0 ¼ 10/04/28,EUR,93.156,NEW YORK LIFE GLOBAL FDG,Financial,2028-10-04,0.25,AA+,0.011445898,600000000,N,,Secured,1,FIXED,04/10/2022,04/10/2027,04/10/2021,93.071,93.242,3.0088980150581794,0.17100000000000648,94.85075501186692,0.24794520547945206,95.09870021734638,1.694755011866917,60.03399496209557,0.04441857463998089,4.624399519535788,26.261002564120062
